"0","TEXT_FESPDY601_03850_SEQ_00","※本クエストは、期間限定のクエストとなります。<hex:02100103><hex:02100103>ウルダハの執事王は、催しの参加者を募っているようだ。"
"145","TEXT_FESPDY601_03850_REDOLENTROSE_000_120","あらあら、困ったわ……。<hex:02100103>小さなお客さんが来てくれたのだけど、<hex:02100103>恥ずかしいのか、何なのか、もじもじしていて……。"
"146","TEXT_FESPDY601_03850_MOMORU_000_121","あ、あの……えっと……。"
"147","TEXT_FESPDY601_03850_Q4_000_000","何と言う？"
"148","TEXT_FESPDY601_03850_A4_000_001","モモル、頑張って想いを伝えて！"
"149","TEXT_FESPDY601_03850_A4_000_002","ロリーちゃんのことを思い出して！"
"150","TEXT_FESPDY601_03850_MOMORU_000_122","そ、そうだよね。"
"151","TEXT_FESPDY601_03850_MOMORU_000_123","えっと、レドレント・ローズさんにお願いがあるの。<hex:02100103>実は、お友だちのロリーちゃんが…………"
"152","TEXT_FESPDY601_03850_REDOLENTROSE_000_124","裁縫師に憧れてるお友だちのために……！？<hex:02100103>なんて、素敵な友情なの……<hex:02100103>もちろん、喜んでお引き受けさせてもらうわ！"
"153","TEXT_FESPDY601_03850_REDOLENTROSE_000_125","仕事を終わらせたら向かうから、<hex:02100103>先に戻っててもらっていいかしら？"
"154","TEXT_FESPDY601_03850_MOMORU_000_126","やったぁ、ありがとう！"
"155","TEXT_FESPDY601_03850_MOMORU_000_127","モモル、レドレント・ローズさんが、<hex:02100103>こんなに大きな男の人だって知らなくて、<hex:02100103>びっくりしちゃったけど……とっても、いい人なのね！"
"156","TEXT_FESPDY601_03850_MOMORU_000_128","それじゃ、薬学院に戻ろっ！"
"157","TEXT_FESPDY601_03850_REDOLENTROSE_000_129","私、そんなに大きいかしら……<hex:02100103>こんなに踊り子みたいに美しいのに……。"
"158","TEXT_FESPDY601_03850_ALCHEMIST03850_000_130","無事、飾り付けが終わりましたよ。<hex:02100103>「小児病棟」に行かれますか？"
"159","TEXT_FESPDY601_03850_MOMORU_000_140","うわぁ……すっごーい！"
"160","TEXT_FESPDY601_03850_LORIE_000_141","わぁ～！"
"161","TEXT_FESPDY601_03850_LORIE_100_141","すごい！　きれいな飾り付け～！！"
"162","TEXT_FESPDY601_03850_REDOLENTROSE_000_142","(-聞き覚えのある声-)まあ、素敵じゃない！"
"163","TEXT_FESPDY601_03850_LORIE_000_143","えっ！？<hex:02100103>れ、レドレント・ローズさん！？"
"164","TEXT_FESPDY601_03850_REDOLENTROSE_000_144","もしかして、あなたがロリーちゃんかしら？"
"165","TEXT_FESPDY601_03850_LORIE_000_145","えっ！？<hex:02100103>なんで私の名前を知ってるの……！？"
"166","TEXT_FESPDY601_03850_REDOLENTROSE_000_146","モモルちゃんから話を聞かせてもらったわよ。<hex:02100103>私に憧れてくれてるだなんて、うれしいわ～。"
"167","TEXT_FESPDY601_03850_REDOLENTROSE_100_146","ロリーちゃん、あなた、裁縫が好きなんですって？<hex:02100103>知りたいことがあったら聞いてちょうだい、<hex:02100103>何でも教えてあげるわ！"
"168","TEXT_FESPDY601_03850_ALDIYTHA_000_147","女の子のみんなに、お姉さんからプレゼントがあります！<hex:02100103>こっちに来てくれるかな？"
"169","TEXT_FESPDY601_03850_ALDIYTHA_000_148","今、お姉さんが頭に付けている「花飾り」を、<hex:02100103>「姫」である、あなたたちにプレゼントします！"
"170","TEXT_FESPDY601_03850_ALDIYTHA_000_149","みんなは、バルドリック王が、毎年プリンセスデーの日に、<hex:02100103>抽選で選ばれた子の家に赴いて、<hex:02100103>執事をしていたのは、知ってるかな？"
"171","TEXT_FESPDY601_03850_ALDIYTHA_000_150","この花飾りには、こんなお話があるの。<hex:02100103>あるときのプリンセスデーで、<hex:02100103>病気がちな女の子が選ばれたことがあったのですって。"
"172","TEXT_FESPDY601_03850_ALDIYTHA_000_151","執事としてその子に仕えた王様は、<hex:02100103>桃の花飾りをプレゼントしたと言われているわ。"
"173","TEXT_FESPDY601_03850_ALDIYTHA_000_152","昔から桃には、悪い気を防ぐ力があると信じられていて、<hex:02100103>「不老長寿の霊薬」になるだなんて、伝説があるほどなの。<hex:02100103>だから王様は、桃の花を選んだのね。"
"174","TEXT_FESPDY601_03850_ALDIYTHA_000_153","そんな王様の気持ちが伝わったのか、<hex:02100103>やがて女の子は、見事に病気を克服……<hex:02100103>生涯幸せに暮らしたというわ。"
"175","TEXT_FESPDY601_03850_ALDIYTHA_000_154","だから、みんなも、辛いときがあるかもしれないけれど、<hex:02100103>めげずに病気を克服してね！"
"176","TEXT_FESPDY601_03850_CHILDA03850_000_155","(-子どもたち-)うん、がんばるー！"
"177","TEXT_FESPDY601_03850_ALDIYTHA_000_156","実は、ダミエリオー先生たちにも、プレゼントがあるのです。<hex:02100103>これを付けてみていただけますか？"
"178","TEXT_FESPDY601_03850_DAMIELLIOT_000_157","こんな感じでしょうか？"
"179","TEXT_FESPDY601_03850_ALDIYTHA_000_158","よかった！<hex:02100103>とてもお似合いです！"
"180","TEXT_FESPDY601_03850_DAMIELLIOT_000_159","これはいったい……？"
"181","TEXT_FESPDY601_03850_ALDIYTHA_000_160","先程、子どもたちに話した逸話には、こんな余談があるんです。<hex:02100103>王様は「姫」に選ばれた子のために御殿医を派遣した、と……。<hex:02100103>その医師は、そういったモノクルを付けていたのだとか。"
"182","TEXT_FESPDY601_03850_ALDIYTHA_000_161","ここにいる「姫」たちの主治医である、<hex:02100103>ダミエリオー先生にピッタリだと思いまして……。<hex:02100103>執事王様にご協力いただいて、用意いたしました。"
"183","TEXT_FESPDY601_03850_DAMIELLIOT_000_162","ありがとうございます。<hex:02100103>その御殿医に負けないよう、<hex:02100103>ここにいる「姫」たちを治療しなければいけませんね！"
"184","TEXT_FESPDY601_03850_ALDIYTHA_000_163","それにしても、みんな、本当に喜んでくれていますね。<hex:02100103>ほら！"
"185","TEXT_FESPDY601_03850_ALDIYTHA_000_164","子どもたちを笑顔にできて、本当によかった……！<hex:02100103>ダミエリオー先生、執事王様、<hex:02100103>ご協力ありがとうございました。"
"186","TEXT_FESPDY601_03850_DAMIELLIOT_000_165","そして冒険者さんにも、心からのお礼を。<hex:02100103>本当にありがとうございました。"
"187","TEXT_FESPDY601_03850_BUTLER_000_166","ダミエリオー先生やアルディシアお嬢さん、そして冒険者さん。<hex:02100103>彼女たちを笑顔にしたみなさんは、<hex:02100103>とても優秀な「執事」ですぞ！"
"188","TEXT_FESPDY601_03850_REAUVERRE_000_166","ダミエリオー先生から話を聞かせてもらったよ！<hex:02100103>いろいろと協力してくれてありがとう！"
"189","TEXT_FESPDY601_03850_REAUVERRE_000_167","冒険者さん、ひさしぶり！<hex:02100103>まだ病気は治ってないんだけど、僕、頑張ってるよ！"
"190","TEXT_FESPDY601_03850_REAUVERRE_000_168","ダミエリオー先生から話を聞かせてもらったよ！<hex:02100103>今度は、こんな素敵な飾り付けをしてくれて、ありがとう！"
"191","TEXT_FESPDY601_03850_MOMORU_000_170","ロリーちゃんも、他のみんなも、喜んでくれてよかった！<hex:02100103>アルディシアさんから、花飾りまで貰えちゃったし！"
"192","TEXT_FESPDY601_03850_MOMORU_000_171","ダミエリオー先生や、アルディシアさん、<hex:02100103><hex:020825E905FF10E3818AE5A789E381A1E38283E38293FF10E3818AE58584E381A1E38283E3829303>のおかげだよ！<hex:02100103>本当にありがと！"
"193","TEXT_FESPDY601_03850_MOMORU_000_172","ダミエリオー先生が、プリンセスデーの期間中は、<hex:02100103>気軽に小児病棟に面会に来れるようにしてくれたみたいだから、<hex:02100103>よかったら、また遊びにきてね！"
"194","TEXT_FESPDY601_03850_ALDIYTHA_000_173","モモルちゃんを見ていたら、<hex:02100103>花飾りとモノクルの逸話を思い出したのです。<hex:02100103>それで、ぜひみんなにプレゼントしたいと思いまして。"
"195","TEXT_FESPDY601_03850_ALDIYTHA_000_174","急な思いつきだったのですが、<hex:02100103>執事王様の協力のおかげで、無事間に合いました。<hex:02100103>子どもたちにも喜んでもらえて、本当によかったです……！"
"196","TEXT_FESPDY601_03850_ALDIYTHA_000_175","名残惜しいですが、私はそろそろ館へ帰るとします。<hex:02100103>長く留守にしては、過保護な執事が体調を心配して、<hex:02100103>探しに来てしまうかもしれませんからね。"
"197","TEXT_FESPDY601_03850_ALDIYTHA_000_176","冒険者様へのプレゼントは、<hex:02100103>ダミエリオー先生に、お渡ししてありますから、<hex:02100103>ぜひ受け取ってくださいね……それでは、ごきげんよう！"
"198","TEXT_FESPDY601_03850_MOMORU_000_177","ダミエリオー先生が、プリンセスデーの期間中は、<hex:02100103>気軽に小児病棟に面会に来れるようにしてくれたみたいだから、<hex:02100103>よかったら、また遊びにきてね！"
"199","TEXT_FESPDY601_03850_DAMIELLIOT_000_180","どうもありがとうございました。<hex:02100103>楽しそうな子どもたちの顔が見れて、<hex:02100103>私やスタッフたちも、元気を貰えました。"
"200","TEXT_FESPDY601_03850_DAMIELLIOT_000_181","そういえば、アルディシアさんから物を預かっています。<hex:02100103>冒険者さんの分の、花飾りとモノクルです。<hex:02100103>忘れないうちに、さぁ。"
"201","TEXT_FESPDY601_03850_DAMIELLIOT_000_182","冒険者さんのように、普段会えない方が来てくださると、<hex:02100103>子どもたちも喜んでくれるに違いありません。<hex:02100103>よければ、またぜひお越しくださいね。"
