"0","TEXT_VOICEMAN_06005_000010_SYSTEM_NONE_VOICE","しばらく前  マグナ・グラキエス――"
"181","TEXT_VOICEMAN_06005_001770_URIANGER","されど、レポリットたちが地上に行きたいと言いだしたとき、<hex:02100103>何かより良き結果が掴めるやもしれないと感じたのです。<hex:02100103>その心に、従いました。"
"182","TEXT_VOICEMAN_06005_Q2_000_001_NONE_VOICE","何と言う？"
"183","TEXT_VOICEMAN_06005_A2_000_001_NONE_VOICE","おかえり、ウリエンジェ"
"184","TEXT_VOICEMAN_06005_A2_000_002_NONE_VOICE","月明輝いてるね、ウリエンジェ大先生"
"185","TEXT_VOICEMAN_06005_001780_URIANGER","はい、ひとまずは……。<hex:02100103>こうして皆さんの無事な様子を見られただけでも、<hex:02100103>出向いた甲斐がありました。"
"186","TEXT_VOICEMAN_06005_001790_URIANGER","フフ…"
"187","TEXT_VOICEMAN_06005_001800_URIANGER","そのような称号をいただくには、<hex:02100103>依然ふさわしくないと存じますが……<hex:02100103>彼らにこの星のことを伝えられていたなら、嬉しいかぎりです。"
"188","TEXT_VOICEMAN_06005_001810_URIANGER","レポリットたちが哲学者議会に招かれている間、<hex:02100103>どうかまた、ご一緒させてください。"
"189","TEXT_VOICEMAN_06005_001820_ALISAIE","そうと決まれば、ウリエンジェが風邪をひく前に帰りましょ！<hex:02100103>私もだんだん冷えてきたし……。"
"190","TEXT_VOICEMAN_06005_001830_GRAHATIA","大丈夫、レポリットでぎゅうぎゅうの飛空艇は、<hex:02100103>きっとあったかいさ。"
"191","TEXT_VOICEMAN_06005_001840_ALPHINAUD","ひとつ、皆に頼みがあるんだ。"
"192","TEXT_VOICEMAN_06005_001850_ALPHINAUD","これから哲学者議会の話を聞くことになるが、<hex:02100103>場合によっては、彼らにさらなる提案をしてみたいと思う。<hex:02100103>次の一手に繋げるようなね。"
"193","TEXT_VOICEMAN_06005_001860_ALPHINAUD","それを、私に任せてもらえるだろうか……？"
"194","TEXT_VOICEMAN_06005_001870_ALISAIE","いいんじゃない。<hex:02100103>もともと、アルフィノが機転を利かせて、<hex:02100103>この機会を勝ち取ったんだしね。"
"195","TEXT_VOICEMAN_06005_001880_KRILE","アルフィノくんが考えを巡らせられるよう、<hex:02100103>質疑はひとまず私の方で受け持つわ。"
"196","TEXT_VOICEMAN_06005_001890_ALPHINAUD","ありがとう……。"
"197","TEXT_VOICEMAN_06005_001900_BARNIER","あー、皆の者、静粛に！<hex:02100103>ただいまより、臨時会を開催する。"
"198","TEXT_VOICEMAN_06005_001910_BARNIER","今日は知ってのとおり、「暁の血盟」からの要請に応え、<hex:02100103>我らが大撤収の計画を明かすこととなっている。"
"199","TEXT_VOICEMAN_06005_001920_BARNIER","さっそくだが、入ってきてくれ。"
"200","TEXT_VOICEMAN_06005_001930_BARNIER","先んじて、君たちに感謝を伝えたい。<hex:02100103>マグナ・グラキエスにて、ラザハンの民と我々の同胞を、<hex:02100103>異形の獣から護ってくれたことについてだ。"
"201","TEXT_VOICEMAN_06005_001940_BARNIER","今しがたラザハンの太守にも報告をし、<hex:02100103>君たちに深く感謝を表するとの伝言を預かった。"
"202","TEXT_VOICEMAN_06005_001950_BARNIER","我々哲学者議会としても、本件を真摯に受け止め、<hex:02100103>この場を用意させてもらった次第だ。<hex:02100103>君たちの質問に、できるかぎり答えよう。"
"203","TEXT_VOICEMAN_06005_001960_KRILE","では、まず前提を確認させてください。"
"204","TEXT_VOICEMAN_06005_001970_KRILE","哲学者議会の目的は、終末によって滅びゆくこの星を脱し、<hex:02100103>人々と知識を月へと運ぶことで間違いありませんか？"
"205","TEXT_VOICEMAN_06005_001980_FOURCHENAULT","相違ない……。<hex:02100103>知の都シャーレアンは、長年、そのために活動をしてきたのだ。"
"206","TEXT_VOICEMAN_06005_001990_FOURCHENAULT","世界中から集め、ラヴィリンソスや大書院に蓄積した知識。<hex:02100103>まずはそれを運び出す。"
"207","TEXT_VOICEMAN_06005_002000_FOURCHENAULT","並行して、シャーレアンの民をいくつかの組に分け、<hex:02100103>月へと順次移送……住環境の確認と整備を開始する計画だ。"
"208","TEXT_VOICEMAN_06005_002010_FOURCHENAULT","それらが落ち着き次第、我が国と協力関係にある国家から順に、<hex:02100103>月へ案内していくという手はずになっている。"
"209","TEXT_VOICEMAN_06005_002020_FOURCHENAULT","ラザハンは、その最優先候補だった。<hex:02100103>だが想定より早く終末の現象に見舞われたため、<hex:02100103>どうにか前倒して移送できないかと試みたのだ。"
"210","TEXT_VOICEMAN_06005_002030_YSHTOLA","なるほど、壮大な計画ね。<hex:02100103>この星のすべての民を運べる算段が立っているのかしら？"
"211","TEXT_VOICEMAN_06005_002040_FOURCHENAULT","……可能な範囲で、だ。"
"212","TEXT_VOICEMAN_06005_002050_YSHTOLA","そしてその線引きは哲学者議会がすると。"
"213","TEXT_VOICEMAN_06005_002060_FOURCHENAULT","別の星への移住は、史上類を見ないほど達成困難な任務だ。<hex:02100103>志の異なる者を取り入れようとすれば、<hex:02100103>そこから腐って全滅しかねない。"
"214","TEXT_VOICEMAN_06005_002070_KRILE","……その是非は、一旦置いておきましょう。"
"215","TEXT_VOICEMAN_06005_002080_KRILE","次に伺いたいのは、計画が順調に進んでいるかどうかです。<hex:02100103>聞いたところによると、肝心の月への移送手段が、<hex:02100103>まだ完成しきっていないとか……？"
"216","TEXT_VOICEMAN_06005_002090_FOURCHENAULT","要求する水準に至っていないという意味では、確かに未完成だ。"
"217","TEXT_VOICEMAN_06005_002100_FOURCHENAULT","かねてより製造を進めてきた、月へ向かう船……<hex:02100103>通称「方舟」は、一応の完成を見ている。"
"218","TEXT_VOICEMAN_06005_002110_FOURCHENAULT","想定外だったのは、終末の広がりがあまりに速いことだ。"
"219","TEXT_VOICEMAN_06005_002120_FOURCHENAULT","現状の方舟の動力機関では、<hex:02100103>航行速度が遅く、何より都度の補給にかかる時間が長すぎる。"
"220","TEXT_VOICEMAN_06005_002130_FOURCHENAULT","見切り発車で移送をはじめたところで、<hex:02100103>往復数を稼げないうちに終末が拡大……<hex:02100103>膨大な数の知識と命を、見捨てざるを得ないだろう。"
"221","TEXT_VOICEMAN_06005_002140_ALISAIE","そんな……何か手はないの？"
"222","TEXT_VOICEMAN_06005_002150_FOURCHENAULT","星外での推進力を生み出す「エーテル縮退炉」、<hex:02100103>その改良ができないか、今も試行錯誤が続いている。"
"223","TEXT_VOICEMAN_06005_002160_FOURCHENAULT","同時に第一陣の荷の積み込みも始めてはいるが……<hex:02100103>限界まで、調整をするつもりだ。"
"224","TEXT_VOICEMAN_06005_002170_ALPHINAUD","では、私たちと取引をするのはいかがでしょう。"
"225","TEXT_VOICEMAN_06005_002180_ALPHINAUD","「暁の血盟」は、エーテル縮退炉の改良に協力します。<hex:02100103>結果、それが必要な性能を上回るものになった場合、<hex:02100103>ふたつの報酬をいただけないでしょうか。"
"226","TEXT_VOICEMAN_06005_002190_ALPHINAUD","ひとつ目は、ハイデリンと会わせてもらうこと……。"
"227","TEXT_VOICEMAN_06005_002200_YSHTOLA","あなたたちとハイデリンの関係を思えば、<hex:02100103>「逆さの塔」を放置しているのは奇妙だわ。"
"228","TEXT_VOICEMAN_06005_002210_YSHTOLA","あるんでしょう？<hex:02100103>かの塔に代わる、より良い別の手段が……。"
"229","TEXT_VOICEMAN_06005_002220_ALPHINAUD","そしてふたつ目が……<hex:02100103>方舟を、誰が、どのように使うかを、<hex:02100103>皆様に提案させていただきたいのです。"
"230","TEXT_VOICEMAN_06005_002230_FOURCHENAULT","「提案」か？　命令ではなく……。"
"231","TEXT_VOICEMAN_06005_002240_ALPHINAUD","ここにいる、たった99人さえ納得させられない提案なら、<hex:02100103>この窮地に貫くべきではありません。"
"232","TEXT_VOICEMAN_06005_002250_MONTICHAIGNE","フォフォフォ……いや、おもしろい！"
"233","TEXT_VOICEMAN_06005_002255_MONTICHAIGNE","フォフォフォ"
"234","TEXT_VOICEMAN_06005_002260_MONTICHAIGNE","その道の専門家たちが頭を抱えている難問に、<hex:02100103>行きずりの者たちが挑むときた！<hex:02100103>フォフォ、なんと無茶で無謀なことよ！"
"235","TEXT_VOICEMAN_06005_002265_MONTICHAIGNE","ニィ"
"236","TEXT_VOICEMAN_06005_002270_MONTICHAIGNE","じゃが、行き詰まった研究に必要なのは、<hex:02100103>嫌というほど見返した理論より、<hex:02100103>ちょっとしたひらめき……新しい風じゃろうて。"
"237","TEXT_VOICEMAN_06005_002280_MONTICHAIGNE","わしは、かつての教え子たちに賭ける。<hex:02100103>彼らとの取引に「賛成」じゃ。"
"238","TEXT_VOICEMAN_06005_002290_BARNIER","あー、静粛に！　静粛に！<hex:02100103>今は一秒すら惜しい、さっそく決を採るとしよう。"
"239","TEXT_VOICEMAN_06005_002300_BARNIER","では、「暁の血盟」との取引に賛成の者は挙手を！"
"240","TEXT_VOICEMAN_06005_002310_BARNIER","賛成71、反対28……<hex:02100103>決まったな、彼らの申し出を受け入れよう。"
"241","TEXT_VOICEMAN_06005_002320_BARNIER","フルシュノ氏、計画の責任者たる君が彼らを案内するように。<hex:02100103>個人としては異論もあろうが、<hex:02100103>議会の決定として、しかと遂行していただきたい。"
"242","TEXT_VOICEMAN_06005_002330_FOURCHENAULT","……承知いたしました。"
"243","TEXT_VOICEMAN_06005_002340_BARNIER","では、此度の臨時会は終了とする！<hex:02100103>終わりのときまで時間がない……<hex:02100103>各自、己の責務をしっかりと果たすように！"
"244","TEXT_VOICEMAN_06005_002350_KOKKOLDANKKOL","あっちのパーツを変えてみるか……？<hex:02100103>いや、ねぇな、あそこはもうイジらん方がいい……。"
"245","TEXT_VOICEMAN_06005_002360_KOKKOLDANKKOL","だぁぁ、クソ！<hex:02100103>どうにかしろでどうにかできたら、<hex:02100103>今ごろ人は宇宙の果てにだってヒトッ飛びだったろうよ！"
"246","TEXT_VOICEMAN_06005_002370_FOURCHENAULT","……取り込み中すまない、ククロ・ダンクロ殿。"
"247","TEXT_VOICEMAN_06005_002380_KOKKOLDANKKOL","うひゃぁ！？　フルシュノの旦那！？<hex:02100103>なななんだよ大勢揃って、いよいよ納期だってか！？"
"248","TEXT_VOICEMAN_06005_002390_FOURCHENAULT","いや、予定については変わりない。<hex:02100103>あまり時間が残されていないという点でもな。"
"249","TEXT_VOICEMAN_06005_002400_FOURCHENAULT","今回は、哲学者議会の意向で、<hex:02100103>エーテル縮退炉の改良に協力したいという者たちを連れてきた。"
"250","TEXT_VOICEMAN_06005_002410_KOKKOLDANKKOL","ほーん、界隈で見た覚えのねぇ顔だな。"
"251","TEXT_VOICEMAN_06005_002420_FOURCHENAULT","実際、賢人も混じってはいるが、この分野の専門ではない。<hex:02100103>何かの突破口になればとのことだが、<hex:02100103>仕事の邪魔になるくらいなら、追い出してもいい。"
"252","TEXT_VOICEMAN_06005_002430_ALPHINAUD","そうならないように、最善を尽くしましょう。<hex:02100103>……さっそくですが、エーテル縮退炉について伺っても？"
"253","TEXT_VOICEMAN_06005_002440_KOKKOLDANKKOL","ああ、構わねぇぜ、息抜きがてらにな。"
"254","TEXT_VOICEMAN_06005_002450_KOKKOLDANKKOL","方舟に搭載される動力機関……<hex:02100103>エーテルを宇宙航行のための推進力に換えるのが、<hex:02100103>俺たちの作ってるエーテル縮退炉だ。"
"255","TEXT_VOICEMAN_06005_002460_KOKKOLDANKKOL","地上に比べて、星外はエーテルが乏しい。<hex:02100103>それでもしっかり方舟を動かし、<hex:02100103>月と行き来させられるスグレモノだ！"
"256","TEXT_VOICEMAN_06005_002470_KOKKOLDANKKOL","……が、まだ性能が足りねぇときた。"
"257","TEXT_VOICEMAN_06005_002480_KOKKOLDANKKOL","計算上、あと6％ほどエーテル伝導率を上げられりゃ、<hex:02100103>哲学者議会に要求されてるだけ往復時間を短縮できる。"
"258","TEXT_VOICEMAN_06005_002490_KOKKOLDANKKOL","たかが6％、されど6％だ！<hex:02100103>最高の素材と最良の設計で縮退炉の製造にあたってる以上、<hex:02100103>そう簡単に数字は上がらねぇんだよ……！"
"259","TEXT_VOICEMAN_06005_002500_URIANGER","レポリットたちには、もう相談したのですか？"
"260","TEXT_VOICEMAN_06005_002510_FOURCHENAULT","ああ、彼らの技師も検討をしてくれているが、<hex:02100103>すぐには解決策が出せそうもないようだ。"
"261","TEXT_VOICEMAN_06005_002520_FOURCHENAULT","レポリットの船である月は、高性能の動力機関を有している。<hex:02100103>しかしそれは、広大な月内部を使えるからこその、<hex:02100103>とてつもなく大きなものだという……。"
"262","TEXT_VOICEMAN_06005_002530_FOURCHENAULT","我々の……彼らに言わせれば「小さな玩具の方舟」に、<hex:02100103>その技術を転用するのは難しい。"
"263","TEXT_VOICEMAN_06005_002540_KOKKOLDANKKOL","はぁぁ、もう、どうしろってんだ！<hex:02100103>そういう無茶を言うときは、<hex:02100103>せめてエクスアダマントを手土産にしてほしいぜ！"
"264","TEXT_VOICEMAN_06005_002550_GRAHATIA","エクスアダマントって……アラグのか？"
"265","TEXT_VOICEMAN_06005_002560_YSHTOLA","あなた、何か知っているの？"
"266","TEXT_VOICEMAN_06005_002570_GRAHATIA","ああいや、詳細までは……。<hex:02100103>アラグ帝国で生み出された金属なんだが、製造法が門外不出で、<hex:02100103>「秘されし金属」なんて呼ばれてたらしい。"
"267","TEXT_VOICEMAN_06005_002580_GRAHATIA","かの帝国においては、ダラガブの製造に用いられたり、<hex:02100103>宇宙進出の要を担ったって、記録で見たことがある。"
"268","TEXT_VOICEMAN_06005_002590_KOKKOLDANKKOL","そう、そいつだ、そのエクスアダマントだよ！<hex:02100103>現代においては完全に失われた、<hex:02100103>未知の冶金技術で作られた素材なんだ！"
"269","TEXT_VOICEMAN_06005_002600_KOKKOLDANKKOL","エーテル伝導率が、もンのすごくてな……！<hex:02100103>今のエーテル縮退炉にも、少量だが使ってるんだ。"
"270","TEXT_VOICEMAN_06005_002610_KOKKOLDANKKOL","ほら、第七霊災の折に、ダラガブが飛び散っただろ？<hex:02100103>たまたま北洋にポチャンとした破片を引き上げて、<hex:02100103>そこから取り出したってわけよ。"
"271","TEXT_VOICEMAN_06005_002620_KOKKOLDANKKOL","あのエクスアダマントが、たくさん手に入りゃ、<hex:02100103>伝導率の6％向上も夢じゃないんだがな……。"
"272","TEXT_VOICEMAN_06005_002630_ALISAIE","ダラガブの破片なら、<hex:02100103>ほかにもエオルゼア各地に刺さってると思うけど……<hex:02100103>そこからは回収しないの？"
"273","TEXT_VOICEMAN_06005_002640_KOKKOLDANKKOL","グリーナーに依頼は出してある。<hex:02100103>だが、エクスアダマントが使われているのは、<hex:02100103>ダラガブの中でもごく一部……"
"274","TEXT_VOICEMAN_06005_002650_KOKKOLDANKKOL","トゲのように突き立った巨大装置、<hex:02100103>いわゆる「ラグナロク級拘束艦」の動力部なんだよ。"
"275","TEXT_VOICEMAN_06005_002660_KOKKOLDANKKOL","調査によると、そこへ辿り着くには、<hex:02100103>数々の防衛機構ひしめくダラガブ片の内部を、<hex:02100103>踏破しなきゃならんそうだ。"
"276","TEXT_VOICEMAN_06005_002670_KOKKOLDANKKOL","凄腕のグリーナーをかき集めたって、<hex:02100103>そうそうできる芸当じゃねぇ……。"
"277","TEXT_VOICEMAN_06005_002680_ALISAIE","……ってそれ、バハムートを消滅させるために、<hex:02100103>私たちが行ったあたりよね？"
"278","TEXT_VOICEMAN_06005_Q3_000_001_NONE_VOICE","何と言う？"
"279","TEXT_VOICEMAN_06005_A3_000_001_NONE_VOICE","自分が行ってこようか……？"
"280","TEXT_VOICEMAN_06005_A3_000_002_NONE_VOICE","ネールが……ネールがいないなら……"
"281","TEXT_VOICEMAN_06005_A3_000_003_NONE_VOICE","誰かに頼もう"
"282","TEXT_VOICEMAN_06005_002690_ALISAIE","確かに、あなたの実力なら申し分ないと思うけれど……。"
"283","TEXT_VOICEMAN_06005_002700_ALISAIE","だ、大丈夫！？<hex:02100103>でも、そうよね、激戦だったものね……。"
"284","TEXT_VOICEMAN_06005_002710_ALISAIE","今はあまり深く思い出さない方がいいわ。<hex:02100103>追体験は、いつだって過酷なものよ……。"
"285","TEXT_VOICEMAN_06005_002720_ALISAIE","それはいいけど、頼めそうなあてはあるの？"
"286","TEXT_VOICEMAN_06005_002730_ALPHINAUD","拘束艦を伴ったダラガブの破片は、<hex:02100103>エオルゼアだけでも複数確認されている……。"
"287","TEXT_VOICEMAN_06005_002740_ALPHINAUD","できるだけ多くのエクスアダマントを回収したいとなれば、<hex:02100103>私たちで手分けするよりも、むしろ……。"
"288","TEXT_VOICEMAN_06005_002750_ALPHINAUD","サンクレッド、君はガレマルドで偵察任務をするにあたって、<hex:02100103>派遣団の代表たちと繋がるリンクパールを渡されていたね。<hex:02100103>それはまだ通じるかい？"
"289","TEXT_VOICEMAN_06005_002760_THANCRED","ああ、現役だ。<hex:02100103>好きに使ってやってくれ。"
"290","TEXT_VOICEMAN_06005_002770_FOURCHENAULT","何をするつもりだ……？"
"291","TEXT_VOICEMAN_06005_002780_ALPHINAUD","皆で薪を集めるのです。<hex:02100103>吹雪を凌ぐ焚火を、暗闇を照らす灯火を点けるために！"
"292","TEXT_VOICEMAN_06005_002790_ALPHINAUD","こちらアルフィノ、聞こえるだろうか。<hex:02100103>「暁の血盟」から皆に頼みたいことがあるんだ。"
"293","TEXT_VOICEMAN_06005_002800_LUCIA","(-ルキア-)ルキアだ、委細承知した。<hex:02100103>すぐにアイメリク様に連絡を取り、<hex:02100103>クルザスのダラガブ片に回収部隊を向かわせる。"
"294","TEXT_VOICEMAN_06005_002810_ARUHNSENNA","(-ア・ルン・センナ-)グリダニアも了解だよ。<hex:02100103>対策に追われてる姉さまたちに代わって、<hex:02100103>黒衣森の分は僕が行く。"
"295","TEXT_VOICEMAN_06005_002820_YSHTOLA","拘束艦のほかに、<hex:02100103>エクスアダマントが回収できるあてはないのかしら？"
"296","TEXT_VOICEMAN_06005_002830_GRAHATIA","わざわざエクスアダマントを使っているような品は、<hex:02100103>尋常じゃない量のエーテルを通したり、<hex:02100103>蓄えたりする必要があるものだ。"
"297","TEXT_VOICEMAN_06005_002840_GRAHATIA","現代にまで残っていれば、とくに強力な魔器として、<hex:02100103>専門家や好事家のもとに流れている可能性が高い。"
"298","TEXT_VOICEMAN_06005_002850_CIRINA","(-シリナ-)……強力なアラグの魔器ですね。<hex:02100103>東方連合に持ちかけて、探してみます！"
"299","TEXT_VOICEMAN_06005_002860_CIRINA","(-シリナ-)ほかにも何か、協力できることはありませんか？<hex:02100103>こちらにはダラガブ片がないので、<hex:02100103>人手にはまだ余裕があります……！"
"300","TEXT_VOICEMAN_06005_002870_ALPHINAUD","ククロ殿、オサード小大陸の方で、<hex:02100103>何かできることはないでしょうか？"
"301","TEXT_VOICEMAN_06005_002880_KOKKOLDANKKOL","ぬお！？　東方諸国が協力してくれるってのか！？"
"302","TEXT_VOICEMAN_06005_002890_KOKKOLDANKKOL","だだだ、だったらアレだ、ほれ、<hex:02100103>「神器」って呼ばれる祭具を貸してもらいてぇ！"
"303","TEXT_VOICEMAN_06005_002900_KOKKOLDANKKOL","神器は、ときに蛮神を顕現させられるほどのエーテルを、<hex:02100103>ため込めるようになってんだ。<hex:02100103>縮退炉と一緒に組み込みゃ、大きな力を扱いやすくなる！"
"304","TEXT_VOICEMAN_06005_002910_ALPHINAUD","……聞こえていただろうか？<hex:02100103>神器の確保も、併せて頼みたいんだ。"
"305","TEXT_VOICEMAN_06005_002920_CIRINA","(-シリナ-)了解です！<hex:02100103>終末の災厄だなんて、どうしようかと思いましたが……<hex:02100103>何かやれることがあって、少し、ほっとしました。"
"306","TEXT_VOICEMAN_06005_002930_CIRINA","(-シリナ-)機械のことはよくわかりませんが、<hex:02100103>完全な形で仕上げられるよう、私たちもがんばります！"
"307","TEXT_VOICEMAN_06005_002940_SICARD","(-シカルド-)よっしゃ、そんじゃまあ、チャチャッと行って来らぁ！<hex:02100103><hex:024A0EFF04E999B8FF07E3818AE3818B03>の上だろうが構わねぇ、景気よく略奪してくるからよ！"
"308","TEXT_VOICEMAN_06005_002950_SICARD","(-シカルド-)届け先は、オールド・シャーレアンでいいんだな？<hex:02100103>首を洗って待っていやがれ！"
"309","TEXT_VOICEMAN_06005_002960_ALPHINAUD","そうするよ。<hex:02100103>……皆、ありがとう。<hex:02100103>くれぐれも気をつけて頼む！"
"310","TEXT_VOICEMAN_06005_002970_ALISAIE","やったわね！"
"311","TEXT_VOICEMAN_06005_002980_ALPHINAUD","ああ……。<hex:02100103>エクスアダマントはきっとここに届く。"
"312","TEXT_VOICEMAN_06005_002990_ALPHINAUD","私たちは、それを信じ……<hex:02100103>さらに先を見据えて、準備を進めていこう！"
"313","TEXT_VOICEMAN_06005_003000_SYSTEM_NONE_VOICE","一方  ウルダハ  香煙の間――"
"314","TEXT_VOICEMAN_06005_003010_NANAMOULNAMO","……改めて、事情はわかった。<hex:02100103>ダラガブ片からのエクスアダマントの回収、<hex:02100103>そして強力なアラグの魔器の収集じゃな。"
"315","TEXT_VOICEMAN_06005_003020_NANAMOULNAMO","よし、すぐに不滅隊の精鋭をそろえ、突入部隊を編成せよ！<hex:02100103>銀冑団や銅刃団からも腕利きを募れ！"
"316","TEXT_VOICEMAN_06005_003030_NANAMOULNAMO","パパシャンは、各ギルドに通達を。<hex:02100103>アラグの防衛機構を制し、未知の素材を回収するにあたっては、<hex:02100103>彼らの協力が必要不可欠じゃ。"
"317","TEXT_VOICEMAN_06005_003040_NANAMOULNAMO","フィルガイス……<hex:02100103>砂蠍衆の中でもそなたを呼んだのは、<hex:02100103>鉄灯団を動かす可能性を考えてのこと。"
"318","TEXT_VOICEMAN_06005_003050_NANAMOULNAMO","不滅隊に協力し、突入部隊の補助や、<hex:02100103>その間の各地の警備を受け持ってくれるな……？"
"319","TEXT_VOICEMAN_06005_003060_FYRGEISS","は……。<hex:02100103>我が息子、鉄灯団団長ツィルンベルク直々に、<hex:02100103>ことにあたるといたしましょう。"
"320","TEXT_VOICEMAN_06005_003070_NANAMOULNAMO","ピピン、突入部隊の長はそなたに任せる。<hex:02100103>集いしつわものたちを率い、存分にティソーナを振るうがよい。"
"321","TEXT_VOICEMAN_06005_003080_NANAMOULNAMO","ロロリトよ、そなたはアラグの魔器の回収じゃ。<hex:02100103>市場に出回っているもの、好事家に買われたもの……<hex:02100103>そなたになら心当たりもあろう。"
"322","TEXT_VOICEMAN_06005_003090_NANAMOULNAMO","無論、善意で……などとは言わぬ。<hex:02100103>取引方法はそなたに任せるゆえ、いつものとおり、<hex:02100103>最後には損のないよう収めてみせよ。"
"323","TEXT_VOICEMAN_06005_003100_NANAMOULNAMO","世界を脅かさんとしておる、終末の災厄……<hex:02100103>それが報告どおりのものならば、<hex:02100103>我らの力のみでは、到底抗い得ぬ。"
"324","TEXT_VOICEMAN_06005_003110_NANAMOULNAMO","しかし、わらわは……エオルゼアの民は、今や知っておろう。<hex:02100103>第七霊災からこちら、抱えてきた傷や痛みと向き合って、<hex:02100103>やっとわかったのじゃ。"
"325","TEXT_VOICEMAN_06005_003120_NANAMOULNAMO","独りでは立ち上がることさえできずとも、<hex:02100103>誰かとならば、戦い抜けると。"
