"0","TEXT_VOICEMAN_06005_000010_SYSTEM_NONE_VOICE","しばらく前  マグナ・グラキエス――"
"475","TEXT_VOICEMAN_06005_004620_HOARYBOULDER","イディルシャイアを仕切るスローフィクス氏が、<hex:02100103>以前、ご息女のラウンドロクスが受けた恩に報いるとして、<hex:02100103>一味を率いて来てくれたのです。"
"476","TEXT_VOICEMAN_06005_004630_HOARYBOULDER","アラグの防衛機構対、ゴブリン族の機工兵器！<hex:02100103>爆発やまぬ、あのアツい戦いを、<hex:02100103>皆さんにもお見せしたかったくらいですよ！"
"477","TEXT_VOICEMAN_06005_004640_ESTINIEN","……で、お前はどうした？<hex:02100103>分身とはいえ、終末の最中にお前が来たんだ、<hex:02100103>野暮用じゃあなさそうだが。"
"478","TEXT_VOICEMAN_06005_004650_VARSHAHN","まずは、君たちにお礼を……<hex:02100103>ガレマルドに向かった者たちを助けてくれたこと、<hex:02100103>心より感謝申し上げる。"
"479","TEXT_VOICEMAN_06005_004660_VARSHAHN","島を離れる決断をしたとはいえ、彼らは大切なラザハンの民だ。<hex:02100103>救い出された者がいて、本当によかった……。"
"480","TEXT_VOICEMAN_06005_004670_VARSHAHN","加えて、君たちは終末に抗うことを諦めていないという。<hex:02100103>ならば、この星の一員として、協力をさせてもらいたい。"
"481","TEXT_VOICEMAN_06005_004680_VARSHAHN","……以前、我が父の話をしたのを覚えているだろうか？<hex:02100103>父祖ミドガルズオルムは、星渡る竜だった。"
"482","TEXT_VOICEMAN_06005_004690_VARSHAHN","その鱗は星外の薄いエーテルさえもよく捕らえ、<hex:02100103>長く、遠くへと渡る力に換えたという……。"
"483","TEXT_VOICEMAN_06005_004700_VARSHAHN","ゆえに、君たちが星渡る船を造るというのなら、<hex:02100103>父の鱗を託してはどうかと考えた。<hex:02100103>そして、血族たちに、竜の咆哮で問うてみたのだ。"
"484","TEXT_VOICEMAN_06005_004710_VARSHAHN","アジュダヤからは、いつものことだが返事がなかった。"
"485","TEXT_VOICEMAN_06005_004720_VARSHAHN","ティアマットは「良し」と言った。<hex:02100103>フレースヴェルグも、彼方から「良し」と返してくれた。"
"486","TEXT_VOICEMAN_06005_004730_VARSHAHN","以て、父もひととき微睡みから浮き上がり、私に告げた。<hex:02100103>「では、そうするがよい」と……。"
"487","TEXT_VOICEMAN_06005_004740_VARSHAHN","以て、父は私に告げた。<hex:02100103>「では、そうするがよい」と……。"
"488","TEXT_VOICEMAN_06005_004750_VARSHAHN","だから私は幻龍の鱗を持ってきた。<hex:02100103>君たちが望む結末へと踏み出す力として、使ってほしい。"
"489","TEXT_VOICEMAN_06005_004760_NIDHANA","竜の鱗を組み込むにあたっては、<hex:02100103>アタシたちがサポートをさせてもらうね！<hex:02100103>護魂の霊鱗を作ったときの経験が活かせると思うんだ。"
"490","TEXT_VOICEMAN_06005_004770_KOKKOLDANKKOL","はは……なんてこった……奇跡でも起きたってのか……？"
"491","TEXT_VOICEMAN_06005_004780_KOKKOLDANKKOL","検めてみないと正しいことは言えねぇが、<hex:02100103>これだけの素材があれば、<hex:02100103>6％の壁なんざ、容易く飛び越えられる……！"
"492","TEXT_VOICEMAN_06005_004790_KOKKOLDANKKOL","それどころか、もっと遠い星までだって行けちまいそうだ！<hex:02100103>できるぞ、最ッ高のエーテル縮退炉が！"
"493","TEXT_VOICEMAN_06005_004800_BARNIER","……ほかならぬククロ氏がこう言っているのだ。<hex:02100103>「暁」は取引の条件を満たしたと、<hex:02100103>認めてやるべきではないかね。"
"494","TEXT_VOICEMAN_06005_004810_ALISAIE","お父様……？"
"495","TEXT_VOICEMAN_06005_004820_FOURCHENAULT","お前たちが、ハイデリンに何を求めているのかはわからない。<hex:02100103>方舟をどう使いたいと考えているのかもな。"
"496","TEXT_VOICEMAN_06005_004830_FOURCHENAULT","いずれにせよ、この局面でそれらに関与することは、<hex:02100103>人の存亡、星の命運を左右するに等しいだろう。"
"497","TEXT_VOICEMAN_06005_004840_FOURCHENAULT","多くの命を巻き込むことになる……<hex:02100103>しくじれば、叱責どころで済みはしまい。"
"498","TEXT_VOICEMAN_06005_004850_FOURCHENAULT","……その責任を負う覚悟はあるのか？"
"499","TEXT_VOICEMAN_06005_004860_ALPHINAUD","……はい。<hex:02100103>すべての出会いが、私の語る「世界」に中身をくれました。<hex:02100103>その上で私は、世界を救いたいのです。"
"500","TEXT_VOICEMAN_06005_004870_FOURCHENAULT","っ…"
"501","TEXT_VOICEMAN_06005_004880_FOURCHENAULT","ならば……ならば私も、ともに背負おう……。"
"502","TEXT_VOICEMAN_06005_004890_FOURCHENAULT","お前たちがこれから為すことの責任を、<hex:02100103>家族として、わかちあわせてほしい。"
"503","TEXT_VOICEMAN_06005_004900_FOURCHENAULT","お前たちが生まれたとき……<hex:02100103>あの小さな手がこの指を握ったときに、<hex:02100103>私は胸が詰まる思いだった。"
"504","TEXT_VOICEMAN_06005_004910_FOURCHENAULT","言い知れないほどの愛しさと、眩い幸せ……<hex:02100103>それから、怒りにも似た激しい決意がこみあげてきたのだ。"
"505","TEXT_VOICEMAN_06005_004920_FOURCHENAULT","私はすでに哲学者議会の一員で、終末の予言を知っていた。<hex:02100103>そんなものに、お前たちの未来を奪われたくはなかった……。"
"506","TEXT_VOICEMAN_06005_004930_FOURCHENAULT","以来、私は月への脱出計画を推し進めてきた。<hex:02100103>何を切り捨て、誰に疎まれても構わなかった。<hex:02100103>手遅れになる方がよほど怖かったのだから。"
"507","TEXT_VOICEMAN_06005_004940_FOURCHENAULT","唯一捨てられないものがあったとしたら、<hex:02100103>それは父……ルイゾワだ。"
"508","TEXT_VOICEMAN_06005_004950_FOURCHENAULT","父はシャーレアンの使命に対し、異なる考え方を持っていた。<hex:02100103>その考え方を……父自身を……<hex:02100103>私は大人になるにつれ、愚かだと感じるようになっていた。"
"509","TEXT_VOICEMAN_06005_004960_FOURCHENAULT","それでもどこかで、あの偉大な人ならば、<hex:02100103>何か革新的なやり方でお前たちを救ってくれるのではと……<hex:02100103>期待していたのだろう。"
"510","TEXT_VOICEMAN_06005_004970_FOURCHENAULT","だから、お前たちが父と親しくすることを、<hex:02100103>あえて止めはしなかったのだ。"
"511","TEXT_VOICEMAN_06005_004980_FOURCHENAULT","しかし、父は果てた。<hex:02100103>家族とは何ら関係のない、遠きカルテノーの地で。"
"512","TEXT_VOICEMAN_06005_004990_FOURCHENAULT","北洋へと飛来した拘束艦を引き上げながら、私は再び決意した。<hex:02100103>自分がお前たちを護らねば……<hex:02100103>そのために、今度こそ障害となるすべてを切り捨てようと。"
"513","TEXT_VOICEMAN_06005_005000_FOURCHENAULT","たとえそれが、お前たち自身の意思であってもだ。"
"514","TEXT_VOICEMAN_06005_005010_FOURCHENAULT","お前たちからどれほど憎まれようが、とにかく計画を進め、<hex:02100103>最後には無理やりにでも連れていけばいい……そう考えていた。"
"515","TEXT_VOICEMAN_06005_005020_FOURCHENAULT","……だが、浅はかだったな。<hex:02100103>お前たちは私が思っているよりずっと多くのことを学び、<hex:02100103>自分たちの足で、求める方へと歩きはじめていたようだ。"
"516","TEXT_VOICEMAN_06005_005030_FOURCHENAULT","私ばかりが護らねばと思っていたが……<hex:02100103>お前たちはもう、護りたいと願う側にいるのだな。"
"517","TEXT_VOICEMAN_06005_005040_ALISAIE","ええ、そうよ。<hex:02100103>見つけたの……大切なもの……大切な人たち……<hex:02100103>たくさんの、かけがえのないものを。"
"518","TEXT_VOICEMAN_06005_005050_FOURCHENAULT","それを知るまでの道のりは、平坦ではなかっただろうに。<hex:02100103>よく、ここまで歩いてきたものだ。"
"519","TEXT_VOICEMAN_06005_005060_ALPHINAUD","すべてが無事におわったら、きっとお話ししましょう。<hex:02100103>私たちが見て、聞いて、感じて、考えたことを。"
"520","TEXT_VOICEMAN_06005_005070_ALPHINAUD","この厳しくも素晴らしい世界のことを……。"
"521","TEXT_VOICEMAN_06005_005080_AMELIANCE","あら大変！<hex:02100103>フルシュノさんは、ふたりからの手紙だって、<hex:02100103>ハラハラしちゃって読めなかったのよ？"
"522","TEXT_VOICEMAN_06005_005090_AMELIANCE","旅のお話なんて聞いたら、どうなってしまうのかしら？"
"523","TEXT_VOICEMAN_06005_005100_FOURCHENAULT","アメリアンス……！"
"524","TEXT_VOICEMAN_06005_005110_ALPHINAUD","ふふふ…"
"525","TEXT_VOICEMAN_06005_005120_ALISAIE","あはは…"
"526","TEXT_VOICEMAN_06005_005130_FOURCHENAULT","君たちにも、度重なる非礼をお詫びせねばならない。"
"527","TEXT_VOICEMAN_06005_005140_FOURCHENAULT","率直に言うと、アルフィノとアリゼーが危険を冒すのは、<hex:02100103>「暁」のせいではないかと考えていた。"
"528","TEXT_VOICEMAN_06005_005150_FOURCHENAULT","とくに、君のことは……。"
"529","TEXT_VOICEMAN_06005_005155_FOURCHENAULT","だが、ふたりが多くの出会いを果たし、<hex:02100103>今ここに大勢が集っているのも、君あっての結果なのだろう。"
"530","TEXT_VOICEMAN_06005_005160_FOURCHENAULT","ならば、どうか……<hex:02100103>これからも、ふたりのことを、よろしく頼む。"
"531","TEXT_VOICEMAN_06005_005170_GRAHATIA","じゃ、まずはこの場を動かさないとだな！<hex:02100103>みんな指示を待ってるみたいだぞ。"
"532","TEXT_VOICEMAN_06005_005180_ALPHINAUD","ひとまず君から、ひと声かけてはくれないか？<hex:02100103>君を慕って来ている者も多いだろうからね。"
"533","TEXT_VOICEMAN_06005_Q4_000_001_NONE_VOICE","何と言う？"
"534","TEXT_VOICEMAN_06005_A4_000_001_NONE_VOICE","まだ力を貸してくれるか？"
"535","TEXT_VOICEMAN_06005_A4_000_002_NONE_VOICE","正念場だ、がんばろう！"
"536","TEXT_VOICEMAN_06005_A4_000_003_NONE_VOICE","指示に従って、なかよく！"
"537","TEXT_VOICEMAN_06005_005190_SICARD","おう！"
"538","TEXT_VOICEMAN_06005_005200_EMMANELLAIN","おう！"
"539","TEXT_VOICEMAN_06005_005210_HANCOCK","オー！"
"540","TEXT_VOICEMAN_06005_005220_SOROBAN","おぉ～"
"541","TEXT_VOICEMAN_06005_005230_ERENVILLE","おう！"
"542","TEXT_VOICEMAN_06005_005240_CID","おう！"
"543","TEXT_VOICEMAN_06005_005250_HOARYBOULDER","おう！"
"544","TEXT_VOICEMAN_06005_005260_NIDHANA","おー！"
"545","TEXT_VOICEMAN_06005_005270_FOURCHENAULT","では、これより順次誘導をさせていただく。<hex:02100103>皆の尽力に感謝を……<hex:02100103>そして、今しばらくご協力いただきたい！"
"546","TEXT_VOICEMAN_06005_005280_AMON","まったく  諦めの悪い人たちですね<hex:02100103>こんな場所にまで踏み込んで――"
"547","TEXT_VOICEMAN_06005_005290_AMON","ですが  ここまでです<hex:02100103>終末を受け入れ  無に還りなさい！"
"548","TEXT_VOICEMAN_06005_005300_AMON","おのれ――行かせるものか――"
"549","TEXT_VOICEMAN_06005_005310_AMON","夢  希望  未来  可能性<hex:02100103>そんなもの  どこにもありはしない――！"
"550","TEXT_VOICEMAN_06005_005320_AMON","っ…"
"551","TEXT_VOICEMAN_06005_005330_AMON","クソ……魂さえ、もうままならない……<hex:02100103>ああ、本当に忌々しい……！"
"552","TEXT_VOICEMAN_06005_005340_ALPHINAUD","……任せよう。"
"553","TEXT_VOICEMAN_06005_005350_AMON","何です……とどめを刺してくれるんですか……？"
"554","TEXT_VOICEMAN_06005_005360_AMON","ハ……望むところですよ……。<hex:02100103>あなたたちの抵抗を見ていると、虫唾が走る……<hex:02100103>いっそ、魂も残さず消してください。"
"555","TEXT_VOICEMAN_06005_Q5_000_001_NONE_VOICE","何と言う？"
"556","TEXT_VOICEMAN_06005_A5_000_001_NONE_VOICE","メーティオンを覚えているか"
"557","TEXT_VOICEMAN_06005_A5_000_002_NONE_VOICE","ヘルメスだったころを覚えているか"
"558","TEXT_VOICEMAN_06005_005370_AMON","何故……その名前を……。"
"559","TEXT_VOICEMAN_06005_005380_AMON","くくく…ふふ…"
"560","TEXT_VOICEMAN_06005_005390_AMON","エルピスにいたの、あれ、<hex:02100103>あなたとエメトセルクだったんですか……！<hex:02100103>くく……まったく……なんという……。"
"561","TEXT_VOICEMAN_06005_005400_AMON","私、ただのアモンとして生きていたころに、<hex:02100103>繰り返し見ていた夢があったんです……。"
"562","TEXT_VOICEMAN_06005_005410_AMON","壊れた記録みたいに、途切れ途切れの夢。<hex:02100103>登場人物の姿は欠けて、声も、顔も思い出せない。"
"563","TEXT_VOICEMAN_06005_005420_AMON","ただぼんやりと、そこがエルピスという場所で、<hex:02100103>自分がヘルメスと呼ばれていることを認識していました。"
"564","TEXT_VOICEMAN_06005_005430_AMON","当然、妄想だと思いましたよ。<hex:02100103>そんな場所は知らないし、私はヘルメスじゃないんですから。"
"565","TEXT_VOICEMAN_06005_005440_AMON","……ですが、アシエンになり、<hex:02100103>オリジナルのファダニエルの情報を受け取ったとき、<hex:02100103>すべてが繋がってしまったんです。"
"566","TEXT_VOICEMAN_06005_005450_AMON","私が夢だと思っていたのは、<hex:02100103>ヘルメスの……カイロスが消した記憶だったのだと。"
"567","TEXT_VOICEMAN_06005_005460_AMON","あのとき、カイロスはその場にいた者の記憶を上書いた。<hex:02100103>もとの記憶はエーテル放射によって覆われ……<hex:02100103>だからこそ、魂に強く焼き込まれた。"
"568","TEXT_VOICEMAN_06005_005470_AMON","死して魂が洗われるときにも、消えきらず……<hex:02100103>幾度の生と死を経て薄れながらも、<hex:02100103>私の代まで継がれてきた、というのが真相でしょう。"
"569","TEXT_VOICEMAN_06005_005480_AMON","やっと死ねたエメトセルクも、星海のどこかで、<hex:02100103>消された日々のことを思い出してるんじゃないですか？"
"570","TEXT_VOICEMAN_06005_005490_AMON","さぞ悔しいでしょうねぇ……。<hex:02100103>啖呵を切っておきながら終末を止められなかったことも、<hex:02100103>核心を忘れたまま、楽園を求めてきたことも。"
"571","TEXT_VOICEMAN_06005_005500_AMON","……ですが、私はヘルメスだから終末を呼んだわけじゃない。"
"572","TEXT_VOICEMAN_06005_005510_AMON","私は、私として生き、この心で苦しんだ……<hex:02100103>絶望した……見切ったんです。"
"573","TEXT_VOICEMAN_06005_005520_AMON","かつて偉大な皇帝と、彼が導いた超大国が示しました。<hex:02100103>最後に待つのは無であると。<hex:02100103>生きるのはただ、そこに至る道程でしかないのだと。"
"574","TEXT_VOICEMAN_06005_005530_AMON","……だったら何故生きる？"
"575","TEXT_VOICEMAN_06005_005540_AMON","他者を踏みつけ、足蹴にし、傷つけながら、<hex:02100103>どうして生き続ける必要があるんだ？"
"576","TEXT_VOICEMAN_06005_005550_AMON","人はあらゆる言葉で生を讃えるが、<hex:02100103>見てみろ、人生の大半は暗澹たる闇の中だ。"
"577","TEXT_VOICEMAN_06005_005560_AMON","しかもその闇を、自分たちで吐きだしているときた。<hex:02100103>まったくもってたちが悪い。"
"578","TEXT_VOICEMAN_06005_005570_AMON","だったらもういい、やめてしまえばいい……！"
"579","TEXT_VOICEMAN_06005_005580_AMON","この星に生きる、いつまでも、どこまでも愚かな人類が、<hex:02100103>誰ひとりそれを謳わなかったとしても……<hex:02100103>終わることこそ、ただひとつの正しい答えだ！"
"580","TEXT_VOICEMAN_06005_005590_AMON","それが正しいと……真理だとわかっているのに……。"
"581","TEXT_VOICEMAN_06005_005600_AMON","どうしてこんな、口にするたび、<hex:02100103>何かに負けたような気がするんだ……。"
"582","TEXT_VOICEMAN_06005_005610_AMON","これじゃないなら、私は何を求めていた……？"
"583","TEXT_VOICEMAN_06005_005620_AMON","どういう結果ならよかったんだ……。"
"584","TEXT_VOICEMAN_06005_005630_AMON","自分が……待っていたのは……"
"585","TEXT_VOICEMAN_06005_005640_AMON","望んでいたのは、どんな答えだ……？"
"586","TEXT_VOICEMAN_06005_005650_ASAHI","(-？？？？-)死者の問いに答えて、どうするんです？<hex:02100103>そいつに未練を晴らさせやしませんよ。"
"587","TEXT_VOICEMAN_06005_005660_ASAHI","(-？？？？-)アシエン・ファダニエル……<hex:02100103>お前が安らかに眠っていなくてよかったよ。"
"588","TEXT_VOICEMAN_06005_005670_ASAHI","(-？？？？-)ここじゃあ、誰も彼もが静かに眠る。<hex:02100103>記憶も想いも溶かして、魂を癒すために……。"
"589","TEXT_VOICEMAN_06005_005680_ASAHI","(-？？？？-)けれど稀に、気がかりがあって眠るに眠れず、<hex:02100103>星海の水面に映る、現し世を眺めてる者がいるんです。"
"590","TEXT_VOICEMAN_06005_005690_ASAHI","(-？？？？-)たとえばそう……<hex:02100103>己の骸がゲス野郎に使われていたり、ねぇ……。"
"591","TEXT_VOICEMAN_06005_005700_ALPHINAUD","まさか、アサヒなのか！？"
"592","TEXT_VOICEMAN_06005_005710_ASAHI","やめていただきたいですね、旧知の間柄みたいな言い草は。<hex:02100103>残念ながら、あなた方には何の用もないんですよ。"
"593","TEXT_VOICEMAN_06005_005720_ASAHI","俺は、俺が死んだあとの世界なんて、どうでもいい。<hex:02100103>派手に滅びてそこの英雄殿を苦しめてくれるんなら、<hex:02100103>いっそありがたいくらいです。"
"594","TEXT_VOICEMAN_06005_005730_ASAHI","身体を使われたことだって……<hex:02100103>まあ、不愉快だと思ったところで、死人に口なしですよ。"
"595","TEXT_VOICEMAN_06005_005740_ASAHI","……だが！<hex:02100103>お前が、俺の身体でゼノス様に近づき、裏切ったこと……。"
"596","TEXT_VOICEMAN_06005_005750_ASAHI","それだけは絶対に、絶対に……死んでも許せるもんじゃあない！"
"597","TEXT_VOICEMAN_06005_005760_ASAHI","お前はここで、俺とともに眠るんだ。<hex:02100103>問いの答えを得ることも、災厄の結末を見ることもなく！"
"598","TEXT_VOICEMAN_06005_005770_ASAHI","次に生まれることがあったとしても……<hex:02100103>苦しんで、苦しんで、苦しんで、答えを探し続けろ……！"
"599","TEXT_VOICEMAN_06005_Q6_000_001_NONE_VOICE","何と言う？"
"600","TEXT_VOICEMAN_06005_A6_000_001_NONE_VOICE","あとのことは任せろ"
"601","TEXT_VOICEMAN_06005_A6_000_002_NONE_VOICE","…………"
"602","TEXT_VOICEMAN_06005_A6_000_003_NONE_VOICE","次はきっと、一緒に探そう"
"603","TEXT_VOICEMAN_06005_005780_AMON","ハ……何を任せられるって言うんですか……。"
"604","TEXT_VOICEMAN_06005_005790_AMON","私の望みは、すべてを殺して、死ぬことですよ。"
"605","TEXT_VOICEMAN_06005_005800_AMON","フ…"
"606","TEXT_VOICEMAN_06005_005810_AMON","何を馬鹿なことを……。"
"607","TEXT_VOICEMAN_06005_005820_AMON","恨んだまま、赦す必要はない……。<hex:02100103>こんな愚か者のことは、過去へ置いていくといい……。"
"608","TEXT_VOICEMAN_06005_005830_AMON","私も、謝ったりはしません。<hex:02100103>あのときヘルメスがあなたに抱いた心残りを、<hex:02100103>永遠に、未練のままにしておいてやりますよ。"
"609","TEXT_VOICEMAN_06005_005840_ASAHI","俺がいるうちは、星海へ来ないでもらえますか？<hex:02100103>死んでからもあなた方の顔を拝みっぱなしとか、最悪なので。"
"610","TEXT_VOICEMAN_06005_005850_ALPHINAUD","ああ……そうならないように、心がけよう。"
"611","TEXT_VOICEMAN_06005_005860_ASAHI","チッ、本当に言葉どおりの意味ですからね。"
"612","TEXT_VOICEMAN_06005_005870_ALPHINAUD","……行こう、ハイデリンが呼んでいるんだ。"
"613","TEXT_VOICEMAN_06005_005880_HYDAELYN","よくぞここまで辿り着きました……。"
"614","TEXT_VOICEMAN_06005_Q7_000_001_NONE_VOICE","何と言う？"
"615","TEXT_VOICEMAN_06005_A7_000_001_NONE_VOICE","久しぶり、ヴェーネス"
"616","TEXT_VOICEMAN_06005_A7_000_002_NONE_VOICE","ずいぶん姿が変わったな"
"617","TEXT_VOICEMAN_06005_005890_HYDAELYN","っ…"
"618","TEXT_VOICEMAN_06005_005900_HYDAELYN","あなたは……エルピスに行ったのですね。"
"619","TEXT_VOICEMAN_06005_005910_HYDAELYN","私たちの時間が、やっと、ここで繋がった……。"
"620","TEXT_VOICEMAN_06005_005920_HYDAELYN","わかりました。<hex:02100103>では、その上で、あえてあなたたちに問いましょう。<hex:02100103>ここへ来た目的を……。"
"621","TEXT_VOICEMAN_06005_005930_ALISAIE","ハイデリン、あなたは終末が再来したときに備えて、<hex:02100103>脱出船としての月を準備していたのよね。"
"622","TEXT_VOICEMAN_06005_005940_ALISAIE","でも、本当にそれですべてなの？<hex:02100103>私たちは逃げたくない……<hex:02100103>鏡像世界も含めて、この星を救いたいの！"
"623","TEXT_VOICEMAN_06005_005950_HYDAELYN","そうですね……<hex:02100103>逃げるのは、人が取り得るふたつの選択、<hex:02100103>その片方にすぎません。"
"624","TEXT_VOICEMAN_06005_005960_HYDAELYN","もうひとつの道は、<hex:02100103>メーティオンが巣くう天の果てへ向かうこと。<hex:02100103>終焉を謳うものたちと、直接決着をつける方法です。"
"625","TEXT_VOICEMAN_06005_005970_HYDAELYN","……しかし、そこは彼女たちが支配する、<hex:02100103>デュナミスで構築された宙域。"
"626","TEXT_VOICEMAN_06005_005980_HYDAELYN","想いだけが力となるその場所では、<hex:02100103>どれほどのエーテルを有し、強大な魔法を繰ろうとも、<hex:02100103>決して彼女たちに勝つことはできません。"
"627","TEXT_VOICEMAN_06005_005990_HYDAELYN","かの空間に集められた、先ゆく星々の絶望、苦しみ、悲しみ……<hex:02100103>それらに抗えなければ、行くだけ無駄。<hex:02100103>あえなく全滅するでしょう。"
"628","TEXT_VOICEMAN_06005_006000_ALISAIE","そんなの平気よ、私は屈したりしないわ！"
"629","TEXT_VOICEMAN_06005_006010_ALISAIE","……なんて、昔なら言えたかもしれないけど。"
"630","TEXT_VOICEMAN_06005_006020_ALISAIE","旅の中には、確かにあったわ。<hex:02100103>どうしようもなく悲しいこと……<hex:02100103>恐れるなって言い聞かせても、足がすくんだこともね。"
"631","TEXT_VOICEMAN_06005_006030_ALISAIE","あの想いを、なかったことにはできない。<hex:02100103>絶対に大丈夫だなんて言えない。"
"632","TEXT_VOICEMAN_06005_006040_ALISAIE","そんな私たちじゃ、逃げる道を選ぶことしかできないの……！？"
"633","TEXT_VOICEMAN_06005_006050_HYDAELYN","……いいえ。<hex:02100103>あなたたちは、だからこそ可能性を持つのです。"
"634","TEXT_VOICEMAN_06005_006060_HYDAELYN","かつて、アーテリスよりも栄えた多くの星々が、<hex:02100103>負の感情のない楽園を作り出そうと試みました。"
"635","TEXT_VOICEMAN_06005_006070_HYDAELYN","悲しみや怒り、争いや破滅、死や絶望……<hex:02100103>そういったものを排除しようとして、失敗したのです。<hex:02100103>メーティオンの報告によれば、ひとつの成功例もなく。"
"636","TEXT_VOICEMAN_06005_006080_HYDAELYN","だとすれば……それらの闇は、<hex:02100103>決してなくならないものなのでしょう。"
"637","TEXT_VOICEMAN_06005_006090_HYDAELYN","どれほど理想を突き詰めていっても、<hex:02100103>すべてを消し去ることはできないのです。"
"638","TEXT_VOICEMAN_06005_006100_HYDAELYN","だから生命は、必ず絶望する。"
"639","TEXT_VOICEMAN_06005_006110_HYDAELYN","するけれど……しない誰かがいたのなら、繋いでいけます。"
"640","TEXT_VOICEMAN_06005_006120_HYDAELYN","あなたたちだって、そうしてここに至ったのではありませんか？"
