"0","TEXT_VOICEMAN_06005_000010_SYSTEM_NONE_VOICE","しばらく前  マグナ・グラキエス――"
"326","TEXT_VOICEMAN_06005_003130_NANAMOULNAMO","それを先陣を切って示してきた「暁」が、<hex:02100103>ともに立つ者を欲している……。"
"327","TEXT_VOICEMAN_06005_003140_NANAMOULNAMO","ならばウルダハは果敢に応え、<hex:02100103>彼らとともに、この災厄に打ち勝とうではないか！"
"328","TEXT_VOICEMAN_06005_003150_NANAMOULNAMO","各方、ただちに取り掛かるがよい！<hex:02100103>第十七代国王、ナナモ・ウル・ナモからの至上命令と心得よ！"
"329","TEXT_VOICEMAN_06005_003160_SYSTEM_NONE_VOICE","一方  黒衣森  フォールゴウド――"
"330","TEXT_VOICEMAN_06005_003170_ARUHNSENNA","兵の数はそろったけど、やっぱり偏りが出るか……。<hex:02100103>治療には事欠かなくても、防衛機構の破壊を担う者が少ない。"
"331","TEXT_VOICEMAN_06005_003180_ARUHNSENNA","グリダニアの在り方としては正しいんだけどね。<hex:02100103>長期戦になるかもしれないな……。"
"332","TEXT_VOICEMAN_06005_003190_LYSE","(-？？？？-)よければ、アタシたちも連れて行ってくれない？"
"333","TEXT_VOICEMAN_06005_003200_ARUHNSENNA","君、どうしてここに……！？"
"334","TEXT_VOICEMAN_06005_003210_LYSE","ギラバニアには、拘束艦がついているような、<hex:02100103>大きなダラガブ片が落ちてきてないんだ。"
"335","TEXT_VOICEMAN_06005_003220_LYSE","だから、グリダニアの手伝いに！<hex:02100103>アラミゴからいちばん近いし、何より、<hex:02100103>思いっきり暴れる前衛が必要なんじゃないかと思ってさ。"
"336","TEXT_VOICEMAN_06005_003230_ARUHNSENNA","……見透かされてるのは癪だけど、そのとおりだよ。<hex:02100103>よくわかったね。"
"337","TEXT_VOICEMAN_06005_003240_LYSE","もう、すごく昔のことみたいに感じちゃうけど……<hex:02100103>アタシ、「暁」の一員として、この国の調査を担当してたんだ。"
"338","TEXT_VOICEMAN_06005_003250_LYSE","だから知ってるよ、黒衣森のことも……<hex:02100103>グリダニアのみんなの戦い方だって。"
"339","TEXT_VOICEMAN_06005_003260_ARUHNSENNA","だったら、遠慮なく力を借りさせてもらうよ。<hex:02100103>さっそくだけど、打ち合わせといこう。"
"340","TEXT_VOICEMAN_06005_003270_LYSE","……必ずやり遂げるから。<hex:02100103>見ててね、パパリモ。"
"341","TEXT_VOICEMAN_06005_003280_SYSTEM_NONE_VOICE","一方  クルザス中央高地――"
"342","TEXT_VOICEMAN_06005_003290_EMMANELLAIN","あ、やっと見つけたぞ……！"
"343","TEXT_VOICEMAN_06005_003300_EMMANELLAIN","兄貴、何してるんだよ。<hex:02100103>もうみんなとっくに集合して……"
"344","TEXT_VOICEMAN_06005_003310_EMMANELLAIN","な、なんだよこれ……竜の……咆哮……！？"
"345","TEXT_VOICEMAN_06005_003320_SYSTEM_NONE_VOICE","一方  紅玉海  筋違砦――"
"346","TEXT_VOICEMAN_06005_003330_HANCOCK","……という要請が、東方連合とロロリト会長からありまして。<hex:02100103>海賊衆の皆さんなら、神器に心当たりがないかと思って、<hex:02100103>こちらに参ったのデ～ス。"
"347","TEXT_VOICEMAN_06005_003340_HANCOCK","おや？　あれは……。"
"348","TEXT_VOICEMAN_06005_003350_SOROBAN","あれぇ、なんでハンコックまでいるのぉ～？"
"349","TEXT_VOICEMAN_06005_003360_SOROBAN","でも、ちょうどいいやぁ～。<hex:02100103>実は、頼みたいことがあってねぇ～。"
"350","TEXT_VOICEMAN_06005_003370_LIVINGWAY","ちょっと休憩……<hex:02100103>一度にこんなにしゃべったのは、はじめてですわ……。"
"351","TEXT_VOICEMAN_06005_003380_THANCRED","よう、盛況だな。<hex:02100103>月の民から助言をもらえるらしいって、<hex:02100103>さっそく街中で話題になってたぞ。"
"352","TEXT_VOICEMAN_06005_003390_URIANGER","そういうことでしたら、<hex:02100103>こちらのスリーピングウェイと話してみるのがよろしいかと。<hex:02100103>彼は月の操縦士ですので……。"
"353","TEXT_VOICEMAN_06005_003400_THANCRED","よく覚えてるもんだな。<hex:02100103>レポリットの違いを見分けるのは難しいと思うんだが。"
"354","TEXT_VOICEMAN_06005_003410_LIVINGWAY","あなた方を嘆きの海から送り出したあと、<hex:02100103>わたくしたちとウリエンジェは、たくさん話をしましたから。"
"355","TEXT_VOICEMAN_06005_003420_LIVINGWAY","彼はアーテリスについていろいろと教えてくれましたし、<hex:02100103>こちらの質問にも、とことん付き合ってくれましたわ。"
"356","TEXT_VOICEMAN_06005_003430_LIVINGWAY","おかげで、わたくしの本ももういっぱい！"
"357","TEXT_VOICEMAN_06005_003440_LIVINGWAY","こうして実際に来てみると、まだ驚くことばかりですが……<hex:02100103>そもそも彼から教えられなければ、<hex:02100103>地上に降りてくることもなく、月で待ち続けていたでしょう。"
"358","TEXT_VOICEMAN_06005_003450_THANCRED","ふ…"
"359","TEXT_VOICEMAN_06005_003460_THANCRED","こんな光景、昔のウリエンジェを知る奴が見たら、<hex:02100103>驚いて……喜んだだろうな。"
"360","TEXT_VOICEMAN_06005_003470_THANCRED","ルイゾワ様やミンフィリア、パパリモ、それから……"
"361","TEXT_VOICEMAN_06005_003480_WILFSUNN","(-？？？？-)やあ、ここで良い相談役を紹介してもらえると聞いたんだ。<hex:02100103>私たちにも頼めるかな？"
"362","TEXT_VOICEMAN_06005_003490_URIANGER","ウィルフスンさん……ブローウィダさん……。"
"363","TEXT_VOICEMAN_06005_003500_THANCRED","転移魔法の研究者として有名な夫妻だよ。<hex:02100103>……ムーンブリダの、ご両親だ。"
"364","TEXT_VOICEMAN_06005_003510_URIANGER","……お久しぶりです。<hex:02100103>おふたりとも……こちらに、いらしたのですか……。"
"365","TEXT_VOICEMAN_06005_003520_WILFSUNN","ああ、しばらく前に、妻ともども引き抜かれてね。<hex:02100103>しかしまさか、ここで君と再会することになるとは。"
"366","TEXT_VOICEMAN_06005_003530_BLOEWYDA","まったくだよ……。<hex:02100103>あんたときたら、うちの子の訃報に手紙を添えてきたきり、<hex:02100103>何の連絡もよこしやしない……！"
"367","TEXT_VOICEMAN_06005_003540_BLOEWYDA","本当に……本っ当に……心配かけて……！"
"368","TEXT_VOICEMAN_06005_003550_URIANGER","っ…"
"369","TEXT_VOICEMAN_06005_003560_URIANGER","申し訳、ございません……。<hex:02100103>直接ご報告に伺うべきだと、わかっていながら……。"
"370","TEXT_VOICEMAN_06005_003570_URIANGER","何より、ムーンブリダのことを……私は……。"
"371","TEXT_VOICEMAN_06005_003580_WILFSUNN","……ルイゾワ様に置いていかれたと嘆いていた彼女にとって、<hex:02100103>君たち「暁」が呼んでくれたことが、どれほどの歓びだったか。"
"372","TEXT_VOICEMAN_06005_003590_WILFSUNN","あの子の為したこと、すべての決断は、<hex:02100103>間違いなくあの子自身のものだったと思う。"
"373","TEXT_VOICEMAN_06005_003600_WILFSUNN","どうか君も、己を責めるのではなく……<hex:02100103>彼女を誇ってやってはくれないか。"
"374","TEXT_VOICEMAN_06005_003610_BLOEWYDA","私たちに怒ってることがあるとすれば、<hex:02100103>それは、あんたと一緒に泣けなかったことだよ。"
"375","TEXT_VOICEMAN_06005_003620_BLOEWYDA","あんな震えた字の手紙だけよこして……<hex:02100103>私たちで、あんたの分まで泣く羽目になったじゃないか。"
"376","TEXT_VOICEMAN_06005_003630_URIANGER","本当に……申し訳が、ございません……。"
"377","TEXT_VOICEMAN_06005_003640_URIANGER","私は、語れる言葉を持たなかった……<hex:02100103>こみあげる気持ちも、よぎる思い出も、<hex:02100103>ひとつとして、正しく言葉にできなかったのです……。"
"378","TEXT_VOICEMAN_06005_003650_URIANGER","積み上げてきた知識も、読み解いてきた詩も、無力でした。<hex:02100103>私はただ……ただ、無力で…………。"
"379","TEXT_VOICEMAN_06005_003660_BLOEWYDA","馬鹿だね……誰だってそうさ……。<hex:02100103>私たちだって、あの子を……<hex:02100103>この悲しみを語れはしないよ……。"
"380","TEXT_VOICEMAN_06005_003670_BLOEWYDA","だからちゃんと、わかってた……わかってたんだよ……。"
"381","TEXT_VOICEMAN_06005_003680_WILFSUNN","……君たちがまだ小さかったころ、<hex:02100103>遊ぶことより学ぶことを愛した君を、冷やかした子がいたね。"
"382","TEXT_VOICEMAN_06005_003690_WILFSUNN","そのたびにムーンブリダが飛んでいって、喧嘩をした。<hex:02100103>私たちがいさめても、「ウリエンジェはいい奴なんだ」と、<hex:02100103>むくれるばかりでね……。"
"383","TEXT_VOICEMAN_06005_003700_BLOEWYDA","だったら相手を叩くんじゃなくて、<hex:02100103>あんたがウリエンジェと周りを繋がないとって言ったら、<hex:02100103>「そうかぁ」なんて、腕組みして唸ってさ……。"
"384","TEXT_VOICEMAN_06005_003710_BLOEWYDA","それからは、前よりも強引にあんたを連れ出してみたり、<hex:02100103>考えてることがわかるようにって、同じ本を読もうとしたり……"
"385","TEXT_VOICEMAN_06005_003720_BLOEWYDA","当時のあんたにとっちゃいい迷惑だったかもしれないけど、<hex:02100103>あの子なりに、とてもがんばっていたんだよ。"
"386","TEXT_VOICEMAN_06005_003730_WILFSUNN","そして君は今、こうして大勢の中にいる。<hex:02100103>それどころか、絆を結ぶ手助けまでしているね。"
"387","TEXT_VOICEMAN_06005_003740_WILFSUNN","私たちは、そのことが……たまらなく嬉しいんだ。"
"388","TEXT_VOICEMAN_06005_003750_BLOEWYDA","ムーンブリダが信じた人は、力いっぱい押した背中は、<hex:02100103>そのあともちゃんと歩き続けてくれていた。"
"389","TEXT_VOICEMAN_06005_003760_BLOEWYDA","うちの自慢の娘の笑顔を、今日はとても近くに感じるよ。<hex:02100103>ありがとう……ウリエンジェ。"
"390","TEXT_VOICEMAN_06005_003770_URIANGER","っ…"
"391","TEXT_VOICEMAN_06005_003780_URIANGER","……はい、私も今やっと……やっと思い出せています……。"
"392","TEXT_VOICEMAN_06005_003790_URIANGER","あの笑顔はまぶしく、あたたかく……<hex:02100103>悲しいものではなかったことを。"
"393","TEXT_VOICEMAN_06005_003800_LIVINGWAY","ウリエンジェには、大切な方がいらっしゃったのですね。"
"394","TEXT_VOICEMAN_06005_003810_THANCRED","……気になるか？"
"395","TEXT_VOICEMAN_06005_003820_LIVINGWAY","いいえ、わたくしはただ……<hex:02100103>まだ知らないことが多いのだと、思い直しただけですわ。"
"396","TEXT_VOICEMAN_06005_003830_THANCRED","そうだな、生まれたときからここにいたって、<hex:02100103>知らないこと、わからないこと、足りないことだらけだ。"
"397","TEXT_VOICEMAN_06005_003840_THANCRED","だから……この星はまだ、終わるには早すぎるんだよ。"
"398","TEXT_VOICEMAN_06005_003850_YSHTOLA","あら、あなたも手が空いたのかしら？"
"399","TEXT_VOICEMAN_06005_003860_ESTINIEN","こっちも、やれそうな仕事は片づけてきたぞ。<hex:02100103>荷運びやら、逃げた動物の捕獲やら……<hex:02100103>役に立ったのかはわからんがな。"
"400","TEXT_VOICEMAN_06005_003870_ALISAIE","十分なんじゃない？<hex:02100103>ここにきて大きな仕事が残ってるようだったら、<hex:02100103>それはそれで、マズそうだし……。"
"401","TEXT_VOICEMAN_06005_003880_GRAHATIA","荷や人の積み込みはともかく、<hex:02100103>方舟そのものの準備は順調そうだったな。<hex:02100103>あとはエーテル縮退炉さえどうにかなれば、って感じだ。"
"402","TEXT_VOICEMAN_06005_003890_THANCRED","ああ、ここに集まってたのか。"
"403","TEXT_VOICEMAN_06005_003900_URIANGER","レポリットたちへの相談も、ひとまず落ち着きました。<hex:02100103>話を聞いて安堵した様子の方もいれば、<hex:02100103>最後まで調整を続けると息巻いている方もおいででしたよ。"
"404","TEXT_VOICEMAN_06005_003910_URIANGER","リヴィングウェイたちも、<hex:02100103>それぞれの研究者に付き添いたいと言ってくれました。<hex:02100103>今しがた、送り届けてきたところです。"
"405","TEXT_VOICEMAN_06005_003920_THANCRED","さて、こうなるとエクスアダマントを待つばかりだが……"
"406","TEXT_VOICEMAN_06005_003930_KRILE","(-クルル-)アルフィノくん、聞こえる？<hex:02100103>こちらクルルよ。"
"407","TEXT_VOICEMAN_06005_003940_KRILE","(-クルル-)お待ちかねの品が届いたわ！<hex:02100103>至急、みんなと一緒に地上にあがって、港へ来て！"
"408","TEXT_VOICEMAN_06005_003950_ALPHINAUD","噂をすれば……だ！<hex:02100103>行ってみよう！"
"409","TEXT_VOICEMAN_06005_003960_OFFICECLERK","フルシュノ様、お忙しいところ失礼します！<hex:02100103>緊急のご報告が……！"
"410","TEXT_VOICEMAN_06005_003970_OFFICECLERK","それが、その、なんというか……<hex:02100103>知神の港が大変なことになっておりまして……ッ！"
"411","TEXT_VOICEMAN_06005_003980_ALPHINAUD","すみません、ちょっと通ります……！"
"412","TEXT_VOICEMAN_06005_003990_ALPHINAUD","これは……！"
"413","TEXT_VOICEMAN_06005_004000_IMMIGRATIONCONTROLSTAFF","だから、困りますってば！<hex:02100103>許可もなく、こんなに荷物を持ち込まれては！"
"414","TEXT_VOICEMAN_06005_004010_ALISAIE","すごい……まさか、これ全部……？"
"415","TEXT_VOICEMAN_06005_004020_KOKKOLDANKKOL","な、なんじゃこりゃあ！<hex:02100103>ここにいる全員、あの海賊船も飛空艇も、<hex:02100103>荷物を届けにきた連中だってのか！？"
"416","TEXT_VOICEMAN_06005_004030_SICARD","よう、待たせたな。<hex:02100103>依頼の品、キッチリお届けに上がったぜ。<hex:02100103>……見た感じ、うちがいちばん大量だな！"
"417","TEXT_VOICEMAN_06005_004040_EMMANELLAIN","そりゃ、グリダニアとウルダハの分も預かってるからだろ。<hex:02100103>威張るなよな。"
"418","TEXT_VOICEMAN_06005_004050_SICARD","アァ？　負け惜しみか？<hex:02100103>っつーかお前、本当にダラガブ片まで行ったのかよ？"
"419","TEXT_VOICEMAN_06005_004060_EMMANELLAIN","おう、入口まで行ったぞ！<hex:02100103>あとはツテを辿って、こういうお宝探索の専門家、<hex:02100103>空賊たちに話を持っていったりしたな！"
"420","TEXT_VOICEMAN_06005_004070_EMMANELLAIN","へへん、当たり前だろ！<hex:02100103>突入部隊が安心して先を目指せるように、<hex:02100103>入口を護る大役を務めたぜ！"
"421","TEXT_VOICEMAN_06005_004080_SICARD","ま、適材適所だな。<hex:02100103>あんなヤベェ場所にボンクラ貴族を連れてっても、<hex:02100103>おもりしきれねぇし。"
"422","TEXT_VOICEMAN_06005_004090_EMMANELLAIN","なにをー！"
"423","TEXT_VOICEMAN_06005_004100_SICARD","やるかぁ！？"
"424","TEXT_VOICEMAN_06005_004110_EMMANELLAIN","負けるからやりませーん"
"425","TEXT_VOICEMAN_06005_004120_HANCOCK","みなさん、ご無沙汰しておりマ～ス！"
"426","TEXT_VOICEMAN_06005_004130_ALPHINAUD","ハンコック殿！？<hex:02100103>ソロバンまで、どうして……！"
"427","TEXT_VOICEMAN_06005_004140_HANCOCK","いやなに、東方連合が集めた神器やアラグの魔器、<hex:02100103>その他諸々こころづけを、代表してお持ちしたのデ～ス。"
"428","TEXT_VOICEMAN_06005_004150_HANCOCK","例えば、ボズヤ・レジスタンスが押収したアラグの遺物など……<hex:02100103>「解放者殿ならば正しく役立ててくださるでしょう」と、<hex:02100103>快く提出してくださいましたヨ！"
"429","TEXT_VOICEMAN_06005_004160_HANCOCK","ついでに、バル島に保管されていた品の中で使えそうなものを、<hex:02100103>エジカ・ツンジカさんより預かってまいりました。<hex:02100103>「急に探せるか！」と怒ってましたがネ！"
"430","TEXT_VOICEMAN_06005_004170_HANCOCK","ついでに、バル島に保管されていた品の中で使えそうなものを、<hex:02100103>現地に残っている調査員から預かってまいりました。"
"431","TEXT_VOICEMAN_06005_004180_SOROBAN","オイラも、神器のお届けに来たんだよぉ～。<hex:02100103>博識のセンリがおやつを求めてクガネに行ったとき、<hex:02100103>たまたまハンコックがその話をしてるのを聞いたそうでさぁ～。"
"432","TEXT_VOICEMAN_06005_004190_SOROBAN","醴泉神社のみんなで相談して、秘蔵の神器、<hex:02100103>テンゼンの愛刀「鳳凰丸」を貸すことにしたんだよぉ～。"
"433","TEXT_VOICEMAN_06005_004200_SOROBAN","けど、とくに朱雀と青龍が心配しちゃってさぁ～。<hex:02100103>渡すまでついてくるっていうから、<hex:02100103>近場にいて信頼できる海賊衆に託そうとしたんだぁ～。"
"434","TEXT_VOICEMAN_06005_004210_SOROBAN","そしたら、そこにハンコックもいてさぁ～。<hex:02100103>よかったぁ～って思ったんだけど、<hex:02100103>青龍が今度は、ちゃんと見届けるまで帰ってくるなって……。"
"435","TEXT_VOICEMAN_06005_004220_SOROBAN","オイラもオイラもぉ～！<hex:02100103>ハンコックから相談を受けたブンチン様が、<hex:02100103>碧甲羅の神器を持っていってやりなさいって言ってさぁ～。"
"436","TEXT_VOICEMAN_06005_004230_SOROBAN","けど、オイラだけで運ぶのが難しかったから、<hex:02100103>海賊衆に手伝ってもらおうと思ったんだぁ～。<hex:02100103>結局、そこでハンコックに会えたんだけどねぇ～。"
"437","TEXT_VOICEMAN_06005_004240_HANCOCK","そういうのを諸々集めた結果、かなりの量になりまして。<hex:02100103>加えて一刻も早く……とのことでしたので、<hex:02100103>知人の素晴らしいフネに乗せていただいた次第デス。"
"438","TEXT_VOICEMAN_06005_004250_HANCOCK","劇団マジェスティックのみなさんが、アナタによろしくと。<hex:02100103>「光の戦士」の冒険譚に、再び劇場艇が出てくるとは光栄だと、<hex:02100103>よろこんでおられましたヨ！"
"439","TEXT_VOICEMAN_06005_004260_ALPHINAUD","しかし……それだけ多くの神器や魔器を集めたとなると、<hex:02100103>多額の費用がかかったのではないだろうか……？"
"440","TEXT_VOICEMAN_06005_004270_HANCOCK","オ～、もしやあとから請求されることを案じてますネ？"
"441","TEXT_VOICEMAN_06005_004280_HANCOCK","しかしご心配なく。<hex:02100103>東アルデナード商会としましては、ロロリト会長の指示のもと、<hex:02100103>将来も見据えて「悪くないように」やっておりますのでネ！"
"442","TEXT_VOICEMAN_06005_004290_HANCOCK","加えて、「暁」からはすでに資金提供を受けておりマ～ス。<hex:02100103>それを使ってそろえてきた品々デスから、<hex:02100103>正真正銘、みなさんの戦利品デ～ス！"
"443","TEXT_VOICEMAN_06005_004300_ALPHINAUD","すでに資金提供を？<hex:02100103>それは……"
"444","TEXT_VOICEMAN_06005_004310_TATARU","(-？？？？-)フーッフッフッフ！"
"445","TEXT_VOICEMAN_06005_004320_TATARU","(-？？？？-)私をケチなだけの金庫番だとお思いでっしたか？"
"446","TEXT_VOICEMAN_06005_004330_TATARU","必要なときには、ドドーンと投資する！<hex:02100103>そのために日ごろの節制と内職があるのでっす！"
"447","TEXT_VOICEMAN_06005_004340_TATARU","それだけではありません……<hex:02100103>今回は、超強力なパトロンが力添えをしてくださいまっした。"
"448","TEXT_VOICEMAN_06005_004350_TATARU","「暁」の設立当初、まだ資金の乏しい冬の時代……<hex:02100103>そんなころから、こっそり支援してくださったこのお方……！"
"449","TEXT_VOICEMAN_06005_004360_ALISAIE","って、お母様！？"
"450","TEXT_VOICEMAN_06005_004370_FOURCHENAULT","アメリアンス……。"
"451","TEXT_VOICEMAN_06005_004380_AMELIANCE","あら、私はあくまで中立よ？<hex:02100103>けれど、あなたががんばって用意してくれている方舟にも、<hex:02100103>うちの金庫を乗せたりはできないでしょう？"
"452","TEXT_VOICEMAN_06005_004390_AMELIANCE","だったら、空けてしまってもいいかなって。<hex:02100103>使えるうちに使ってこそのお金だもの。"
"453","TEXT_VOICEMAN_06005_004400_AMELIANCE","ねー"
"454","TEXT_VOICEMAN_06005_004410_TATARU","ねー"
"455","TEXT_VOICEMAN_06005_004420_THANCRED","しかし、これだけの短時間に、よく連携がとれたな。<hex:02100103>派遣団に参加していた連中以外にも、<hex:02100103>ずいぶん広まってるようだが……。"
"456","TEXT_VOICEMAN_06005_004430_KRILE","そこはほら、私にもツテがあるって言ったでしょう？"
"457","TEXT_VOICEMAN_06005_004440_ALISAIE","エレンヴィル！<hex:02100103>あなたがクルルと組んでたの……！？"
"458","TEXT_VOICEMAN_06005_004450_ERENVILLE","おたくらとラヴィリンソスで別れたあと、<hex:02100103>あらためてこのお嬢ちゃんから手紙をもらったんだよ。"
"459","TEXT_VOICEMAN_06005_004460_ERENVILLE","「暁」が何を目的としてるか。<hex:02100103>それから、世界中を飛び回ってるグリーナーの足と連絡網を、<hex:02100103>いざってときには貸してほしい……ってな。"
"460","TEXT_VOICEMAN_06005_004470_ERENVILLE","俺らに、シャーレアンを裏切るつもりはない。<hex:02100103>これまで命じられてきた収集が、<hex:02100103>月へ知識を運び出すためだったってのも、まあいい。"
"461","TEXT_VOICEMAN_06005_004480_ERENVILLE","だがな、俺らは自分で集めたからこそ知ってるんだ。<hex:02100103>この星にはまだまだ、「未知」がたくさんあるってことを。"
"462","TEXT_VOICEMAN_06005_004490_ERENVILLE","だから、終末と抗う道を探してる「暁」に手を貸した。<hex:02100103>もっとも、人使いの荒さにかけては、<hex:02100103>おたくらと同じくらいだったけどな。"
"463","TEXT_VOICEMAN_06005_004500_ERENVILLE","……ってなわけで、<hex:02100103>グリーナーズ・ギルドシップが総力を挙げて連れてきたぜ。<hex:02100103>これが最後の助っ人たちだ！"
"464","TEXT_VOICEMAN_06005_004510_CID","よう、宇宙を行く船を作ってるんだって？"
"465","TEXT_VOICEMAN_06005_004520_CID","これまで我が社を散々巻き込んできたんだ、<hex:02100103>そんなおもしろそうな案件にだけ、除け者ってことはないよな。"
"466","TEXT_VOICEMAN_06005_004530_GRAHATIA","シド……みんな……！"
"467","TEXT_VOICEMAN_06005_004540_CID","ガーロンド・アイアンワークス、参上だ！<hex:02100103>集まった素材を方舟に組み込む役目、<hex:02100103>俺たちにも手伝わせてくれ。"
"468","TEXT_VOICEMAN_06005_004550_CID","おっと、もうひとつ伝えなきゃならないことがあった。<hex:02100103>……ここに来る前、ウェルリトの、<hex:02100103>ガイウスのところに寄ってきてな。"
"469","TEXT_VOICEMAN_06005_004560_CID","ウァレンスがアルテマウェポン研究のために溜め込んでた、<hex:02100103>アラグの魔器を預かってきた。<hex:02100103>見たところ、少量だがエクスアダマントが使われてる。"
"470","TEXT_VOICEMAN_06005_004570_CID","ガイウスが「暁」に対して贈れる、<hex:02100103>どんな言葉よりも誠実な謝罪で、支援だろうよ。<hex:02100103>受け取ってやってくれ。"
"471","TEXT_VOICEMAN_06005_004580_HOARYBOULDER","私たちは、クルルさんから要請を受けて、<hex:02100103>モードゥナのダラガブ片へ向かいました。"
"472","TEXT_VOICEMAN_06005_004590_HOARYBOULDER","……とはいえ、かの防衛機構を相手取るとなると、<hex:02100103>「暁」の残存メンバーだけでは厳しいものがある。"
"473","TEXT_VOICEMAN_06005_004600_HOARYBOULDER","そこへ、グリーナーの呼びかけによって、<hex:02100103>イディルシャイアのトレジャーハンターたちが、<hex:02100103>駆けつけてくれたのです。"
"474","TEXT_VOICEMAN_06005_004610_HOARYBOULDER","その一団の中には、多くのゴブリン族の姿もありました。"
