"0","TEXT_CTSDKBCHARACTER4SUB1_00578_YALANA_000_000","あら、旅人さんですか？<hex:02100103>こちらでは、クリスタリウムの食糧調達に貢献するため、<hex:02100103>肥料の改良や最適な土壌の研究を行っています。"
"1","TEXT_CTSDKBCHARACTER4SUB1_00578_YALANA_000_010","あ、<hex:022C0DFF07022903EB0203FF02200203>さん！<hex:02100103>調達科のケシ・レイ科長は、あれ以降、<hex:02100103>ご迷惑をおかけしたりしていませんか……？"
"2","TEXT_CTSDKBCHARACTER4SUB1_00578_YALANA_000_020","シムーンらしき巨大生物の研究が楽しいのは、認めます……！<hex:02100103>でも私は、ケシ・レイ科長みたいに、<hex:02100103>仕事をサボったりはしていませんからね……！"
"3","TEXT_CTSDKBCHARACTER4SUB1_00578_YALANA_000_030","まったく、マオには困ったものです。<hex:02100103>あなたのおかげで、無事に連れ帰れたからいいものの……。"
"4","TEXT_CTSDKBCHARACTER4SUB1_00578_YALANA_000_031","ケシ・レイ科長も、マオも、<hex:02100103>シムーンを見つけたいなら、自分を大事にしてほしいです！<hex:02100103>まったく、猛進するボアみたいなんだから……。"
"5","TEXT_CTSDKBCHARACTER4SUB1_00578_YALANA_000_040","あ、<hex:022C0DFF07022903EB0203FF02200203>さん！<hex:02100103>シムーンの研究は順調ですよ！<hex:02100103>先日は、コルシア島でシムーンの卵の殻を発見したんです！"
