"0","TEXT_CTSDOMRECONSTRUCTTAUYAKU_00530_TAUYAKU_000_000","ここは、がれきを片づけていたときに、水が溜まっちゃってね。<hex:02100103>大工衆の人たちが機転を利かせて、橋をかけてくれたんだ。<hex:02100103>おかげで、立派な池になっただろう？"
"1","TEXT_CTSDOMRECONSTRUCTTAUYAKU_00530_TAUYAKU_000_005","この池をどうするか、ちょっと考えがあるんだけどね……。<hex:02100103>詳しいことは、まだ内緒にさせておくれ。"
"2","TEXT_CTSDOMRECONSTRUCTTAUYAKU_00530_TAUYAKU_000_010","……私の本来の仕事？<hex:02100103>君ならもう、<hex:02100103>なんとなくわかっているんじゃないのかい？"
"3","TEXT_CTSDOMRECONSTRUCTTAUYAKU_00530_KOZAKURA_000_015","これは…………！<hex:02100103>なんと見事な庭園でございましょう！"
"4","TEXT_CTSDOMRECONSTRUCTTAUYAKU_00530_KOZAKURA_000_016","風流や雅というのは、<hex:02100103>きっとこういうものを指すのでございましょうね……！"
"5","TEXT_CTSDOMRECONSTRUCTTAUYAKU_00530_KOZAKURA_000_017","奥の東屋も居心地がよさそうで、<hex:02100103>皆さんの、よき憩いの場となりそうでございまする！"
"6","TEXT_CTSDOMRECONSTRUCTTAUYAKU_00530_HACHISUBA_000_018","タウヤクさんに指示されるまま、動いてただけだから、<hex:02100103>オレもこんなにきれいな庭になるって、<hex:02100103>途中までわからなかったよ！"
"7","TEXT_CTSDOMRECONSTRUCTTAUYAKU_00530_HACHISUBA_000_019","タウヤクさん、<hex:02100103>こんな技術、いったいどこで覚えたんだい？"
"8","TEXT_CTSDOMRECONSTRUCTTAUYAKU_00530_HACHISUBA_000_020","帝国の属州だった頃は、<hex:02100103>ドマ風の庭園を造る機会なんて、なかったはずだろ？<hex:02100103>娯楽施設も、帝国風が最上とされていたしさ。"
"9","TEXT_CTSDOMRECONSTRUCTTAUYAKU_00530_TAUYAKU_000_021","もちろん、そのとおりだよ。<hex:02100103>ただ、帝国に支配される前は、<hex:02100103>庭師の見習工をやってたってだけさ。"
"10","TEXT_CTSDOMRECONSTRUCTTAUYAKU_00530_TAUYAKU_000_022","親父は、ドマ城お抱えの庭師でね。<hex:02100103>私も、剪定なんかを手伝わせてもらったのさ。"
"11","TEXT_CTSDOMRECONSTRUCTTAUYAKU_00530_TAUYAKU_000_023","そういえば幼い頃、手伝いをしていた最中に、<hex:02100103>カイエン様が可愛がっておられた梅の木の枝を、<hex:02100103>誤って、手折ってしまったことがあったな。"
"12","TEXT_CTSDOMRECONSTRUCTTAUYAKU_00530_TAUYAKU_000_024","親父には、ひっぱたかれてね。<hex:02100103>じんじん痛む頬をおさえながら、カイエン様に謝りにいった。<hex:02100103>道中は、悲しくて恐ろしくて、震えがとまらなかったよ。"
"13","TEXT_CTSDOMRECONSTRUCTTAUYAKU_00530_TAUYAKU_000_025","でもカイエン様は笑って、<hex:02100103>折れた枝を、大切そうに受け取ってくださったんだ。<hex:02100103>ミナ様への手土産がほしかったところだと、おっしゃってね。"
"14","TEXT_CTSDOMRECONSTRUCTTAUYAKU_00530_TAUYAKU_000_026","それから私はずっと、<hex:02100103>ドマいちの庭師になることを志していたんだ。<hex:02100103>……帝国に支配されていても、内心でずっとね。"
"15","TEXT_CTSDOMRECONSTRUCTTAUYAKU_00530_TAUYAKU_000_027","だから、帝国から解放されて、<hex:02100103>こうして造園までやらせてもらえて、本当に嬉しいよ。<hex:02100103><hex:022C0DFF07022903EB0203FF02200303>さん、ありがとう。"
"16","TEXT_CTSDOMRECONSTRUCTTAUYAKU_00530_TAUYAKU_000_028","…………ドマ城の庭園は、<hex:02100103>いつも優しくて穏やかな時間が流れている、美しい庭だった。<hex:02100103>そんな記憶の中にあった庭園を、再現させてもらったんだ。"
"17","TEXT_CTSDOMRECONSTRUCTTAUYAKU_00530_TAUYAKU_000_029","カイエン様や親父に見てもらえないのが残念だが、<hex:02100103>この庭を完成できて、本当に良かった。"
"18","TEXT_CTSDOMRECONSTRUCTTAUYAKU_00530_TAUYAKU_000_030","ああ、すまない。<hex:02100103>せっかく庭園が完成したのに、しんみりさせてしまったね。"
"19","TEXT_CTSDOMRECONSTRUCTTAUYAKU_00530_TAUYAKU_000_031","でも、故人を想うことすら、いままでは難しかった。<hex:02100103>帝国に支配されてる間はもちろん、解放されてからも、<hex:02100103>ずっと、生きるのに必死だったからね。"
"20","TEXT_CTSDOMRECONSTRUCTTAUYAKU_00530_TAUYAKU_000_032","いま、ようやく過去を振り返る余裕ができた……<hex:02100103>そんな気がするよ。"
"21","TEXT_CTSDOMRECONSTRUCTTAUYAKU_00530_HACHISUBA_000_033","町並みも再建できて、こうして憩いの庭ができたならさ、<hex:02100103>みんなで集まって、なにかできたらいいよな。"
"22","TEXT_CTSDOMRECONSTRUCTTAUYAKU_00530_HACHISUBA_000_034","ただ、祭りじゃちょっと派手すぎるし、<hex:02100103>年忌の法要だと、もの悲しくなりすぎちまうし……。<hex:02100103>程度が難しいとは思うけど……。"
"23","TEXT_CTSDOMRECONSTRUCTTAUYAKU_00530_KOZAKURA_000_035","そうでございますね……。<hex:02100103>車前会でも、いつか作業に区切りがついた折には、<hex:02100103>節目の催しを行いたいと、話が上がっておりました。"
"24","TEXT_CTSDOMRECONSTRUCTTAUYAKU_00530_KOZAKURA_000_036","不肖ゆえ、<hex:02100103>ふさわしい催しが、すぐには思いつきませぬが……<hex:02100103>この件を持ち帰り、一考を投じたく存じまする。"
"25","TEXT_CTSDOMRECONSTRUCTTAUYAKU_00530_KOZAKURA_000_037","それまで、しばしお待ちいただいても、<hex:02100103>よろしいでしょうか。"
"26","TEXT_CTSDOMRECONSTRUCTTAUYAKU_00530_HACHISUBA_000_038","もちろんさ！<hex:02100103>なにか困ったことがあれば、いつでも言ってくれな！"
"27","TEXT_CTSDOMRECONSTRUCTTAUYAKU_00530_KOZAKURA_000_039","では、わたくしめはお先に失礼いたしまする！<hex:02100103>必ずや、よき催しを開催いたしまする！"
"28","TEXT_CTSDOMRECONSTRUCTTAUYAKU_00530_TAUYAKU_000_040","根をつめすぎないようにね。<hex:02100103>煮詰まったら、ここに休憩にくるんだよ。"
"29","TEXT_CTSDOMRECONSTRUCTTAUYAKU_00530_SYSTEM_000_041","冒険者の活躍により、<hex:02100103>ドマ町人地における、すべての場所の作業が完了しました！"
"30","TEXT_CTSDOMRECONSTRUCTTAUYAKU_00530_SYSTEM_000_042","節目となる催しについて、<hex:02100103>どうやらコザクラが悩んでいるようです。<hex:02100103>話を聞いてみましょう。"
"31","TEXT_CTSDOMRECONSTRUCTTAUYAKU_00530_TAUYAKU_000_045","庭師の仕事っていうのはね、庭を造って終わり、じゃないんだ。<hex:02100103>丹念に手入れして、管理してあげると、<hex:02100103>もっともっと、きれいになるよ。"
