"598880","0","1","2","0","0","4218","0","0","1","1","1","0","0","0","0","0","0","False","False","False","あら、私を捕まえる？<hex:02100103>言ったでしょう……本当の私たちは、閉じた残骸の中……。<hex:02100103>この身は幻、残骸から滴った雫に過ぎないわ。","それでも、あなたたちを呑み込むことくらい、<hex:02100103>造作もないはずなのだけど……。<hex:02100103>あの人たちの想いが、邪魔をするんだもの……。","だから眺めているだけよ。<hex:02100103>命なき街で、あなたたちがどこにも行けず、<hex:02100103>ぐるりぐるりと回るのを……。"
"598881","0","1","2","0","0","763","1024","953","1","1","1","0","0","0","0","0","0","False","False","False","わっ、来てくれて嬉しいだす！<hex:02100103>ほら見て、空はすっかりもとどおり……<hex:02100103>漁も再開できるようになっただす。","ただ……カルザール商会はもうないし……<hex:02100103>メヴァンとケラシャフだって、戻ってこないだす……。<hex:02100103>ほかにも、もとどおりにならない部分はたくさんあるだす。","それでも、今日という日が来た以上、<hex:02100103>訓えを胸に生きていくだす。<hex:02100103><hex:022C0DFF07022903EB0203FF02200203>にも、こうして会えたことだし！"
"598882","0","1","2","0","0","762","764","5665","1","1","1","0","0","0","0","0","0","False","False","False","<hex:022C0DFF07022903EB0203FF02200203>さん！<hex:02100103>会えて嬉しいけど、うん、今すぐ逃げて！","うちの錬金術師たちがね、次にあなたたちが来たら、<hex:02100103>アーカーシャの与える影響や、天の果てに行った痕跡について、<hex:02100103>あれこれ調べさせてほしいって話してたんだ。","こう……採られたり……抜かれたり……測られたり……<hex:02100103>されてもいいならアタシも大歓迎なんだけど、<hex:02100103>そうじゃないなら、こっそり逃げた方がいいと思う！"
"598883","0","1","2","0","0","5734","5695","9014","1","1","1","605","6215","605","0","0","0","False","False","False","あらあら、まあまあ！<hex:02100103>あなたが、ひとりで訪ねてきてくれるなんて。<hex:02100103>お茶はいかが？　それともお食事の方がいい……？","……アルフィノがね、天の果てから戻って以来、<hex:02100103>前よりもこまめに手紙を寄越してくれるの。<hex:02100103>きっと、心配かけたことを気にしているのね。","元気に帰ってきてくれたら、それだけで十分なのだけど……<hex:02100103>フルシュノさんが、眉根を寄せながら読んでいるのを見ると、<hex:02100103>つい楽しみにもなってしまうのよ！"
"598884","0","1","2","0","0","5695","715","0","1","1","1","617","624","0","0","0","0","False","False","False","リーンさんから終末の話は伺いました。<hex:02100103>現状、こちらでは対抗のしようもないのが歯がゆいですが……<hex:02100103>災厄が訪れた場合に的確な指示が出せるよう備えておきます。","ですので、どうかご心配なく……<hex:02100103>私たちを信じ、あなた方のやるべきことに集中してください！","0"
"598885","0","1","2","0","0","764","5533","5696","1","1","1","0","6215","605","0","0","0","False","False","False","実は、一足先に妖精王……フェオ＝ウルが、<hex:02100103>原初世界で起きていた大きな問題は退けられたらしいと、<hex:02100103>私たちに教えてくれたんです。","本当によかった……。<hex:02100103>あなたも報告に来てくださったこと、<hex:02100103>リーンさんにも伝えておきますね。","みなさんは、別の世界にいても、この世界を救ってくれた。<hex:02100103>だから私たちも、ノルヴラントから、<hex:02100103>変わらずみなさんの幸せを願い続けたいと思います。"
"598886","0","1","2","0","0","766","768","763","1","1","1","0","0","0","0","0","0","False","False","False","むむ……？<hex:02100103>クリスタリウムの住民とすっかり打ち解けたこと以外に、<hex:02100103>変わったことはなかったか、とな？","と、年寄りをからかうでないわ！<hex:02100103>ワシはただ、正当な対価の取引をしておるだけだ！","変わったことも、とくには思い当たらんぞ。<hex:02100103>しかしそんなことを問うとは……<hex:02100103>おぬし、何か隠してはいまいな？"
"598887","0","1","2","0","0","768","5627","4229","1","1","1","0","0","0","0","0","0","False","False","False","<hex:022C0DFF07022903EB0203FF02200203>！<hex:02100103>妖精王から聞いたぞ、まさか終末などという、<hex:02100103>超重大なことをワシに隠していようとは……！","説教のひとつもくれてやりたいところだが、<hex:02100103>まあ、ワシらを思いやってくれていたのだとはわかる。","よって、おぬしの無事な顔を対価として、<hex:02100103>留飲を下げてやるとしよう。<hex:02100103>まったく……心配をかけおって……！"
"598888","0","1","2","0","0","764","0","0","1","1","1","6215","0","0","0","0","0","False","False","False","エクスアダマントの調達の際には、<hex:02100103>イルサバード派遣団だけでなく、<hex:02100103>多くの方々に協力していただいたんですよね。","次は、そういった方々のところに、<hex:02100103>試供品を持っていくのも良いかも……？<hex:02100103>タタルさんと計画を練っておきます！","0"
"598889","0","1","2","0","0","763","0","0","1","1","1","0","0","0","0","0","0","False","False","False","ようこそ、<hex:02081FE905FF0D>お姉さん<hex:FF0D>お兄さん<hex:03>。<hex:02100103>どれも新生祭に合わせて、心を込めて創った作品たちだ。<hex:02100103>眺めていってもらえると嬉しいよ。","0","0"
"598890","0","1","2","0","0","764","0","0","1","1","1","0","0","0","0","0","0","False","False","False","気鋭の彫金師ジャ・ベン・ティアの路上個展だ。<hex:02100103>ぜひ、こいつの作品をじっくり見ていってほしい。","0","0"
"598891","0","1","2","0","0","4218","0","0","1","1","1","0","0","0","0","0","0","False","False","False","俺はこの街付近から離れないで、<hex:02100103>バルデシオン委員会の面々と学者さんの連絡を待とうと思う。<hex:02100103>新しい調査の目処が立ったら、君にも声をかけるよ。","0","0"
"598892","0","1","2","0","0","4219","766","0","1","1","1","0","0","0","0","0","0","False","True","False","ここはすごく面白いところで、研究が捗ります！<hex:02100103>なにかわかったら、すぐに連絡しますねえ。","それはそうと……<hex:02100103>ここ、「なにか」いますよね？","あなたやラハくんの話を推察するに、<hex:02100103>彼らが神々の依り代だと思うんですが……<hex:02100103>私が近づくと逃げちゃうんですよ、残念だなぁ。"
"598893","0","0","0","0","0","0","0","0","0","0","0","0","0","0","0","0","0","False","False","False","","",""
"598894","0","0","0","0","0","0","0","0","0","0","0","0","0","0","0","0","0","False","False","False","","",""
"598895","0","0","0","0","0","0","0","0","0","0","0","0","0","0","0","0","0","False","False","False","","",""
"598896","0","0","0","0","0","0","0","0","0","0","0","0","0","0","0","0","0","False","False","False","","",""
"598897","0","0","0","0","0","0","0","0","0","0","0","0","0","0","0","0","0","False","False","False","","",""
"598898","0","0","0","0","0","0","0","0","0","0","0","0","0","0","0","0","0","False","False","False","","",""
"598899","0","0","0","0","0","0","0","0","0","0","0","0","0","0","0","0","0","False","False","False","","",""
"598900","0","1","2","0","0","5695","9058","0","1","1","1","6215","6215","0","0","0","0","False","False","False","<hex:022C0DFF07022903EB0203FF02200203>様、<hex:02100103>アメリアンス様のご依頼を快く引き受けてくださったそうで、<hex:02100103>本当にありがとうございました！","ミラディーン様のお世話は、わたくしにお任せください。<hex:02100103>とても礼儀正しくて、頑張り屋で……<hex:02100103>つい親身になって応援したくなる方ですね。","0"
"598901","0","1","2","0","0","764","5734","0","1","1","1","6215","6229","0","0","0","0","False","False","False","お洋服は気に入っていただけたでしょうか？<hex:02100103>アメリアンス様含め、わたくしどもで心を込めて作りました。<hex:02100103>あなた様には、感謝してもしきれませんから！","それにしても、ミラディーン様が帰国されてから、<hex:02100103>やはりお屋敷が寂しく感じてしまいますね……。<hex:02100103>次にお会いできる日がわたくしも待ち遠しいです！","0"
"598902","0","1","2","0","0","708","0","0","1","1","1","0","0","0","0","0","0","False","False","False","焼き菓子入りの飾りタマゴ、喜んでもらえて本当によかった！<hex:02100103>寝る間も惜しんでレシピを研究した甲斐があったわ。","ニワトリも機嫌よく卵を産んでくれているし、<hex:02100103>お祭りの間は、どんどん作っていかないとね！","0"
"598903","0","1","2","0","0","950","0","0","1","1","1","0","0","0","0","0","0","False","False","False","かわいこちゃんたちの大事な卵は、<hex:02100103>中身は焼き菓子の材料に、<hex:02100103>殻は飾りタマゴの素材に用いられているっ！","彼女たちが苦心して産んだ白い宝石……<hex:02100103>ひとつたりとも無駄にはしないのだっ！","0"
"598904","0","1","2","0","0","953","0","0","1","0","1","0","0","0","0","7","0","False","False","False","キュッ！　キャウゥ～！","しあわせうさぎは、誇らしげな様子だ。<hex:02100103>飾りタマゴ配りにもやる気を見せている……気がした！","0"
"598905","0","1","2","0","0","948","0","0","1","0","1","0","0","0","0","7","0","False","False","False","コケッ……！","ニワトリは、まっすぐこちらを見つめている。<hex:02100103>大切な卵を使うことを認めてくれている……気がした！","0"
"598906","0","1","0","0","0","665","0","0","1","1","1","0","0","0","5","0","0","False","False","False","……ほっほっほ、人里を訪れるのは、いつ以来じゃったか……。<hex:02100103>来たる災厄に向けて、力ある者を探さねばならん……。","0","0"
"598907","0","1","2","0","0","950","764","763","1","1","1","0","0","0","0","5","5","False","False","False","おやぁ～、<hex:022C0DFF07022903EB0203FF02200203>じゃないかぁ～！<hex:02100103>近いうちにまた会えるって、玄武さまに聞いていたけど、<hex:02100103>まさかこんなに早く再会できるなんて、驚いたよぉ～！","……ほっほっほ。<hex:02100103>こやつとひとつになったせいか、近ごろは凶兆だけでなく、<hex:02100103>ごくまれに吉兆も見えるようになってな。","じゃが、どうやらワシが見た未来は、今日この時ではないようじゃ。<hex:02100103>なぜ、もう一度おぬしと会うことになるのかはわからぬが、<hex:02100103>その時を楽しみにしておるぞい。"
"598908","0","1","0","0","0","757","0","0","1","1","1","0","0","0","0","0","0","False","False","False","僕は、こんな所で何をしているんだ……。<hex:02100103>彼を失って以来、ヒトとの関わりを絶ったというのに……。","0","0"
"598909","0","1","2","0","0","763","0","1041","1","1","1","0","0","0","0","0","0","False","False","False","やあ。<hex:02100103>ようやくキミに会えた。<hex:02100103>こうして醴泉神社の外で会うのは、いつぶりだろうね。","わざわざこんな西方にまで出張ってきたのは、訳があってね。<hex:02100103>夢の中で、赤いスズメと白いネコが、<hex:02100103>僕を差し置いて、キミに会いに行く光景を視たのさ。","まったく、夢とはいえ彼らにはナメられたものだよ。<hex:02100103>抜け駆けしてキミを独占しようだなんてね。<hex:02100103>誰がキミの隣に相応しいか、そろそろ決着をつけないとな……。"
"598910","0","1","0","0","0","0","0","0","1","1","1","0","0","0","0","0","0","False","False","False","やはり、ヒトとは尊い生き物だ。<hex:02100103>我が内の魂が荒ぶれば、この者らを犠牲にすることになる……。<hex:02100103>それだけは、避けねばなるまい……。","0","0"
"598911","0","1","2","0","0","763","0","4219","1","1","1","0","0","0","0","0","0","False","False","False","また会ったな。<hex:02100103>「えおるぜあ」の祭りというのは、実に奇っ怪で面白い。","もしもこの場にテンゼンがいたら、<hex:02100103>街中を駆け回る二足歩行のウサギを瑞獣と勘違いして、<hex:02100103>旅の仲間に加えようとしただろう……。","ところで、他の3体にはもう会ったか？<hex:02100103>まだなら、探しに行ってやってくれ。<hex:02100103>お前を独り占めしたとあっては、連中のアラミタマが……。"
"598912","0","1","0","0","0","757","0","0","1","1","1","0","0","0","0","0","0","False","False","False","私にもっと力があれば……。<hex:02100103>あのヒトとともに、祭礼を楽しむ未来もあったかもしれぬのに……。","0","0"
"598913","0","1","2","0","0","768","0","5695","1","1","1","0","0","0","0","0","0","False","False","False","きっと、またお会いできると思っていましたよ。<hex:02100103>あなたとよく似たあのヒトも、このような祭りが大好きでしたから。","本来ならば、私ひとりで来るつもりでしたが、<hex:02100103>耳ざとい他の3体まで、なかば無理やりついてきてしまい……。<hex:02100103>彼らにしがみつかれたおかげで、自慢の羽毛が傷んでしまいました。","とは言え、もしもあのヒトが生きていたら、<hex:02100103>祭りは皆で楽しむものだと、優しく私を諭したことでしょう。<hex:02100103>きっと少しだけ、困った顔で……。"
"598914","0","1","2","0","0","950","715","0","1","1","1","0","0","0","0","0","0","False","False","False","あっ、<hex:022C0DFF07022903EB0203FF02200203>さん！<hex:02100103>あなたも、エッグハントに参加してらしたんでっすね！","私は、商売繁盛のための市場調査中でっす！<hex:02100103>それにしてもこのスーツ、侮れない着心地……<hex:02100103>「大繁盛商店」でもスーツを販売すべきか迷ってしまいまっす！","0"
"598915","0","1","2","0","0","950","0","0","1","1","1","0","0","0","0","0","0","False","False","False","しっかし、グリダニアってのは、<hex:02100103>クソ真面目で陰気な都市かと思ってたんだが……<hex:02100103>イシュガルドの仮面舞踏会も真っ青なイカした祭りじゃねぇか！","0","0"
"598916","0","1","2","0","0","767","5665","950","1","1","1","0","0","0","0","0","0","False","False","False","よう、相棒！<hex:02100103>お前もエッグハントに参加してたんだな。","……なんか今、「誰だこいつ」って顔したよな？<hex:02100103>オレだよ、オレ、お前のマブダチだっての！<hex:02100103>兄貴から友好国との親善の仕事を押し付けられたんだよ！","しっかし、グリダニアって、陰気な都市かと思ってたんだが……<hex:02100103>イシュガルドの仮面舞踏会も真っ青なイカした祭りじゃねぇか！<hex:02100103>こりゃ、ラニエットも誘うべきだったぜ……！"
"598917","0","1","0","0","0","768","0","0","1","1","1","0","0","0","0","0","0","False","False","False","エマネラン様、どのような姿であっても、<hex:02100103>気品ある振る舞いをお願いしますです、はい。","0","0"
"598918","0","1","2","0","0","950","0","0","1","1","1","0","0","0","0","0","0","False","False","False","ホッホッホゥ！<hex:02100103>タマゴをモチーフとした見事な飾り付け……<hex:02100103>新作の着想が次々と沸いてきますぞ！","0","0"
"598919","0","1","1","0","0","0","0","0","1","1","1","0","0","0","0","0","0","False","False","False","クエッ、クエ～ッ♪","0","0"
"598920","0","1","2","0","0","950","0","0","1","1","1","0","0","0","0","0","0","False","False","False","情熱的な愛の祝祭「ヴァレンティオンデー」を開催中だ！<hex:02100103>くすぶる想いを抱えてるなら、今こそ燃え上がらせるときだぜ！","0","0"
"598921","0","1","2","0","0","5696","0","0","1","1","1","0","0","0","0","0","0","False","False","False","多くの愛が紡がれる、美しき季節が到来しております。<hex:02100103>恋のお悩みがありましたら、ぜひ愛の伝道師にご相談ください。","0","0"
"598922","0","1","0","0","0","5761","959","0","1","1","1","0","0","0","0","0","0","False","False","False","フーッ、フーッ……ヌルヌル……ヌルヌルだぁ……！<hex:02100103>まさかアーテリスにも、同好の士がいるなんて……ッ！","いったい、どんな粘液を使ってるんでしょう？<hex:02100103>聞いてみようか……ああでも、なんだか近づきがたい……。","0"
"598923","0","1","1","0","0","0","757","5696","1","1","1","0","0","0","0","0","0","False","False","False","む……。<hex:02100103>よもや、よりにもよってこんな時に、<hex:02100103>貴殿と再会することになろうとはな……。","……よせ、みなまで言うでない。<hex:02100103>娘にせがまれては、拒むことはできぬ。<hex:02100103>それが父というものだ。","……だが、セウェラやヴァルドランには内密に頼む。<hex:02100103>かような姿を見られては、何を言われるか……。<hex:02100103>特にヴァルドランには、しばらく笑いものにされるであろう……。"
"598924","0","1","2","0","0","9003","933","5734","1","1","1","0","0","0","0","0","0","False","False","False","わあ、こんな所で英雄さんに会えるなんて……！<hex:02100103>父さんに無理言って連れてきてもらって良かった……！","と言っても遊びに来たわけじゃなくて、<hex:02100103>ウェルリト暫定政府から、双蛇党宛ての書状を届けるがてら、<hex:02100103>ちょっとだけお祭りを覗きにきただけ。","それに、みんなにも見せたかったんだ。<hex:02100103>この世界には、こんなに楽しいお祭りがあるってこと。<hex:02100103>この光景も、みんなが命を懸けて守った、幸せのひとつだから……。"
"598925","0","1","2","0","0","950","0","0","1","1","1","0","0","0","0","0","0","False","False","False","わかってるぜ、お前がその「すげぇ冒険者」だってな。<hex:02100103>目を閉じて中継地点まで攻略、やるんだろ？","0","0"
"598926","0","1","2","0","0","950","0","0","1","1","1","0","0","0","0","0","0","False","False","False","おや、なんだ、ここにいるじゃないか。<hex:02100103>あんたは「すごい冒険者」だ、私にはわかる。<hex:02100103>目を閉じて終着地点まで攻略を、やるんだろう？","0","0"
"598927","0","1","2","0","0","764","0","0","1","1","1","0","0","0","0","0","0","False","False","False","フッ……俺は待っているんだ。<hex:02100103>奇想天外な方法で魔城を攻略する、<hex:02100103>「すげぇ冒険者」が現れるのを、な……。","0","0"
"598928","0","1","2","0","0","764","0","0","1","1","1","0","0","0","0","0","0","False","False","False","ヒッヒッヒッ……どこかに居ないものか。<hex:02100103>驚天動地な方法で魔城を攻略してくれる、「すごい冒険者」は……。","0","0"
"598929","0","1","2","0","0","764","0","0","1","1","1","6215","0","0","0","0","0","False","False","False","来てくれたのか、<hex:022C0DFF07022903EB0203FF02200203>！<hex:02100103>テミスなら、エルピスで調べ物の真っ最中……。<hex:02100103>俺も役立たずにならないよう、修行中さ。","0","0"
"598930","0","1","2","0","0","764","0","0","1","1","1","0","0","0","0","0","0","False","False","False","熱気あふれる「紅蓮祭」が開催中だよ！<hex:02100103>帰ってきた「アイツ」に挑戦したければ、<hex:02100103>コスタ・デル・ソルに集合だ～！","0","0"
"598931","0","1","2","0","0","764","0","0","1","1","1","0","0","0","0","0","0","False","False","False","あんたも「紅蓮祭」に参加しに、来てくれたのか？<hex:02100103>歓迎するぞ、思いっきり楽しんでくれ！","0","0"
"598932","0","1","2","0","0","764","0","0","1","1","1","0","0","0","0","0","0","False","False","False","ル・フル・ティアのことを、よろしく頼んだぞ。","0","0"
"598933","0","1","2","0","0","764","756","0","1","1","1","0","0","0","0","0","0","False","False","False","ル・フル・ティアのことは、<hex:02100103>目をかけていて、いろいろと教えていたんだが……。<hex:02100103>やはり、あんたの背中を見せる方が、効果的だったな。","ま、ともかく、丸く収まったんだ。<hex:02100103>今は「紅蓮祭」を楽しんでいってくれ！","0"
"598934","0","1","2","0","0","950","0","0","1","1","1","0","0","0","0","0","0","False","False","False","おーいえぇい、魔城に挑戦してえのか？<hex:02100103>アンタみたいな冒険者なら、問題ねえ。<hex:02100103>思いっきり楽しんでくれよ！","0","0"
"598935","0","1","2","0","0","4229","0","0","1","1","1","0","0","0","0","0","0","False","False","False","ル・フル・ティアたちの声、聞こえていたぜ。<hex:02100103>どうやら、こじれてるみたいだな。<hex:02100103>やれやれだ……。","0","0"
"598936","0","1","2","0","0","708","0","0","1","1","1","0","0","0","0","0","0","False","False","False","ひゃっはー！　ル・フル・ティアのことは、ありがとよ！<hex:02100103>さあ、なんの憂いもなくなったところで改めて、<hex:02100103>「帰ってきた常夏の魔城」に挑戦してくれ！","0","0"
"598937","0","1","2","0","0","764","0","0","1","1","1","0","0","0","0","0","0","False","False","False","お疲れさまでした、ここが中継地点となります。<hex:02100103>終着地点まであと少しですので、頑張ってください！","0","0"
"598938","0","1","2","0","0","764","0","0","1","1","1","0","0","0","0","0","0","False","False","False","ル・フル・ティアの一件、おつかれさまでした。<hex:02100103>私も駆け出しの頃に、貴方が先輩だったなら、<hex:02100103>なんて考えて、彼が羨ましくなりましたよ。","0","0"
"598939","0","1","2","0","0","764","0","0","1","1","1","0","0","0","0","0","0","False","False","False","ゴールお疲れさま！　ここが終着地点よ！<hex:02100103>ここからさらに上を目指す最難関コースもあるから、<hex:02100103>余裕があるなら、挑戦してみて！","0","0"
"598940","0","1","2","0","0","764","0","0","1","1","1","0","0","0","0","0","0","False","False","False","ゴールお疲れさま！<hex:02100103>また、攻略するなんて楽しんでるね！<hex:02100103>よければ、ここから上を目指すコースも挑戦してみて！","0","0"
"598941","0","1","1","0","0","0","0","0","1","1","1","0","0","0","0","0","0","False","False","False","旅の終わりは、新たな旅の始まりでもある。<hex:02100103>さあ吟じよう、第七霊災を経てなお続く「今」を歩む、<hex:02100103>すべての旅人たちの詩を……。","0","0"
"598942","0","1","2","0","0","950","0","0","1","1","1","0","0","0","0","0","0","False","False","False","私がおっきくなったら、冒険者になって、<hex:02100103>みんなと一緒に魔城を攻略するの！<hex:02100103>そのときは、<hex:020825E905FF10>おねえさん<hex:FF10>おにいさん<hex:03>も一緒にね？","0","0"
"598943","0","1","2","0","0","9003","0","0","1","1","1","0","0","0","0","0","0","False","False","False","うおー！　兄貴たちと魔城攻略、楽しみだぜ！<hex:02100103>大<hex:020813E905FF07>姉貴<hex:FF07>兄貴<hex:03>も俺の本気、見ていかれますか！？","0","0"
"598944","0","1","2","0","0","764","0","0","1","1","1","0","0","0","0","0","0","False","False","False","駆け出しとはいえ、これでも冒険者の端くれなのよ。<hex:02100103>魔城攻略という冒険に、心が燃えないわけがないわ。<hex:02100103>私の本気を、いまこそ披露しなくちゃね。","0","0"
"598945","0","1","2","0","0","764","0","0","1","1","1","0","0","0","0","0","0","False","False","False","これから、三人で魔城に挑戦することになったんです。<hex:02100103>先輩として良い格好を……なんて、もう言いません。<hex:02100103>俺の本気を、ただぶつけるのみ、です！","0","0"
