"598946","0","1","2","0","0","715","764","0","1","1","1","0","0","0","0","0","0","False","False","False","私は最近、バルデシオン委員会に加入したんです。<hex:02100103>シャーレアンに連なる組織でありながら開放的で、<hex:02100103>「暁の血盟」とともに世界の脅威に立ち向かう姿に感銘を受けて。","現在は、聖コイナク財団との連絡係を務めています。<hex:02100103>若輩者ですが、しっかり務めさせてもらいますね。","0"
"598947","0","1","2","0","0","764","0","0","1","1","1","0","0","0","0","0","0","False","False","False","慣れないことを始めるってのは、やっぱ不安がでかいけどよ、<hex:02100103>やるって決めたからには、頭のアタイが手本にならねぇとだな！","0","0"
"598948","0","1","2","0","0","763","0","0","1","1","1","0","0","0","0","0","0","False","False","False","新しいサービスを始めるってのは、<hex:02100103>緊張もするが、なによりワクワクしてくるぜ！<hex:02100103>島でがんばってる連中に、美味い飯を届けてやらないとな！","0","0"
"598949","0","1","2","0","0","766","0","0","1","1","1","0","0","0","0","0","0","False","False","False","ヒッポの幼獣を保護できたのはよかったけどよ、<hex:02100103>弁当強盗に、ヒッポの生息地荒らしと、厄介ごとが続くな。<hex:02100103>これ以上、ややこしいことにならなきゃいいが……。","0","0"
"598950","0","1","2","0","0","764","0","0","1","1","1","0","0","0","0","0","0","False","False","False","アチャラのことは、頭が痛ぇな。<hex:02100103>盗られちまったヒッポのことも心配だしよ。<hex:02100103>せめて、ちゃんと飯食わせてもらってりゃあいいが……。","0","0"
"598951","0","1","2","0","0","764","0","0","1","1","1","0","0","0","0","0","0","False","False","False","勝てたからよかったって話ではあるけどよ、<hex:02100103>街道を使ったレース、最高にシビれたぜ……！<hex:02100103>仕事もあるし頻繁にはできねぇけど、またやりたいな！","0","0"
"598952","0","1","2","0","0","5625","764","0","1","1","1","0","0","0","0","0","0","False","False","False","よう、<hex:022C0DFF07022903EB0203FF02200203>！<hex:02100103>顔を出してくれて嬉しいぜ！","みんなで前向いてがんばろうぜってときこそ、娯楽も大事だろ？<hex:02100103>近々、またレースをやって島を盛り上げようって話してるんだ！<hex:02100103>参加者を募ったりとか、新しいことも試してみたいな……！","0"
"598953","0","1","2","0","0","764","0","0","1","1","1","0","0","0","0","0","0","False","False","False","運送屋のことは、もうここまできたら協力するしかないよね。<hex:02100103>姐御って、一度言い出したことは簡単に撤回しないヒトだし……。<hex:02100103>ま、そういうところもボクらは尊敬してるんだけどさ。","0","0"
"598954","0","1","2","0","0","5627","0","0","1","1","1","0","0","0","0","0","0","False","False","False","はぁ……厨房のありがたさが、胃袋にしみる……。<hex:02100103>賄い飯なら、いつでも作り置きがあるし、<hex:02100103>空腹をこらえて買いに行かなくていいとか、さいこー……！","0","0"
"598955","0","1","2","0","0","1024","0","0","1","1","1","0","0","0","0","0","0","False","False","False","水回りの改装、本当にしんどかった……。<hex:02100103>いったん溜まってた水を抜いて、苔の掃除をして、<hex:02100103>水を入れ替えやすいようにポンプまで……大変だったー……。","0","0"
"598956","0","1","2","0","0","766","0","0","1","1","1","0","0","0","0","0","0","False","False","False","ガジャースラ族は、歴史上で語られてる存在って感覚だから、<hex:02100103>島に現れたって聞いても、正直ピンとこなくてさ……。<hex:02100103>けど、オグルの怯えっぷりを見ると、ちょっと怖いかも……。","0","0"
"598957","0","1","2","0","0","764","0","0","1","1","1","0","0","0","0","0","0","False","False","False","姐御はああいう性格だから、こういう事態も予想はしてたけど、<hex:02100103>まさか本当に、アチャラたちを引き入れるなんてね……。<hex:02100103>なんか、すごいことになってきたなー……。","0","0"
"598958","0","1","2","0","0","767","0","0","1","1","1","0","0","0","0","0","0","False","False","False","ヒッポライダーズは、無事に独り立ちしたって話だけど、<hex:02100103>仕事が山積みだし、手伝いはいつでも大歓迎。<hex:02100103>気が向いたときでいいから、よろしくー……。","0","0"
"598959","0","1","2","0","0","768","5627","0","1","1","1","0","0","0","0","0","0","False","False","False","今日もヒッポちゃんたちは、クッソかわいくてよォ……！！<hex:02100103>配達の疲れも、すっかり癒えちまうぜェ！<hex:02100103>チビちゃんたちの成長も、今から楽しみでしかたねェなァ！","0","0"
"598960","0","1","2","0","0","764","0","0","1","1","1","0","0","0","0","0","0","False","False","False","ココ、飯ウマイ、腹満タセル、助カル。<hex:02100103>オデト手下、除ケ者イツモ、腹満タセナカッタ……。","仕事覚エル、大変。<hex:02100103>デモ、ココノ飯、ひっぽかーと、最高。<hex:02100103>オデ、手下ノ手本、ナル、ガンバル……！！","0"
"598961","0","1","2","0","0","5625","0","0","1","1","1","0","0","0","0","0","0","False","False","False","おうおう、あんたもトリプルトライアドやってンのか！？<hex:02100103>俺ァ、運送屋仲間の中じゃあ、負け知らずでよォ！<hex:02100103>ここはひとつ、勝負といこうぜェ！","0","0"
"598962","0","1","2","0","0","768","0","0","1","1","1","0","0","0","0","0","0","False","False","False","トリプルトライアドかッ！　クソおもしれェ遊びだよなァ！！<hex:02100103>これから配達の仕事がなけりゃあ、一戦したかったが……<hex:02100103>付き合えなくて悪ィな、また誘ってくれェ！","0","0"
"598963","0","1","2","0","0","5625","0","0","1","1","1","0","0","0","0","0","0","False","False","False","ヨッシャーーーーッ！！　俺の勝ちだぜェ！！<hex:02100103>こいつァ、気分よく仕事に戻れそうだッ！<hex:02100103>熱い勝負を、ありがとよォ！","0","0"
"598964","0","1","2","0","0","768","764","0","1","1","1","0","0","0","0","0","0","False","False","False","カーーーーッ！！！！　負けちまった！！！！<hex:02100103>ヒッポカートのカードを活かせなかったのが敗因かァ！？<hex:02100103>宣伝用にこさえたもンつっても、勝ちを狙える1枚なのによォ！","ったく、ウチの助言役はカード遊びまで得意とか反則だぜェ！<hex:02100103>腕、鍛えなおしとくからよォ、近いうちにまたひと勝負しようや！","0"
"598965","0","1","2","0","0","766","0","0","1","1","1","0","0","0","0","0","0","False","False","False","まさか引き分けになっちまうたァ、ツメが甘かったかッ……！<hex:02100103>あんた、これで終わりなンて言わねェよなァ？<hex:02100103>次の一戦で、決着つけようぜェ！","0","0"
"598966","0","1","2","0","0","764","933","0","1","1","1","0","0","0","0","0","0","False","False","False","バルデシオン委員会と聖コイナク財団の情報共有のため、<hex:02100103>連絡係として、やってきたのですが……","財団の調査員であるクリントータさんから、<hex:02100103>仕事に息抜きにと「トリプルトライアド」を教えてもらいましてね。<hex:02100103>知恵比べということで一戦願えませんか？","0"
"598967","0","1","2","0","0","715","0","0","1","1","1","0","0","0","0","0","0","False","False","False","私の勝ちですね……！<hex:02100103>運命の女神、星神ニメーヤが私に味方をしたようです。","0","0"
"598968","0","1","2","0","0","764","0","0","1","1","1","0","0","0","0","0","0","False","False","False","私の負けですね。<hex:02100103>知神サリャクの加護を受けたが如き戦略、<hex:02100103>なるほどなかなか興味深い……。","0","0"
"598969","0","1","2","0","0","764","0","0","1","1","1","0","0","0","0","0","0","False","False","False","引き分け、か……。<hex:02100103>時神アルジクの力であなたを引き留め、<hex:02100103>もう一戦お願いしたいところです。","0","0"
"598970","0","1","2","0","0","950","0","0","1","1","1","0","0","0","0","0","0","False","False","False","「暁の血盟」が解散しても、<hex:02100103>やることは山積みなのでっす！","0","0"
"598971","0","1","2","0","0","953","0","0","1","1","1","0","0","0","0","0","0","False","False","False","人造アトモスのことは、私たちに任せて！<hex:02100103>睡眠時間を削ってでも、やり遂げてみせるよ！","0","0"
"598972","0","1","2","0","0","764","0","0","1","1","1","0","0","0","0","0","0","False","False","False","少しでもあんた方の力になれて良かっただす。<hex:02100103>また船が要るときは、声をかけてほしいだす。","0","0"
"598973","0","1","2","0","0","950","0","0","1","1","1","0","0","0","0","0","0","False","False","False","お前たちの出発まで、まだ時間があると聞いてな。<hex:02100103>エスティニアンさんに頼んで、<hex:02100103>団員たちに稽古をつけてもらってるんだ。","0","0"
"598974","0","1","1","0","0","0","0","0","1","1","1","0","0","0","0","0","0","False","False","False","こんなこと、俺の性には合わないが、<hex:02100103>一宿一飯の恩義というやつだ。","0","0"
"598975","0","1","2","0","0","5695","0","0","1","1","1","0","0","0","0","0","0","False","False","False","ヴォイドへの旅は、一筋縄ではいかないだろう。<hex:02100103>それでも、必ず姉さんを見つけてみせるさ。<hex:02100103>5000年以上も、待ち続けたのだからな。","0","0"
"598976","0","1","2","0","0","5533","0","0","1","1","1","0","0","0","0","0","0","False","False","False","ただじっと待っているというのは、<hex:02100103>私の性に合わなくてね。<hex:02100103>こうしてニッダーナの手伝いをしてるのよ。","0","0"
"598977","0","1","2","0","0","1005","9003","5695","1","1","1","7410","6215","6215","0","0","0","False","False","False","わっ……<hex:022C0DFF07022903EB0203FF02200203>さん！？<hex:02100103>こんなところでお会いできるなんて、感激です！","実は私、この製薬堂で、見習いとして働けることになったんです。<hex:02100103>夢を実現させて、アメリアンスさんにご報告するためにも、<hex:02100103>まずは精一杯努力して、錬金術を極めたいと思います！","……それから、帰国後に母とも話し合いました。<hex:02100103>真正面からぶつかったら、最後には背中を押してくれたんです。<hex:02100103>前に進めたのは、あなたとアメリアンスさんのおかげです！"
"598978","0","1","2","0","0","4218","0","0","1","1","1","0","0","0","0","0","0","False","False","False","すみません、こちらはただいま準備中です。<hex:02100103>開店まで、しばらくお待ちください。","0","0"
"598979","0","1","2","0","0","763","0","0","1","1","1","0","0","0","0","0","0","False","False","False","あんたは、ガレマルドで会った者だな？<hex:02100103>フン、フルシュノとやらに、そそのかされて移住してみたが、<hex:02100103>やはりロクなもんじゃなかったぞ。","魔導列車もなければ、ラジオもないのだぞ？<hex:02100103>これでは引退などしておれん。<hex:02100103>やれやれ、この街の技術水準を高めるのは骨が折れそうだ。","0"
"598980","0","1","2","0","0","5695","0","0","1","1","1","0","0","0","0","0","0","False","False","False","あんたはあのときの……。<hex:02100103>わしらはこの国で何不自由なく暮らせているよ。<hex:02100103>魔導技術に興味を持つ学生から、講義を頼まれたりもしているんだ。","仲間は愚痴を言いながらも、<hex:02100103>本当のところ、この街が気に入ったみたいだ。<hex:02100103>専門知識を持つ者には、種族に関わらず敬意を示してくれるからね。","0"
"598981","0","1","2","0","0","767","763","0","1","1","1","0","0","0","0","0","0","False","False","False","やあ、誰かと思ったらあんたか。<hex:02100103>あれから俺たちは月で何とかやっている。","最初は、どう見ても森じゃない森やら、<hex:02100103>ニンジンばかりの畑やらに面食らったが……<hex:02100103>帝国にもなかった未知の高度な技術に興奮しっぱなしさ。","いまは、俺たち「ヒト」の視点から、<hex:02100103>レポリットたちに技術の改善を提案する役目を担っているんだ。<hex:02100103>資料保管庫の計画も進んでいて忙しいが、毎日が充実しているよ。"
"598982","0","1","2","0","0","764","0","0","1","1","1","0","0","0","0","0","0","False","False","False","これから人々が立ち上がろうというときに、偽神獣騒ぎとはな。<hex:02100103>しかし、貴公が力をかしてくれるとなると、<hex:02100103>早期解決が望めるというものだ。","0","0"
"598983","0","1","2","0","0","5696","0","0","1","1","1","0","0","0","0","0","0","False","False","False","偽神獣を討ち払ってくれたこと、礼を言う。<hex:02100103>これで、やっと帝国が終わったのだな……。","そして、ガレアン人の新たな歩みが始まった。<hex:02100103>復興に向けて動き出した人々に、<hex:02100103>私も精一杯、尽力していくつもりだ。","0"
"598984","0","1","2","0","0","4218","0","0","1","1","1","0","0","0","0","0","0","False","False","False","偽神獣の件、どうかよろしくお願いします。<hex:02100103>私たちは引き続き、このキャンプで獣化が起きないよう、<hex:02100103>人々の声に耳を傾けて心を解きほぐすことに務めます。","0","0"
"598985","0","1","2","0","0","763","0","0","1","1","1","0","0","0","0","0","0","False","False","False","暫定政権の樹立に向けた話し合いは、<hex:02100103>元老院の元議員たちの協力を得ながら進めています。","帝政転換以前のガレマールは、共和制でしたからね。<hex:02100103>ひとまず、そこに立ち戻る形で制度を整えてから、<hex:02100103>新たなる国の在り方を模索していくことになりそうですよ。","0"
"598986","0","1","2","0","0","5695","0","0","1","1","1","0","0","0","0","0","0","False","False","False","やあ、<hex:022C0DFF07022903EB0203FF02200203>。<hex:02100103>ガレマルドの偽神獣対策に協力してくれているそうだね。","私たちも、さらなる獣化の被害が広まらぬよう、<hex:02100103>ここで最善を尽くしているところだ。<hex:02100103>あの悲劇は、もう二度と見たくはないからね……。","0"
"598987","0","1","2","0","0","763","0","0","1","1","1","0","0","0","0","0","0","False","False","False","君たちが偽神獣を倒してくれたと聞いたよ。<hex:02100103>本当に、ありがとう。","ネルウァのように帝国という国に対し、<hex:02100103>拠り所を見出していた人にとって今の状況は辛いはずだ。<hex:02100103>だからこそ、私はここで成せることを成そうと思う。","0"
"598988","0","1","2","0","0","768","0","0","1","1","1","0","0","0","0","0","0","False","False","False","せっかく生き延びた人たちを、獣なんかにさせるもんですか！<hex:02100103>誰かが絶望に堕ちそうになったら、別の誰かが希望を繋ぐ……<hex:02100103>そうやって、この状況を打破してみせるわ！","0","0"
"598989","0","1","2","0","0","768","4219","933","1","1","1","0","0","0","0","0","0","False","False","False","ちょっと、<hex:022C0DFF07022903EB0203FF02200203>！<hex:02100103>お父様が偽神獣と戦ったって本当……！？","まったく、無理しないでって言ったのに……<hex:02100103>って、人のこと言えないけどね。","だから今度、お父様といっしょに戦いに出るときは、<hex:02100103>必ず私も連れていってちょうだい？<hex:02100103>どれだけ強くなったか、見せつけてやるんだから！"
"598990","0","1","2","0","0","764","0","0","1","1","1","0","0","0","0","0","0","False","False","False","ガレマルドの偽神獣の件、引き受けてくれたようだね。<hex:02100103>どうかよろしく頼むよ。","0","0"
"598991","0","1","2","0","0","763","0","4219","1","1","1","0","0","0","0","0","0","False","False","False","これはこれは、<hex:02100103>すべての偽神獣を討ち払いし、我らが英雄ではないか！","おかげさまで、終末の獣の脅威は去った。<hex:02100103>しかし、この平和が必ずしも続くとは限らない。","今後も、この流星の間に集う各国の武官たちとは、<hex:02100103>情報共有を密にしていくよ。<hex:02100103>脅威の芽を見逃さないためにもね……。"
"598992","0","1","1","0","0","765","9002","0","1","1","1","0","0","0","0","0","0","False","False","False","あら、また会えて嬉しいわ。<hex:02100103>もしかして、カルザールさんの商会のことを、<hex:02100103>気にかけて来てくれたのかしら……？","要だった人たちが、ほとんど亡くなってしまったから、<hex:02100103>運営はとても大変みたい。<hex:02100103>だけど商会を畳むつもりはないんですって。","名前も、カルザール商会のままにするって言っていたわ。<hex:02100103>彼のいた証が、彼の大切にしていたものに残ること、<hex:02100103>私も嬉しく思っているの。"
"598993","0","1","2","0","0","4218","5695","0","1","1","1","0","0","0","0","0","0","False","False","False","ああ、あなたでしたか。<hex:02100103>先日は、ナシュヴァンと話をしていただいて、<hex:02100103>ありがとうございました。","終末直後は、酷く打ちひしがれていた彼でしたが、<hex:02100103>ここで働き始めたころに、ポツリと言ったんです。<hex:02100103>あのとき助けてもらってよかった……と。","生き延びたから、今、息子たちを覚えていられるんだと。<hex:02100103>……私も彼を見習い、悲しいことも力に変えて、<hex:02100103>製糸局を盛り立てていきたいと思います。"
"598994","0","1","1","0","0","755","755","755","1","1","1","0","0","0","8","8","8","False","False","False","<hex:024804F2022303>ああ、これは喜ばしい来客だ。<hex:02100103>貴殿が古き時代の思い出話をしたくなったというのなら、<hex:02100103>私はいつでも歓迎しよう。<hex:0248020103>","<hex:024804F2022303>そういえば、アーテリスの文化に触れたレポリットが、<hex:02100103>おやつに合うお茶を創ってみたと話していた。<hex:02100103>それを、わけてもらってこようか……。<hex:0248020103>","<hex:024804F2022303>私の維持には不要なものだが、<hex:02100103>ヴェーネスは、長話をするときによく茶を淹れていてね。<hex:02100103>……なぞらえてみるのも、悪くはないだろう。<hex:0248020103>"
"598995","0","1","2","0","0","764","0","0","1","1","1","0","0","0","0","0","0","False","False","False","そっちの用事が落ち着いたら、<hex:02100103>私の相談にも乗ってもらえると助かるわ。","0","0"
"598996","0","1","2","0","0","715","0","0","1","1","1","0","0","0","0","0","0","False","False","False","アストリドのこと、手伝ってくれてあ・り・が・と♪<hex:02100103>これで「リゼットちゃん」としても、思い残すことなしッ☆","……ってことで、こっからはアストリドたちの時代だ。<hex:02100103>あの子がどんな風に祝祭を盛り上げていくか、<hex:02100103>今から楽しみだな。","0"
"598997","0","1","2","0","0","4218","9071","0","1","1","1","0","0","0","0","0","0","False","False","False","リゼットさんが伯爵令嬢なのに対して、僕は貴族ですらない。<hex:02100103>アストリドが僕たちのお付き合いに否定的だったのは、<hex:02100103>この身分差が原因かもしれないね。","でも、ついにデートに送り出してくれたんだ！<hex:02100103>受け入れてもらえたのなら、本当に嬉しく思うよ。","0"
"598998","0","1","2","0","0","4219","5734","0","1","1","1","0","0","0","0","0","0","False","False","False","冒険者さんとエミリエさんのおかげで、<hex:02100103>自分らしさを大切にしようと思えるようになりました。","やっぱり、この服装こそ私なんです。<hex:02100103>リゼットちゃんの幸せのためにも、自分の今後のためにも、<hex:02100103>主催の務めを頑張っていきますよ……！","0"
"598999","0","1","1","0","0","755","0","0","1","1","1","0","0","0","0","0","0","False","False","False","アメリアンスさんたちとのお茶会、とても楽しかったわね。<hex:02100103>文通して以来、直接お会いするのはあの日が初めてだったのだけど、<hex:02100103>あなたも一緒だったから、すぐに緊張がほぐれたわ。","美人で気品があって、朗らかで優しくて……本当に素敵な方。<hex:02100103>……それにあのときのロウェナさん、<hex:02100103>冷静に見えたけれど、内心焦っていたようにも見えなかった？","フフ、憧れてしまうわ。<hex:02100103>さすがはアルフィノさんたちのお母さんね。<hex:02100103>そうだ、今度はアリゼーさんも一緒にお茶に誘うのはどうかしら。"
"599000","0","1","1","0","0","755","0","0","1","1","1","0","0","0","0","0","0","False","False","False","ああン、何か用か？<hex:02100103>マンダヴィルウェポンの次なる強化は、<hex:02100103>ゴッドベルトが古文書を解読するのを待つしかねぇぞ。","別のマンダヴィルウェポンをご所望だってんなら、<hex:02100103>そこにいるスッポンポンに頼め。<hex:02100103>面倒だが仕上げはオレがやってやンよ。","0"
"599001","0","1","2","0","0","764","0","0","1","1","1","0","0","0","0","0","0","False","False","False","やや、これは<hex:022C0DFF07022903EB0203FF02200203>殿、ようこそいらっしゃいました！<hex:02100103>カフェ「ラストレムナント」、まもなく開店デスよ！","0","0"
"599002","0","1","2","0","0","764","0","0","1","1","1","0","0","0","0","0","0","False","False","False","オスモンくんてね、私のこと「うるさい」って言うわりに、<hex:02100103>なんだかんだで、一緒に行動してくれてるのよね～。","まあ、読書で目が疲れがちの彼には、私の薬茶が不可欠だし、<hex:02100103>私は私で、彼の豊富な知識を頼ってたし……。<hex:02100103>持ちつ持たれつな関係、ってヤツなの！","0"
"599003","0","1","1","1","0","755","755","0","1","1","1","6215","622","0","0","0","0","False","False","False","楽しい時間は過ぎ去り、いつもの生活に逆戻り……。<hex:02100103>俺に言わせれば、穏やかな日常だなんて、<hex:02100103>泥の中に浸っているようなもんだ。","泥の中の俺を、空へと解き放ってくれる……<hex:02100103>そんな冒険にまた出会えるまで、銃を磨いておくさ。<hex:02100103>もちろん、そのときは……お前も空へと繰り出すんだぞ？","0"
"599004","0","1","2","0","0","933","0","0","1","1","1","0","0","0","0","0","0","False","False","False","そうそう、レオファードの家族のことは団員以外には秘密よ？<hex:02100103>ラドリアでさえ掴んでいない情報になるからね。","0","0"
"599005","0","1","2","0","0","763","0","0","1","1","1","0","0","0","0","0","0","False","False","False","レオファードめ、まだ秘密を隠しているに違いないぞ。<hex:02100103>奴は、それが伊達男の条件だとうそぶくが……<hex:02100103>私に言わせれば、水臭いことこの上ない！","だが、危険の中では、<hex:02100103>自分を偽ることもできなくなるというもの。<hex:02100103>奴を、血湧き肉躍る冒険に連れ出そうと画策しておるのだよ。","0"
"599006","0","1","1","0","0","755","0","0","1","1","1","0","0","0","0","0","0","False","False","False","当面の課題だった、レミーユ号の建造も片付いた。<hex:02100103>今は、新規のアイディアを形にしようとアレコレ検討中さ。","どうせなら、突飛なことを試したくてね。<hex:02100103>あたしのお気に入りプランは、マナカッターの先端に、<hex:02100103>巨大ドリルを付ける案なんだけど……みんな反対するんだよねえ。","0"
