"0","テストデータ"
"62","類まれな水棲生物の創造者として知られた、<hex:02100103>初代「ミトロン」を記念して設立された「ミトロン院」。<hex:02100103><hex:02100103>ここでは、現在も多くの創造魔道士たちが、<hex:02100103>独創的かつ有益な水棲生物の創造を続けています。<hex:02100103><hex:02100103>種の多様性こそが、星を豊かにする。<hex:02100103>生命のスープたる海を、さらに多くの命で満たすこと。<hex:02100103>その理念は、今もミトロン院に受け継がれているのです。"
"63","植物分野の創造において多大な貢献を果たした、<hex:02100103>初代「ハルマルト」が造園家であったことを知っていますか？<hex:02100103><hex:02100103>美しい迷宮庭園の創り手として知られた彼は、<hex:02100103>庭木を蝕む害虫を駆除するため、創造魔法を行使しました。<hex:02100103>これが、世界初の食虫植物の創造だったと言われています。<hex:02100103>以後、彼の門下生たちは植物の創造術を発展させ、<hex:02100103>多種多様な移動性植物が、生み出されることとなったのです。<hex:02100103>貴方が植物の創造を学びたいなら、当院の門扉を叩くべきでしょう。"
"64","海向こうの大陸で、意図しない創造現象の発現が確認された。<hex:02100103>それは、悪夢の産物とでも言うべき醜悪な姿を持つ、<hex:02100103>獰猛な「獣」であったという。<hex:02100103>幻想生物の創造を研究する「ラハブレア院」では、<hex:02100103>直ちに職員を派遣、巨大な口を持つ「獣」の捕獲を行った。<hex:02100103>我々は、これを「アルケオタニア」と命名、調査を行っている。<hex:02100103>当代のラハブレアの見解によれば、この「獣」は、<hex:02100103>人々の潜在意識下にある恐怖心の集合体ではないかとのこと。<hex:02100103>現在、これに対抗するための強力な幻獣の創造方法を進めている。"
"65","若き日のシドが記した、<hex:02100103>月の衛星「ダラガブ」の観測データのようだ。<hex:02100103>几帳面な文字で、難解な数式と数字が羅列されている。<hex:02100103>シドの推論によると「ダラガブ」は、太陽エネルギーを集積し、<hex:02100103>波長を変えて送る機能を有している可能性が高いようだ。<hex:02100103><hex:02100103>受信設備が不十分な状態で「ダラガブ」を起動すれば、<hex:02100103>数千年に亘って蓄積されてきた膨大なエネルギーが、<hex:02100103>降り注ぎ重大事故が発生するであろう、と結論付けている。"
"66","創造した生物が、星にとって善き存在なのか、<hex:02100103>心配になったことはありませんか？<hex:02100103>そんなときは、私たち造物院にお任せください！<hex:02100103>温暖な平原から熱帯の密林、<hex:02100103>果ては灼熱の溶岩地帯や極寒の雪原まで……。<hex:02100103>様々な環境で、あなたの創造生物を試すことができます。<hex:02100103>美しき星の大自然に解き放たれたとき、<hex:02100103>あなたの創造生物は、生き残ることができるのか。<hex:02100103>予期せぬ危険性がないか熟練の職員が評価します！"
"67","リッサ氏から預かった創造生物は、<hex:02100103>二足歩行する狼、というコンセプトで創ったものらしい。<hex:02100103>たしかに、その歩行能力は目をみはるものがある。<hex:02100103>道具を使うなど、知能も高い。<hex:02100103>いや、知能が高すぎると言った方がいいだろう。<hex:02100103>あの目つき、職員たちの会話を理解しているのでは？<hex:02100103>そうなってくると、<hex:02100103>喉の構造上、発話できないのが勿体ないように思う。<hex:02100103>この点を、次回の報告書にまとめるとしよう。"
"68","季節に応じて大陸間を移動する、<hex:02100103>「渡り鳥」の創造成功は、停滞していた飛行生物界に、<hex:02100103>文字通りの新風を吹き込むこととなった。<hex:02100103>太陽と星から、おおよその方角を把握させることは、<hex:02100103>さほど難しいことではなかった。<hex:02100103>だが、それだけでは決して毎年同じ場所には渡れない。<hex:02100103>最大の発見は、当代のファダニエルが、<hex:02100103>エルピス所長時代に編み出した磁場の利用法だ。<hex:02100103>アーテリスの磁場を鳥に読ませるとは、何たる創造性だろう！"
"69","なんと残酷な問いであろう。<hex:02100103>身は腫れ上がり、傷は爛れ、血が腐り果てた我に、<hex:02100103>それでも命の意味を問うのか、青き鳥よ。<hex:02100103>その答えを知りたくば、我らの進みたる航路を知るべし。<hex:02100103>我らは繁栄を求めてきた。<hex:02100103>繁栄とはすなわち、子を産み育て、増えることである。<hex:02100103>そのために我らは陸に上った。<hex:02100103>そして、恐ろしき火すら従え、鉄を手に入れた。<hex:02100103>鉄でよろわれた我らは、他を圧倒し、繁栄を極めたのだ。"
"70","しかし、やがて我らは、<hex:02100103>かつて我らが信じていたほど、世界は広くないと知った。<hex:02100103>子を産み育てるに適した土地は、あまりに少なかった。<hex:02100103>また無限に思えた海も、有限の水溜まりであると知った。<hex:02100103>鉄のため火を燃やすほどに海は汚れ、<hex:02100103>子の増えすぎた街では病がまたたく間に広がった。<hex:02100103>かくして我らは、病によって滅びようとしている。<hex:02100103>今ならわかる、命とは求めるほどに死を呼ぶものなり。<hex:02100103>そして、死に向かう痛みと苦しみに満ちた過程である、と。"
"71","異星より来る天使が、<hex:02100103>最初の相互接触の対象として、我々世界連邦を選んだことは、<hex:02100103>我々に正義あることの証左である。<hex:02100103>自由の獲得という大義名分の下、<hex:02100103>世界秩序を乱す自由連盟に裁きの鉄槌を振り下ろせ！<hex:02100103>統一政体を維持してこそ、恒久的世界平和が実現するのである。<hex:02100103>我々は、かつて分断された国の国民であり、<hex:02100103>あらゆる違いを理由として、争い、戦い、殺し合った。<hex:02100103>しかし、世界連邦の成立により、ひとつになったのである。"
"72","ついに上層部が、ピースキーパーを起動した！<hex:02100103>平和維持を目的に掲げて開発された、世界連邦の切り札、<hex:02100103>武装蜂起したテロリストを、自動的に制圧する自律兵器である！<hex:02100103>ところが、起動したピースキーパーの機械頭脳は、<hex:02100103>人類こそが、世界平和の実現にとっての最大の障害と判断。<hex:02100103>自由連盟のみならず、我々にも攻撃を開始したらしい。<hex:02100103>全10000機を超えるピースキーパー群を停止させるには、<hex:02100103>たとえ汚染のリスクがあろうとも、最終兵器を使うしかない。<hex:02100103>命にかえても、機械どもを粉砕するのだ！"
"73","星を渡る鳥は、言った。<hex:02100103>生きる理由とは、命の意味とは、何であるのかと。<hex:02100103>その問いは、当個体に懐かしさとほろ苦さを感じさせた。<hex:02100103>当個体と、全個体が未だに未成熟であった頃、<hex:02100103>等しく生きる理由と、命の意味を求めた時代があったからだ。<hex:02100103>しかし、成熟した今、その問いに意味がないことを知っている。<hex:02100103>当個体は、星を渡る鳥に、<hex:02100103>その問いの無意味さを伝えようとした。<hex:02100103>しかし、鳥は未成熟ゆえに理解できず、同じ問いを繰り返した。"
"74","かつて当個体と全個体は、<hex:02100103>命を産み、育み、次世代に繋ぐことに意味を見出した。<hex:02100103>しかし、不死を手にしたことで、増殖の意味は消失した。<hex:02100103>かつて当個体と全個体は、<hex:02100103>宇宙普遍の真理と正義の追求に意味を見出した。<hex:02100103>しかし、完全なる相互理解に達し、正義の意味は消失した。<hex:02100103>当個体は全個体となり、全個体が当個体となった今、<hex:02100103>定命の宇宙で永遠の生を続けることに、意味は皆無なのである。<hex:02100103>ゆえに全個体を消す、ラーラーを喚んだのである。"
"75","古ぼけた貼り紙がある。<hex:02100103><hex:02100103><hex:02100103>“3:34<hex:02100103>私は鬼哭隊壱番槍、探索班リデル。<hex:02100103>後続隊へ向けメモを残す。”<hex:02100103>“洞内に複数の魔物の姿を確認。<hex:02100103>排除しつつ前進する。”"
"76","古ぼけた貼り紙がある。<hex:02100103><hex:02100103><hex:02100103>“5:45<hex:02100103>再び強力な魔物と交戦。当方にも負傷者が出た。<hex:02100103>これ以上の調査続行について、隊員と協議を続けている。”"
"77","古ぼけた貼り紙がある。<hex:02100103><hex:02100103><hex:02100103>“6:22<hex:02100103>ダイアマイト種の繁殖を確認、私は撤退を決断。<hex:02100103>メモはここまでとする。後続隊はくれぐれも注意されたし。”"
"78",""