"0","TEXT_VOICEMAN_05505_002630_KANESENNA","皆様……。<hex:02100103>こたびの会議への出席、心より感謝いたします。"
"149","TEXT_VOICEMAN_05505_003950_FANDANIEL","いやはや、なかなかどうして、<hex:02100103>エオルゼアの連中もやるものですねぇ……？"
"150","TEXT_VOICEMAN_05505_003960_FANDANIEL","あいにくと、結節点の破壊には失敗。<hex:02100103>今後も地脈の流れはカルテノーに集まり、<hex:02100103>「杭」へのエーテル供給は、相応のものになるでしょう。"
"151","TEXT_VOICEMAN_05505_003970_FANDANIEL","残念ですが、その分こちらの出力を上げればいいだけのこと。<hex:02100103>少しばかり、アレの見る夢が深くなりますが……<hex:02100103>問題ありませんよね？"
"152","TEXT_VOICEMAN_05505_003980_ZENOS","……構わん。<hex:02100103>アレにとっては、むしろ本望だろう。"
"153","TEXT_VOICEMAN_05505_003990_FANDANIEL","では、急いで調整いたしましょう。<hex:02100103>「神の門」は、こうして完成しているのです……<hex:02100103>あとはエネルギーさえかき集めれば、念願の獲物に手が届く！"
"154","TEXT_VOICEMAN_05505_004000_FANDANIEL","さあさあ、うんと働きなさい！<hex:02100103>私のために！　あなたのために！"
"155","TEXT_VOICEMAN_05505_004010_FANDANIEL","そして、終わりに抗おうとしている、<hex:02100103>美しく唾棄すべき、人類の皆々様のために！"
"156","TEXT_VOICEMAN_05505_004020_ZENOS","数多の命も  闇夜の月も<hex:02100103>喰らいつくして  お前を待とう"
"157","TEXT_VOICEMAN_05505_004030_ZENOS","怒りを燃やせ  憎悪に滾れ<hex:02100103>その果てに――"
"158","TEXT_VOICEMAN_05505_004040_ZENOS","至極の一戦を果たそうぞ"
"159","TEXT_VOICEMAN_05505_004050_YSHTOLA","やはり……ここも地脈の流れが変わってるわ。"
"160","TEXT_VOICEMAN_05505_004060_THANCRED","ザナラーン方面も同じだな。<hex:02100103>どこで計測しても、記録とは異なるエーテル波形しか出てこない。"
"161","TEXT_VOICEMAN_05505_004070_GRAHATIA","それに、地脈を流れるエーテルの濃度が低下してるんだ。<hex:02100103>自然現象とは、とても思えないくらいにな……。"
"162","TEXT_VOICEMAN_05505_004080_URIANGER","お戻りになりましたか。<hex:02100103>……ドラヴァニアの方はいかがでしたか？"
"163","TEXT_VOICEMAN_05505_004090_ALPHINAUD","いくつかの地点で観測を行ったが、<hex:02100103>「終末の塔」に近いほど、エーテルの減少が顕著だったよ。<hex:02100103>つまり……"
"164","TEXT_VOICEMAN_05505_004100_ALISAIE","塔が地脈からエーテルを吸い上げてる可能性が高いってこと！<hex:02100103>これが蛮神召喚のカラクリだったのかしら……？"
"165","TEXT_VOICEMAN_05505_004110_THANCRED","ともかく、「石の家」に戻るぞ。<hex:02100103>タタルに頼んで、エオルゼア統合司令部に、<hex:02100103>観測結果を送るんだ。"
"166","TEXT_VOICEMAN_05505_004120_MYSTERIOUSLADY","お願い――聞いて――"
"167","TEXT_VOICEMAN_05505_004130_MYSTERIOUSLADY","危機が――終わりのときが――迫って――"
"168","TEXT_VOICEMAN_05505_004140_MYSTERIOUSLADY","護って――あなたの――星の未来を――"
"169","TEXT_VOICEMAN_05505_004150_ESTINIEN","おい相棒、どうかしたのか？"
