"175","TEXT_CHRHDB831_04718_DELION_000_322","結局、事件屋の勘というのは、<hex:02100103>チャネリングでも予知能力でもなく、単なる勘だったのですね……。<hex:02100103>もう、当てずっぽうで捜査するのは限界でしょう。"
"176","TEXT_CHRHDB831_04718_DELION_100_322","それこそ、<hex:02100103>人をたくさん動員して世界中を探すくらいしないと……。"
"177","TEXT_CHRHDB831_04718_KOYOKOYO_000_323","人をたくさん動員……"
"178","TEXT_CHRHDB831_04718_KOYOKOYO_000_324","そうだ！<hex:02100103>前みたいに、ヒルディブランドをたくさん複製すればいいんだ！"
"179","TEXT_CHRHDB831_04718_HILDIBRAND_000_325","いやいや、それはちょっと……"
"180","TEXT_CHRHDB831_04718_KOYOKOYO_000_326","ダメだ……<hex:02100103>複製機能、前から調子悪かったけど、完全に壊れちゃった。<hex:02100103>今できた1体が最後で、もう作れない。"
"181","TEXT_CHRHDB831_04718_BRADIHILND_000_327","(-複製失敗したヒルディブランド-)えっと……<hex:02100103>ブラディ……ヒルンド……ですぞ。"
"182","TEXT_CHRHDB831_04718_NASHUMHAKARACCA_000_328","ブラディヒルンド……様？<hex:02100103>なんだか、見た目が粗いです～。"
"183","TEXT_CHRHDB831_04718_KOYOKOYO_000_329","どう見ても失敗作だ……すぐに消去するよ。"
"184","TEXT_CHRHDB831_04718_HILDIBRAND_000_330","お待ちください……。"
"185","TEXT_CHRHDB831_04718_HILDIBRAND_000_331","この見た目なら、私と見間違われることもありません！<hex:02100103>捜索はひとりでも多い方がよい……<hex:02100103>彼にも協力してもらいましょう！"
"186","TEXT_CHRHDB831_04718_HILDIBRAND_000_332","ブラディヒルンド殿！<hex:02100103>これから、よろしくお願いしますぞ！"
"187","TEXT_CHRHDB831_04718_BRADIHILND_000_333","は、はい……<hex:02100103>よろしく……お願いします……ぞ。"
"188","TEXT_CHRHDB831_04718_NASHUMHAKARACCA_000_340","ブラディヒルンド様、かくかくしてます～。"
"189","TEXT_CHRHDB831_04718_KOYOKOYO_000_341","複製機能、壊れかけで出力が不安定だったんだ。<hex:02100103>だから、見た目が粗くなってしまって、<hex:02100103>性格まで別物になっちゃった。"
"190","TEXT_CHRHDB831_04718_DELION_000_342","失敗したとはいえ、知性体を複製するとは……<hex:02100103>異星人の技術は謎に包まれてますね。"
"191","TEXT_CHRHDB831_04718_GODBERT_000_343","ハッハッハ、相変わらず我が息子ながら愉快ですなぁ！<hex:02100103>結構、結構……。"
"192","TEXT_CHRHDB831_04718_BRADIHILND_000_344","ど、どうも……。<hex:02100103>なにとぞ、よろしくお願いします……ぞ。"
"193","TEXT_CHRHDB831_04718_HILDIBRAND_000_350","崩れた遺跡は父上がすっかり元どおりにしてくれました。<hex:02100103>それにしても、新たな仲間はとってもチャーミングですなぁ！<hex:02100103>今後が楽しみですぞ！"
"194","TEXT_CHRHDB831_04718_BRADIHILND_000_351","そ、そんな……<hex:02100103>こ、この私がチャーミングだなんて……。"
"195","TEXT_CHRHDB831_04718_NASHUMHAKARACCA_100_352","ブラディヒルンド様、恥ずかしそうです～。<hex:02100103>照れ屋さんなんですね～。"
