"157","TEXT_AKTKBZ003_04581_SYSTEM_000_103","「同行」は、エリアを移動した場合や、<hex:02100103>「同行状態を解除する」を選んだ場合に解除されます。"
"158","TEXT_AKTKBZ003_04581_SYSTEM_000_104","解除した場合、もとの場所に戻った同行者に話しかけることで、<hex:02100103>再び「同行」させることができます。"
"159","TEXT_AKTKBZ003_04581_FOURCHENAULT_000_105","この辺りには、若者たちの姿はないようだな……。<hex:02100103>先に進んで探してみよう。"
"160","TEXT_AKTKBZ003_04581_Q2_000_000","何をする？"
"161","TEXT_AKTKBZ003_04581_A2_000_001","話す"
"162","TEXT_AKTKBZ003_04581_A2_000_002","同行状態を解除する"
"163","TEXT_AKTKBZ003_04581_A2_000_003","キャンセル"
"164","TEXT_AKTKBZ003_04581_FOURCHENAULT_000_106","若者たちを死なせるわけにはいかない。<hex:02100103>塔に入って獣に襲われる前に、何としても探し出そう。"
"165","TEXT_AKTKBZ003_04581_SYSTEM_000_107","同行状態を解除します。本当によろしいですか？"
"166","TEXT_AKTKBZ003_04581_FOURCHENAULT_000_108","用があるのならば手早く済ませてくれ。<hex:02100103>私は「ウルバニッシマ区」の先ほどの場所で待っていよう。"
"167","TEXT_AKTKBZ003_04581_FOURCHENAULT_000_109","用は済んだようだな。<hex:02100103>では、急ぎ若者たちを探そう。"
"168","TEXT_AKTKBZ003_04581_SYSTEM_000_110","このクエストを進行させるには、<hex:02100103>フルシュノが同行している状態で、<hex:02100103>さらに、プレイヤーの近くにいる必要があります。"
"169","TEXT_AKTKBZ003_04581_SYSTEM_000_111","同行者がまだ到着していない。<hex:02100103>近くまで迎えにいって、ともに話を聞こう。"
"170","TEXT_AKTKBZ003_04581_ALPHINAUD_100_112","やあ、<hex:022C0DFF07022903EB0203FF02200203>。<hex:02100103>ガレマルドの偽神獣対策に協力してくれているそうだね。"
"171","TEXT_AKTKBZ003_04581_ALPHINAUD_200_112","私たちも、さらなる獣化の被害が広まらぬよう、<hex:02100103>ここで最善を尽くしているところだ。<hex:02100103>あの悲劇は、もう二度と見たくはないからね……。"
"172","TEXT_AKTKBZ003_04581_ALPHINAUD_100_113","お父様、この駅にいる人々のことは我々にお任せください。<hex:02100103>いまのところ、獣化する者は出ておりません。"
"173","TEXT_AKTKBZ003_04581_FOURCHENAULT_100_114","ああ、引き続き頼む。<hex:02100103>偽神獣に関しては、<hex:022C0DFF07022903EB0203FF02200203>殿らと共に、<hex:02100103>対策に動いている……どうか、しばし堪えてくれ。"
"174","TEXT_AKTKBZ003_04581_ALISAIE_100_115","せっかく生き延びた人たちを、獣なんかにさせるもんですか！<hex:02100103>誰かが絶望に堕ちそうになったら、別の誰かが希望を繋ぐ……<hex:02100103>そうやって、この状況を打破してみせるわ！"
"175","TEXT_AKTKBZ003_04581_FOURCHENAULT_100_116","頼もしいな、アリゼー。<hex:02100103>その意気で、どうかここにいる人々のことを頼む。"
"176","TEXT_AKTKBZ003_04581_ALISAIE_100_117","お父様もどうか気をつけて。<hex:02100103>ふたりとも、あんまり無理はしないでね……。"
"177","TEXT_AKTKBZ003_04581_YOUNGRETURNEE_000_120","(-若者の声-)た、助けてくれーーー！"
"178","TEXT_AKTKBZ003_04581_FOURCHENAULT_000_121","悲鳴のもとへ急ごう……！"
"179","TEXT_AKTKBZ003_04581_YOUNGRETURNEE_000_125","と、塔の方からバケモノが……！"
"180","TEXT_AKTKBZ003_04581_FOURCHENAULT_000_126","すまない、獣を倒してくれ！"
"181","TEXT_AKTKBZ003_04581_FOURCHENAULT_000_130","獣を倒してくれて感謝する。<hex:02100103>彼は無事だろうか……？"
"182","TEXT_AKTKBZ003_04581_YOUNGRETURNEE_000_140","た、助かったよ。<hex:02100103>あんたは、俺たちに話を聞きにきた奴だな……。"
"183","TEXT_AKTKBZ003_04581_YOUNGRETURNEE_000_141","魔導城に、ネルウァ様がいると聞いたんだが……<hex:02100103>中からバケモノが飛び出して襲ってきやがった。<hex:02100103>いったい、どうなってるんだ……？"
"184","TEXT_AKTKBZ003_04581_YOUNGRETURNEE_000_142","ネルウァ様がバケモノに……？"
"185","TEXT_AKTKBZ003_04581_YOUNGRETURNEE_000_143","なんてこった……。<hex:02100103>やっぱり俺たちには、もう居場所は残されてないんだな。"
"186","TEXT_AKTKBZ003_04581_FOURCHENAULT_000_145","そんなことはない。<hex:02100103>君のような若者こそ、新たな国家の建設に加わればいい。<hex:02100103>むろん、我がシャーレアンへの移住という選択肢もある。"
"187","TEXT_AKTKBZ003_04581_YOUNGRETURNEE_000_146","そう簡単に割り切れるものかよ。<hex:02100103>新たな国家とやらは、俺が愛した帝国とは別物だ。<hex:02100103>それに他国で生きるくらいなら、野垂れ死にを選ぶね……。"
"188","TEXT_AKTKBZ003_04581_FOURCHENAULT_000_147","失われた故郷を夢に見ながら自ら死を選ぶというのか？"
"189","TEXT_AKTKBZ003_04581_FOURCHENAULT_100_147","それだけの覚悟があるならば、<hex:02100103>古き国家の枠組みなど飛び越え、新天地を目指すべきだ。"
"190","TEXT_AKTKBZ003_04581_YOUNGRETURNEE_000_148","新天地だと……？<hex:02100103>どこにそんなものがあるというんだ？"
"191","TEXT_AKTKBZ003_04581_FOURCHENAULT_000_149","……月にある。"
"192","TEXT_AKTKBZ003_04581_FOURCHENAULT_000_150","我々は、月をいかなる国家にも属さぬ、<hex:02100103>人類の叡智の集積地とする計画を立てているのだ。<hex:02100103>その理念に賛同してもらえるなら、共にきてほしい。"
"193","TEXT_AKTKBZ003_04581_FOURCHENAULT_000_151","ガレアン人は誰よりも魔導技術に、機械操作に長けている。<hex:02100103>進んだ知識を持つ月の民、レポリットたちとも、<hex:02100103>きっと対等に渡り合えるだろう。"
"194","TEXT_AKTKBZ003_04581_YOUNGRETURNEE_000_152","ハッ、何を言っている？<hex:02100103>いまさら、そんなところへ……"
"195","TEXT_AKTKBZ003_04581_NERO_000_153","(-ネロの声-)いいじゃないか……。"
"196","TEXT_AKTKBZ003_04581_NERO_000_154","いいか、よく聞けよ。<hex:02100103>帝国を強国へと発展させてきたガレアン人の本質は、<hex:02100103>現状や過去に甘んじることなく、進歩を続けることにある。"
"197","TEXT_AKTKBZ003_04581_NERO_000_155","オレは、そのとおりに生きてきた。<hex:02100103>ときに負け、辛酸を舐めたことだってあったが、<hex:02100103>それでも、どこにいようと、オレは高みを目指してきた。"
"198","TEXT_AKTKBZ003_04581_NERO_100_155","祖国がガレキの山に変わろうが、オレの技術は変わらねぇ。<hex:02100103>むしろ、さらなる高みを目指して、まだ見ぬ知識が眠る月に、<hex:02100103>行ってみたくてウズウズしてるンだ……。"
"199","TEXT_AKTKBZ003_04581_NERO_100_156","聞けば、終末の獣ってのは、絶望した奴がなるらしい。<hex:02100103>だとしたら、なぜお前たちは人のままでいるンだ？"
"200","TEXT_AKTKBZ003_04581_NERO_000_156","帝国は滅びた。<hex:02100103>だが、お前たちは終わってないし、終わってるとも思ってないンだよ。<hex:02100103>これからは好きに生き、好きに高みを目指せばいいってこった。"
"201","TEXT_AKTKBZ003_04581_NERO_200_156","……ま、オレはお前たちが野垂れ死のうが、絶望しようが、<hex:02100103>知ったこっちゃないがな。"
"202","TEXT_AKTKBZ003_04581_YOUNGRETURNEE_000_157","わかった……。<hex:02100103>腐ったまま野垂れ死にするくらいなら、やってやる。<hex:02100103>月だろうと、どこだろうと行って、高みってやつを見てやるよ。"
"203","TEXT_AKTKBZ003_04581_YOUNGRETURNEE_100_157","たしかに、俺も学生だった頃は、新技術に夢中になって、<hex:02100103>魔導展に出品する作品を作ってたっけ……。<hex:02100103>つねに高みを目指す、か……。"
"204","TEXT_AKTKBZ003_04581_FOURCHENAULT_000_158","では、そのためにも我々は、<hex:02100103>偽神獣を倒さねばならないな……。"
"205","TEXT_AKTKBZ003_04581_YOUNGRETURNEE_000_159","皇族を敬愛していた気持ちは、今も変わりない。<hex:02100103>だが、ネルウァ様が、そんなバケモノになってしまったのなら……<hex:02100103>どうか安らかに眠らせてやってくれ。"
"206","TEXT_AKTKBZ003_04581_YOUNGRETURNEE_000_160","迷惑かけてすまなかった、俺たちはキャンプに戻るよ。"
"207","TEXT_AKTKBZ003_04581_FOURCHENAULT_000_161","感謝する、君のおかげで説得することができた。<hex:02100103>しかし、面倒事に関わるのは嫌だったのでは……？"
"208","TEXT_AKTKBZ003_04581_NERO_000_162","……オレは皇族なんて、よくわからん他人のために、<hex:02100103>振り回される奴が大嫌いなンでね。<hex:02100103>文句のひとつでも、言ってやりたかっただけだ。"
"209","TEXT_AKTKBZ003_04581_NERO_000_163","それに、いくつもの国がつるんで月に進出しようっていうのに、<hex:02100103>ガレアン人がひとりもいないってのは気に食わない。"
"210","TEXT_AKTKBZ003_04581_NERO_000_164","いざとなれば、<hex:02100103>あいつらから月の情報も仕入れられるしな……。"
