"175","召唤出宠物“自由脑玩偶”。<hex:02100103>模仿离群一族制作的魔法人偶。嘁嘁嘁……","模仿骨颌族“离群一族”外形的魔法人偶。某个骨颌族在任务中看到人类带着的人偶，出于感慨而制作了离群一族的人偶。后来这个骨颌族被人们称为“人偶师”。","嘁嘁嘁……我们是<hex:02100103>不被任何事物所束<hex:02100103>缚的离群一族。<hex:02100103>　　　　——讲故事","跑得快","令使用特殊技点数的宠物的移动速度提高30%。<hex:02100103><hex:024804F201F803><hex:024904F201F903>持续时间：<hex:0249020103><hex:0248020103>10秒","60","35","2","False","True","False","False","False","3"
"176","召唤出宠物“迷你浮士德”。<hex:02100103>青蓝之手为了评价新武器的综合火力而研发的小型机工兵。","将浮士德进行微缩并重新设计之后的小型机工兵。似乎是哥布林族科学家集团青蓝之手为了评价新武器的综合火力而专门设计出来当靶子的。它拼尽全力与挑战者对抗的身影令人肃然起敬。","哧哈……哧哈……好好<hex:02100103>体会一下……我们青蓝<hex:02100103>之手的恐怖吧……<hex:02100103>　　　　——奎克辛克思","战斗楷模","对范围内的敌人造成380攻击力的伤害。","100","75","3","False","False","True","False","False","1"
"177","召唤出宠物“新型迷你雅·修特拉”。<hex:02100103>重整戎装再踏征程！","冒险者行会为庆祝艾欧泽亚的新生庆典而准备的魔法人偶。当提出要以拂晓血盟的贤人雅·修特拉为原型制作魔法人偶时，某位莱韦耶勒尔家的少爷凭借记忆描绘出了精致的肖像画，得以用来参考。","对自己的绘画和记忆力<hex:02100103>有自信，即使没有模特<hex:02100103>在也能画得差不多……<hex:02100103>我过后得找阿尔菲诺大<hex:02100103>人好好谈谈。<hex:02100103>　　　　——雅·修特拉","以太脉冲罩","无效化“动物”类型的宠物对范围内我方宠物的攻击。<hex:02100103><hex:024804F201F803><hex:024904F201F903>持续时间：<hex:0249020103><hex:0248020103>5秒","80","50","2","False","False","False","False","False","3"
"178","召唤出宠物“卡尔克”。<hex:02100103>让你满不在乎地攻过来！","可爱又恐怖的魔法人偶。萨雷安的伟大魔法师为了守护颠倒塔，将魔力灌注在人偶中从而诞生。另外，起初人偶是没有头发的，后来觉得太惊悚，经过改良植入了头发。","我们是热情活泼的<hex:02100103>卡尔克布莉娜！<hex:02100103>——卡尔克＆布莉娜","阴沉的舞蹈","令范围内我方宠物的防御力增加10。当该宠物为布莉娜时，防御力增加40。<hex:02100103><hex:024804F201F803><hex:024904F201F903>持续时间：<hex:0249020103><hex:0248020103>6秒","40","45","2","False","False","False","True","False","3"
"179","召唤出宠物“布莉娜”。<hex:02100103>提头来见！","可爱又恐怖的魔法人偶。和卡尔克一起守卫颠倒塔，却被冒险者击败，四散而逃。意外的是冒险者却在附近的宝箱之中发现了她，就作为土特产收下了。","让人又爱又怕的人偶！<hex:02100103>呀呵呵呵！<hex:02100103>　——卡尔克＆布莉娜","活泼的舞蹈","令范围内我方宠物的攻击力增加20。当该宠物为卡尔克时，攻击力增加60。<hex:02100103><hex:024804F201F803><hex:024904F201F903>持续时间：<hex:0249020103><hex:0248020103>6秒","40","55","3","False","False","True","False","False","3"
"180","召唤出宠物“蓝闪蝶”。<hex:02100103>绽放着梦幻般光芒的蓝色蝴蝶。","绽放着梦幻般光芒的蓝色蝴蝶。它的羽毛由于拥有妨碍魔力恢复的功能，在魔大战时代被认为是制作对魔法师用毒药的珍稀炼金素材，因此遭到滥捕，导致如今濒临灭绝。","闪闪发光！哈哈哈哈！<hex:02100103>棒不棒？<hex:02100103>　　　　　——星神圣人","猛毒鳞粉","对范围内的敌人每秒造成10点持续伤害。<hex:02100103><hex:024804F201F803><hex:024904F201F903>持续时间：<hex:0249020103><hex:0248020103>30秒","40","50","2","True","False","False","False","False","1"
"181","召唤出宠物“波罗·罗格”。<hex:02100103>小蟾蜍也有大智慧。","老贤者玛托雅对蟾蜍施法而创造出的使魔，已经忠实地为玛托雅工作了50年以上。如今，玛托雅同意了它“世界这么大，我想去看看”的请求，让它和光之战士一起踏上了旅程。","不过，只要有我们智蛙在，<hex:02100103>不管怎样都是湿漉漉黏糊糊<hex:02100103>的呱。<hex:02100103>　　　　　　——特罗·罗格","神意","击退范围内的敌人，并造成90攻击力的伤害。","50","65","2","False","False","True","True","False","1"
"182","召唤出宠物“迷你吉尔伯特”。<hex:02100103>听说是个英雄，但看起来却意外地没用。","以古代英雄“吉尔伯特”为原型的魔法人偶。作为拥有特殊才能的吟游诗人末裔，他的歌声具有能降妖除魔的神奇力量。同时，传说他作为亡国的王子，为了爱从未停止与黑暗势力的战斗。","这的确是记载着强弓吉尔<hex:02100103>伯特事迹的手抄本，不过<hex:02100103>解读起来可费劲了。<hex:02100103>　　　　　　——盖罗尔特","歌唱","令范围内我方宠物的防御力增加20。<hex:02100103><hex:024804F201F803><hex:024904F201F903>持续时间：<hex:0249020103><hex:0248020103>10秒","40","55","3","False","False","False","False","False","3"
"183","召唤出宠物“芬里尔幼崽”。<hex:02100103>小小年纪就拥有父辈的桀骜和勇猛。","古代野兽霜狼的幼崽。拥有月光一般冷彻的青色皮毛，因此也被人们以传说中的幻兽月狼芬里尔的名字来称呼它们。从小在狼群互相争斗的“狼狱”长大，虽然年幼但是桀骜且勇猛。","竟然能够击退月狼芬里尔……<hex:02100103>光之战士，你的力量果然非同<hex:02100103>凡响。<hex:02100103>　　　　　　　　　——伊塞勒","月夜狼嚎","令范围内我方宠物的攻击力增加20。当该宠物为“魔物”类型时，攻击力增加40。<hex:02100103><hex:024804F201F803><hex:024904F201F903>持续时间：<hex:0249020103><hex:0248020103>6秒","65","30","4","False","False","False","False","False","3"
"184","召唤出宠物“幼龙玩偶”。<hex:02100103>按照幼龙卡尔·米克的形象制作的魔法人偶。要永远和它做好朋友哦！","模仿幼龙形象制作的魔法人偶。是莫古力族的工匠在学习人类手艺的过程中做成的。以年龄约为30岁左右的幼龙卡尔·米克为原型，为了再现真实的质感，使用了它脱皮时掉下来的真的鳞片。","没办法，从现在开始你<hex:02100103>就是我的朋友了！我叫<hex:02100103>卡尔·米克，多关照！<hex:02100103>　　　　——卡尔·米克","幼龙吐息","对范围内的敌人造成230攻击力的伤害。","75","60","1","False","False","False","False","True","1"
"185","召唤出宠物“拉姆之形”。<hex:02100103>在我的制裁面前，你能证明自己说过的言论吗？","以雷神拉姆为原型制作的魔法人偶。发现迦楼罗的魔法人偶很受欢迎，于是开始设计制作拉姆人偶。因为参考了暂留地的妖精族的描述，总觉得长得有点像妖精族。","如果你做不到，我雷神<hex:02100103>拉姆将会对世上所有的<hex:02100103>人类降下制裁之雷！<hex:02100103>　　　　　——雷神拉姆","制裁之雷","对范围内的敌人造成230攻击力的伤害。","40","75","3","False","True","False","False","False","1"
"186","召唤出宠物“希瓦之形”。<hex:02100103>破碎吧！钻石星尘！","以冰神希瓦为原型制作的魔法人偶。异端者们在得知各个城市都在制作以蛮神为原型的魔法人偶后，决心制作冰神希瓦人偶并公开制作方法。也许是因为他们的信仰太过虔诚，人偶的表情非常得可爱。","重逢将至，我能感觉到自己<hex:02100103>的心跳在不断加速。这恐怕<hex:02100103>是受到了希瓦的影响吧……<hex:02100103>　　　　　　　　——伊塞勒","钻石星尘","令范围内的敌人止步。<hex:02100103><hex:024804F201F803><hex:024904F201F903>持续时间：<hex:0249020103><hex:0248020103>5秒","35","35","3","False","True","False","False","False","4"
"187","召唤出宠物“波奇”。<hex:02100103>用双脚走路的谜之猪。哼哧。","用双脚走路的谜之猪。因为在金碟游乐场的自助餐厅吃霸王餐而被抓住当作了纪念品。但是没有人知道这个猪是谁、从何而来。","哼哧。<hex:02100103>——波奇","哼哧","打消范围内我方身上的弱化效果。","45","30","3","False","False","False","False","False","6"
"188","召唤出宠物“魔法水桶”。<hex:02100103>利用魔法人偶技术制作出来的会动的水桶。","利用魔法人偶技术制作出来的会动的水桶。听说是某个捕鱼人因为嫌把钓来的鱼拎回去太麻烦而制作的。不管倒空几次，不知不觉间桶里就又会出现水和生物。那些东西到底是从哪里来的呢？","前阵在还跟我说什么“叽叽叽……<hex:02100103>赛伦……最近、比从前、更像水桶<hex:02100103>了！”吓得我赶紧一量腰围……<hex:02100103>　　　　　　　　　　——赛伦蒂碧提","水桶接力","令范围内我方宠物的移动速度提高35%。<hex:02100103><hex:024804F201F803><hex:024904F201F903>持续时间：<hex:0249020103><hex:0248020103>6秒","20","55","1","False","False","False","False","False","3"
"189","召唤出宠物“触手”。<hex:02100103>被冒险者砍下来的克拉肯的触手的尖端。","被冒险者砍下来的克拉肯的触手的尖端。在海上漂流许久，最后再次回到破舰岛。和一心想要复仇的本体不同，触手的尖端并不想战斗，反而喜欢歌颂自由的人生。","希尔迪布兰德大人，这、<hex:02100103>这可不得了！有好多触手！<hex:02100103>　　　　——娜修·玛卡拉卡","飞溅狙击","击退范围内的敌人，并造成90攻击力的伤害。","65","60","2","False","False","False","True","False","1"
"190","召唤出宠物“腕龙玩偶”。<hex:02100103>模仿腕龙制作的魔法人偶。","某位空贼模仿腕龙制作的魔法人偶，原型是在云冠群岛目击到的超大型古代生物。不过话说回来，为什么浮岛上会有那么巨大的生物呢？真是谜团重重啊。","我们艾因哈特家在召集<hex:02100103>探索云冠群岛的勇士！<hex:02100103>　　　　　——奥瓦埃尔","星体风暴","让范围内的敌人增加“玩偶”类型的弱点。<hex:02100103><hex:024804F201F803><hex:024904F201F903>持续时间：<hex:0249020103><hex:0248020103>15秒","115","50","1","False","False","False","True","False","4"
"191","召唤出宠物“拉拉队小姑娘”。<hex:02100103>拉拉队姑娘的魔法人偶。总之会为你加油。","拉拉队姑娘的魔法人偶。为给狼狱水上竞技场战斗的饿狼们加油而制作出来的。但据说发现有人消极应赛时，它的眼神会变得很危险，还可能爆粗口喝倒彩什么的。","加油加油！<hex:02100103>——拉拉队小姑娘","加油","令范围内我方宠物的攻击力增加25。<hex:02100103><hex:024804F201F803><hex:024904F201F903>持续时间：<hex:0249020103><hex:0248020103>6秒","40","40","1","False","False","False","False","True","3"
"192","召唤出宠物“迷你可露儿”。<hex:02100103>真是抱歉，让你们久等了。","冒险者行会为庆祝艾欧泽亚的新生庆典而准备的魔法人偶，模仿的是萨雷安出身的魔法师可露儿小姐。据说兜帽上那个如同猫魅族一样的大耳朵其实彰显着她拥有的某种“能力”。","呵呵呵，看来你在艾欧<hex:02100103>泽亚也学到了尊敬前辈<hex:02100103>的道理呢。那今后也不<hex:02100103>要忘了对姐姐的敬意哦。<hex:02100103>　　　　　　——可露儿","邻家小姐姐","令范围内我方宠物的防御力增加10。当该宠物为“玩偶”类型时，防御力增加30。<hex:02100103><hex:024804F201F803><hex:024904F201F903>持续时间：<hex:0249020103><hex:0248020103>6秒","30","30","3","True","False","False","False","False","3"
"193","召唤出宠物“迷你艾默里克”。<hex:02100103>以艾默里克为原型制作的魔法人偶。父皇！这到底是为什么？","以艾默里克为原型制作的魔法人偶。某个神殿骑士团副骑士长想要制作敬爱的上司的人偶，然而因为她的手太笨导致制作失败。看到她沮丧的样子太过可怜，教皇厅的技师偷偷地把人偶重新制作了一下。","艾默里克阁下……<hex:02100103>　　　——阿尔菲诺","神殿骑士团突击","对敌人的防御盾造成70%的伤害。对已被破坏的防御盾无效。","80","75","3","False","False","True","True","False","8"
"194","召唤出宠物“天马幼兽”。<hex:02100103>最近能在空中飞翔了。","天马的幼兽。与父母不小心走散，在到处都是可怕古代猛兽的云冠群岛四下奔逃。遭遇古代猛兽袭击的时候被冒险者救下，之后便一直跟着冒险者。","天马流星踹！<hex:02100103>——卜奇喇吉","流星","令范围内我方宠物的移动速度提高35%。<hex:02100103><hex:024804F201F803><hex:024904F201F903>持续时间：<hex:0249020103><hex:0248020103>6秒","70","45","3","False","False","False","True","False","3"
"195","召唤出宠物“卡洛菲斯提莉玩偶”。<hex:02100103>最喜欢闪闪发光的东西了……","以卡洛菲斯提莉为原型制作的魔法人偶，作者不详。在暗中注视着冒险者与卡洛菲斯提莉战斗的某人，注入强烈的情感即兴制作而成。随后，他与妖异一起消失了踪影。","妨碍我千年之眠的人，就是你们<hex:02100103>吗？我是卡洛菲斯提莉，以妖异<hex:02100103>之血化为的超越人类的存在……<hex:02100103>　　　　　　　——卡洛菲斯提莉","闪耀","令使用特殊技点数的宠物的防御力增加40。<hex:02100103><hex:024804F201F803><hex:024904F201F903>持续时间：<hex:0249020103><hex:0248020103>10秒","50","55","2","True","True","True","False","False","3"
"196","召唤出宠物“大脚小猿”。<hex:02100103>以大脚巨猿为原型制作的魔法人偶。禁止滥捕野生生物。","制革匠行会为宣传自然保护启蒙活动，以大脚巨猿为原型制作的魔法人偶。想以此告诉大家，因一时流行的需要滥捕野生动物，会使它们濒临灭绝。","大脚巨猿本应栖息在谢<hex:02100103>尔达莱群岛这种温暖的<hex:02100103>密林才对。<hex:02100103>　　　　　——怪物猎人","唔吼","可以拆除敌人设置的陷阱。","45","45","3","False","False","False","True","False","6"
"197","召唤出宠物“小矮兔”。<hex:02100103>可爱的小型兔子。非常害怕寂寞。","可爱的小型兔子。曾在小村庄里过着幸福的生活，然而有一天，它在田里偷作物的父亲被农妇做成了馅饼。为了治愈心中的伤痛踏上流浪之旅后与冒险者相遇。","每当结印失败时看到那<hex:02100103>兔子悠哉的表情……啊<hex:02100103>啊……简直是地狱。<hex:02100103>　　　　　　　——阳明","胡萝卜炸弹","设置陷阱。10秒后可通过点击发动陷阱按钮起爆。对范围内的敌人每秒造成10点持续伤害。<hex:02100103><hex:024804F201F803><hex:024904F201F903>持续时间：<hex:0249020103><hex:0248020103>20秒","60","45","4","False","False","False","True","False","2"
"198","召唤出宠物“百目”。<hex:02100103>从百目妖身上脱落下来的眼球。大概不会引起密集恐惧症。","从百目妖身上脱落下来的眼球。因为以前每个角度都能看到，所以现在只能看到一个方向的状态让它很不安。于是决定在长出足够的眼球之前和强者一起行动。","记得千万不要给它戴上<hex:02100103>眼罩，不然它就找不到<hex:02100103>营地了。<hex:02100103>　　　　　　——巴德龙","黏黏网","令范围内敌人的移动速度降低70%。<hex:02100103><hex:024804F201F803><hex:024904F201F903>持续时间：<hex:0249020103><hex:0248020103>5秒","35","35","2","False","True","False","False","False","4"
"199","召唤出宠物“道士莫古力娃娃”。<hex:02100103>身着东方风格服饰的魔法人偶。","身着东方风格服饰的魔法人偶。是桃源老师的侍从艳丽为了赠送给冒险者而私下亲手缝制的。在艾欧泽亚备受欢迎的莫古力形象基础上，添加了东方风格的道士着装。","好、好可爱……莫<hex:02100103>古力好可爱……<hex:02100103>    　——伊塞勒","东方功夫","击退范围内的敌人。","30","35","3","False","False","True","False","False","9"