"337","召唤出宠物“隆卡的水蛇？”。<hex:02100103>被认为是隆卡水蛇化身的某种生物。到底是什么生物？","被视为隆卡水蛇化身的某种生物。出现在夜之民的见习导师秦福特的梦境中，并传达了森林即将面临危机的事情，不过其真实身份依然是谜。看上去外表像是东方传说中的土龙……","啾啾、啾！！<hex:02100103>——隆卡的水蛇？","隆卡的秘法","令使用特殊技点数的宠物的移动速度提高30%。<hex:02100103><hex:024804F201F803><hex:024904F201F903>持续时间：<hex:0249020103><hex:0248020103>10秒","55","15","3","False","True","True","True","False","3"
"338","召唤出宠物“迷你巨人掌”。<hex:02100103>巨人掌的幼苗。到底是大还是小呢。","巨人掌的幼苗。被人广泛周知的巨大品种，不过刚发芽后的个体还是很小，会逐渐开始成长。此个体推测年龄为20至30岁，可依然属于幼苗的范畴。据说也有存活到200年以上的个体。","说不定再过300年，<hex:02100103>我就比大叔你还厉害了！<hex:02100103>　　　　——奥尔·迪","花千刺！","对距离最近的敌方奥秘核石造成8%的伤害。","60","40","1","False","False","False","False","True","8"
"339","召唤出宠物“小小冰海天使”。<hex:02100103>冰海天使的幼体。正是食欲旺盛的阶段。","冰海天使的幼体。实际上是卷贝的同类，刚出生时以植物微生物为食，随后逐渐转变为肉食，头顶部的触手最终会发展成捕获猎物用的武器，不过现在还是会老老实实地跟在人的身后。至少现在是这样……","请看，那美妙的触手……<hex:02100103>不对，那可疑的行为！<hex:02100103>　　　——希尔迪布兰德","锥形腔","对敌方探索眼造成90%的伤害。对已被破坏的探索眼无效。","40","50","2","False","False","True","True","False","8"
"340","召唤出宠物“小鸭嘴兽”。<hex:02100103>鸭嘴兽的幼崽。嘴部可不是游泳装备。","鸭嘴兽的幼崽。由于嘴部的形状酷似鸭嘴因此得名，其嘴部能够感知猎物的生物电流，所以能够不依赖视觉进行狩猎。此外后脚部有着能够分泌毒液的勾爪，令人意外的拥有着凶恶的一面。","嘿嘿，真是太可爱了！<hex:02100103>　　　　　　——杰西","毒液勾爪","对范围内的敌人每秒造成20点持续伤害。<hex:02100103><hex:024804F201F803><hex:024904F201F903>持续时间：<hex:0249020103><hex:0248020103>15秒","30","70","3","False","True","False","True","False","1"
"341","召唤出宠物“迷你伊甸”。<hex:02100103>伊甸本体参照自身创造出的迷你个体。","世界上最初的食罪灵伊甸参照自身创造出的迷你个体。时常会在头顶召唤魔法阵意图放射破坏光线，不过总因为以太存储量过少而无法成功。于里昂热也认为它应该是无害的。","这个词在妖灵语中意味<hex:02100103>着理想乡。<hex:02100103>　　　　　——于里昂热","永恒吐息","对范围内的敌人造成380攻击力的伤害。","85","45","2","True","False","False","False","False","1"
"342","召唤出宠物“大河狸”。<hex:02100103>谜一样的生物。不去揭开真相，某种意义上也算是件好事。","出现在群树馆的充满谜团的生物。人只要得到自己的渴望之物就应该满足了吧。世界上有许多事情是不能去揭开真相的，此生物就会让你亲身体验到这个人生中的真理。","那、那里好像混、混进了<hex:02100103>什么奇怪的东西吧？<hex:02100103>　　　　　　　——埃莉","嗷嗷嗷！","当防御盾被破坏时，可令其复活。","55","55","3","False","False","True","False","False","9"
"343","召唤出宠物“朱雀机关人偶”。<hex:02100103>以朱雀为原型制作的机关人偶。请清醒过来吧！","以朱雀为原型制作的机关人偶。碧甲族的人偶师从同胞算盘那里听说了他所经历过的奇闻，为了称赞守护了红玉海的四圣兽而制作了此人偶。完美地再现了为爱而生，同时又是优秀笛师的朱雀。","如果是你的话，<hex:02100103>应该能帮助朱雀大人喵。<hex:02100103>　　　　　　　——仙狸","微热的旋律","对范围内的敌人造成110攻击力的伤害。","55","35","3","False","True","True","False","False","1"
"344","召唤出宠物“迷你欧米茄M”。<hex:02100103>以迷你欧米茄M为原型制作的魔法人偶。 确认……无法理解的行为。","以迷你欧米茄M为原型制作的魔法人偶。某位雕金匠以“全新的美的形态”为题制作出来的作品。制作者在将人偶卖给罗薇娜商会时说道：“要想理解事物的一面，就需要同时深入地去了解其另一面。这才是表里如一的美。”","功率全部、增殖漏洞……<hex:02100103>沙沙……世界你好？！<hex:02100103>　　　　　　——欧米茄","共鸣M","令范围内我方宠物的防御力增加10。当该宠物为迷你欧米茄F时，防御力增加40。<hex:02100103><hex:024804F201F803><hex:024904F201F903>持续时间：<hex:0249020103><hex:0248020103>6秒","15","80","1","False","False","False","False","True","3"
"345","召唤出宠物“迷你欧米茄F”。<hex:02100103>以迷你欧米茄F为原型制作的魔法人偶。 导入……战友……","以迷你欧米茄F为原型制作的魔法人偶。某位雕金匠以“全新的美的形态”为题制作出来的作品。加隆德因奇怪制作者是从哪里得来的题材而派员工前去调查，却发现制作者像是被时空缝隙吞噬了一样，失去了踪影。","结束……结束……<hex:02100103>包含加时赛在内，<hex:02100103>所有进程已全部结束。<hex:02100103>　　　　　——欧米茄","共鸣F","令范围内我方宠物的攻击力增加20。当该宠物为迷你欧米茄F时，攻击力增加60。<hex:02100103><hex:024804F201F803><hex:024904F201F903>持续时间：<hex:0249020103><hex:0248020103>6秒","85","20","4","True","False","False","True","False","3"
"346","召唤出宠物“叮叮摇铃”。<hex:02100103>有着妖灵名字的传说中的摇铃。","有着妖灵名字的传说中的摇铃。某位鳍人族的青年看到这个摇铃从大嘴巨兽身上掉落下来并捡了回来。好像是由古代人制作或是重现的东西。刻有能够使魔力倍增的特殊术式。","你脖子上挂着的那个铃铛……<hex:02100103>虽然古旧，但光泽独特！<hex:02100103>　　　　　　　　　——付丧","奇幻音色","对范围内的敌人造成30攻击力的伤害，并且令敌人的防御力降低30%。<hex:02100103><hex:024804F201F803><hex:024904F201F903>持续时间：<hex:0249020103><hex:0248020103>6秒","20","60","3","True","False","False","True","False","1"
"347","召唤出宠物“石莲小猬”。<hex:02100103>石莲猬的幼崽。尾巴末端是甜甜的。","石莲猬的幼崽。背部长着像是多肉植物石莲花一样的板状鳞甲，潜藏在草原中时非常难以被发现。尾部的末梢能够分泌出蜜一样的甜味液体，用于吸引并捕食昆虫。是一种具有非常珍稀性质的生物。","蜂鸟喜欢花蜜，<hex:02100103>而且特别喜欢旅神葵和<hex:02100103>接雨草这种红色花的花蜜。<hex:02100103>　　　　　　——怪物猎人","蜜的味道","令使用特殊技点数的宠物追加设施特效“奥秘核石”。<hex:02100103><hex:024804F201F803><hex:024904F201F903>持续时间：<hex:0249020103><hex:0248020103>6秒","40","60","2","False","True","False","False","False","3"
"348","召唤出宠物“鮣鱼级潜水艇”。<hex:02100103>虽然是潜艇，但是不防水。","负责驾驶潜水艇的魔法人偶闲暇时自己制作的模型，和鮣鱼一样喜欢跟着宿主行动。很少有人注意到由魔法人偶制造的魔法人偶所代表的重大意义……","潜水艇、会由我的人偶<hex:02100103>同事、驾驶。<hex:02100103>　　——冒险人偶014号","鱼雷战","对范围内的敌人造成120攻击力的伤害，并且令使用特殊技点数的宠物的攻击力增加20。<hex:02100103><hex:024804F201F803><hex:024904F201F903>持续时间：<hex:0249020103><hex:0248020103>6秒","60","40","3","False","False","False","False","False","1"
"349","召唤出宠物“鲸头鹳”。<hex:02100103>遇事绝不动摇，有着王者风范的鸟类。","主要栖息在珂露西亚岛的鸟类。以纹丝不动而被人广泛周知，就算是狩猎时也是守株待兔，等候猎物自己送上门才会用喙捕获猎物。不知具体是何原因，将冒险者认作为自己的主人，保持着绝妙的距离跟在身后，一直跟到了这里。","唔——纹丝不动！<hex:02100103>——娜修·玛卡拉卡","王者风范","令范围内敌人的攻击力降低40%。<hex:02100103><hex:024804F201F803><hex:024904F201F903>持续时间：<hex:0249020103><hex:0248020103>6秒","40","35","1","False","False","True","True","False","4"
"350","召唤出宠物“蝴蝶效应”。<hex:02100103>能够投射出一对蝴蝶飞舞的幻影的神奇结晶。","能够投射出一对蝴蝶飞舞的幻影的神奇结晶。有一种说法，就算是蝴蝶翅膀的振动所引起的小小的变化，也会对事情的结果产生出巨大的差异。不过此结晶并不是用来体现该说法的物品，而是古代隆卡帝国的神官抱着开玩笑的想法创作出来的。","隆卡的智慧就是人类的<hex:02100103>智慧，决不能让智慧就<hex:02100103>此灭亡……<hex:02100103>　　　　　——隆卡皇帝","蝴蝶效果","令范围内我方宠物的特殊技点数增加10。对拥有同效果特殊技的宠物无效。","30","40","4","False","True","False","True","False","3"
"351","召唤出宠物“青蛙号A”。<hex:02100103>矮人族的工匠制作出来的小型自走人偶。","矮人族的工匠制作出来的小型自走人偶。虽然有着能够自动补充动力源矿物的机能，可还是会因为担心燃料是否正确补充的问题而弄出来检查检查。另外背部的螺丝只是为了烘托气氛的装饰。","那我就赶紧时间去挖了！<hex:02100103>　　　　　——扣鲁图","采矿魂","对距离最近的敌方奥秘核石造成5%的伤害。","50","60","2","False","False","True","False","False","8"
"352","召唤出宠物“得到宽恕的仇恨”。<hex:02100103>像是超小型食罪灵的东西。由于忏悔了过去的罪恶，因此对人是无害的。","在格鲁格火山发现的超小型疑似食罪灵的东西。它会一直仇视捡到它的人并不断地追赶。但其实除了追赶人以外也并没有其他的能力，只是偶尔会旋转而已。看上去并没有什么害处，想必带着它旅行应该也不会有问题。","那个奇怪的箱子<hex:02100103>大概也是食罪灵对吧？<hex:02100103>　　　　——桑克瑞德","激发与推进","击退范围内的敌人，并造成30攻击力的伤害。","20","80","1","False","False","False","False","True","1"
"353","召唤出宠物“猪小仙”。<hex:02100103>小小的猪使魔，烘烤时间约为1分钟！","梦见被飞在天上的猪追着跑的雇员，在采集的空闲时间用找到的黏土捏成的小猪，不知为何真的飞了起来。也许是仙子们为了捉弄人，将仙子油灯的火种赋予了小猪，使其成为了真正的使魔。","现在用我教你的术式，<hex:02100103>为这只黏土猪注入灵魂吧。<hex:02100103>　　　　　　——拜克·拉各","猪风","打消范围内敌我双方身上的附加效果。","20","80","1","False","False","False","False","True","6"
"354","召唤出宠物“仙子人偶”。<hex:02100103>乖巧的小仙子，不会捉弄人。","以仙子为原型制作的魔法人偶。丽耶美格梦园的仙子们要是在梦中与孩子们玩开心了，会赠送这个他们亲手制作的人偶，当然，这只是众多礼物中的一种。人偶与真正的仙子不同，不会捉弄人类，所以很好相处。","这是和可爱的小仙子<hex:02100103>结下契约了啊！<hex:02100103>　　　　——阿尔菲诺","仙子的治疗","令范围内我方宠物恢复100点体力。当该宠物为“玩偶”类型时，恢复150点体力。","20","80","1","False","False","False","False","True","7"
"355","召唤出宠物“神秘兵装”。<hex:02100103>雇员找到它时明明是把剑……","雇员在旅行途中发现的古旧长剑。在触碰之后，突然就发动了某种古代魔法，变成了奇怪的魔法生物开始走动。虽然感觉像是被诅咒了一样，不过反正都要交给主人，也就不是很在意了。","剑舞生风！<hex:02100103>——吉尔伽美什","愤怒一击","对范围内的敌人造成230攻击力的伤害。","85","35","3","False","True","False","False","False","1"
"356","召唤出宠物“狐獴”。<hex:02100103>挖洞生活的小动物，喜欢太阳。","栖息在灰海附近的小动物。它们会在地表挖洞作为巢穴，以家族为单位生活，在太阳升起来时会回到地面，直立不动的让太阳温暖自己的身体。因好奇心钻入在岸边进行修理的潜水艇后，开始了自己一生一次的大冒险。","利用天然洞穴<hex:02100103>建造的地下要塞……<hex:02100103>　　　　　——奥菲丽","晒太阳","打消范围内我方身上的弱化效果。","50","45","3","False","True","False","True","False","6"
"357","召唤出宠物“白小骑士”。<hex:02100103>天钢机工房制作的机工人偶。","天钢机工房制作的机工人偶。原本是为神殿骑士团的桌上模拟演习而制作的棋子，将它们摆在地图上，模拟验证作战计划，进行军事研究。据说它一直在寻找强劲的对手。","我是直属于教皇厅的<hex:02100103>神殿骑士团的一员。<hex:02100103>　　　　　——马瑟兰","降频","令使用特殊技点数的宠物的防御力增加40。<hex:02100103><hex:024804F201F803><hex:024904F201F903>持续时间：<hex:0249020103><hex:0248020103>10秒","25","35","3","False","False","True","True","False","3"
"358","召唤出宠物“极合金正义号”。<hex:02100103>以机工兵器残暴正义号为原型制作的面向儿童的玩具。","遭到青蓝之手解雇的哥布林族技术员转职加入加隆德炼铁厂后，以机工兵器残暴正义号为原型制作的面向儿童的玩具。因大量运用了锌合金压铸工艺，所以成品非常牢固结实。","代号“残暴正义号”！<hex:02100103>发现预料之外的时空改变<hex:02100103>者……降下正义的铁锤！<hex:02100103>　　　　——残暴正义号","惊异机能","令使用特殊技点数的宠物的自动攻击变为范围攻击。<hex:02100103><hex:024804F201F803><hex:024904F201F903>持续时间：<hex:0249020103><hex:0248020103>12秒","75","75","2","False","True","False","False","False","3"
"359","召唤出宠物“多玛金鱼儿”。<hex:02100103>雇员钓上来的金鱼，圆圆的身体特别可爱。","雇员钓上来的金鱼。这种身体圆圆的金鱼被称为多玛金鱼儿，这是由多玛的金鱼爱好者改良出来的新品种。因为吞下了白云花的种子，所以能够漂浮在空中。","你不觉得这是一个<hex:02100103>赚钱的好机会吗？<hex:02100103>　　　——某位商人","鱼鳍扇打","击退范围内的敌人，并造成30攻击力的伤害。","20","80","1","False","False","False","False","True","1"
"360","召唤出宠物“新型迷你埃斯蒂尼安”。<hex:02100103>埃斯蒂尼安退出龙骑士团后的样子，没有鱿鱼干。","模仿退出龙骑士团的埃斯蒂尼安所制作的魔法人偶。伊修加德的所有教育设施均有此人偶，目的是为学生们讲述改变了伊修加德的龙诗战争。还有一点需要注意，就是千万不要问他现在是不是无业游民！","哼，没有我的魔枪<hex:02100103>穿透不了的东西！<hex:02100103>　　——埃斯蒂尼安","龙火烤鱿鱼","对范围内的敌人造成120攻击力的伤害，并且令使用特殊技点数的宠物的攻击力增加20。<hex:02100103><hex:024804F201F803><hex:024904F201F903>持续时间：<hex:0249020103><hex:0248020103>6秒","70","40","4","False","False","False","True","False","1"
"361","召唤出宠物“小凉南希”。<hex:02100103>凉南希的幼体，刚刚萌发新芽。","凉南希的幼体，刚刚萌发新芽，所以性情也很随和。不过随着自身成长，为确保营养源的本能变为贪欲，会用尽各种手段引诱动物与人类。现在正为了习得魅惑技能努力特训中。","凉南希……<hex:02100103>驱逐入侵者！<hex:02100103>——拜克·拉各","春风","对距离最近的敌方萌宠之门造成60%的伤害。对已被破坏的萌宠之门无效。","35","50","2","False","True","True","False","False","8"
"362","召唤出宠物“大哥布林人偶”。<hex:02100103>这并不是你母亲！","以大哥布林为原型制作的魔法人偶。雇员每天都会梦见像老婆婆一样的大哥布林，为了辟邪能让自己睡个好觉，便自制了这个魔法人偶。如果将它交给别人，或许就能将自己梦中的大哥布林一起交到对方梦中了吧。","你个大哥布林<hex:02100103>养的丑八怪！！<hex:02100103>　　　——冒险者","哥布林乱拳","设置陷阱。10秒后可通过点击发动陷阱按钮起爆。对范围内的敌人造成270攻击力的伤害。","30","60","3","False","False","False","True","False","2"
"363","召唤出宠物“小刻耳柏洛斯”。<hex:02100103>拥有三只脑袋的小型犬，叫声也是别人的三倍。","在艾因哈特家物资仓库的阴暗角落中发现的三只脑袋疑似犬类的生物。众所周知，库尔札斯地区的野生妖异非常多，所以它应该是下级妖异中的一种。除了有三个脑袋之外，其他地方和普通的小型犬没区别。","真是的，这可不是小野狗啊。<hex:02100103>　　　　　　　　　　——西德","地狱小冲","降低范围内敌人特殊技点数最大值的50%。","40","60","4","False","True","False","True","False","4"
"364","召唤出宠物“辅助机054”。<hex:02100103>在机械遗迹发现的白色随行支援机。","在机械遗迹最深处发现的小型白色机械。据2P所说，这是寄叶部队人手一台的随行辅助机。拥有强大的射击援助能力和高度的对话功能，不过现在已经坏掉了。","抓住它飞去对面吧！<hex:02100103>　　　　　——阿诺古","A014：提升点数","令范围内我方宠物的特殊技点数增加10。对拥有同效果特殊技的宠物无效。","30","60","3","False","True","True","False","False","3"
"365","召唤出宠物“辅助机316”。<hex:02100103>在机械遗迹发现的黑色随行支援机。","在机械遗迹最深处发现的小型黑色机械。原本是支援寄叶部队的随行辅助机。即便武器和其他各种机能都出现了故障，也不放弃跟随支援对象。","抓住它到对面去吧！<hex:02100103>　　　　　——阿诺古","R014：提升速度","令范围内我方宠物的移动速度提高35%。<hex:02100103><hex:024804F201F803><hex:024904F201F903>持续时间：<hex:0249020103><hex:0248020103>6秒","25","40","3","False","True","False","True","False","3"
"366","召唤出宠物“黄金塔罗斯”。<hex:02100103>代达罗斯公司制作的小玩具，曾风靡一时。","代达罗斯公司制作的小玩具。以自家的塔罗斯为模型，在表面贴上一层金箔，显得格外高级。因为这个设计广受好评，所以风靡一时导致供不应求，使得诺弗兰特全境的金箔工匠都在为制作玩具而努力。","采先生，可以<hex:02100103>请你着手设计<hex:02100103>塔罗斯了吗？<hex:02100103>——雅·修特拉","黄金粉碎","对距离最近的敌方萌宠之门造成90%的伤害。对已被破坏的萌宠之门无效。","70","40","2","False","True","True","False","False","8"
"367","召唤出宠物“马小龙”。<hex:02100103>古代生物的幼体，栖息在与世隔绝的云冠群岛。","在云冠群岛发现的古代生物的幼体。特别亲近发现自己的冒险者，从而跟到了云海之外。非常能吃，感觉时时刻刻都在饿肚子，看到自己的尾巴也会追着咬上去。","她完全没有理解<hex:02100103>古代生物的魅力！<hex:02100103>　　　——科希·芮","飞速旋转","令范围内我方宠物的移动速度提高35%。<hex:02100103><hex:024804F201F803><hex:024904F201F903>持续时间：<hex:0249020103><hex:0248020103>6秒","65","25","4","False","False","True","True","False","3"
"368","召唤出宠物“草小人”。<hex:02100103>形似草人的某种东西，不知为何会动。","在伊尔美格做游戏扮演广域交易商的仙子们贩卖的稀有物品。虽然外表看上去和草人一样，但不知为何会动。在问卖它的仙子族这到底是什么的时候，那个仙子族只会偷偷笑个不停。","哇！<hex:02100103>草人动起来了！<hex:02100103>——睡眼惺忪的恩莫","草绿葱葱","令范围内我方宠物的攻击力增加25。<hex:02100103><hex:024804F201F803><hex:024904F201F903>持续时间：<hex:0249020103><hex:0248020103>6秒","15","80","1","False","False","False","True","True","3"
"369","召唤出宠物“霍啪栌的水蛇？”。<hex:02100103>被当做是隆卡水蛇化身的东西，究竟是何物？","被当做是隆卡水蛇化身的东西。于洞窟遗迹内部，出现在卢利采掘队面前，并告诉他们修复坏掉的石碑，不过具体为何物无人知晓。不知为何戴着头盔，就算在昏暗的洞窟中也能安心。","戴着头盔的水蛇<hex:02100103>大人又出现了。<hex:02100103>——茶咕卢利·柯呫栌","隆卡的诅咒","对距离最近的敌方奥秘核石造成10%的伤害。","60","10","3","False","True","True","True","False","8"
"370","召唤出宠物“奇塔利的水蛇？”。<hex:02100103>被当做是隆卡水蛇化身的东西，到底是何物？","被当做是隆卡水蛇化身的东西。为了缅怀消失的奇塔利的水蛇大人，便为霍啪栌古盘的其他个体制作并戴上了相似的帽子。外观与奇塔利的水蛇大人一模一样，真是太好了。","戴着帽子的水蛇大人……<hex:02100103>再也没有出现了……<hex:02100103>　　——茶咕卢利·柯呫栌","隆卡的神秘","对范围内的敌人造成90攻击力的伤害。","55","40","2","True","False","False","False","False","1"
"371","召唤出宠物“银山雀儿”。<hex:02100103>娇小迷人非常可爱，长长的尾巴也有着独特魅力。","娇小迷人非常可爱的鸟儿。不知何时钻进了派遣到灰海的潜水艇内。应该是人偶驾驶员为了换气浮上海面打开舱盖时飞进来的吧。虽然很啰嗦，但它真的很可爱。","真是太可爱了，<hex:02100103>我都想要一个了！<hex:02100103>　　——赛伦蒂碧提","吱吱吱","令范围内敌人的防御力降低50%。<hex:02100103><hex:024804F201F803><hex:024904F201F903>持续时间：<hex:0249020103><hex:0248020103>15秒","45","40","4","False","True","True","True","False","4"
"372","召唤出宠物“烹调猴面雀儿”。<hex:02100103>猴面雀儿的幼体，以成为烹调师为目标在努力修行。","云顶营地的蔷薇骑兵团送来的支援物资中，藏着一只猴面雀的幼体。作为它吃光了物资中所有食物的惩罚，它需要担任烹调师的助手。拿手绝活是焦糖奶茶。","想要让猴面雀们拿出干劲<hex:02100103>真是好难啊噗……<hex:02100103>　　　　　　　　——鱼虾","料理的宇宙","打消范围内敌人的所有强化效果。","100","80","3","False","True","True","False","False","6"
"373","召唤出宠物“衣匠猴面雀儿”。<hex:02100103>猴面雀儿的幼体，以成为裁衣匠为目标在努力修行。","曾经发生过一场神秘的连续捣乱事件，蔷薇骑兵们的私服上，每晚都会多出精心缝纫的刺绣。前去监视的拉妮艾特阁下，抓到的则是这只猴面雀的幼体。作为惩罚，它需要帮忙进行复兴工作。","这的确像是猴面雀<hex:02100103>会感兴趣的东西噗！<hex:02100103>　　　　　　——鱼虾","缝纫的宇宙","打消范围内我方身上的弱化效果。","75","45","3","False","True","False","True","False","6"
"374","召唤出宠物“小小古代人”。<hex:02100103>仿照古代人制作的魔法人偶，据说是古代人的玩具。","在阿尼德罗追忆馆发现了内含理念的水晶，这个魔法人偶就是由水晶再现出来的。这应该是古代人的玩具，因为古代人长得很高，所以他们制作出来的魔法人偶有着拉拉菲尔族般的大小。","怎么，你以为无影和古代人<hex:02100103>都是无血无泪的怪物吗？<hex:02100103>　　　　　——爱梅特赛尔克","疑惑","无效化“动物”类型的宠物对范围内我方宠物的攻击。<hex:02100103><hex:024804F201F803><hex:024904F201F903>持续时间：<hex:0249020103><hex:0248020103>5秒","50","50","3","False","True","False","True","False","3"
"375","召唤出宠物“鲨鱼指挥官”。<hex:02100103>长有手脚的鲨鱼，似人非人。","曾经有人说过，增加头部的时代结束了，接下来要长的是腿。可是，这只鲨鱼不仅有腿，就连手都长齐了。它到底是古代的杀人兵器，还是突然变异而来……还是不要深究了。","谁在造杀人兵器了？<hex:02100103>别乱说啊，你这笨蛋！<hex:02100103>　——赛兹尔·托托罗克","地狱的杀人部队","击退范围内的敌人，并造成90攻击力的伤害。","40","45","3","False","False","True","False","False","1"
