"376","召唤出宠物“迷你杜丽雅”。<hex:02100103>别看个头小，力量一样大。","模仿杜丽雅制作的魔法人偶。这是采·努兹运用制造塔罗斯的技术制作的25周年结婚纪念礼物。为了让返乡的暗之战士们记住二人，杜丽雅让人偶抱着自己制作的最爱的老公，并一起送给了暗之战士等人。","不，老公，<hex:02100103>我要和你一起去。<hex:02100103>　　　　——杜丽雅","爱的拥抱","对范围内的敌人每秒造成10点持续伤害。<hex:02100103><hex:024804F201F803><hex:024904F201F903>持续时间：<hex:0249020103><hex:0248020103>20秒","40","70","2","False","False","False","True","False","1"
"377","召唤出宠物“阿马罗宝宝”。<hex:02100103>阿马罗的幼体，想飞却不会飞。","阿马罗的幼体。阿马罗在诺弗兰特被人们广泛用作骑行兽，而幼体的阿马罗想飞却不会飞，实属令人着急。它们有着过人的智力，随着岁月的积累，等成长为图帕克·阿马罗后没准就能理解人类的语言了。","啊……阿马罗这种生物真<hex:02100103>是神秘又富有浪漫色彩……<hex:02100103>你也这么认为吧？<hex:02100103>　　　　　　　——贝斯里克","隆卡的魔法","将召唤宠物的复唱时间缩短一半。<hex:02100103><hex:024804F201F803><hex:024904F201F903>持续时间：<hex:0249020103><hex:0248020103>10秒","50","35","3","False","True","False","False","False","9"
"378","召唤出宠物“拉拉鳄”。<hex:02100103>性格温厚的小型鳄鱼，再怎么长也长不大。","帝王鳄的近亲，再怎么长也长不大，而且性格温厚。为此，曾经在伊修加德的贵族之间，将它比喻为“与传说中的小矮人拉拉菲尔相媲美的鳄鱼”，并当做宠物养了起来。实际上，它温厚的性格甚至能与小鸟做朋友。","比我们个头更小的……<hex:02100103>是拉拉菲尔族啊！<hex:02100103>　　　　　　　——阳山","温柔的世界","无效化所有敌人对我方萌宠之门、防御盾、探索眼的攻击。<hex:02100103><hex:024804F201F803><hex:024904F201F903>持续时间：<hex:0249020103><hex:0248020103>20秒","50","60","2","False","False","False","True","False","9"
"379","召唤出宠物“不幸小兔”。<hex:02100103>深知世间酸甜苦辣的小兔魔法玩偶。","戈德伯特阁下设计的兔子外形的魔法人偶。虽然在乌尔达哈迅速获得了大量人气，但是由于复杂的所属权问题，使得魔法人偶一时之间成为了白金幻象的吉祥物。最后，所属权终于回到了金碟游乐场。","不要欺负我这人畜无害<hex:02100103>人见人爱的小兔子啊。<hex:02100103>　　　　　　　——尼禄","怎么了？","令使用特殊技点数的宠物的移动速度提高30%。<hex:02100103><hex:024804F201F803><hex:024904F201F903>持续时间：<hex:0249020103><hex:0248020103>10秒","70","55","3","False","True","False","False","False","3"
"380","召唤出宠物“啦哩吼矮人”。<hex:02100103>以矮人族为原型制作的小型自走人偶，擅长用啦哩吼打招呼。","以矮人族为原型制作的小型自走人偶。不擅长打招呼的罗尼图为了能有个陪着练习啦哩吼的对象，秘密地开发了这台自走人偶。因此这台自走人偶能很流利地做出啦哩吼的动作。此外还选用了矮人酒精作为燃料。","干杯！啦哩吼！<hex:02100103>再来一杯！<hex:02100103>　 ——吉奥图","啦哩吼","令范围内的敌人止步。<hex:02100103><hex:024804F201F803><hex:024904F201F903>持续时间：<hex:0249020103><hex:0248020103>5秒","20","50","2","False","True","False","True","False","4"
"381","召唤出宠物“猫秘玩偶”。<hex:02100103>以某人为原型制作的猫秘族魔法人偶，具体指的是谁呢？","究竟是以谁为原型制作的人偶，想必不用多说也会明白。不过大家都清楚那个人并不希望自己成为偶像。所以中庸工艺馆的工匠们制作出了这个无名的猫秘族魔法人偶以便大家缅怀与那个人的回忆。","等时候到了，<hex:02100103>就要大胆地站出来……<hex:02100103>　　　　　 　——莫伦","亚拉戈秘术","令范围内我方宠物的防御力增加10。当该宠物为“玩偶”类型时，防御力增加30。<hex:02100103><hex:024804F201F803><hex:024904F201F903>持续时间：<hex:0249020103><hex:0248020103>6秒","30","80","1","False","False","True","False","True","3"
"382","召唤出宠物“迷你阿尔博特”。<hex:02100103>以阿尔博特为原型制作的魔法人偶。你必须明白！","以光之战士同时也是暗之战士的阿尔博特为原型制作出的魔法人偶。该人偶是为了永不忘记他想要拯救第一世界而坚持战斗的壮举，特意制作而成。他的情感将由继承了他灵魂的人一并传承下去吧。","你应该会明白吧……<hex:02100103>不，你必须明白！<hex:02100103>　　 ——暗之战士","与英雄的约定","无效化所有敌人对我方萌宠之门、防御盾、探索眼的攻击。<hex:02100103><hex:024804F201F803><hex:024904F201F903>持续时间：<hex:0249020103><hex:0248020103>20秒","70","40","3","False","True","False","True","False","9"
"383","召唤出宠物“魔导地狱潜者追踪型”。<hex:02100103>以魔导地狱潜者为原型制作的模型。","以魔导地狱潜者为原型制作的模型。虽然同为飞行型魔导装甲，但由于与浮空装甲的操纵感觉差异较大，因此在机种转换训练中，受训者有义务利用该模型学习操纵此类机体战斗的技巧。","竟然能在空中斩断飞行型<hex:02100103>魔导装甲，多玛的武士……<hex:02100103>真是令人敬佩。<hex:02100103>　　　　　　　——艾默里克","气枪","对距离最近的敌方奥秘核石造成10%的伤害。","45","70","4","False","False","True","True","False","8"
"384","召唤出宠物“肥肥风筝猫”。<hex:02100103>长得肥肥的风筝猫，有着衣服晾晒后的清香。","长得肥肥的风筝猫。不知道是不是因为适应了寒冷地区的气候，身上不仅储蓄了许多的皮下脂肪，而且还穿着像是防寒服一样的东西。可却无法将这身衣服硬扒下来。如果还要一意孤行想要尝试的话，很可能会遇到留下心理阴影的遭遇。","这也……太理想了吧！<hex:02100103>　　　 ——猫咪传道士","毛茸茸蓬松松","对范围内的敌人造成80攻击力的伤害，并且令敌人的防御力降低13%。<hex:02100103><hex:024804F201F803><hex:024904F201F903>持续时间：<hex:0249020103><hex:0248020103>6秒","30","40","2","False","False","True","True","False","1"
"385","召唤出宠物“幻影亡灵法师”。<hex:02100103>以幻光亡灵法师为原型编织的幻影，只不过无法操控尸体。","仙子族为了感谢与他们一同玩耍的你而参照幻光亡灵法师编织出的幻影。作为幻影原型的女性想必也是在某个世界与邪恶战斗的英雄吧。不过其姓名与来历已无从得知了。","我也要战斗……<hex:02100103>为了世界……<hex:02100103>为了我最爱的……<hex:02100103>　——幻光亡灵法师","亡灵术","当防御盾被破坏时，可令其复活。","30","45","3","False","False","False","True","False","9"
"386","召唤出宠物“亚拉戈西瓜”。<hex:02100103>富含大量水分的西瓜，不知是何原理居然会动。","自古就有将西瓜供奉在墓前的习俗，以便逝者在死后上路时不至于口渴。从此事上不难看出古人将西瓜视作为水源的一种。可西瓜笨重不易搬运，所以亚拉戈帝国的农业学者为西瓜赋予了自动跟随的功能。","太过于冲击了，<hex:02100103>我完全不懂该怎么办！<hex:02100103>——肌肉发达的剧团成员","西瓜炸弹","设置陷阱。10秒后可通过点击发动陷阱按钮起爆。对范围内的敌人造成270攻击力的伤害。","40","40","2","True","False","False","False","False","2"
"387","召唤出宠物“沙狐”。<hex:02100103>千年妖狐的子孙，最喜欢桦木糖浆。","寿命超过千年的妖狐的子孙。曾经试着拜传说中的先祖宗旦为师，可却被干脆地拒绝了。于是它最近好像又决定要将冒险者作为自己新的师父。因为是杂食性，所以不论肉类还是果实都是来者不拒，特别是最近它迷上了桦木糖浆的味道。","那只狐狸的脸真的<hex:02100103>跟“那位大人”<hex:02100103>长得一模一样。<hex:02100103>——从伊修加德来的男性","挖洞","可以拆除敌人设置的陷阱。","30","45","3","False","False","False","True","False","6"
"388","召唤出宠物“无齿翼龙幼崽”。<hex:02100103>无齿翼龙的幼龙。虽然个头小，但飞行技术超棒。","无齿翼龙的幼龙。在云冠群岛进行采集活动的伊修加德园艺工发现了这只被父母舍弃的幼龙。在众人热心地喂养下，它变得非常亲近人类。为了让它在更广阔的世界中成长，现正在募集领养者。","幼龙的幼崽状态会<hex:02100103>持续几十年库啵。真是<hex:02100103>很让人伤脑筋呢库啵。<hex:02100103>　　　 ——莫古艾克","滑翔飞行","令使用特殊技点数的宠物的移动速度提高30%。<hex:02100103><hex:024804F201F803><hex:024904F201F903>持续时间：<hex:0249020103><hex:0248020103>10秒","50","55","3","False","False","True","True","False","3"
"389","召唤出宠物“达因斯莱瓦追踪型”。<hex:02100103>以达因斯莱瓦为原型制作的模型。再启动！","以达因斯莱瓦为原型制作的模型。由于参照动物制作的魔导复仇者取得了一定的成果，于是设计者们围绕着下期主力机体的要以何种动物为原型进行了热烈讨论。这个四足肉食动物型模型就是他们用来验证讨论成果的。","那是一种食肉的恐怖野兽，<hex:02100103>还会袭击人类……<hex:02100103>　　　　——亚历克松德尔","魔导机牙","对敌方探索眼造成90%的伤害。对已被破坏的探索眼无效。","40","50","3","True","False","False","False","False","8"
"390","召唤出宠物“阎魔”。<hex:02100103>位于妖怪的顶点，引领妖魔界前行的大王。","位于妖怪的顶点，引领妖魔界前行的大王。他的体内寄宿着一个充满勇气的少年和强大的妖怪之魂。","久等了！","霸王阎魔玉","对范围内的敌人造成230攻击力的伤害。","70","35","2","True","True","True","True","False","1"
"391","召唤出宠物“蛇王凯拉”。<hex:02100103>接手阎魔的大王之位，君临妖魔界的妖怪。","接手阎魔的大王之位，君临妖魔界的妖怪。过去曾与阎魔站在对立面，现在是交流频繁的好伙伴。","诸位，战斗吧！","蛇王叛狱波","打消范围内敌人的所有强化效果。","75","25","3","False","True","True","False","False","6"
"392","召唤出宠物“滑头鬼”。<hex:02100103>阎魔大王手下的参谋。","侍奉阎魔大王的参谋。和卸下大王身份的阎魔一起，调查潜伏在妖魔界里的黑暗。妖魔评议会会长的职务则交予他的心腹代理。","阎魔大人！","超波动裁决","令范围内我方宠物的特殊技点数增加10。对拥有同效果特殊技的宠物无效。","50","50","2","False","True","True","False","False","3"
"393","召唤出宠物“百鬼公主”。<hex:02100103>出生于地狱小国的公主。","出生于地狱小国的公主。自幼学习的暗之妖术可谓是水准极高。作为代价，她失去了大部分的感情。","轮到我出场了～","惊心动魄☆百鬼夜行","令范围内的敌人止步。<hex:02100103><hex:024804F201F803><hex:024904F201F903>持续时间：<hex:0249020103><hex:0248020103>5秒","60","25","2","False","True","False","True","False","4"
"394","召唤出宠物“2B”。<hex:02100103>在人偶军事基地深处发现的小型黑色自走人偶。","在人偶军事基地深处发现的小型黑色自走人偶。外观与自称“寄叶机体二号B型”的人造人很相似。可到底是谁究竟为了什么目的而制作的，目前仍然无从猜测。","一切都还没有结束。<hex:02100103>不论是我们还是敌人……<hex:02100103>　　　　　　　　 ——2B","战斗的终结","击退范围内的敌人，并造成150攻击力的伤害。","65","40","3","False","True","False","True","False","1"
"395","召唤出宠物“2P”。<hex:02100103>在人偶军事基地深处发现的小型白色自走人偶。","在人偶军事基地深处发现的小型白色自走人偶。虽然外表好像是仿照2P制作的，不过目前没有敌意的样子，暂时算是安全的。此外该人偶还运用了未知的技术，因此包含动力源在内的一切信息均为不明。","我是……2号……<hex:02100103>不对，我是2P。<hex:02100103>　　　　 ——2P","战斗的延续","降低范围内敌人特殊技点数最大值的50%。","75","45","4","False","False","True","False","False","4"
"396","召唤出宠物“莫莫拉·莫拉！！！”。<hex:02100103>莫莫拉·莫拉的幼鱼。已经够了吗？那就再来一条吧！","常出现于梅尔托尔海峡附近的巨型海水鱼莫莫拉·莫拉的幼鱼。捕鱼人常常在不想要的时候偏偏能钓到它，因此在渔夫们的口中逐渐成为了一个传说。不过，请不要嫌弃它。它只是想跟你一起旅行而已。","至于在什么地方能够钓到<hex:02100103>什么鱼……你会在失败中<hex:02100103>学到经验的，就和恋爱一样。<hex:02100103>　　　　　　　　——瓦瓦拉哥","！！！","将使用特殊技点数的宠物传送回我方的中央萌宠之门。","55","60","2","False","True","False","True","False","9"
"397","召唤出宠物“希尔德拉级潜水艇P型”。<hex:02100103>希尔德拉级潜水艇的缩小模型。","负责操纵潜水艇的冒险人偶在远航期间一步步设计出的模型。将希尔德拉级潜水艇按照比例进行了缩小。名字中的P其实是原型的意思。","别在奇怪的地方逞强啦，<hex:02100103>于里昂热也是，好好练习<hex:02100103>游泳不就行了吗……<hex:02100103>　　　　　　　——阿莉塞","炮击战","对范围内的敌人造成230攻击力的伤害。","50","80","3","True","False","False","False","False","1"
"398","召唤出宠物“迷你盖娅”。<hex:02100103>以盖娅为原型制作的魔法人偶。就这么约好了。","以盖娅为原型制作的魔法人偶，是在那个被创造出的理想乡中发现的。可能是米特隆由于想念阿洛格里夫，仿照其转生体制作出来的。从这个意义上来说，这个人偶也代表着那个被遗忘的约定。","就这么约好了。<hex:02100103>　　　　——盖娅","扩张的大锤","对距离最近的敌方萌宠之门造成60%的伤害。对已被破坏的萌宠之门无效。","55","30","1","True","False","False","False","True","8"
"399","召唤出宠物“迷你帕罗姆”。<hex:02100103>以古代英雄为原型制作的魔法人偶。上吧，普罗姆！","以古代英雄帕罗姆为原型制作的魔法人偶。出生在魔法师生活的村子里的天才，传说中刚满5岁时就已经能够操控黑魔法了，与双胞胎姐姐普罗姆一起踏上了冒险的旅程，曾拼命守护了同伴。","我们不会让你们<hex:02100103>死在这里的！<hex:02100103>　　　——帕罗姆","逞强","令范围内我方宠物的防御力增加20。<hex:02100103><hex:024804F201F803><hex:024904F201F903>持续时间：<hex:0249020103><hex:0248020103>10秒","20","60","2","False","False","True","False","False","3"