"591400","0","1","1","0","0","755","0","0","1","1","1","0","0","0","0","0","0","False","False","False","整个前哨都知道你是一个值得信赖的人。<hex:02100103>肯定有不少人对你感兴趣，想求你来帮忙。","相对的，也会有人尚未接受你……<hex:02100103>希望你用宽大的胸怀和他们接触，他们只不过是太爱狄兰达尔家了。","0"
"591401","0","1","2","0","0","764","0","0","1","1","1","0","0","0","0","0","0","False","False","False","呀吼！最近怎么样啊？冒险还顺利吗？<hex:02100103>如果你想念西艾娜的可爱笑颜了，<hex:02100103>那就随时到小麦酒港来！等着你哟！","0","0"
"591402","0","1","2","0","0","764","0","0","1","1","1","0","0","0","0","0","0","False","False","False","最近过得还好吗？<hex:02100103>一个冒险者的力量放在加雷马帝国面前显得太过渺小。<hex:02100103>你做任何行动都务必要慎重小心。","0","0"
"591403","0","1","2","0","0","764","0","0","1","1","1","0","0","0","0","0","0","False","False","False","自从打倒了盖乌斯，<hex:02100103>驻留在摩杜纳的帝国军就销声匿迹了……<hex:02100103>我们想要趁这个时机扩建营地。","0","0"
"591404","0","1","2","0","0","764","0","0","1","1","1","0","0","0","0","0","0","False","False","False","嘉恩·艾·神纳大人的使者来了。<hex:02100103>看来因为你们的活跃表现，<hex:02100103>格里达尼亚要给我们提供支援了。","这实在是件大好事……<hex:02100103>这样一来，丧灵钟就可以扩建得更好了。<hex:02100103>我也必须得向你道谢才行。","0"
"591405","0","1","2","0","0","764","0","0","1","1","1","0","0","0","0","0","0","False","False","False","梅尔维布提督派来了使者。<hex:02100103>继格里达尼亚之后，<hex:02100103>利姆萨·罗敏萨也愿意支援丧灵钟的建设了。","多玛的难民们身处异乡，还有很多不习惯的地方。<hex:02100103>但也都作为开拓团的一员积极出力。<hex:02100103>这个营地将来一定会成为一个大据点的！","0"
"591406","0","1","1","0","0","755","0","0","1","1","1","0","0","0","0","0","0","False","False","False","“思念”这种东西啊，到关键时刻会化为一种动力。<hex:02100103>……我把对帝国的憎恨寄托给你们。<hex:02100103>如果那能成为你们的力量，我也算是了了心愿。","0","0"
"591407","0","1","1","0","0","755","0","0","1","1","1","0","0","0","0","0","0","False","False","False","打倒漆黑的王狼之后，丧灵钟也渐渐发生改变……<hex:02100103>看着来往于此的人们，我也有点……<hex:02100103>想要寻找复仇之后的……新的未来。","0","0"
"591408","0","1","1","0","0","755","0","0","1","1","1","0","0","0","0","0","0","False","False","False","太阳海岸是我的私有土地……<hex:02100103>在这里我就是老大！<hex:02100103>这是毫无疑问的，就算不对也要将错就错！","0","0"
"591409","0","1","1","0","0","755","0","0","1","1","1","0","0","0","0","0","0","False","False","False","芙·拉敏现在也是超级可爱呢！<hex:02100103>啊……我想让这座沙滩成为充满可爱女孩子的乐园。","0","0"
"591410","0","1","2","0","0","764","0","0","1","1","1","0","0","0","0","0","0","False","False","False","还想要再见，巴斯卡隆！<hex:02100103>等店铺，变大，<hex:02100103>特特卢恩，会自信满满，去见巴斯卡隆！","0","0"
"591411","0","1","1","0","0","755","0","0","1","1","1","0","0","0","0","0","0","False","False","False","虽然我认为跨天桥以后会繁华起来……<hex:02100103>不过你看，眼下一片冷清啊。","话说回来，你在小阿拉米格见到希希菈了吗？<hex:02100103>那孩子从小就是个爱做梦的女孩。<hex:02100103>不过，她平安无事就是对我最大的安慰。","0"
"591412","0","1","2","0","0","764","0","0","1","1","1","0","0","0","0","0","0","False","False","False","啊！不！<hex:02100103>难道……只能依靠毛蓬蓬补剂了吗？！<hex:02100103>它在哭泣！我的发根在哭泣着呼唤爱！","0","0"
"591413","0","1","2","0","0","764","0","0","1","1","1","0","0","0","0","0","0","False","False","False","哟，这不是不怕死的家伙嘛，你回来了！<hex:02100103>虽然这肮脏的最前线没什么东西可以拿出来犒劳你，<hex:02100103>不过你可以想休息就休息，想战斗就战斗！","0","0"
"591414","0","1","1","0","0","755","0","0","1","1","1","0","0","0","0","0","0","False","False","False","哈……你是谁啊？<hex:02100103>我关照过的冒险者？<hex:02100103>这样啊，我不太记得了。唔……","比起这些事，听我来给你讲讲以太吧。<hex:02100103>哎？别客气啊！听听呗！嘁，真是无聊……<hex:02100103>那算了！你走吧你走吧，拜拜！唔……","0"
"591415","0","1","2","0","0","764","0","0","1","1","1","0","0","0","0","0","0","False","False","False","以朗贝尔坦老师发表的“属性转移理论”为基础，<hex:02100103>计算出偏属性水晶的属性转换功率，<hex:02100103>那么由极性干涉引起的暗淡现象就能……","……啊，你、你好……<hex:02100103>偏属性水晶有起到作用吗？","0"
"591416","0","1","2","0","0","764","0","0","1","1","1","0","0","0","0","0","0","False","False","False","哦哦，你最近怎么样啊？<hex:02100103>我的研究马马虎虎吧！","我会让朗贝尔坦老师认可我的论文，<hex:02100103>然后让那个自大的小姑娘和书呆子知道，<hex:02100103>我才是“零组”的组长！","0"
"591417","0","1","1","0","0","755","0","0","1","1","1","0","0","0","0","0","0","False","False","False","虽然在我们这里这种话不能公开说……<hex:02100103>不过听说，冒险者在白云崖前哨十分活跃……<hex:02100103>是么，原来就是你啊。","龙族、帝国军、鸟人族……<hex:02100103>需要我们提高警惕的对象太多了。<hex:02100103>和外界的关系发生改变，或许也是必然的。","0"
"591418","0","1","2","0","0","764","0","0","1","1","1","0","0","0","0","0","0","False","False","False","虽然击溃了“海蛇之舌”的阴谋，<hex:02100103>但是鱼人族的威胁依然存在。<hex:02100103>只要我活着，就绝不会让南北防波堤陷落！","0","0"
"591419","0","1","1","0","0","755","0","0","1","1","1","0","0","0","0","0","0","False","False","False","没能在小姐身边排忧解难，<hex:02100103>这让我悔恨至今……<hex:02100103>啊，愿小姐能够在另一个世界得到安息。","0","0"
"591420","0","1","1","0","0","755","0","0","1","1","1","0","0","0","0","0","0","False","False","False","从庄园回来的鬼哭队告诉我了。<hex:02100103>是你救了他们吧……<hex:02100103>还有，小姐被妖异所驱使的事也……","这件事会让我终身自责……<hex:02100103>但这次……达尔坦库尔家的悲剧终于被画上句号。<hex:02100103>真的……真的很感谢你。","0"
"591421","0","1","2","0","0","763","0","0","1","1","1","0","0","0","0","0","0","False","False","False","诺亚的调查揭开了亚拉戈帝国的历史……<hex:02100103>我是这么认为的。<hex:02100103>所以，你也要磨练武艺啊！","可是啊……却无法亲眼见证关键部分，<hex:02100103>这真是让人郁闷……<hex:02100103>我要是耍两下弓箭，也是很强的啊！","0"
"591422","0","1","2","0","0","764","0","0","1","1","1","0","0","0","0","0","0","False","False","False","延伸至地下的“陨石痕迹”属于未知领域。<hex:02100103>可能比帝国的要塞还要危险。<hex:02100103>请和同伴们做好万全准备！","0","0"
"591423","0","1","2","0","0","764","0","0","1","1","1","0","0","0","0","0","0","False","False","False","我接到了报告，了解到了你的壮举。<hex:02100103>没想到你竟然到达了<hex:02100103>延伸至帝国西方堡地下的“陨石痕迹”的最深处。","攻破了重重难关，干得不错！<hex:02100103>虽然调查不会就此结束，<hex:02100103>但如果是你的话，一定可以好好保护阿莉塞小姐的。","0"
"591424","0","1","1","0","0","755","0","0","1","1","1","0","0","0","0","0","0","False","False","False","金石之交，有朋自远方来。<hex:02100103>强者，你来灰阵营所为何事？","如果是和敌人正面交战受了伤，欢迎你在这里疗养。<hex:02100103>但如果是背对敌人时受的伤，请恕吾等不欢迎你。<hex:02100103>吾等乃是战鬼，身处修罗之道，常怀死战之心。","0"
"591425","0","1","2","0","0","763","0","0","1","1","1","0","0","0","0","0","0","False","False","False","冒险者，你好呼啾。<hex:02100103>多亏了你，神子大人现在成长得很快呼啾。<hex:02100103>希望他能早日和暂留地的同伴们成为好朋友呼啾！","0","0"
"591426","0","1","0","0","0","0","0","0","1","1","1","0","0","0","0","0","0","False","False","False","我也很习惯暂留地的生活了，<hex:02100103>给妖精族的各位跑腿……<hex:02100103>不对，是帮忙，也变得熟练多了。","啊，你看，我还给通向树屋的坡道做了栅栏！<hex:02100103>身为学者的我，最近好像越来越像个工匠了，啊哈哈……","0"
"591427","0","1","2","0","0","757","0","0","1","1","1","0","0","0","0","0","0","False","False","False","冒险者 你又来帮忙吗？<hex:02100103>哎？不 我没有偷懒！<hex:02100103>我还是 很努力的！","0","0"
"591428","0","1","0","0","0","720","0","0","1","1","1","0","0","0","0","0","0","False","False","False","<hex:022903EB0203>，你听我说！<hex:02100103>这个采矿地里这些地灵，<hex:02100103>不管怎么鞭策他们都不肯干活！","真是令人火大啊！<hex:02100103>这样子下去一辈子都是开采量倒数第一啊！","0"
"591429","0","1","2","0","0","763","0","0","1","1","1","0","0","0","0","0","0","False","False","False","呼嘶，你来啦，<hex:022903EB0203>。<hex:02100103>你跟我们诺布一伙也算一家人。<hex:02100103>和兄弟们好好聊聊，轻松地休养一下吧。","0","0"
"591430","0","1","0","0","0","0","0","0","1","1","1","0","0","0","0","0","0","False","False","False","我听说了，你潜入之前提到的那个“食人庄园”了啊？<hex:02100103>不愧是<hex:022903EB0203>，艺高人胆大啊。<hex:02100103>如果有什么有趣的事情我会再告诉你的。","0","0"
"591431","0","1","1","0","0","755","0","0","1","1","1","0","0","0","0","0","0","False","False","False","自那之后我又听说了一些详细的情况。<hex:02100103>铜铃铜山因为百臂巨人族变得一团糟。","之前也是被那些家伙压制来着吧？<hex:02100103>铁灯团的人好像完全手足无措啊……","0"
"591432","0","1","1","0","0","755","0","0","1","1","1","0","0","0","0","0","0","False","False","False","让我回斗技场财团吗……<hex:02100103>虽然我对那里也确实有所留恋。","但现在，在丧灵钟这里每天听冒险者们的故事，<hex:02100103>我就很开心了。","0"
"591433","0","1","2","0","0","763","0","0","1","1","1","0","0","0","0","0","0","False","False","False","迪尔斯特维兹是个重情重义，爱照顾人的男人……<hex:02100103>修行时我就受了他很多照顾。总有一天我得报答他。","0","0"
"591434","0","1","2","0","0","764","0","0","1","1","1","0","0","0","0","0","0","False","False","False","哦哦，前几天受你照顾了。<hex:02100103>虽然让塞壬逃走了，<hex:02100103>不过眼看天狼星灯塔的修复工作可以开始了。","0","0"
"591435","0","1","2","0","0","764","0","0","1","1","1","0","0","0","0","0","0","False","False","False","哦哦，你最近怎么样啊？<hex:02100103>虽然被塞壬夺走了很多东西，<hex:02100103>但是我终于整理好心情，开始向前迈步了。","0","0"
"591436","0","1","2","0","0","763","0","0","1","1","1","0","0","0","0","0","0","False","False","False","塞壬的事谢谢你了。<hex:02100103>天狼星灯塔的修复准备工作也终于重新开始了。<hex:02100103>我每天都在弥弥德亚先生的指导下磨练技艺。","0","0"
"591437","0","1","1","0","0","764","0","0","1","1","1","0","0","0","0","0","0","False","False","False","冒险之后要不要在沉溺海豚亭休息一下呢？<hex:02100103>和同伴约在这里集合也很方便。","0","0"
"591438","0","1","2","0","0","763","0","0","1","1","1","0","0","0","0","0","0","False","False","False","为冒险者随时提供具有吸引力的商品，这可不是件容易事。<hex:02100103>对了，你想要修理劣化的武具吗？<hex:02100103>我这里有亚拉戈时光油和亚拉戈时光沙，你感兴趣吗？","我想用它们和你交换怪物猎人的手册。<hex:02100103>这手册是那些危险怪物的手下败将的遗物。","那些死掉的人生前都记录了些什么……<hex:02100103>有些低级趣味的收藏家就爱研究这种东西，<hex:02100103>因此肯定能卖个好价钱。"
"591439","0","1","1","0","0","764","0","0","1","1","1","0","0","0","0","0","0","False","False","False","不好意思能过后再来吗？<hex:02100103>罗薇娜的那些事已经让我忙不过来了……","0","0"
"591440","0","1","1","0","0","764","0","0","1","1","1","0","0","0","0","0","0","False","False","False","过去是过去，现在是现在。<hex:02100103>不过不好好回顾过去也无法在现在生存下去啊。","0","0"
"591441","0","1","2","0","0","763","0","0","1","1","1","0","0","0","0","0","0","False","False","False","狩猎过蛮神的你应该见过寄宿着蛮神力量的武器吧，<hex:02100103>那是蛮族献给蛮神的贡品受到蛮神祝福后的产物。","如果向蛮神武器中注入更强大的魔力，就可以强化蛮神武器。<hex:02100103>不知道你见没见过可以用来强化的东西。","就好比说，如果有寄宿着希瓦魔力的“钻石尘晶”，<hex:02100103>就可以强化同样受希瓦祝福的武器。<hex:02100103>如果你找到那东西了的话，就连武器一并拿来吧。"
"591442","0","1","2","0","0","764","0","0","1","1","1","0","0","0","0","0","0","False","False","False","伟大的黑魔法师<hex:022903EB0203>啊。<hex:02100103>即便你成就了代代相传的族人宿命，<hex:02100103>但这不过是崭新故事的起点。","故而磨杵作针，终得衣锦还乡。<hex:02100103>抱持那坚定的意志，水滴石穿的决心，<hex:02100103>终有一日可迎来再无种族之别的繁荣昌盛。","0"
"591443","0","1","2","0","0","763","0","0","1","1","1","0","0","0","0","0","0","False","False","False","如果与蛮神拉姆对话失败，<hex:02100103>格里达尼亚人民和妖精族可能会从此决裂。<hex:02100103>因此这次的作战一定要成功！","0","0"
"591444","0","1","2","0","0","763","756","0","1","1","1","0","0","0","0","0","0","False","False","False","光靠拂晓，是解决不了难民问题的……<hex:02100103>我刚才跟那个难民说的都是事实。<hex:02100103>作为盟主，我认为我的判断是正确的。","但与此同时，我也很不甘心。<hex:02100103>因此，只要是我能做得到的，一定会去做好。<hex:02100103>……调查暴动一事就交给你了，请你也尽全力去办。","0"
"591445","0","1","2","0","0","763","0","0","1","1","1","0","0","0","0","0","0","False","False","False","蛮神拉姆一事就交给你们了。<hex:02100103>我跟于里昂热先生也说了这件事，他可能会赶去协助你们……","0","0"
"591446","0","1","2","0","0","763","0","0","1","1","1","0","0","0","0","0","0","False","False","False","事情虽还没有圆满结束，但也算告一段落了。<hex:02100103>趁现在没有任务，你不如出去转转。<hex:02100103>和大家说说话，转换一下心情。","0","0"
"591447","0","1","2","0","0","0","763","0","1","1","1","0","0","0","0","0","0","False","False","False","讨伐了主要的几个蛮神，也抓住了消灭无影的线索……<hex:02100103>现在正是向前迈进一步的大好时机。","为了让阿尔菲诺酝酿的计划成功，<hex:02100103>我们需要你的力量。<hex:02100103>请一定要助他一臂之力。","0"
"591448","0","1","2","0","0","763","0","0","1","1","1","0","0","0","0","0","0","False","False","False","拂晓血盟获得了水晶义勇队这一新的力量，<hex:02100103>与此同时，也背负上了更重大的责任。<hex:02100103>肩负起这份责任，需要很大的决心。","不过，我们也因此变得更强大了。<hex:02100103>今后也要更加努力！","0"
"591449","0","1","1","0","0","756","0","0","1","1","1","0","0","0","0","0","0","False","False","False","拼命工作的女性可真是美，<hex:02100103>就像那在风雪中绽放的野花一般动人。","0","0"
"591450","0","1","2","0","0","763","0","0","1","1","1","0","0","0","0","0","0","False","False","False","我和芙·拉敏说了在妖精领发生的事情，<hex:02100103>比如假桑克瑞德的事……<hex:02100103>啊，你可别告诉他是我说的！","0","0"
"591451","0","1","1","0","0","765","0","0","1","1","1","0","0","0","0","0","0","False","False","False","自从多玛的孩子们来了之后，就一点都清静不下来……<hex:02100103>不过，就算和伊达在一起也一点都不清静。","0","0"
"591452","0","1","2","0","0","763","0","0","1","1","1","0","0","0","0","0","0","False","False","False","塔塔露一有空就在专心钻研。<hex:02100103>我也要向她学习，刻苦研究。<hex:02100103>所谓暴风雨后的平静，指的正是现在这个时候。","0","0"
"591453","0","1","2","0","0","764","0","0","1","1","1","0","0","0","0","0","0","False","False","False","多亏绯桐在这里帮忙，为我减轻了不少负担。<hex:02100103>多玛的女性是不是都像她那么勤劳呀？","0","0"
"591454","0","1","2","0","0","763","0","0","1","1","1","0","0","0","0","0","0","False","False","False","只要坚持锻炼，就一定能获得自信。<hex:02100103>为了能让多玛人民取回对生活的自信，<hex:02100103>我也要尽自己的微薄之力。","0","0"
"591455","0","1","1","0","0","765","0","0","1","1","1","0","0","0","0","0","0","False","False","False","<hex:022903EB0203>，要不要来看看我们练习？","0","0"
"591456","0","1","1","0","0","756","0","0","1","1","1","0","0","0","0","0","0","False","False","False","同伴们都加入了丧灵钟开拓团，大多都去运送物资、修理街道了。<hex:02100103>我也要努力清点要用的工具了。","0","0"
"591457","0","1","2","0","0","763","0","0","1","1","1","0","0","0","0","0","0","False","False","False","最近孩子们都在积极磨练本领，<hex:02100103>我们大人也不能松懈，要给孩子们树立榜样……","0","0"
"591458","0","1","2","0","0","763","0","0","1","1","1","0","0","0","0","0","0","False","False","False","我负责帮忙管理物资。<hex:02100103>我要细心一点，可别数错了……","0","0"
"591459","0","1","2","0","0","763","0","0","1","1","1","0","0","0","0","0","0","False","False","False","即使赫利·博尔达不训练我们，<hex:02100103>我们多玛冒险者团也要自发活动。<hex:02100103>走！去丧灵钟巡逻喽！","0","0"
"591460","0","1","2","0","0","763","0","0","1","1","1","0","0","0","0","0","0","False","False","False","啊，<hex:020819E905FF0A>大姐姐<hex:FF0A>大哥哥<hex:03>也在休息？<hex:02100103>我还想和<hex:020819E905FF0A>大姐姐<hex:FF0A>大哥哥<hex:03>一起玩！<hex:02100103>上次在港口玩捉迷藏，别提多有趣了！","0","0"
"591461","0","1","2","0","0","763","0","0","1","1","1","0","0","0","0","0","0","False","False","False","阳山真是厉害，<hex:02100103>在多玛的时候也是最努力修行的……<hex:02100103>不过他再怎么厉害，也比不过生气时的小春。","0","0"
"591462","0","1","2","0","0","763","0","0","1","1","1","0","0","0","0","0","0","False","False","False","虽然我讨厌练习，但我喜欢赫利·博尔达……<hex:02100103>鲁加族的人都高大魁梧，好像大熊一样呢……","0","0"
"591463","0","1","1","0","0","765","0","0","1","1","1","0","0","0","0","0","0","False","False","False","周围人都听见你们刚才的对话了。<hex:02100103>然后伊达和桑克瑞德就飞速跑了出去……<hex:02100103>哎，接下来就全拜托你了。","0","0"
"591464","0","1","1","0","0","765","0","0","1","1","1","0","0","0","0","0","0","False","False","False","我想请你记住一件事，<hex:02100103>那就是这个世上有些大人，比孩子还要孩子气……","0","0"
"591465","0","1","1","0","0","765","0","0","1","1","1","0","0","0","0","0","0","False","False","False","我正喝着绯桐帮我泡的茶休息呢。<hex:02100103>她泡的茶非常好喝。","0","0"
"591466","0","1","2","0","0","764","0","0","1","1","1","0","0","0","0","0","0","False","False","False","绯桐跟我说，多玛那里也有香味浓郁的茶。<hex:02100103>真想尝尝啊……","0","0"
"591467","0","1","2","0","0","766","0","0","1","1","1","0","0","0","0","0","0","False","False","False","怎么突然变得那么安静？<hex:02100103>我还在这里拼命盘点呢，<hex:02100103>大家都去哪了？","0","0"
"591468","0","1","2","0","0","763","0","0","1","1","1","0","0","0","0","0","0","False","False","False","芙·拉敏教我唱了很多艾欧泽亚的歌。<hex:02100103>我每天都会学到很多新的知识。","0","0"
"591469","0","1","2","0","0","763","757","0","1","1","1","0","0","0","0","0","0","False","False","False","<hex:022903EB0203>，这回你又立功了！<hex:02100103>让我们去那边吧台喝一杯吧，我请客！<hex:02100103>这样就能在芙·拉敏和绯桐的身边……","啊，我、我什么都没说，哈哈哈！<hex:02100103>总、总之，为你的胜利干杯！","0"
"591470","0","1","1","0","0","765","0","0","1","1","1","0","0","0","0","0","0","False","False","False","……嗯？！<hex:02100103>我、我才不是睡着了！<hex:02100103>我只是在闭上眼睛想事罢了！","0","0"
"591471","0","1","0","0","0","933","0","0","1","1","1","0","0","0","0","0","0","False","False","False","任何时候都不能大意，<hex:02100103>正是因为现在工作告一段落了，<hex:02100103>所以才更要小心谨慎……<hex:02100103>伊达……你在听吗？！","0","0"
"591472","0","1","1","0","0","765","0","0","1","1","1","0","0","0","0","0","0","False","False","False","辛苦了，今天你就好好休息吧。<hex:02100103>不过你也不能太放松……<hex:02100103>跟旁边的某人似的。","0","0"
"591473","0","1","2","0","0","708","0","0","1","1","1","0","0","0","0","0","0","False","False","False","大家都回来了，这里又变得热闹了起来！<hex:02100103>让我回想起了以前沙之家热闹非凡的景象……","0","0"
"591474","0","1","2","0","0","764","0","0","1","1","1","0","0","0","0","0","0","False","False","False","绯桐特别会做饭。<hex:02100103>她切菜之快，简直让人叹为观止！<hex:02100103>看来，她也是个不一般的人。","0","0"
"591475","0","1","2","0","0","933","0","0","1","1","1","0","0","0","0","0","0","False","False","False","正因为我是在教孩子们本领，所以更不能掉以轻心！<hex:02100103>多玛人民今后也要受不少苦，<hex:02100103>所以我不光要锻炼他们的身体，还要让他们有一颗强大的内心！","0","0"
"591476","0","1","1","0","0","765","0","0","1","1","1","0","0","0","0","0","0","False","False","False","赫利·博尔达最近充满了干劲。<hex:02100103>他那么大个子，希望他别兴奋过头，伤到孩子们……","0","0"
"591477","0","1","1","0","0","765","0","0","1","1","1","0","0","0","0","0","0","False","False","False","冒险者虽看起来很自由，但其实很辛苦吧？<hex:02100103>不侍奉于任何君王，只凭自己一颗真心闯荡……<hex:02100103>看来你们和“浪客”还是有点不一样的。","0","0"
"591478","0","1","1","0","0","765","0","0","1","1","1","0","0","0","0","0","0","False","False","False","我们正在讨论，虽然我们的祖国毁灭了，<hex:02100103>但我们可以活用在这里学到的知识，<hex:02100103>为故乡做点什么。","0","0"
"591479","0","1","2","0","0","763","0","0","1","1","1","0","0","0","0","0","0","False","False","False","要想做出原汁原味的家乡菜，光凭这里的食材和调料是不行的。<hex:02100103>至于怎么弥补材料上的缺憾，就要看我的手艺了。","0","0"
"591480","0","1","2","0","0","933","0","0","1","1","1","0","0","0","0","0","0","False","False","False","赫利·博尔达的训练很严格，<hex:02100103>不过我在多玛的时候也一直在修行！<hex:02100103>这点程度是难不倒我的！","0","0"
"591481","0","1","2","0","0","764","0","0","1","1","1","0","0","0","0","0","0","False","False","False","我也想变得和<hex:020819E905FF0A>大姐姐<hex:FF0A>大哥哥<hex:03>一样强。<hex:02100103>这样的话，就算帝国打过来，我也能保护大家！","0","0"
"591482","0","1","2","0","0","763","0","0","1","1","1","0","0","0","0","0","0","False","False","False","老师的盔甲又白又闪亮，真是太帅了。<hex:02100103>不过剑的话，我更喜欢大一点的！","0","0"
"591483","0","1","2","0","0","757","0","0","1","1","1","0","0","0","0","0","0","False","False","False","我不喜欢打仗……<hex:02100103>赫利·博尔达讲的也好难懂……","0","0"
"591484","0","1","1","0","0","765","0","0","1","1","1","0","0","0","0","0","0","False","False","False","<hex:022903EB0203>，走好！<hex:02100103>我在这里等着你平安归来！","0","0"
"591485","0","1","1","0","0","765","0","0","1","1","1","0","0","0","0","0","0","False","False","False","你又要去执行重大任务了……<hex:02100103>这是你的使命，我不会阻止你的。<hex:02100103>不过，你可千万要小心啊。","0","0"
