"594523","0","1","2","0","0","764","0","0","1","1","1","0","0","0","0","0","0","False","False","False","多亏了贝蕾塔带来的阿拉基利人，<hex:02100103>这个村子终于重生了希望，鼓起干劲栽培椰枣了。<hex:02100103>而这一切都是艾拉特的功劳，说多少次谢谢都不够啊……","0","0"
"594524","0","1","2","0","0","764","0","0","1","1","1","0","0","0","0","0","0","False","False","False","冒险者阁下，鲍特阁下的事就拜托了。<hex:02100103>他现在就像是一根燃烧的导火线，<hex:02100103>稍不留神就会酿成悲剧啊。","0","0"
"594525","0","1","2","0","0","763","0","0","1","1","1","0","0","0","0","0","0","False","False","False","冒险者阁下！<hex:02100103>对鲍特阁下的审讯进行得非常顺利。<hex:02100103>照这个样子，他很快就会获释的。","0","0"
"594526","0","1","2","0","0","763","0","0","1","1","1","0","0","0","0","0","0","False","False","False","冒险者阁下，见到鲍特阁下了吗？<hex:02100103>他现在一边在酒馆帮忙干活，<hex:02100103>一边帮助寒炉村栽培椰枣呢。","说不定过不了多久，<hex:02100103>我们就能喝到由寒炉村的椰枣酿造的阿剌吉酒了。<hex:02100103>哎呀，好期待呀！","0"
"594527","0","1","2","0","0","764","0","0","1","1","1","0","0","0","0","0","0","False","False","False","如果能攻陷威罗迪纳基地，<hex:02100103>那么它将成为攻破阿拉米格的一块踏板。<hex:02100103>这场战斗的意义十分重大。","0","0"
"594528","0","1","1","0","0","755","0","0","1","1","1","0","0","0","0","0","0","False","False","False","我们部队获得飞燕大人的特赦，<hex:02100103>可以回到故乡了。<hex:02100103>今后，我们会誓死守护多玛……","不过，被帝国征兵的狼人族不光只有我们。<hex:02100103>而且，留在这里的人有一部分成为了强盗。<hex:02100103>真是的……都想要借助弟弟的力量了……","0"
"594529","0","1","1","0","0","755","0","0","1","1","1","0","0","0","0","0","0","False","False","False","如果我的腿脚没事的话……","0","0"
"594530","0","1","2","0","0","950","0","0","1","1","1","0","0","0","0","0","0","False","False","False","你是那个时候的……<hex:02100103>这样……原来是这么回事啊……谢谢你了，年轻人。","0","0"
"594531","0","1","2","0","0","764","0","0","1","1","1","0","0","0","0","0","0","False","False","False","简直难以置信！<hex:02100103>多玛……多玛再次是我们的多玛了！<hex:02100103>我做梦都没有想到能等到这一天！","0","0"
"594532","0","1","2","0","0","763","0","0","1","1","1","0","0","0","0","0","0","False","False","False","现正在举办新生庆典……<hex:02100103>主旨为悼念在第七灵灾中丧生的人们，<hex:02100103>并向灵灾中奋勇作战的英雄“光之战士们”表达感谢。","冒险者也来一起向逝去的生命们献上祈祷吧。<hex:02100103>愿我们今日的快乐与幸福，能够永远延续下去。","0"
"594533","0","1","2","0","0","768","0","0","1","1","1","0","0","0","0","0","0","False","False","False","你解决掉故障虫，将遭到囚禁的异国诗人救了出来。<hex:02100103>真的——真的非常感谢你！","这下我总算可以专心祈祷了。<hex:02100103>冒险者也一起来祝愿逝去的灵魂们得到安息吧。","0"
"594534","0","1","2","0","0","763","0","0","1","1","1","0","0","0","0","0","0","False","False","False","听说在乌尔达哈的红玉大路国际市场能买到一些<hex:02100103>新生庆典限定的烟花、家具、乐谱。<hex:02100103>就算你对这些不感兴趣，也还是推荐你去看一眼哟。","0","0"
"594535","0","1","2","0","0","4219","0","0","1","1","1","0","0","0","0","0","0","False","False","False","要想复兴街道，<hex:02100103>首先得保证好大家的伙食。<hex:02100103>一直都没什么像样的配给可不行！","0","0"
"594536","0","1","2","0","0","4219","0","0","1","1","1","0","0","0","0","0","0","False","False","False","为了强化支援体系，<hex:02100103>我被从罗薇娜商会派遣过来，负责管理与各方的交易。<hex:02100103>当然我也负责给冒险者的交易提供中介服务，你有什么打算呢？","0","0"
"594537","0","1","2","0","0","4219","0","0","1","1","1","0","0","0","0","0","0","False","False","False","0","0","0"
"594538","0","1","2","0","0","4218","0","0","1","1","1","0","0","0","0","0","0","False","False","False","要移动到剧场艇初见号道具间吗？","0","0"
"594539","0","1","2","0","0","725","0","0","1","1","1","0","0","0","0","0","0","False","False","False","没有许可，不得进入！","0","0"
"594540","0","1","2","0","0","725","0","0","1","1","1","0","0","0","0","0","0","False","False","False","这里是超越技术研究所。<hex:02100103>无许可，不得进入。","0","0"
"594541","0","1","2","0","0","763","0","0","1","1","1","0","0","0","0","0","0","False","False","False","盐村的复兴才刚刚开始……<hex:02100103>我们正在向未来阔步前进！","0","0"
"594542","0","1","2","0","0","763","0","0","1","1","1","0","0","0","0","0","0","False","False","False","我和阿拉米格解放军的同伴们<hex:02100103>巡逻盐湖周边，守卫村落的安全。<hex:02100103>正如先前得到的教诲！","0","0"
"594543","0","1","2","0","0","763","0","0","1","1","1","0","0","0","0","0","0","False","False","False","感谢平日里大力相助……","0","0"
"594544","0","1","2","0","0","763","0","0","1","1","1","0","0","0","0","0","0","False","False","False","修行还是不够……","0","0"
"594545","0","1","2","0","0","763","0","0","1","1","1","0","0","0","0","0","0","False","False","False","有你，才有了寻宝众……<hex:02100103>鄙人尚不成熟，无力领导他人……","0","0"
"594546","0","1","2","0","0","4219","0","0","1","1","1","0","0","0","0","0","0","False","False","False","寻宝众已经团结一致，正在努力经商、寻宝……<hex:02100103>为了获得更多助力，鄙人正在逐个动员碧玉水的每一个碧甲族……","0","0"
"594547","0","1","2","0","0","763","0","0","1","1","1","0","0","0","0","0","0","False","False","False","有人出海寻找漂流物，<hex:02100103>也有人通过商业手段，收集稀有物件。<hex:02100103>探宝的手段，各有分别。","0","0"
"594548","0","1","2","0","0","763","0","0","1","1","1","0","0","0","0","0","0","False","False","False","武盔这个家伙，和你比较之后，<hex:02100103>终于发现了自己的能力不足。<hex:02100103>这就是独行侠的局限性。","0","0"
"594549","0","1","2","0","0","763","0","0","1","1","1","0","0","0","0","0","0","False","False","False","哎……<hex:02100103>可能今后还是需要<hex:022903EB0203>的帮助啊。","0","0"
"594550","0","1","2","0","0","4219","0","0","1","1","1","0","0","0","0","0","0","False","False","False","街道也开始了复兴，大家都在热心的工作着。<hex:02100103>就是在休息时间缺少点可以放松的娱乐活动，<hex:02100103>有点娱乐活动的话，大家的疲劳也会恢复不少……","0","0"
"594551","0","1","2","0","0","4219","0","0","1","1","1","0","0","0","0","0","0","False","False","False","一个人不行，就两个人——<hex:02100103>两个人不行，就找更多的同伴——<hex:02100103>鄙人终于明白何为缘分的力量——","偶尔大家也会意见相左，<hex:02100103>这时候，就要效仿付丧，通过讨论来解决问题——","0"
"594552","0","1","2","0","0","4219","0","0","1","1","1","0","0","0","0","0","0","False","False","False","寻宝众正是付丧带来的馈赠——<hex:02100103>所以鄙人要好好保护这些缘分与宝物——！<hex:02100103>当然，还有和付丧的回忆——！","0","0"
"594553","0","1","2","0","0","763","0","0","1","1","1","0","0","0","0","0","0","False","False","False","在王宫的时候，真是谢谢你了。<hex:02100103>我当时作为市区代表，出席会议。","放心……<hex:02100103>芙朵拉那件事，我已经不打算继续追究了。<hex:02100103>并非我原谅了，我只是想做更有建设性的事。","0"
"594554","0","1","2","0","0","763","0","0","1","1","1","0","0","0","0","0","0","False","False","False","哦哦，怎么啦？！<hex:02100103>我听说你在阿拉米格那边操劳，<hex:02100103>已经不需要再担心了吗？","我终于体会到重建国家的辛苦了。<hex:02100103>至于施政，我甚至觉得在战争时期，<hex:02100103>更简单明快。","可是，选项变多也就是获得自由的证明……<hex:02100103>总有一天，现在的辛劳会变成酒后谈资！<hex:02100103>请转告莉瑟吧！"
"594555","0","1","2","0","0","763","0","0","1","1","1","0","0","0","0","0","0","False","False","False","很遗憾，总有盗贼试图抢夺用于重建的物资。<hex:02100103>在看到如野兽般袭击过来的人是同胞的时候，<hex:02100103>就更是难受……","0","0"
"594556","0","1","2","0","0","763","0","0","1","1","1","0","0","0","0","0","0","False","False","False","哎呀，<hex:022903EB0203>！<hex:02100103>这边如你所见，为了兴建新多玛，<hex:02100103>我们正在清理战场。","我还是希望大家用的是农具和工具，而不是武器。<hex:02100103>不过，还是需要人来保卫国家……<hex:02100103>要和飞燕大人商讨如何保持自由。","0"
"594557","0","1","2","0","0","763","0","0","1","1","1","0","0","0","0","0","0","False","False","False","道路的垃圾大概清理完毕了，不过这只是开始。<hex:02100103>要快些造一个工坊，哪怕破一点也行……<hex:02100103>如果总在草刈家寄宿地和这里之间往返，就太浪费时间了！","0","0"
"594558","0","1","2","0","0","763","0","0","1","1","1","0","0","0","0","0","0","False","False","False","无论要建造什么，都需要整理好土地，<hex:02100103>所以，大家一起来清理垃圾了。<hex:02100103>到这里的大道比以前干净很多了吧？","0","0"
"594559","0","1","2","0","0","763","0","0","1","1","1","0","0","0","0","0","0","False","False","False","我负责将船从这里摆渡到多玛飞地。<hex:02100103>你也要乘船吗？","0","0"
"594560","0","1","1","0","0","765","0","0","1","1","1","0","0","0","0","0","0","False","False","False","重建城镇太费力了……<hex:02100103>不过，苦中有乐……","0","0"
"594561","0","1","2","0","0","763","0","0","1","1","1","0","0","0","0","0","0","False","False","False","喂，阿拉米格那边情况怎样了？<hex:02100103>白狼的部队以外，那些被征走的人，<hex:02100103>能不能回来了呢？","0","0"
"594562","0","1","1","0","0","755","0","0","1","1","1","0","0","0","0","0","0","False","False","False","好嘞，剩下的就是大号的瓦砾了。<hex:02100103>这真是能累死人……但是！<hex:02100103>很快就会变得干净利落的！","0","0"
"594563","0","1","1","0","0","755","0","0","1","1","1","0","0","0","0","0","0","False","False","False","有没有发现，除了码头的监视塔，<hex:02100103>还有一些完整的建筑物？","那些多半都是帝国军利用的建筑。<hex:02100103>现在飞燕大人所在的地方……<hex:02100103>镇长的官邸曾经是帝国高官住的地方。","0"
"594564","0","1","2","0","0","763","0","0","1","1","1","0","0","0","0","0","0","False","False","False","需要优先建造的建筑，以及所需材料……<hex:02100103>还需要更多人手……<hex:02100103>为了他们，还需要更多食物……","啊，脑袋要炸了！<hex:02100103>哪里有经验丰富的建筑师啊？！","0"
"594565","0","1","2","0","0","763","0","0","1","1","1","0","0","0","0","0","0","False","False","False","孩子们无论在什么环境下都会找到玩耍的地方。<hex:02100103>真是坚强而又可靠。<hex:02100103>要尽快整备好他们的学习场所。","0","0"
"594566","0","1","2","0","0","764","0","0","1","1","1","0","0","0","0","0","0","False","False","False","如果没有你在，<hex:02100103>我怕是早就被蛮神精炼了。<hex:02100103>非常感谢……","0","0"
"594567","0","1","1","0","0","755","0","0","1","1","1","0","0","0","0","0","0","False","False","False","当时在王宫之外也有很多信徒潜伏着。<hex:02100103>我们虽然想办法解决了他们，但也延误了赶过来支援的时间。<hex:02100103>……抱歉。","0","0"
"594568","0","1","1","0","0","757","0","0","1","1","1","0","0","0","0","0","0","False","False","False","如果我早点发现战士们已经遭到了精炼的话……","0","0"
"594569","0","1","2","0","0","764","757","0","1","1","1","0","0","0","0","0","0","False","False","False","我完全不记得自己是怎么活下来的，<hex:02100103>当时我太拼命了……","0","0"
"594570","0","1","2","0","0","763","0","0","1","1","1","0","0","0","0","0","0","False","False","False","莉瑟向曾经的敌人求助，选择共同奋斗。<hex:02100103>那就是她特有的达成理想的方式。","0","0"
"594571","0","1","2","0","0","763","0","0","1","1","1","0","0","0","0","0","0","False","False","False","咕哎，咕哎！","0","0"
"594572","0","1","2","0","0","763","0","0","1","1","1","617","0","0","0","0","0","False","False","False","之前从欧米茄控制室回收的亚拉戈神典石，<hex:02100103>现在我们的员工们已经完成了解析。<hex:02100103>最新的解析结果可以从魔导终端进行确认。","为了让罗薇娜给我们引荐解析的专家，<hex:02100103>结果被狠狠地坑了一大笔钱……就算是特殊经费了。<hex:02100103>希望能多多少少为你们做点贡献……","0"
"594573","0","1","2","0","0","715","0","0","1","1","1","0","0","0","0","0","0","False","False","False","我一定会找出小贼一匹狼的线索！","0","0"
"594574","0","1","2","0","0","708","0","0","1","1","1","0","0","0","0","0","0","False","False","False","有好多从没见过的建筑，真是好有意思！","0","0"
"594575","0","1","2","0","0","1071","0","0","1","1","1","0","0","0","0","0","0","False","False","False","在下一定会抓住那家伙！","0","0"
"594576","0","1","2","0","0","764","0","0","1","1","1","0","0","0","0","0","0","False","False","False","有了解放军的帮助，<hex:02100103>我们就可以放心工作和生活了。","0","0"
"594577","0","1","1","0","0","764","0","0","1","1","1","0","0","0","0","0","0","False","False","False","前方就是王宫的后门。<hex:02100103>不过只有经过许可的人才能进入……","0","0"
"594578","0","1","2","0","0","764","0","0","1","1","1","0","0","0","0","0","0","False","False","False","为纪念代表大会的召开，<hex:02100103>空中庭园已向市民开放。<hex:02100103>如果你愿意，我可以做向导哦？","0","0"
"594579","0","1","2","0","0","764","0","0","1","1","1","0","0","0","0","0","0","False","False","False","我听说你在协助调查空无大地啊。<hex:02100103>就算是在拯救世界之后还能奋不顾身投身到危险的调查任务中……<hex:02100103>像你这样的人才配称得上是英雄吧。","你要是遇到什么不便之处就尽管吩咐我或卢利。<hex:02100103>如果能帮上暗之战士大人的话，<hex:02100103>我们安居会将不惜余力进行支援！","0"
"594580","0","1","1","0","0","0","765","0","1","1","1","0","0","0","0","0","0","False","False","False","呀，你是来看我的吗？<hex:02100103>伤口已经愈合，可以放心了。","可是阿尔菲诺还是要我认真静养。<hex:02100103>干嘛偏等到这个时候才装作一副兄长的样子。<hex:02100103>不过，他为我担心……让我觉得很高兴。","0"
"594581","0","1","2","0","0","764","0","0","1","1","1","0","0","0","0","0","0","False","False","False","暂时还是需要我在阿拉米格和拂晓之间做联络人。<hex:02100103>我也会帮助处理和蛮神有关的麻烦事的。","0","0"
"594582","0","1","2","0","0","4219","0","0","1","1","1","0","0","0","0","0","0","False","False","False","自由来之不易，<hex:02100103>不可轻易放手……<hex:02100103>我要从暗处守卫故乡。","0","0"
"594583","0","1","2","0","0","4219","0","0","1","1","1","0","0","0","0","0","0","False","False","False","既然是付丧神大人亲自指名的，那就更得加油了——<hex:02100103><hex:022903EB0203><hex:020813E905FF07>大姐<hex:FF07>大哥<hex:03>，<hex:02100103>为了收集更多宝物，请多多协助——！","0","0"
"594584","0","1","2","0","0","933","0","0","1","1","1","0","0","0","0","0","0","False","False","False","自从开始和鲶鱼精们交易后，<hex:02100103>我们又去了更多地方找了更多商品回来——<hex:02100103>在那些地方又结下了新的缘分，鲶鱼精万岁——！","0","0"
"594585","0","1","2","0","0","4219","0","0","1","1","1","0","0","0","0","0","0","False","False","False","哎——，从和凯苏提尔部的交易过程中学到了很多——<hex:02100103>他们一言不发，只能费脑筋试着理解对方的感情，<hex:02100103>一点一点找出正确的交流方式——","0","0"
"594586","0","1","2","0","0","768","0","0","1","1","1","0","0","0","0","0","0","False","False","False","小锻冶屋经常照顾我们，<hex:02100103>既然要和红甲族战斗，那交易量也会暴涨的——！","我不擅长战斗，<hex:02100103>不过会尽力和小锻冶屋商量，让他们给我们更多武器的——<hex:02100103><hex:020813E905FF07>大姐<hex:FF07>大哥<hex:03>也来帮忙吧——！","0"
"594587","0","1","2","0","0","4219","0","0","1","1","1","0","0","0","0","0","0","False","False","False","蛭卷那家伙被打倒了，真是大快人心——<hex:02100103>不过他们群龙无首，会变得更麻烦——<hex:02100103><hex:020813E905FF07>大姐<hex:FF07>大哥<hex:03>，今后也请继续关照啊——！","0","0"
"594588","0","1","2","0","0","4219","946","0","1","1","1","0","0","0","0","0","0","False","False","False","<hex:022903EB0203><hex:020813E905FF07>大姐<hex:FF07>大哥<hex:03>，作为寻宝众的成员，<hex:02100103>我想谢谢你帮助我们这么多——<hex:02100103>如果没有你，我们也无法收集这么多宝物——","付丧神大人的事，我也忘记了，<hex:02100103>不过我听说他为我们和<hex:020813E905FF07>大姐<hex:FF07>大哥<hex:03>结下了缘分——<hex:02100103>今后也请继续帮助我们——！","0"
"594589","0","1","2","0","0","763","0","0","1","1","1","0","0","0","0","0","0","False","False","False","<hex:022903EB0203>阁下，武盔就交给你了——<hex:02100103>我和斑鳐都会为你加油的——！","0","0"
"594590","0","1","2","0","0","4219","933","0","1","1","1","0","0","0","0","0","0","False","False","False","<hex:022903EB0203>阁下，听我说——！<hex:02100103>刚才，武盔来帮忙照看斑鳐了——！<hex:02100103>以前从没有过这种事——","难道这也是我们完全不记得的<hex:02100103>付丧神大人的功劳吗——？<hex:02100103>不管怎样，真是太好了——","0"
"594591","0","1","2","0","0","4219","0","0","1","1","1","0","0","0","0","0","0","False","False","False","我们在这里卖一些我们得到的，<hex:02100103>但并不需要的东西——<hex:02100103>来，想要就买吧——","0","0"
"594592","0","1","2","0","0","4219","0","0","1","1","1","0","0","0","0","0","0","False","False","False","我在商品上附加了商品斑鳐哦——<hex:02100103>枕头和蛸壶说，对那些慷慨相助的人，<hex:02100103>可以附赠这个——","0","0"
"594593","0","1","2","0","0","763","0","0","1","1","1","0","0","0","0","0","0","False","False","False","这次女儿节也会举办小黄莺的公演。<hex:02100103>此次将是观众随意参加型的露天公演，<hex:02100103>请一定要去乌尔达哈看看！","0","0"
"594594","0","1","2","0","0","4218","0","0","1","1","1","0","0","0","0","0","0","False","False","False","我们想用水晶公带来的<hex:02100103>魔晶石的知识造福大众。<hex:02100103>因此只要是掌握了“精制魔晶石”的人，我们都会予以帮助。","0","0"
"594595","0","1","2","0","0","4218","0","0","1","1","1","0","0","0","0","0","0","False","False","False","我们想用水晶公带来的<hex:02100103>魔晶石的知识造福大众。<hex:02100103>因此，也让我们来帮助你吧。","0","0"
"594596","0","1","2","0","0","764","0","0","1","1","1","0","0","0","0","0","0","False","False","False","哎呀，你要交换魔晶石吗？<hex:02100103>欢迎欢迎！","0","0"
"594597","0","1","2","0","0","764","0","0","1","1","1","0","0","0","0","0","0","False","False","False","现在正在举办孩子们的节日“星芒节”。<hex:02100103>可以的话，为了孩子们也请冒险者你多多帮忙。","0","0"
"594598","0","1","2","0","0","764","0","0","1","1","1","0","0","0","0","0","0","False","False","False","贝恩费尔德先生应该已经告诉你情况了。<hex:02100103>请你和熊一起，<hex:02100103>激励低落的孩子们，让他们露出笑容吧！","0","0"
"594599","0","1","2","0","0","764","0","0","1","1","1","0","0","0","0","0","0","False","False","False","贝恩费尔德已经告诉我情况了。<hex:02100103>谢谢你帮助夺回星芒节的装饰品。","多亏了冒险者的帮助，孩子们的欢笑声又回来了。<hex:02100103>我想，成为星芒节起源的伊修加德卫兵，<hex:02100103>一定是像你这样的人吧。","0"
"594600","0","1","2","0","0","764","0","0","1","1","1","0","0","0","0","0","0","False","False","False","旅行者<hex:020819E905FF0A>大姐姐<hex:FF0A>大哥哥<hex:03>，欢迎来到这里。<hex:02100103>这里是迦利克村！","0","0"
"594601","0","1","2","0","0","763","0","0","1","1","1","0","0","0","0","0","0","False","False","False","恭贺新季节的到来。<hex:02100103>在下名为亥奉行。","在下带着来自东方的深切祝福，<hex:02100103>将与艾欧泽亚的各位共同庆祝降神节，<hex:02100103>我们正在计划发放降神糕，请各位务必赏光参加。","0"
"594602","0","1","2","0","0","763","0","0","1","1","1","0","0","0","0","0","0","False","False","False","哦，是冒险者阁下，<hex:02100103>猫奉行的事情真是麻烦你了。<hex:02100103>请让在下再次表示感谢。","多亏了你，才没有耽搁降神节的举行。<hex:02100103>只是还不死心的猫奉行依然令人担心……<hex:02100103>只能劳烦下一任降神节的负责人了。","0"
"594603","0","1","2","0","0","975","0","0","1","1","1","0","0","0","0","0","0","False","False","False","哼？哼哼？","0","0"
"594604","0","1","2","0","0","984","0","0","1","1","1","0","0","0","0","0","0","False","False","False","哼！哼哼！","0","0"
"594605","0","1","1","0","0","933","0","0","1","1","1","0","0","0","0","0","0","False","False","False","我是伟大帅气的维斯卡德先生的佣人。<hex:02100103>我这里有些很不错的货品……<hex:02100103>但是我只接待熟客。","0","0"
"594606","0","1","1","0","0","738","0","0","1","1","1","0","0","0","0","0","0","False","False","False","……莫非你是很厉害的冒险者？<hex:02100103>那我可以卖给你好厉害的东西哦。","0","0"
"594607","0","1","1","0","0","933","0","0","1","1","1","0","0","0","0","0","0","False","False","False","我是美之传教士的助手……<hex:02100103>我只向追求美的人售卖商品。","0","0"
"594608","0","1","1","0","0","738","0","0","1","1","1","0","0","0","0","0","0","False","False","False","哦哦，看来你也是追求美的人。<hex:02100103>那就请你看看我的商品吧……","0","0"
"594609","0","1","2","0","0","764","756","0","1","1","1","0","0","0","0","0","0","False","False","False","为防止伽黎亚派再次召唤蛮神，<hex:02100103>我们打算加强监视。","同时，为了防止同伴们被变成信徒，<hex:02100103>需要更加谨慎地行动。<hex:02100103>就像帕帕力莫所说的那样。","0"
"594610","0","1","2","0","0","764","0","0","1","1","1","0","0","0","0","0","0","False","False","False","娜娜莫陛下所指挥的支援阿拉米格难民回国计划<hex:02100103>进展十分顺利。","有了废王的黄金，资金也很充足。<hex:02100103>盐村那边也准备好接受难民了。<hex:02100103>阿拉米格的复兴终于要开始了。","0"
"594611","0","1","2","0","0","1071","0","0","1","1","1","0","0","0","0","0","0","False","False","False","和美神的战斗中，我深刻体会到了自己的实力不足。<hex:02100103>我打算让莫尔巴和玛哈帮我锻炼，<hex:02100103>好让我能在<hex:022903EB0203>不在场的情况下对抗蛮神。","0","0"
"594612","0","1","2","0","0","764","0","0","1","1","1","0","0","0","0","0","0","False","False","False","目前，伽黎亚派并没有什么大动作。<hex:02100103>要在完善监视体系的同时，<hex:02100103>稳步推进战后处理工作才是。","0","0"
"594613","0","1","1","0","0","765","0","0","1","1","1","0","0","0","0","0","0","False","False","False","莉瑟背负了太多责任，<hex:02100103>劳班局长的回归正如雪中送炭。<hex:02100103>对阿拉米格也是好事。","0","0"
"594614","0","1","0","0","0","0","0","0","1","1","1","0","0","0","0","0","0","False","False","False","嘶——……多谢在代表大会时出手相助。<hex:02100103>能消灭那个假美神两次，<hex:02100103>……我们感激不尽。","伽黎亚派竟然再次召唤蛮神，<hex:02100103>让基拉巴尼亚的大地陷入恐慌……<hex:02100103>作为同族，必须谢罪才是。","0"
"594615","0","1","2","0","0","764","0","0","1","1","1","0","0","0","0","0","0","False","False","False","由衷欢迎救命恩人来访。<hex:02100103>话说回来，我到现在都不知道应该如何面对，<hex:02100103>居然被骷髅处刑人救了一命的事实。","0","0"
