"590492","0","1","2","0","0","764","0","0","1","1","1","0","0","0","0","0","0","False","False","False","前方是通往王宫的御道。<hex:02100103>闲杂人等不得入内。","0","0"
"590493","0","1","2","0","0","764","0","0","1","1","1","0","0","0","0","0","0","False","False","False","格里达尼亚十分重视和谐与合作。<hex:02100103>相信这点可以将这个国家，<hex:02100103>乃至整个艾欧泽亚引向和平之路。","就如同森林和人联起手来的这个城邦一般，<hex:02100103>为了能让艾欧泽亚诸国同心协力……<hex:02100103>冒险者阁下。今后也请多多帮忙。","0"
"590494","0","1","2","0","0","764","0","0","1","1","1","0","0","0","0","0","0","False","False","False","我名叫卢因。<hex:02100103>担任以歼灭森林的敌人为使命的神勇队的队长。","想要侵占森林的人，<hex:02100103>不仅限于鸟人族和加雷马帝国军。<hex:02100103>随时欢迎你这样的冒险者来帮忙。","0"
"590495","0","1","1","0","0","0","0","0","1","1","1","0","0","0","0","0","0","False","False","False","使用利姆萨·罗敏萨港口的船舶，<hex:02100103>有义务接受货物检查，并支付关税。<hex:02100103>首先，请去梅尔凡海关办理手续。","0","0"
"590496","0","1","2","0","0","764","0","0","1","1","1","0","0","0","0","0","0","False","False","False","现在正在进行用秘术检查货物的训练。<hex:02100103>抱歉，因为需要集中注意力，所以请不要跟我说话。","0","0"
"590497","0","1","1","0","0","0","0","0","1","1","1","0","0","0","0","0","0","False","False","False","我们红血圣女团是由罗丝温大人率领的海盗团。<hex:02100103>我们是利姆萨·罗敏萨三大海盗团之一。<hex:02100103>要是想加入的话，你还需多磨练自己的本领。","0","0"
"590498","0","1","1","0","0","765","0","0","1","1","1","0","0","0","0","0","0","False","False","False","这家酒馆中，聚集了来自各地的冒险者。<hex:02100103>收集情报自不必说，为了能找到旅途的同伴，<hex:02100103>还是积极与他人交流为好。","0","0"
"590499","0","1","2","0","0","763","0","0","1","1","1","0","0","0","0","0","0","False","False","False","捕鱼人行会拥有艾欧泽亚最大型的鱼塘。<hex:02100103>总是能捕到大量鲜鱼。","完全没有成果的时候，就在那里悄悄地……<hex:02100103>不，什么事也没有。","0"
"590500","0","1","1","0","0","756","0","0","1","1","1","0","0","0","0","0","0","False","False","False","哎呀，你也想加入头儿的海盗团吗？<hex:02100103>那就排在队尾吧。<hex:02100103>要是能让头儿看上，就能加入海盗团了。","头儿的船，是被利姆萨·罗敏萨的守护神……<hex:02100103>航海的女神利姆莱茵所眷顾的最强之船。","0"
"590501","0","1","2","0","0","1018","0","0","1","1","1","0","0","0","0","0","0","False","False","False","虽然不知道儿子现在在哪里干些什么，<hex:02100103>但为了能让他回到家就吃上饭，<hex:02100103>我总是多买一些鱼。","0","0"
"590502","0","1","1","0","0","764","756","0","1","1","1","0","0","0","0","0","0","False","False","False","我们断罪党是利姆萨·罗敏萨三大海盗团之一，<hex:02100103>而且也以势力最大为荣。","我们航行到远方的东方海域，<hex:02100103>袭击属于帝国的船只。<hex:02100103>给我记住了，能够做出这样的举动，也是我们实力的体现。","0"
"590503","0","1","0","0","0","757","0","0","1","1","1","0","0","0","0","0","0","False","False","False","在灵灾之后，梅尔维布提督的政策起了功效，<hex:02100103>违法的海盗大幅减少……<hex:02100103>即使这样，也有顽强生存下来的家伙。真让人头疼。","0","0"
"590504","0","1","2","0","0","764","0","0","1","1","1","0","0","0","0","0","0","False","False","False","砂盐滩上巨大的盐柱，<hex:02100103>是藉由灵灾时降下的火焰，在一夜之间形成的。<hex:02100103>对周围会产生何种影响，现在仍然在调查。","0","0"
"590505","0","1","2","0","0","764","0","0","1","1","1","0","0","0","0","0","0","False","False","False","陆行鸟是一种十分纤细的生物。<hex:02100103>要比其他家畜更加谨慎地对待才行，<hex:02100103>不然它们立刻就会变得无精打采了……","0","0"
"590506","0","1","2","0","0","763","0","0","1","1","1","0","0","0","0","0","0","False","False","False","这是农场刚建成时的事情了。<hex:02100103>孵化出了一只红色的鸡。<hex:02100103>便有人打赌看，它是否能比普通的鸡更强壮。","不料，却因结果而大打出手，<hex:02100103>不论是鸡还是人，都被血染成了红色。<hex:02100103>这就是农场名赤血雄鸡的由来。","0"
"590507","0","1","2","0","0","764","0","0","1","1","1","0","0","0","0","0","0","False","False","False","虽说生活在海上的人略显粗野，<hex:02100103>但即使以这个标准，利姆萨·罗敏萨的家伙也显得特别。<hex:02100103>真不愧是海盗的城邦。","0","0"
"590508","0","1","2","0","0","764","0","0","1","1","1","0","0","0","0","0","0","False","False","False","这里是麦酒交易的集中地小麦酒港。<hex:02100103>麦酒是长期航行时的必备品，船员们都把它当水喝。<hex:02100103>因为水会腐坏，但酒却可以长期保存！","这个港口的酒品税很低，<hex:02100103>商船们都竞相购买。","0"
"590509","0","1","2","0","0","764","0","0","1","1","1","0","0","0","0","0","0","False","False","False","你也来一杯如何，哈哈哈！<hex:02100103>这里能喝到很便宜的酒，真是太棒了！<hex:02100103>我当佣兵时攒下的钱，全都换成酒喝了。","0","0"
"590510","0","1","2","0","0","764","0","0","1","1","1","0","0","0","0","0","0","False","False","False","吉吉卢恩的店，要去要去？<hex:02100103>闪闪金币，要40金币！","0","0"
"590511","0","1","2","0","0","764","0","0","1","1","1","0","0","0","0","0","0","False","False","False","闪闪金币，没有没有？<hex:02100103>闪闪金币，给我给我，40金币！","0","0"
"590512","0","1","2","0","0","764","0","0","1","1","1","0","0","0","0","0","0","False","False","False","梅梅卢恩的店，要去要去？<hex:02100103>闪闪金币，要40金币！","0","0"
"590513","0","1","2","0","0","764","0","0","1","1","1","0","0","0","0","0","0","False","False","False","闪闪金币，没有没有？<hex:02100103>闪闪金币，给我给我，40金币！","0","0"
"590514","0","1","2","0","0","764","0","0","1","1","1","0","0","0","0","0","0","False","False","False","要乘船前往小麦酒港吗？","0","0"
"590515","0","1","2","0","0","764","0","0","1","1","1","0","0","0","0","0","7","False","False","False","这艘船是驶向小麦酒港的……<hex:02100103>看来你是刚到利姆萨·罗敏萨的冒险者啊。","那么，我劝你先在利姆萨·罗敏萨市内转一转，<hex:02100103>熟悉城市的地理和冒险者的工作。<hex:02100103>之后再出城也不晚。","等级达到15级后才可以使用。"
"590516","0","1","2","0","0","764","0","0","1","1","1","0","0","0","0","0","0","False","False","False","要乘船前往利姆萨·罗敏萨吗？","0","0"
"590517","0","1","2","0","0","764","0","0","1","1","1","0","0","0","0","7","0","False","False","False","这艘船是驶向利姆萨·罗敏萨的……<hex:02100103>但现在因维修而暂停运营了。不好意思。","等级达到15级后才可以使用。","0"
"590518","0","1","2","0","0","764","0","0","1","1","1","0","0","0","0","0","0","False","False","False","要乘船前往太阳海岸吗？","0","0"
"590519","0","1","2","0","0","764","0","0","1","1","1","0","0","0","0","0","7","False","False","False","这艘船是驶向太阳海岸的……<hex:02100103>看来你是刚到利姆萨·罗敏萨的冒险者啊。","那么，我劝你先在利姆萨·罗敏萨市内转一转，<hex:02100103>熟悉城市的地理和冒险者的工作。<hex:02100103>之后再出城也不晚。","等级达到30级后才可以使用。"
"590520","0","1","2","0","0","764","0","0","1","1","1","0","0","0","0","0","0","False","False","False","要乘船前往利姆萨·罗敏萨吗？","0","0"
"590521","0","1","2","0","0","764","0","0","1","1","1","0","0","0","0","7","0","False","False","False","这艘船是驶向利姆萨·罗敏萨的……<hex:02100103>但现在因维修而暂停运营了。不好意思。","等级达到30级后才可以使用。","0"
"590522","0","1","2","0","0","764","0","0","1","1","1","0","0","0","0","0","0","False","False","False","要乘船前往小麦酒港吗？","0","0"
"590523","0","1","2","0","0","764","0","0","1","1","1","0","0","0","0","0","0","False","False","False","要乘船前往守炬埠头吗？","0","0"
"590524","0","1","2","0","0","764","0","0","1","1","1","0","0","0","0","0","0","False","False","False","这里是白狼门。<hex:02100103>要通过大门，去往中央林区吗？","0","0"
"590525","0","1","2","0","0","764","0","0","1","1","1","0","0","0","0","0","0","False","False","False","这里是白狼门。<hex:02100103>门外危险的魔物众多，<hex:02100103>不能让像你这样的新手冒险者通过。","0","0"
"590526","0","1","2","0","0","764","0","0","1","1","1","0","0","0","0","0","0","False","False","False","这道门正处于封闭中。<hex:02100103>要去往森林之都格里达尼亚的话，<hex:02100103>从东南方的地母神忘迹下去，由青貉门进入即可。","0","0"
"590527","0","1","2","0","0","764","0","0","1","1","1","0","0","0","0","0","0","False","False","False","要乘船前往接雨草树林吗？","0","0"
"590528","0","1","2","0","0","764","0","0","1","1","1","0","0","0","0","0","0","False","False","False","要乘船前往隐秘瀑布吗？","0","0"
"590529","0","1","2","0","0","764","0","0","1","1","1","0","0","0","0","0","0","False","False","False","这里是白狼门。<hex:02100103>要通过大门，去往森林之都格里达尼亚吗？","0","0"
"590530","0","1","2","0","0","764","0","0","1","1","1","0","0","0","0","0","0","False","False","False","真是十分抱歉，<hex:02100103>因为您没有飞空艇登艇证，<hex:02100103>所以无法搭乘环线航空。","0","0"
"590531","0","1","2","0","0","764","0","0","1","1","1","0","0","0","0","0","0","False","False","False","真是十分抱歉，<hex:02100103>因为您没有飞空艇登艇证，<hex:02100103>所以无法搭乘环线航空。","0","0"
"590532","0","1","2","0","0","763","0","0","1","1","1","0","0","0","0","0","0","False","False","False","我正积极与兽人商人做着生意。<hex:02100103>虽然在故乡乌尔达哈，兽人是受到厌恶的，<hex:02100103>但在这里，可以自由地做买卖。","辉鳞人是出身于西方新大陆的强壮民族。<hex:02100103>他们的商品就是自己，也就是说当佣兵。","哥布林族背上的巨大包袱中，<hex:02100103>大多是些破烂货，但偶尔也会有些值钱的东西。<hex:02100103>要是想要宝石或矿石的话，就去拜托卢恩族吧。"
"590533","0","1","1","2","0","0","764","0","1","1","1","0","0","0","0","0","0","False","False","False","这里是守炬埠头。<hex:02100103>如你所见，是专门面向小型船只的埠头。","这里原本是奥修昂火炬的灯塔守卫使用的港口，<hex:02100103>但在灵灾之后，有一段时间，<hex:02100103>莫拉比造船厂的港口无法使用。","就在那时，<hex:02100103>这里才活用为重建物资的卸货地点及人才的登陆地点，<hex:02100103>并由此逐渐扩大。"
"590534","0","1","2","0","0","763","0","0","1","1","1","0","0","0","0","0","0","False","False","False","你听说过我们布鲁盖尔商会吗？<hex:02100103>经营武器、食品、衣服、杂物等种类繁多的商品，<hex:02100103>是利姆萨·罗敏萨数一数二的大型商会。","此次，我被提拔为<hex:02100103>班戈·赞戈副会长的助手。<hex:02100103>以谈下数个大单的商人为目标，不断努力！","0"
"590535","0","1","2","0","0","764","0","0","1","1","1","0","0","0","0","0","0","False","False","False","请容我带您前往芙蓉圆桌。<hex:02100103>请切记不要失礼……","0","0"
"590536","0","1","2","0","0","764","0","0","1","1","1","0","0","0","0","0","0","False","False","False","幻术皇嘉恩·艾·神纳大人有要事缠身。<hex:02100103>现在无法去往芙蓉圆桌。","0","0"
"590537","0","1","2","0","0","764","0","0","1","1","1","0","0","0","0","0","0","False","False","False","0","0","0"
"590538","0","1","2","0","0","764","0","0","1","1","1","0","0","0","0","0","0","False","False","False","啊，<hex:022903EB0203>！<hex:02100103>辛苦了。接待处没有异常情况。","0","0"
"590539","0","1","2","0","0","764","0","0","1","1","1","0","0","0","0","0","0","False","False","False","实在抱歉，<hex:02100103>这里是不允许普通人进入的。<hex:02100103>请快点回去吧。","0","0"
"590540","0","1","2","0","0","764","0","0","1","1","1","0","0","0","0","0","0","False","False","False","一上来就是任务实在不好意思。<hex:02100103>但还是想让你了解到蛮神问题的急迫性。","第七灵灾之后，世界正向着复兴前进……<hex:02100103>但事实果真如此吗？","请你去寻找真相，<hex:02100103>对现在的艾欧泽亚有一个真正的了解。<hex:02100103>我期待你的出色表现。"
"590541","0","1","2","0","0","764","0","0","1","1","1","0","0","0","0","0","0","False","False","False","虽然塔塔露的喋喋不休有些难办，<hex:02100103>但这说不定是个好机会。","要是从属于大国防联军的话，<hex:02100103>与拂晓血盟的关联就会很难看清了……<hex:02100103>意思就是可以随心所欲大展身手了！","0"
"590542","0","1","2","0","0","764","0","0","1","1","1","0","0","0","0","0","0","False","False","False","你的事在各地都成为人们热议的话题了！<hex:02100103>当然，在这沙之家也是！","啊，原本的沙之家是另外一个更像样的建筑来着，<hex:02100103>但发生了许多事，现在就……<hex:02100103>也罢，总之是我们的据点！","0"
"590543","0","1","2","0","0","764","0","0","1","1","1","0","0","0","0","0","0","False","False","False","你的事在各地都成为人们热议的话题了！<hex:02100103>当然，在这沙之家也是！","啊，原本的沙之家是另外一个更像样的建筑来着，<hex:02100103>但发生了许多事，现在就……<hex:02100103>也罢，总之是我们的据点！","0"
"590544","0","1","2","0","0","764","0","0","1","1","1","0","0","0","0","0","0","False","False","False","演讲觉得如何？<hex:02100103>我不太擅长应付那种场面……","0","0"
"590545","0","1","2","0","0","763","0","0","1","1","1","0","0","0","0","0","0","False","False","False","你拥有的力量，比其他超能力者要强上许多。<hex:02100103>我们对你的期待也更高了。","0","0"
"590546","0","1","1","0","0","0","0","0","1","1","1","0","0","0","0","0","0","False","False","False","你拥有的力量，比其他超能力者要强上许多。<hex:02100103>我们对你的期待也更高了。","0","0"
"590547","0","1","2","0","0","764","0","0","1","1","1","0","0","0","0","0","0","False","False","False","加尔提诺烈士追悼大会……<hex:02100103>时隔五年，终于要召开了。","那时，三国的大国防联军联起手来，<hex:02100103>组成艾欧泽亚同盟军，与帝国的军队交战。<hex:02100103>追悼会上盟主们的演讲，就是为此。","但是，那场战役的记忆却在脑海中褪色。<hex:02100103>杀戮者是谁，拯救者又是谁……<hex:02100103>所有人都不得而知。"
"590548","0","1","2","0","0","764","0","0","1","1","1","0","0","0","0","0","0","False","False","False","召唤蛮神，会使作为生命之源的以太枯竭。<hex:02100103>大地龟裂、水源干涸、大气沉淀。","对于艾欧泽亚诸国来说，<hex:02100103>蛮族们拥有蛮神这一强大的战斗力本身就是一个问题。","而且，蛮神还拥有自己的意志……<hex:02100103>也就是说，这是一股蛮族自己也无法控制的力量。"
"590549","0","1","2","0","0","764","0","0","1","1","1","0","0","0","0","0","0","False","False","False","召唤蛮神，会使作为生命之源的以太枯竭。<hex:02100103>大地龟裂、水源干涸、大气沉淀。","对于艾欧泽亚诸国来说，<hex:02100103>蛮族们拥有蛮神这一强大的战斗力本身就是一个问题。","而且，蛮神还拥有自己的意志……<hex:02100103>也就是说，这是一股蛮族自己也无法控制的力量。"
"590550","0","1","1","0","0","757","0","0","1","1","1","0","0","0","0","0","0","False","False","False","看着你这个榜样，我也得加把劲了。<hex:02100103>可不能再像上次那么丢人了。","0","0"
"590551","0","1","2","0","0","764","0","0","1","1","1","0","0","0","0","0","0","False","False","False","我们拂晓血盟原本是两个组织。<hex:02100103>其中一个，<hex:02100103>是由出身于萨雷安的我们组成的救世诗盟……","另外一个，<hex:02100103>则是由像你这样拥有不可思议力量的<hex:02100103>超能力者们组成的十二迹调查会。","这两个组织以5年前的第七灵灾为契机联起手来，<hex:02100103>整合而成为拂晓血盟。"
"590552","0","1","2","0","0","764","0","0","1","1","1","0","0","0","0","0","0","False","False","False","我们拂晓血盟原本是两个组织。<hex:02100103>其中一个，<hex:02100103>是由出身于萨雷安的我们组成的救世诗盟……","另外一个，<hex:02100103>则是由像你这样拥有不可思议力量的<hex:02100103>超能力者们组成的十二迹调查会。","这两个组织以5年前的第七灵灾为契机联起手来，<hex:02100103>整合而成为拂晓血盟。"
"590553","0","1","2","0","0","764","0","0","1","1","1","0","0","0","0","0","0","False","False","False","你的活跃事迹我都听说了。<hex:02100103>虽说我本来就不会搭理拖后腿的人……<hex:02100103>可还是要对你说，你的表现尚在预想之上。","话又说起来桑克瑞德居然在关键的时候不见人影。<hex:02100103>要是再晚一步登场的话，可就要酿成大祸了……","0"
"590554","0","1","2","0","0","764","0","0","1","1","1","0","0","0","0","0","0","False","False","False","“七月将散，七阳当升。<hex:02100103>苍天之理纷乱，伏地之骸蠢动……”","这是古代的预言书……«神历记»中所记载的句子。<hex:02100103>我们将这理解为，对第七灵灾之后……<hex:02100103>也就是当今这个时代的预言……","如预言所说，天地异变……拂晓之光辉，依然被黑暗所笼罩……<hex:02100103>因此……我们在守望。<hex:02100103>守望终会将黑暗照亮的新时代的种子……"
"590555","0","1","1","0","0","0","0","0","1","1","1","0","0","0","0","0","0","False","False","False","“七月将散，七阳当升。<hex:02100103>苍天之理纷乱，伏地之骸蠢动……”","这是古代的预言书……«神历记»中所记载的句子。<hex:02100103>我们将这理解为，对第七灵灾之后……<hex:02100103>也就是当今这个时代的预言……","如预言所说，天地异变……拂晓之光辉，依然被黑暗所笼罩……<hex:02100103>因此……我们在守望。<hex:02100103>守望终会将黑暗照亮的新时代的种子……"
"590556","0","1","1","1","1","0","0","0","1","1","1","0","0","0","0","0","0","False","False","False","5年前的那一天，给这片大地带来毁灭的，<hex:02100103>不仅仅是帝国军……","巨大的喷火黑龙……<hex:02100103>有些人将它称为传说中的神龙，<hex:02100103>有些人将它暗喻为隐藏的记忆……","就连我们也无法掌握事件的全部……<hex:02100103>为探求坠落之月的真相，<hex:02100103>我们仍在持续调查。"
"590557","0","1","2","0","0","764","0","0","1","1","1","0","0","0","0","0","0","False","False","False","我是“拂晓血盟”的前身组织之一……<hex:02100103>“十二迹调查会”的会长。","那个组织是为了你这种拥有奇妙力量的人而成立的。<hex:02100103>我们一边研究奇妙力量的谜题，<hex:02100103>一边摸索能否将其用于世界和平。","以灵灾为契机，组织改变了。<hex:02100103>但是如果没有过去，就没有现在的我。<hex:02100103>……我也很珍惜新的伙伴。"
"590558","0","1","2","0","0","764","0","0","1","1","1","0","0","0","0","0","0","False","False","False","你是冒险者，也是“拂晓血盟”的成员，<hex:02100103>这次又加入了大国防联军……<hex:02100103>你的身份还真复杂。","不过好像挺好玩的。<hex:02100103>我偶尔也想和帕帕力莫以外的人组队试试……<hex:02100103>话说我为什么选了帕帕力莫啊？","0"
"590559","0","1","2","0","0","764","0","0","1","1","1","0","0","0","0","0","0","False","False","False","灵灾过后，各国以大国防联军为中心，对各组织进行了整编。<hex:02100103>其中也吸收了很多其他组织。","格里达尼亚的鬼哭队和神勇队如今也成了双蛇党的一部分。<hex:02100103>在利姆萨·罗敏萨，梭鱼骑士团被黑涡团吸收合并了。","在乌尔达哈，各组织似乎依旧保持着自己的独立性，<hex:02100103>不过……不管怎样，<hex:02100103>现在对各国来说大国防联军都是不可或缺的。"
"590560","0","1","1","0","0","757","0","0","1","1","1","0","0","0","0","0","0","False","False","False","劳班局长对恒辉队里出了叛徒感到很遗憾。","他说，“我的注意力集中在国内问题的期间，<hex:02100103>恒辉队的士气低落到这种地步了啊……”","但我知道，恒辉队并不都是那样的人，<hex:02100103>因为我长年在近处观察他们。<hex:02100103>我并不是帮他们说好话，希望你能明白。"
"590561","0","1","2","0","0","764","0","0","1","1","1","0","0","0","0","0","0","False","False","False","我们继续进行蛮神的相关调查。<hex:02100103>召唤蛮神的蛮族不止蜥蜴人族……<hex:02100103>你也要多注意此事。","0","0"
"590562","0","1","2","0","0","764","0","0","1","1","1","0","0","0","0","0","0","False","False","False","命运指引我们前进……<hex:02100103>志同道合之时再相会……","我们的知识之都如今也化为了泡影……<hex:02100103>与流沙同行……直到拂晓的太阳升起……","0"
"590563","0","1","2","0","0","764","0","0","1","1","1","0","0","0","0","0","0","False","False","False","哦哦，是<hex:022903EB0203>啊。<hex:02100103>你要是有事找梅尔维布提督的话，<hex:02100103>可以使用这个海将之梯。","0","0"
"590564","0","1","2","0","0","764","0","0","1","1","1","0","0","0","7","0","0","False","False","False","大门紧闭","0","0"
"590565","0","1","2","0","0","764","0","0","1","1","1","0","0","0","0","0","0","False","False","False","什么，是你啊。是来检查我有没有在好好工作的吗？<hex:02100103>……嘿嘿嘿……哈哈哈……正如你所见，<hex:02100103>我现在非常认真地在工作！比在旅团的时候还要拼！","我能把从前团长教给我的东西运用到鬼哭队的工作上，<hex:02100103>就是对团长最好的报恩方式了……我怎么到现在才明白！<hex:02100103>……咳咳，要是你有机会见到团长，就把我说的告诉他吧。","0"
"590566","0","1","2","2","0","763","755","0","1","1","1","0","0","0","0","0","0","False","False","False","之前朗德内尔真是承蒙照顾了。<hex:02100103>在讨伐了蛮神的你的协助下，<hex:02100103>他应该清楚地认识到重建旅团已经没有意义了吧。","那家伙终于开始在自己的道路上前进了。<hex:02100103>真不知道下次见面的时候，他会有怎样的改变。","0"
"590567","0","1","2","0","0","764","0","0","1","1","1","0","0","0","0","0","0","False","False","False","我们银胄团是效忠王家的近卫骑士团。<hex:02100103>由初代乌尔达哈国王萨萨加恩1世陛下下命，<hex:02100103>在乌尔达哈建国时成立的。","现任团长杰林斯大人是一个年轻且充满热情的人。<hex:02100103>他为重振王家和银胄团，鞠躬尽瘁。<hex:02100103>但即便如此……","还是会有人觉得短时间内不会有什么变化。"
"590568","0","1","2","0","0","764","0","0","1","1","1","0","0","0","0","0","0","False","False","False","不仅是利姆萨·罗敏萨，<hex:02100103>现在艾欧泽亚各国都面临着诸多的问题。","为了解决这些困难，<hex:02100103>我们需要像你这样的冒险者提供力量。<hex:02100103>冒险者，请你今后继续贡献出你的力量。","0"
"590569","0","1","2","0","0","764","0","0","1","1","1","0","0","0","0","0","0","False","False","False","我在格格鲁玖大人的手下做事……<hex:02100103>如果你想为我的主人效力，<hex:02100103>那么可以过来找我……","0","0"
"590570","0","1","2","0","0","764","0","0","1","1","1","0","0","0","0","0","0","False","False","False","我是布鲁盖尔商会的副会长班戈·赞戈。<hex:02100103>不好意思，我正在工作……","0","0"
"590571","0","1","2","0","0","764","0","0","1","1","1","0","0","0","0","0","0","False","False","False","在农场工作可不是件轻松事。<hex:02100103>不过怎么说呢……<hex:02100103>我没有想过要辞掉这份工作。","0","0"
"590572","0","1","2","0","0","764","0","0","1","1","1","0","0","0","0","0","0","False","False","False","我是一个不足道的贸易商人。<hex:02100103>虽然这里是贫瘠的殖民地，<hex:02100103>不过我想，在这里可能会发现什么新的可能吧。","0","0"
