"591486","0","1","2","0","0","715","0","0","1","1","1","0","0","0","0","0","0","False","False","False","贤人们不在的时候，就由我来保护石之家。<hex:02100103>这边就交给我吧！","0","0"
"591487","0","1","1","0","0","765","0","0","1","1","1","0","0","0","0","0","0","False","False","False","石之家就交给我和赫利·博尔达吧。<hex:02100103>虽然不能去欣赏你的英姿，<hex:02100103>不过我们会完成自己的使命的。","0","0"
"591488","0","1","2","0","0","763","0","0","1","1","1","0","0","0","0","0","0","False","False","False","换了环境，生活习惯也会有所改变……<hex:02100103>俗话说入乡随俗，<hex:02100103>但我还是没法那么快习惯这里。","0","0"
"591489","0","1","2","0","0","764","0","0","1","1","1","0","0","0","0","0","0","False","False","False","和异国人谈话真是太有趣了……<hex:02100103>我学到了许多在多玛学不到的东西，<hex:02100103>每天都在扩展自己的眼界。","0","0"
"591490","0","1","2","0","0","766","0","0","1","1","1","0","0","0","0","0","0","False","False","False","我本想为大家提供我拿手的多玛菜肴……<hex:02100103>但材料一直凑不齐。<hex:02100103>土地不同，上面生长的作物也不同。","0","0"
"591491","0","1","1","0","0","765","0","0","1","1","1","0","0","0","0","0","0","False","False","False","<hex:020819E905FF0A>大姐姐<hex:FF0A>大哥哥<hex:03>，这次你要和什么样的敌人战斗？<hex:02100103>你太厉害了！真是太帅了！","0","0"
"591492","0","1","2","0","0","763","0","0","1","1","1","0","0","0","0","0","0","False","False","False","拉姆很强吗？<hex:02100103>不过<hex:020819E905FF0A>大姐姐<hex:FF0A>大哥哥<hex:03>肯定更强吧？<hex:02100103>那我就不担心了，快去快回呀！","0","0"
"591493","0","1","2","0","0","756","764","0","1","1","1","0","0","0","0","0","0","False","False","False","在乌尔达哈和你分别之后，我又来查看难民们的情况了。<hex:02100103>虽然问题还没有完全解决，不过暂时应该不会发生武装暴动吧。","同时，你也出色地解决了蛮神拉姆一事，<hex:02100103>详情我就去问敏菲利亚吧，<hex:02100103>辛苦了，<hex:022903EB0203>。","0"
"591494","0","1","2","0","0","763","0","0","1","1","1","0","0","0","0","0","0","False","False","False","祖父曾经率领“救世诗盟”，<hex:02100103>从预言诗所记载的灵灾中保护艾欧泽亚。","救世诗盟是一个集思广益，<hex:02100103>引导人类走向更光明的未来的组织。<hex:02100103>虽然在方法上有点不同，不过和统一组织还是很相似的吧？","0"
"591495","0","1","2","0","0","763","0","0","1","1","1","0","0","0","0","0","0","False","False","False","你和赫利·博尔达的比赛，看得我都热血沸腾了。<hex:02100103>不管再吟出多么华美的诗篇，<hex:02100103>也打动不了看了你的比赛的小姐们的芳心了。","0","0"
"591496","0","1","1","0","0","651","0","0","1","1","1","0","0","0","0","0","0","False","False","False","看来又要开始新的工作了。<hex:02100103>这次会遇到怎样的人呢？<hex:02100103>我真期待呀！","0","0"
"591497","0","1","2","0","0","707","0","0","1","1","1","0","0","0","0","0","0","False","False","False","真是的，伊达简直太乐观了，<hex:02100103>我们要解决的问题还堆积如山呢……","0","0"
"591498","0","1","1","0","0","765","0","0","1","1","1","0","0","0","0","0","0","False","False","False","伊达虽然有点大大咧咧，<hex:02100103>不过只要和她在一起，就觉得问题能够迎刃而解。<hex:02100103>当然了，这和你在我们身边也有很大关系。","0","0"
"591499","0","1","2","0","0","719","0","0","1","1","1","0","0","0","0","0","0","False","False","False","哇哇哇……要变得忙碌起来了！<hex:02100103>有事的话，一会再来找我吧！","0","0"
"591500","0","1","2","0","0","764","0","0","1","1","1","0","0","0","0","0","0","False","False","False","既然来到了这里，<hex:02100103>我也要尽我所能，做好我能做的！","0","0"
"591501","0","1","2","0","0","0","724","0","1","1","1","0","0","0","0","0","0","False","False","False","<hex:022903EB0203>，<hex:02100103>感谢你和我交手。","你真的好强！<hex:02100103>我会把这次和你战斗的经验铭记于心，<hex:02100103>更加努力锻炼自己和孩子们的。","0"
"591502","0","1","1","0","0","765","0","0","1","1","1","0","0","0","0","0","0","False","False","False","这次我也很热血沸腾。<hex:02100103>……我们也要变得更强。","0","0"
"591503","0","1","1","0","0","765","0","0","1","1","1","0","0","0","0","0","0","False","False","False","有很多同伴都因失去了故乡而悲痛万分，<hex:02100103>但通过和你们接触，我们也有了一些勇气。<hex:02100103>今后的路还很长很长。","0","0"
"591504","0","1","1","0","0","765","0","0","1","1","1","0","0","0","0","0","0","False","False","False","我们在这里尝试了多玛的农耕技术……<hex:02100103>不知道有没有效果呢？","0","0"
"591505","0","1","2","0","0","763","0","0","1","1","1","0","0","0","0","0","0","False","False","False","大家都好忙啊，<hex:02100103>我去泡杯茶，让大家休息休息。","0","0"
"591506","0","1","2","0","0","0","933","0","1","1","1","0","0","0","0","0","0","False","False","False","虽然赫利·博尔达也很帅，<hex:02100103>但最强的还要数<hex:020819E905FF0A>大姐姐<hex:FF0A>大哥哥<hex:03>呀！","我决定了！我也要变强，<hex:02100103>总有一天，也要向<hex:020819E905FF0A>大姐姐<hex:FF0A>大哥哥<hex:03>挑战！<hex:02100103>嘿嘿，我是不会输的！","0"
"591507","0","1","2","0","0","763","0","0","1","1","1","0","0","0","0","0","0","False","False","False","赫利·博尔达真是的，又这么拼命！<hex:02100103>明明身体还很疼呢……呵呵，真是拿他没办法！","0","0"
"591508","0","1","2","0","0","766","0","0","1","1","1","0","0","0","0","0","0","False","False","False","在战斗中，每个人都有各自的职责。<hex:02100103>因此我们多玛冒险者团也需要明确职责……<hex:02100103>嗯……阳山是快刀斩乱麻队长……","0","0"
"591509","0","1","2","0","0","764","0","0","1","1","1","0","0","0","0","0","0","False","False","False","库尔特内使的那招叫幻术对吧？<hex:02100103>能为人疗伤，真是好啊……<hex:02100103>我要是努力的话，是不是也能学会啊？","0","0"
"591510","0","1","1","0","0","756","765","0","1","1","1","0","0","0","0","0","0","False","False","False","自从开始吃绯桐做的饭，<hex:02100103>我的身体马上就变得特别好。","多玛的饭菜的确对身体很好，<hex:02100103>但最重要的果然是做饭人对菜肴倾注的爱吧。<hex:02100103>绯桐……真是太温柔了……","0"
"591511","0","1","1","0","0","765","0","0","1","1","1","0","0","0","0","0","0","False","False","False","帕帕力莫不和我比试！<hex:02100103>他一定是怕输！","0","0"
"591512","0","1","1","0","0","765","0","0","1","1","1","0","0","0","0","0","0","False","False","False","比谁说出的水晶义勇队队员名字多……<hex:02100103>虽然这个想法还不错，<hex:02100103>但在那之前应该去帮塔塔露做名册啊。","0","0"
"591513","0","1","2","0","0","764","0","0","1","1","1","0","0","0","0","0","0","False","False","False","听完里奥尔的一席话，<hex:02100103>我才意识到我对地灵族的认识太贫乏了。<hex:02100103>我们要多借助海雄旅团的知识呀。","0","0"
"591514","0","1","2","0","0","933","0","756","1","1","1","0","0","0","0","0","0","False","False","False","先锋统一组织——水晶义勇队，<hex:02100103>它的意思是“被母水晶引导的勇士们”。","宝蓝的制服代表清澈无瑕的水晶，<hex:02100103>胸前水晶之剑的徽章则是在逆境中战斗的勇者的标志。","希望有一天，这个组织能成为引导人们的光芒……<hex:02100103>为此，我也要继续战斗下去。"
"591515","0","1","2","0","0","737","0","0","1","1","1","0","0","0","0","0","0","False","False","False","哇……我都忙得头晕目眩了！<hex:02100103>我还觉得准备得很周全了呢，<hex:02100103>没想到名册中漏了名字，又要重做了……","0","0"
"591516","0","1","2","0","0","711","0","0","1","1","1","0","0","0","0","0","0","False","False","False","桑克瑞德最近可喜欢缠着绯桐了，<hex:02100103>呵呵，年轻人真是的……","不过，于里昂热先生拜托我监视桑克瑞德，<hex:02100103>说以免再次增加生命中只剩下悔恨和复仇的女性。<hex:02100103>看这样子，是不是差不多要……","0"
"591517","0","1","2","0","0","715","0","0","1","1","1","0","0","0","0","0","0","False","False","False","跟有志之士谈话时，自然而然就会挺直腰板。<hex:02100103>我虽是拂晓的人，但只要是我能帮得上忙的，<hex:02100103>请尽管和我说。","0","0"
"591518","0","1","1","0","0","765","0","0","1","1","1","0","0","0","0","0","0","False","False","False","这么说来，孩子们都去哪了？<hex:02100103>希望他们没想什么鬼点子……","0","0"
"591519","0","1","2","0","0","764","0","0","1","1","1","0","0","0","0","0","0","False","False","False","听说你们建立了一个新组织，<hex:02100103>请让我也尽微薄之力帮帮忙。","0","0"
"591520","0","1","2","0","0","763","0","0","1","1","1","0","0","0","0","0","0","False","False","False","我正在学习艾欧泽亚的练兵方法。<hex:02100103>毕竟要迎接一个新组织，肯定要多学些知识的。","0","0"
"591521","0","1","2","0","0","708","0","0","1","1","1","0","0","0","0","0","0","False","False","False","桑克瑞德夸多玛的菜肴很好吃。<hex:02100103>他能喜欢，我也很开心！","0","0"
"591522","0","1","2","0","0","766","0","0","1","1","1","0","0","0","0","0","0","False","False","False","水晶义勇队可真是帅！<hex:02100103>我们也改叫“多玛义勇队”吧！","0","0"
"591523","0","1","2","0","0","763","0","0","1","1","1","0","0","0","0","0","0","False","False","False","多玛义勇队的总帅，就决定是阳山了！","0","0"
"591524","0","1","1","0","0","765","0","0","1","1","1","0","0","0","0","0","0","False","False","False","一切为了艾欧泽亚！<hex:02100103>……我学得像吗？","0","0"
"591525","0","1","2","0","0","764","0","0","1","1","1","0","0","0","0","0","0","False","False","False","那、那个……<hex:02100103>我们正在商量为多玛冒险者团改名……","0","0"
"591526","0","1","1","0","0","756","0","0","1","1","1","0","0","0","0","0","0","False","False","False","因为刚巧碰到了她，我们就在交换各自的情报。<hex:02100103>同伴间不能有所隐瞒……对吧？","0","0"
"591527","0","1","1","0","0","0","765","0","1","1","1","0","0","0","0","0","0","False","False","False","有不少人都是慕你名而来的。<hex:02100103>原来你不光在小阿拉米格活跃，<hex:02100103>全艾欧泽亚都有你的身影啊……","……我真的很尊敬你。<hex:02100103>作为水晶义勇队的一员，<hex:02100103>我也想多开阔眼界，变得更强。","0"
"591528","0","1","1","0","0","756","0","0","1","1","1","0","0","0","0","0","0","False","False","False","怎么样，我穿这身制服是不是也很帅啊？<hex:02100103>虽然以前发生了很多事，但现在我已经焕然一新了！<hex:02100103>今后我要争取名扬四方，让巴斯卡隆老爹也为我骄傲。","0","0"
"591529","0","1","1","0","0","765","0","0","1","1","1","0","0","0","0","0","0","False","False","False","听了水晶义勇队的成立宣言，我很是感动。<hex:02100103>在艾欧泽亚进行了这么多次的冒险，<hex:02100103>现在，该由我来保护艾欧泽亚了……","0","0"
"591530","0","1","0","0","0","757","0","0","1","1","1","0","0","0","0","0","0","False","False","False","大家都为组织的建立高兴。<hex:02100103>虽然我也深有感触，<hex:02100103>但只有漂亮地完成任务，才能让别人认可我们……","0","0"
"591531","0","1","2","0","0","764","0","0","1","1","1","0","0","0","0","0","0","False","False","False","我们现在开始办理加隆德装备的贸易了。<hex:02100103>这些都是加隆德炼铁厂久违的新作。","面对如此精致的装备，罗薇娜嗅到了商机，<hex:02100103>即刻与加隆德炼铁厂签订了专营合同。<hex:02100103>真是个令人厌恶的女人……","0"
"591532","0","1","0","0","0","0","0","0","1","1","1","0","0","0","0","0","0","False","False","False","今天的晚饭吃什么好呢……<hex:02100103>我家的孩子总是干啥啥不行吃啥啥没够，<hex:02100103>真得想想办法才行……","0","0"
"591533","0","1","2","0","0","764","0","0","1","1","1","0","0","0","0","0","0","False","False","False","你来了啊。<hex:02100103>多亏了你，<hex:02100103>才能成功夺回皇都伊修加德的防御要塞石卫塔。","在重建工作完成之前……<hex:02100103>我们会严加防守的。","0"
"591534","0","1","1","0","0","755","0","0","1","1","1","0","0","0","0","0","0","False","False","False","我还打算向上级提出夺回石卫塔的方案呢，<hex:02100103>没想到都已经成功夺回来了。<hex:02100103>当务之急是对它进行重建，想想还真是头疼。","0","0"
"591535","0","1","1","0","0","755","0","0","1","1","1","0","0","0","0","0","0","False","False","False","白云崖前哨归伊修加德四大名门之一的狄兰达尔家管辖，<hex:02100103>现在主要的任务是对石卫塔的重建。","0","0"
"591536","0","1","1","0","0","755","0","0","1","1","1","0","0","0","0","0","0","False","False","False","你来得正好。<hex:02100103>没有你的活跃表现，恐怕是难以夺回要塞的。<hex:02100103>白云崖前哨的所有人心里都明白。","不过即便如此，还是会有不接受你的人。<hex:02100103>“荣耀”有时候会成为盔甲使自己变强，<hex:02100103>但有时也会成为束缚心灵的枷锁。","0"
"591537","0","1","2","0","0","764","0","0","1","1","1","0","0","0","0","0","0","False","False","False","我是伊修加德出身，为了增长见识而出门修行……<hex:02100103>最近开始觉得冒险者自由自在的生活方式也不错。","0","0"
"591538","0","1","2","0","0","764","0","0","1","1","1","0","0","0","0","0","0","False","False","False","成功夺回了石卫塔啊。<hex:02100103>虽然是场艰辛痛苦的战斗，<hex:02100103>但是能活着回来比什么都重要。","0","0"
"591539","0","1","1","0","0","755","0","0","1","1","1","0","0","0","0","0","0","False","False","False","哟，你见到斯宾塞那家伙了吗？<hex:02100103>他刚刚好像摇摇晃晃地来到酒馆了，<hex:02100103>不会又被酒香给熏醉了吧……","0","0"
"591540","0","1","1","0","0","755","0","0","1","1","1","0","0","0","0","0","0","False","False","False","不知道布迦加老师对这次温泉满不满意啊……<hex:02100103>真希望这片沙滩全都是可爱妹子，然后一起跳着老师教的舞蹈。","0","0"
"591541","0","1","1","0","0","755","0","0","1","1","1","0","0","0","0","0","0","False","False","False","利姆萨·罗敏萨是高傲的海盗之国。<hex:02100103>虽然这个时代也在逐渐走向终结。","0","0"
"591542","0","1","1","0","0","755","0","0","1","1","1","0","0","0","0","0","0","False","False","False","你问最后一代雾须到底是谁？<hex:02100103>……喂，不要问这么不知趣的问题嘛。","0","0"
"591543","0","1","1","0","0","755","0","0","1","1","1","0","0","0","0","0","0","False","False","False","就像那两条缠绕在一起的白蛇一样，<hex:02100103>我们会团结在一起，<hex:02100103>保护森林之都格里达尼亚。","0","0"
"591544","0","1","2","0","0","1041","0","0","1","1","1","0","0","0","0","0","0","False","False","False","如果让人知道我儿子和琉璃色的少女订婚了，<hex:02100103>那么布鲁盖尔商会就会受更多人关注。<hex:02100103>呵呵，真是期待公布消息的时刻啊。","0","0"
"591545","0","1","1","0","0","0","0","0","1","1","1","0","0","0","0","0","0","False","False","False","……别随便跟我搭话。<hex:02100103>我可是布鲁盖尔商会下一任的会长大人！","0","0"
"591546","0","1","2","0","0","763","0","0","1","1","1","0","0","0","0","0","0","False","False","False","亲手拉扯大的女儿将要嫁给布鲁盖尔商会下一任会长，<hex:02100103>作为父母，没有比这更开心的了。","0","0"
"591547","0","1","2","0","0","764","0","0","1","1","1","0","0","0","0","0","0","False","False","False","宴会马上就要开始了，好期待啊。<hex:02100103>有好吃的又有好喝的，再加上这件喜事，<hex:02100103>和东阿尔迪纳德商会的商谈也能更顺利吧。","0","0"
"591548","0","1","1","0","0","755","0","0","1","1","1","0","0","0","0","0","0","False","False","False","马上就能见到阿拉贝拉小姐了，好开心。<hex:02100103>既然能成为瓦讷大人的夫人，<hex:02100103>肯定是美若天仙了。","0","0"
"591549","0","1","2","0","0","764","0","0","1","1","1","0","0","0","0","0","0","False","False","False","能借到格格鲁玖大人的私有地的商人，<hex:02100103>肯定是在利姆萨·罗敏萨和乌尔达哈都非常有势。<hex:02100103>能在这美丽的沙滩上开宴会，真是幸福。","0","0"
"591550","0","1","2","2","0","933","755","0","1","1","1","0","0","0","0","0","0","False","False","False","哼哼哼，下一期的«秘银之眼»又有新闻了。<hex:02100103>传说中的怪盗白假面终于要露出真身了！","下一个预告没记错的话是艾玛吉娜杯斗技大会的奖品。<hex:02100103>毕竟是在乌尔达哈本地的斗技场举办的活动，<hex:02100103>我会好好做调查的。","0"
"591551","0","1","0","0","0","0","0","0","1","1","1","0","0","0","0","0","0","False","False","False","一个士兵倒下去，还会有千千万万个士兵站起来！<hex:02100103>为了胜利坚持到最后一刻……<hex:02100103>这就是恒辉队！","0","0"
"591552","0","1","0","0","0","0","0","0","1","1","1","0","0","0","0","0","0","False","False","False","对冒险者而言，梦想和希望是很重要的！<hex:02100103>梦想则是亿万富翁！希望则是一举千金！<hex:02100103>说白了就是钱，钱就是整个世界！","0","0"
"591553","0","1","2","0","0","764","0","0","1","1","1","0","0","0","0","0","0","False","False","False","我以前制作的仿古装备，<hex:02100103>随着交易量减少，现在已经完全变成了订制商品。<hex:02100103>哎呀，罗薇娜女士的眼光可真是挑剔啊……","0","0"
"591554","0","1","0","0","0","0","0","0","1","1","1","0","0","0","0","0","0","False","False","False","我是一名武器工匠，在艾吉恩奥尔夫师傅的手下学习！<hex:02100103>如果你能被师傅认同的话，我会给行方便的。","0","0"
"591555","0","1","2","2","0","763","755","0","1","1","1","0","0","0","0","0","0","False","False","False","我听格格鲁玖大人说有商会的宴会，<hex:02100103>没想到你也在。","一会要去打倒蛮神，一会又要去潜入宴会……<hex:02100103>真是的，冒险者也真够忙的。","0"
"591556","0","1","1","0","0","755","0","0","1","1","1","0","0","0","0","0","0","False","False","False","你见到传说中的阿拉贝拉了吗？<hex:02100103>不知道阿拉贝拉愿不愿意做我的舞女啊。<hex:02100103>哈……要不我去问问看？","0","0"
"591557","0","1","0","0","0","0","0","0","1","1","1","0","0","0","7","0","0","False","False","False","已经记录了20处探索笔记中的风景了。<hex:02100103>到格里达尼亚碧企鹅瀑布去向米莉丝·艾恩哈特报告吧。","0","0"
"591558","0","1","2","0","0","1045","0","0","1","1","1","0","0","0","0","0","0","False","False","False","你找我吗？<hex:022903EB0203>阁下。<hex:02100103>在下已经做好万全准备！<hex:02100103>一切为了艾欧泽亚！","0","0"
"591559","0","1","2","0","0","1045","0","0","1","1","1","0","0","0","0","0","0","False","False","False","一切为了艾欧泽亚！<hex:02100103>……我很中意这个口号。<hex:02100103>最早的时候还觉得很害羞，不过现在觉得非常光荣！","0","0"
"591560","0","1","2","0","0","1045","0","0","1","1","1","0","0","0","0","0","0","False","False","False","辛苦了。<hex:02100103>我们要尽快扩大水晶义勇队的名声，<hex:02100103>好有更多收入丰富的委托。","0","0"
"591561","0","1","0","0","0","0","0","0","1","1","1","0","0","0","0","0","0","False","False","False","我从师父那里听说了！<hex:02100103>你想换什么就找我好了。","0","0"
"591562","0","1","2","0","0","763","0","0","1","1","1","0","0","0","0","0","0","False","False","False","你居然被全力以赴的拉姆大人认同了呼啾！<hex:02100103>真是太厉害了呼啾。<hex:02100103>而且最让我吃惊的是，你居然没被电成卷毛呼啾！","0","0"
"591563","0","1","2","0","0","763","0","0","1","1","1","0","0","0","0","0","0","False","False","False","只有自己拥有这不祥的魔眼，导致小的时候有很不快的回忆。<hex:02100103>所以我才调查古代亚拉戈，想知道这眼睛的秘密。","虽然就算知道了秘密，也没什么用吧。<hex:02100103>只是，越接近水晶塔的核心，就越觉得有些事必须要想起来……","0"
"591564","0","1","2","0","0","763","0","0","1","1","1","0","0","0","0","0","0","False","False","False","再次启动的水晶塔虽然没全盛时期那么厉害，<hex:02100103>可还是在聚集太阳之力……目的是要打开连接暗之世界的大门。","尼禄察觉到了这点，为了进入希尔科斯塔而接近我们。<hex:02100103>……这个老朋友还是那么不直率啊。","0"
"591565","0","1","2","0","0","763","0","0","1","1","1","0","0","0","0","0","0","False","False","False","连接异界的门——虚无界之门……<hex:02100103>这属于咒术师的专业领域了。","不过，既然它利用着水晶塔，<hex:02100103>那我们技师肯定也有能帮上忙的地方，<hex:02100103>我们会竭尽全力看看能做什么的。","0"
"591566","0","1","2","0","0","763","0","0","1","1","1","0","0","0","0","0","0","False","False","False","赞德不可能什么都没做就消失了。<hex:02100103>估计在被打倒前，没准在登上塔顶之前，<hex:02100103>他就打开了门。","结果，乌内与多加被吸入了异界，<hex:02100103>还是没能斩断与黑暗之力的契约。<hex:02100103>始皇帝的执念，真是可怕……","0"
"591567","0","1","1","0","0","755","0","0","1","1","1","0","0","0","0","0","0","False","False","False","你居然再次讨伐了蛮神拉姆……<hex:02100103>果然依靠你是正确的，其他人的话估计做不到。","你也知道，妖精族内部也是有分歧的。<hex:02100103>正因为每个人想法不一样，所以才会产生问题……<hex:02100103>而这些又不是简简单单就能解决的，这一点和人类社会很像。","0"
"591568","0","1","2","0","0","764","0","0","1","1","1","0","0","0","0","0","0","False","False","False","这里是红莲炮兵队演习的活动现场哦。<hex:02100103>这个活动是冒险者行会举办的红莲节的活动之一。","0","0"
"591569","0","1","2","0","0","711","0","0","1","1","1","0","0","0","0","0","0","False","False","False","呵呵呵……这真是个大城市。<hex:02100103>和东方的城市比起来毫不逊色。<hex:02100103>接下来就差找到身手好的人了……","0","0"
"591570","0","1","2","0","0","764","0","0","1","1","1","0","0","0","0","0","0","False","False","False","这里是红莲节的总部。<hex:02100103>我就是执行委员长，不过说真的，我真不是当负责人的料。","0","0"
"591571","0","1","2","0","0","764","0","0","1","1","1","0","0","0","0","0","0","False","False","False","利姆萨·罗敏萨正在举办红莲节。<hex:02100103>这是冒险者行会举办的活动，<hex:02100103>现在正在找愿意帮忙的冒险者。","0","0"
"591572","0","1","2","0","0","764","0","0","1","1","1","0","0","0","0","0","0","False","False","False","利姆萨·罗敏萨正在举办红莲节。<hex:02100103>这是冒险者行会举办的活动。<hex:02100103>为了能成功举办，现在正在找愿意帮忙的冒险者。","0","0"
"591573","0","1","2","0","0","764","0","0","1","1","1","0","0","0","0","0","0","False","False","False","利姆萨·罗敏萨正在举办红莲节。<hex:02100103>这是冒险者行会举办的活动，<hex:02100103>现在正在大量募集冒险者哦。","0","0"
"591574","0","1","2","0","0","764","0","0","1","1","1","0","0","0","0","0","0","False","False","False","这里是红莲水龙队出击的活动现场。<hex:02100103>这个活动是红莲节的活动之一。","0","0"
"591575","0","1","2","0","0","764","0","0","1","1","1","0","0","0","0","0","0","False","False","False","这里是红莲节的活动现场。<hex:02100103>正在举办名为红莲爆炎队散花的放烟花活动。","0","0"
"591576","0","1","2","0","0","767","0","0","1","1","1","0","0","0","0","0","0","False","False","False","你的活跃度真是惊人啊。<hex:02100103>奔跑于世界各地，留下了很多功绩嘛。","0","0"
"591577","0","1","2","0","0","767","0","0","1","1","1","0","0","0","0","0","0","False","False","False","邮递员的工作还顺利吗？<hex:02100103>能接触到各种各样的人，肯定很开心吧。","0","0"
"591578","0","1","2","0","0","764","0","0","1","1","1","0","0","0","0","0","0","False","False","False","关于我哥哥的事给你添麻烦了。<hex:02100103>知道了他受伤的原因我就安心了……<hex:02100103>不过哥哥的伤真是一波接一波啊。","0","0"
