"594324","0","1","2","0","0","4219","0","0","1","1","1","0","0","0","0","0","0","False","False","False","居然找外国武士来助阵……<hex:02100103>事先声明，在这件事上我持反对意见。","0","0"
"594325","0","1","2","0","0","4218","0","0","1","1","1","0","0","0","0","0","0","False","False","False","虽说是你解决了副局长那个叛徒，<hex:02100103>但可不代表我会把你当成同伴看待……","0","0"
"594326","0","1","2","0","0","764","0","0","1","1","1","0","0","0","0","0","0","False","False","False","我就知道你不简单，<hex:02100103>但没想到是罪人无双斋的徒弟。<hex:02100103>而且雨月的妹妹还成了代理局长……","0","0"
"594327","0","1","2","0","0","764","0","0","1","1","1","0","0","0","0","0","0","False","False","False","真是对不起，误会了你那么长时间。<hex:02100103>我也是从小就特别崇拜木枯。<hex:02100103>感谢你一直以来对赤诚组的帮助。","0","0"
"594328","0","1","1","0","0","0","0","0","1","1","1","0","0","0","0","0","0","False","False","False","想要击溃大逆不道的雨月一派，<hex:02100103>必须每日坚持锻炼才行！","0","0"
"594329","0","1","1","0","0","0","0","0","1","1","1","0","0","0","0","0","0","False","False","False","居然身在赤诚组还私通雨月一派……<hex:02100103>他们一定是缺乏锻炼！","0","0"
"594330","0","1","1","0","0","0","0","0","1","1","1","0","0","0","0","0","0","False","False","False","连金刚局长都败了……<hex:02100103>那我们再怎么锻炼，也……","0","0"
"594331","0","1","1","0","0","0","0","0","1","1","1","0","0","0","0","0","0","False","False","False","我要以剑豪无双斋和你为目标，<hex:02100103>每日坚持锻炼！","0","0"
"594332","0","1","2","0","0","764","0","0","1","1","1","0","0","0","0","0","0","False","False","False","你就是真琴带来的外国武士吧？<hex:02100103>欢迎来到赤诚组！<hex:02100103>我相信真琴的眼光。","0","0"
"594333","0","1","2","0","0","4218","0","0","1","1","1","0","0","0","0","0","0","False","False","False","紫电居然是奸细……<hex:02100103>真琴和他比较亲近，现在心里肯定不会好过。","0","0"
"594334","0","1","2","0","0","4219","0","0","1","1","1","0","0","0","0","0","0","False","False","False","真琴是雨月的妹妹这种事一定是假的吧？！<hex:02100103>快告诉我都是骗人的……","0","0"
"594335","0","1","2","0","0","764","0","0","1","1","1","0","0","0","0","0","0","False","False","False","真琴通过亲手杀死自己的哥哥雨月，<hex:02100103>斩断了自己的过去，也给我们赤诚组做了表率。<hex:02100103>大家都接受了她局长的身份。","0","0"
"594336","0","1","2","0","0","4309","0","0","1","1","1","0","0","0","0","0","0","False","False","False","这里是赤诚组营房。<hex:02100103>是你呀……进来坐坐吧。","0","0"
"594337","0","1","1","0","0","756","0","0","1","1","1","0","0","0","0","0","0","False","False","False","你已经是出色的战士了。<hex:02100103>但是别忘了你也是一个斧术师。<hex:02100103>战士的基础就是斧术。","0","0"
"594338","0","1","2","0","0","764","0","0","1","1","1","0","0","0","0","0","0","False","False","False","现在暂时还没发现鸦的下落。<hex:02100103>至于长老那边，我只汇报说是在追踪夺走了卷轴的神秘忍者……","0","0"
"594339","0","1","0","0","0","0","0","0","1","1","1","0","0","0","0","0","0","False","False","False","那个，能跟你聊一下吗？","0","0"
"594340","0","1","2","0","0","764","0","0","1","1","1","0","0","0","0","0","0","False","False","False","这里的粮食短缺问题比我上次来的时候还要严重。","0","0"
"594341","0","1","0","0","0","0","0","0","1","1","1","0","0","0","0","0","0","False","False","False","什么事啊？","0","0"
"594342","0","1","2","0","0","4219","0","0","1","1","1","0","0","0","0","0","0","False","False","False","既然首领是这么决定的，那我们只有遵从。<hex:02100103>对不住了。","0","0"
"594343","0","1","1","0","0","0","0","0","1","1","1","0","0","0","0","0","0","False","False","False","加入海贼众的人，都是抛弃了故乡和过去的。<hex:02100103>就算猎物是以前的同志，那也会毫不犹豫袭击过去。<hex:02100103>曾经的敌人如果按规矩办事，那我们也不能对他出手。","如果因个人恩怨引起私斗，<hex:02100103>难免会给整个海贼众带来危险。<hex:02100103>不管是我还是其他人，都很明白这一点……","0"
"594344","0","1","1","0","0","0","0","0","1","1","1","0","0","0","0","0","0","False","False","False","你们可以从翠水乡西边的海底洞窟登陆——<hex:02100103>前往绝鬼岛——<hex:02100103>你们务必要小心啊——","0","0"
"594345","0","1","2","0","0","764","0","0","1","1","1","0","0","0","0","0","0","False","False","False","延夏这里弥漫着浓雾，隔断了噪音。<hex:02100103>所以从古时候起就是一片安静祥和的大地。<hex:02100103>在这片土地上出生的我们，也过着平静的生活。","0","0"
"594346","0","1","2","0","0","763","0","0","1","1","1","0","0","0","0","0","0","False","False","False","啊，你听我说，<hex:020819E905FF0A>大姐姐<hex:FF0A>大哥哥<hex:03>！<hex:02100103>一亩哥现在还没法好好和夕雾说话呢。<hex:02100103>明明只要说一句“谢谢”、“太帅了”之类的就好嘛！","0","0"
"594347","0","1","1","0","0","0","0","0","1","1","1","0","0","0","0","0","0","False","False","False","哦，你没事就好——<hex:02100103>我听说记载于传说之中的豪神须佐之男在宝物殿显现了啊……","真是抱歉啊，竟然让客人们身陷险境——<hex:02100103>不过，和须佐之男大神交手是不是很畅快啊——？<hex:02100103>嚯嚯嚯……等再有事说不定还有拜托你哦——","0"
"594348","0","1","1","0","0","0","0","0","1","1","1","0","0","0","0","0","0","False","False","False","上次我们碧甲族也能帮上忙真是太好了——<hex:02100103>我们和多玛也结下了缘分——<hex:02100103>今后，双方就争取往好的方向继续发展交流吧——","0","0"
"594349","0","1","1","0","0","0","0","0","1","1","1","0","0","0","0","0","0","False","False","False","嚯嚯嚯——<hex:02100103>客人你今天可是容光焕发啊——<hex:02100103>是结下了什么良缘吗——","0","0"
"594350","0","1","2","0","0","763","0","0","1","1","1","0","0","0","0","0","0","False","False","False","今天的工作也辛苦啦——！<hex:02100103>以后还想再和你们合作呢——<hex:02100103>等有机会再多多指教啦——","0","0"
"594351","0","1","2","0","0","763","0","0","1","1","1","0","0","0","0","0","0","False","False","False","之后我也在多玛城附近游了好几圈——<hex:02100103>但都没有找到类似的人——","不过，也没在城中的废墟中找到他——<hex:02100103>也有可能是顺着急流被冲到了大海——<hex:02100103>今后我会在游泳时留个心眼的——","0"
"594352","0","1","2","0","0","763","0","0","1","1","1","0","0","0","0","0","0","False","False","False","我听汉考克说了——<hex:02100103>说是西方的战场也大获全胜——","真是太厉害了——<hex:02100103>我可喜欢听好消息了——<hex:02100103>会不会以此为契机，结下新的缘分啊——","0"
"594353","0","1","2","0","0","763","0","0","1","1","1","0","0","0","0","0","0","False","False","False","啊，你去哪里了啊！<hex:02100103>本来还想谢谢你们呢，<hex:02100103>莉瑟他们也是，一转眼就不见了！","所以……那个……虽然有点晚了，不过谢谢啦。<hex:02100103>听说你们的战斗还要继续下去，<hex:02100103>我就先说这么多吧。","0"
"594354","0","1","2","0","0","763","0","0","1","1","1","0","0","0","0","0","0","False","False","False","啊，你终于露面了！<hex:02100103>我还以为就你们回到西方了，<hex:02100103>可飞燕大人又说这次要轮到他出兵……到底是怎么回事啊！","不过最后大家都平安回来倒还好……<hex:02100103>看你也平安无事，这我就放心了。<hex:02100103>虽然大家都把你当成英雄，可你也不能太乱来了，要劳逸结合！","0"
"594355","0","1","2","0","0","763","0","0","1","1","1","0","0","0","0","0","0","False","False","False","我都听说了，多玛的攻城作战。<hex:02100103>毕竟都这时候了，我们头领也会不遗余力地协助你们的。<hex:02100103>从攻入渔村的那一天起，我们就是生死与共的关系了。","0","0"
"594356","0","1","2","0","0","764","0","0","1","1","1","0","0","0","0","0","0","False","False","False","嗯……能做的都已经做了。<hex:02100103>之后就只能相信患者们的生命力了……","0","0"
"594357","0","1","2","0","0","764","0","0","1","1","1","0","0","0","0","0","0","False","False","False","你回来了啊。<hex:02100103>你那边的任务也挺不容易的吧？<hex:02100103>辛苦了……","0","0"
"594358","0","1","2","0","0","764","0","0","1","1","1","0","0","0","0","0","0","False","False","False","人员增加的话，相应的物资储备也需要增加……<hex:02100103>我会加油做好接收新人的准备的！","0","0"
"594359","0","1","2","0","0","764","0","0","1","1","1","0","0","0","0","0","0","False","False","False","很多事情都要感谢你们。<hex:02100103>那两个人……阿莉塞和莉瑟也回到西方的战场了吧？<hex:02100103>总之，你们要多保重啊。","0","0"
"594360","0","1","2","0","0","764","0","0","1","1","1","0","0","0","0","0","0","False","False","False","结束生死与共的战斗后，我们又变回了最初的臭流氓。<hex:02100103>你以后也要按规矩交红玉钱……<hex:02100103>哈哈，开玩笑的，我们可不会那么不讲义气的！","0","0"
"594361","0","1","2","0","0","4219","0","0","1","1","1","0","0","0","0","0","0","False","False","False","哦哟！<hex:022903EB0203>，好久不见了！","0","0"
"594362","0","1","1","0","0","0","0","0","1","1","1","0","0","0","0","0","0","False","False","False","我就和你们打这个赌，留意着红甲族的动向。<hex:02100103>如果你们真的能压制住他们，<hex:02100103>那我们也会响应你们，夺回渔村。","0","0"
"594363","0","1","1","0","0","0","0","0","1","1","1","0","0","0","0","0","0","False","False","False","多玛那边怎么样了？虽然这不是件容易的事，<hex:02100103>不过海贼众把所有筹码都押在你们身上了。<hex:02100103>我们相信……一定会成功的。","0","0"
"594364","0","1","1","0","0","0","0","0","1","1","1","0","0","0","0","0","0","False","False","False","我们已经同意多玛起义军的提议了。<hex:02100103>这场战斗对于海贼众来说，也是背水一战……<hex:02100103>为了不给历代的首领们丢脸，我们会堂堂正正参战的。","0","0"
"594365","0","1","1","0","0","0","0","0","1","1","1","0","0","0","0","0","0","False","False","False","我们特意把你送到黄金港，怎么又回来了？<hex:02100103>……不过，战斗中偶尔也有这种时候啊。<hex:02100103>虽然没法热情款待你，不过你在这里可以随意待着。","0","0"
"594366","0","1","1","0","0","0","0","0","1","1","1","0","0","0","0","0","0","False","False","False","……25年前，我还住在多玛。<hex:02100103>帝国军攻入后，杀光了我的全家。","因为武力相差实在悬殊，我一直都觉得没有人能战胜帝国。<hex:02100103>但是现在一切都不一样了……<hex:02100103>不禁想要看看将来到底会怎么样啊。","0"
"594367","0","1","2","0","0","763","0","0","1","1","1","0","0","0","0","0","0","False","False","False","虽然我能理解夕雾的想法，不过……<hex:02100103>怎么说呢，对手可是那个芝诺斯，<hex:02100103>就算要暗杀，也不是件容易的事……","0","0"
"594368","0","1","2","0","0","766","0","0","1","1","1","0","0","0","0","0","0","False","False","False","芝诺斯……要来了……<hex:02100103>我该做些什么呢……","0","0"
"594369","0","1","2","0","0","763","0","0","1","1","1","0","0","0","0","0","0","False","False","False","哎呀，行动进展得还顺利吗？<hex:02100103>阿尔菲诺先生已经去和你们汇合了，<hex:02100103>塔塔露小姐今天依然在街上收集情报呢！","0","0"
"594370","0","1","2","0","0","763","0","0","1","1","1","0","0","0","0","0","0","False","False","False","<hex:022903EB0203>？<hex:02100103>解放多玛的大战在即，你怎么来这里了？<hex:02100103>你要是想了解海贼众的武器提供情况那就放心吧，一切都很顺利。","0","0"
"594371","0","1","2","0","0","764","0","0","1","1","1","0","0","0","0","0","0","False","False","False","哎呀，莫非是有好消息？","0","0"
"594372","0","1","2","0","0","763","0","0","1","1","1","0","0","0","0","0","0","False","False","False","接下来就该轮到解放阿拉米格了吧。<hex:02100103>罗罗力特对这件事也表示非常关注。","啊，放心，是支持你们的意思哦。<hex:02100103>因为这些帝国的行省，如果一直是行省的话，<hex:02100103>只会有百害而无一利。","0"
"594373","0","1","2","0","0","763","0","0","1","1","1","0","0","0","0","0","0","False","False","False","继多玛之后，你们又成功解放了阿拉米格，真是恭喜了。<hex:02100103>哎呀，真没想到你们能做到这个程度，<hex:02100103>恐怕连罗罗力特会长都没想到呢……","今后也请继续光顾我们东阿尔迪纳德商会哦！","0"
"594374","0","1","2","0","0","763","0","0","1","1","1","0","0","0","0","0","0","False","False","False","目前从外面来看，至少帝国大使馆没有什么动向。<hex:02100103>我相信多玛一定能够得到解放的！","0","0"
"594375","0","1","2","0","0","763","0","0","1","1","1","0","0","0","0","0","0","False","False","False","啊，<hex:022903EB0203>！<hex:02100103>你特意过来的嘛，好开心！","自从多玛得到解放后，<hex:02100103>有像是帝国的使者多次来到帝国大使馆……<hex:02100103>看来他们现在还没有商定好对策！","0"
"594376","0","1","2","0","0","763","0","0","1","1","1","0","0","0","0","0","0","False","False","False","<hex:022903EB0203>，辛苦你了！<hex:02100103>阿拉米格解放的喜讯已经传到这里了！","今后莉瑟也……<hex:02100103>虽然我也很想立刻回到艾欧泽亚，<hex:02100103>不过越是这种时候，越要留意不寻常的消息！","0"
"594377","0","1","2","0","0","764","0","0","1","1","1","0","0","0","0","0","0","False","False","False","同时指导两个人还是第一次，<hex:02100103>不过也许我自己也能发现些新东西。<hex:02100103>也请你们多多指教了。","0","0"
"594378","0","1","2","0","0","933","0","0","1","1","1","0","0","0","0","0","0","False","False","False","<hex:022903EB0203>，你进展如何？<hex:02100103>作为指导者，<hex:02100103>看到弟子铸甲匠每天过得都很充实真是太好不过了。","0","0"
"594379","0","1","2","0","0","4219","0","0","1","1","1","0","0","0","0","0","0","False","False","False","你已经熟悉东方铠甲的做法了吗？<hex:02100103>有不懂的随时问我！","0","0"
"594380","0","1","2","0","0","764","0","0","1","1","1","0","0","0","0","0","0","False","False","False","那之后我有空也请布兰修提尔教我西方铠甲的做法。<hex:02100103>西方和东方制作方法原来有这么大的差别，<hex:02100103>真是让我好好学习了一番。","0","0"
"594381","0","1","1","0","0","0","0","0","3","1","1","0","0","0","0","0","0","False","False","False","关于多玛的作战，没必要再多说些什么。<hex:02100103>我已经允许你们下达指令了。<hex:02100103>……不过，可不要把我和那个女人安排在一起行动。","0","0"
"594382","0","1","1","0","0","0","0","0","3","1","1","0","0","0","0","0","0","False","False","False","我们已经完成了在多玛的任务。<hex:02100103>那个国家的未来，就要靠那个国家的人去思考和建设了吧。<hex:02100103>当然前提是不要妨碍到我们奥罗尼部。","0","0"
"594383","0","1","1","1","1","0","0","0","3","3","3","0","0","0","0","0","0","False","False","False","哼……看来你也拿下了西方的战斗。<hex:02100103>这也是理所当然的，<hex:02100103>毕竟你可是那达慕的霸者。","不过，坐在下一届霸者宝座上的还会是我们。<hex:02100103>在先前那达慕上受伤的兄弟姐妹们也已经恢复了。<hex:02100103>当然巴图也是……","……毕竟他的妻子是一名优秀的医师。<hex:02100103>估计单凭爱意都可以完全治好他。<hex:02100103>那真的是……挺好的。"
"594384","0","1","2","0","0","950","0","0","1","1","1","0","0","0","0","0","0","False","False","False","你回来了，<hex:022903EB0203>！<hex:02100103>多玛那边派来的使者告诉了我们胜利的消息。","大家的愿望能够实现……真的是太好了……<hex:02100103>到访模儿部家园的勇士们，掀起了红莲之狂潮，<hex:02100103>我们也要把这事迹传唱下去才行啊。","0"
"594385","0","1","1","0","0","765","0","0","1","1","1","0","0","0","0","0","0","False","False","False","我听说豪雪的事了。<hex:02100103>他是否成为了一颗陨落的流星，这我们也不得而知……","不过，就像其日娜找到负伤的飞燕那样，<hex:02100103>总会有置之死地而后生的奇迹……<hex:02100103>在你前进的路上，一定也会看到与他所连接着的未来。","0"
"594386","0","1","2","0","0","763","0","0","1","1","1","0","0","0","0","0","0","False","False","False","嘶——感谢你们能够接受我们的委托。<hex:02100103>我还没有自我介绍，我叫伐折罗，<hex:02100103>名字的寓意为闪耀光辉的坚硬岩石。","我可以随时出发。<hex:02100103>等你们打算前往伽黎亚派的据点时，就来找我吧。","0"
"594387","0","1","1","0","0","758","712","0","1","1","1","0","0","0","0","0","0","False","False","False","嗯？<hex:02100103>阿答儿金部的亚德基拉是说我吗？","噗……哈哈哈哈哈哈哈！<hex:02100103>怎、怎怎怎、怎么可能！<hex:02100103>我只是可爱的波奇，并不知道什么族长候选人！","那种好像很容易被暗杀或者骗婚的职业，<hex:02100103>和开始了悠闲自如的店主生活的波奇无缘！<hex:02100103>别说那些乱七八糟的了，来吃了这个特制包子赶紧回去吧！"
"594388","0","1","0","0","0","924","0","0","1","1","1","0","0","0","0","0","0","False","False","False","父亲……你醒醒啊！","0","0"
"594389","0","1","2","0","0","4218","0","0","1","1","1","612","0","0","0","0","0","False","False","False","父亲他……再也回不来了。<hex:02100103>帝国把我唯一的亲人也夺走了……<hex:02100103>我……","0","0"
"594390","0","1","2","0","0","764","0","0","1","1","1","0","0","0","0","0","0","False","False","False","在帝国袭击中失去父亲后，我曾考虑要放下剑。<hex:02100103>但在同志的鼓励下，我选择了继续战斗。<hex:02100103>因为我觉得，父亲也会希望我这样做吧……","0","0"
"594391","0","1","2","0","0","708","0","0","1","1","1","0","0","0","0","0","0","False","False","False","我们终于赢得了自由……<hex:02100103>父亲如果泉下有知，一定也会很高兴的。<hex:02100103>真是太好了。","0","0"
"594392","0","1","2","0","0","737","0","0","1","1","1","0","0","0","0","0","0","False","False","False","店里的工具也好，食物也好，都被烧成了灰烬……<hex:02100103>不过好歹保住了一条命。","0","0"
"594393","0","1","2","0","0","1071","0","0","1","1","1","0","0","0","0","0","0","False","False","False","自上次的袭击之后，也有人从这行洗手不干了。<hex:02100103>不过我是个不肯死心的人……<hex:02100103>所以又重头开始，一点点筹集商品！","0","0"
"594394","0","1","2","0","0","708","0","0","1","1","1","0","0","0","0","0","0","False","False","False","怎么样，一段时间不见，神拳痕又重新复兴了吧？<hex:02100103>都是多亏商人们一起合作，四处筹集物资。","0","0"
"594395","0","1","2","0","0","764","0","0","1","1","1","0","0","0","0","0","0","False","False","False","祖国终于得到解放了。<hex:02100103>今后可要撸起袖子，大赚一笔了。<hex:02100103>我可不会输给乌尔达哈的商人的！","0","0"
"594396","0","1","0","0","0","0","0","0","1","1","1","0","0","0","0","0","0","False","False","False","太没用了……<hex:02100103>大家都在为了祖国的解放而战斗……<hex:02100103>可我甚至连剑都握不住……","0","0"
"594397","0","1","0","0","0","0","0","0","1","1","1","0","0","0","0","0","0","False","False","False","……听说你为了阿拉米格挺身而战？<hex:02100103>谢谢……我这副样子连行礼都做不到……<hex:02100103>不过，至少要对你说一声感谢……","0","0"
"594398","0","1","1","0","0","765","0","0","1","1","1","0","0","0","0","0","0","False","False","False","最近这里的家伙都有些坐不住。<hex:02100103>大家都焦虑不安地关注着基拉巴尼亚的动态。","0","0"
"594399","0","1","1","0","0","765","0","0","1","1","1","0","0","0","0","0","0","False","False","False","我最终还是决定留在了这里。<hex:02100103>因为解放后的阿拉米格和乌尔达哈增强交流的话，<hex:02100103>那么小阿拉米格可以作为中转地发挥作用。","0","0"
"594400","0","1","1","0","0","0","0","0","1","1","1","0","0","0","0","0","0","False","False","False","最、最近啊……身体状况好的时候，<hex:02100103>我会去给阿尔法恩老爷子帮忙制作草药……<hex:02100103>为了送去给前线……","0","0"
"594401","0","1","1","0","0","605","0","0","1","1","1","0","0","0","0","0","0","False","False","False","咳咳……虽然我的身体状况很糟……<hex:02100103>但心情是前所未有的好……<hex:02100103>终于给了帝国一次沉重的反击……","0","0"
"594402","0","1","1","0","0","756","0","0","1","1","1","0","0","0","0","0","0","False","False","False","我好歹也是阿拉米格的男子汉啊。<hex:02100103>周围的人都这么情绪高昂了，<hex:02100103>我也想多少出一份力。","0","0"
"594403","0","1","1","0","0","756","0","0","1","1","1","0","0","0","0","0","0","False","False","False","真是做梦也没想到，<hex:02100103>祖国的解放竟然能让人那么欣喜若狂……<hex:02100103>我果然也是骨子里留着阿拉米格血液的男子汉啊。","0","0"
"594404","0","1","2","0","0","764","0","0","1","1","1","0","0","0","0","0","0","False","False","False","我和回到基拉巴尼亚的梅弗里德队长合作<hex:02100103>帮助难民避难、交接物资什么的。<hex:02100103>就算身处窘境，也是有能做的事情的……","0","0"
"594405","0","1","2","0","0","690","0","0","1","1","1","0","0","0","0","0","0","False","False","False","我从解放军的联络员那里听说了。<hex:02100103>梅弗里德队长他被杀了……<hex:02100103>而且还是被同为阿拉米格人的女人……怎么会这样！","0","0"
"594406","0","1","2","0","0","757","0","0","1","1","1","0","0","0","0","0","0","False","False","False","我曾经被愤怒和后悔的情绪淹没过一段时间……<hex:02100103>但是那样根本没有脸面再面对梅弗里德队长。<hex:02100103>所以我就重新振作起来，完成我自己的使命。","0","0"
"594407","0","1","2","0","0","764","0","0","1","1","1","0","0","0","0","0","0","False","False","False","等这边的工作安顿好后，<hex:02100103>我想要到神拳痕那边去。<hex:02100103>得给梅弗里德队长带些酒过去才行啊。","0","0"
"594408","0","1","2","0","0","764","756","0","1","1","1","0","0","0","0","0","0","False","False","False","没想到那时的那个冒险者，竟然成为了解放阿拉米格的英雄。<hex:02100103>我震惊的同时，也打心底里感谢你。<hex:02100103>谢谢你为我的祖国而战。","接下来，我要好好考虑一下，<hex:02100103>是回到解放后的阿拉米格呢，<hex:02100103>还是继续留在这森林中生活……","0"
"594409","0","1","0","0","0","0","0","0","1","1","1","0","0","0","0","0","0","False","False","False","哈……哈……<hex:02100103>当看到面前有这么耀眼的希望……<hex:02100103>想要继续活下去的心情也会变得更加强烈……","0","0"
"594410","0","1","2","0","0","756","933","0","1","1","1","0","0","0","0","0","0","False","False","False","阿拉米格的解放终于成为了现实。<hex:02100103>当然，我们欣喜之余也不能大意。","因为我们不仅要提防帝国的军事力量，<hex:02100103>还要留意像骸旅团这样的旧王家势力，以防他们趁机复权。","0"
"594411","0","1","1","0","0","0","0","0","1","1","1","0","0","0","0","0","0","False","False","False","你是来看望我的吗？<hex:02100103>虽然我很高兴，但你还有要去的地方。<hex:02100103>我没事的……你要平安回来啊。","0","0"
"594412","0","1","2","0","0","764","0","0","1","1","1","0","0","0","0","0","0","False","False","False","<hex:022903EB0203>阁下？！<hex:02100103>你回来了啊！","0","0"
"594413","0","1","2","0","0","764","0","0","1","1","1","0","0","0","0","0","0","False","False","False","哦！你在这里，这么说飞燕大人他也在了？！","0","0"
"594414","0","1","2","0","0","764","0","0","1","1","1","0","0","0","0","0","0","False","False","False","攻占了威罗迪纳大桥后，<hex:02100103>可以说雷天军星作战向前迈进了一大步。<hex:02100103>今后这个基地就是物资补给方面的重要一环了。","0","0"
