"597514","0","1","2","0","0","722","0","0","1","1","1","0","0","0","0","0","0","False","False","False","嗨！你好啊！<hex:02100103>人家是愛情傳教士，莉賽特．德．瓦倫提昂，<hex:02100103>大夥都叫人家小莉呢！","你有在好好享受戀人節嗎？<hex:02100103>你就趁著這個機會，將心中的「愛」<hex:02100103>傳達給意中人吧，一定會有好事發生的！","0"
"597515","0","1","2","0","0","695","0","0","1","1","1","0","0","0","0","0","0","False","False","False","這次的戀人節也是十分的熱鬧呢！<hex:02100103>小莉真心祝願大家能夠趁著這個節日<hex:02100103>將心中的愛意傳達給意中人！","0","0"
"597516","0","1","2","0","0","708","0","0","1","1","1","0","0","0","0","0","0","False","False","False","品嘗到了愛情滋味的普庫緹．皮叩，<hex:02100103>還有結下了姻緣的阿洛伊絲和埃佐勒米萊！<hex:02100103>愛情真是偉大！所以人家才不想辭去愛情傳教士這份工作呢！","0","0"
"597517","0","1","2","0","0","766","0","0","1","1","1","0","0","0","0","0","0","False","False","False","嗯……<hex:02100103>庫普卡．叩普他沒事吧……","0","0"
"597518","0","1","2","0","0","764","0","0","1","1","1","0","0","0","0","0","0","False","False","False","庫普卡．叩普的委託到底是什麼呢？","0","0"
"597519","0","1","2","0","0","763","0","0","1","1","1","0","0","0","0","0","0","False","False","False","普庫緹．皮叩的絨球變成了心形，真是令人驚訝！<hex:02100103>難道是因為體驗到了愛情，所以形狀發生了變化嗎……<hex:02100103>那要是體驗其他的事情，會不會變成星形呢？","0","0"
"597520","0","1","2","0","0","945","0","0","1","1","1","0","0","0","0","0","0","False","False","False","雖然不清楚絨球到底是基於什麼原理變成了心形，<hex:02100103>不過這感覺倒也不賴。正因為人家說莫古看上去能帶來姻緣，<hex:02100103>所以莫古才開始擔任起了愛情郵務士庫啵。","0","0"
"597521","0","1","2","0","0","764","0","0","1","1","1","0","0","0","0","0","0","False","False","False","埃佐勒米萊說我總是習慣一個人想方設法解決問題，<hex:02100103>這並不是一個好習慣。<hex:02100103>所以今後如果再遇到問題的話，我會找他商量的。","0","0"
"597522","0","1","2","0","0","763","0","0","1","1","1","0","0","0","0","0","0","False","False","False","就是我在城裡感到身體不適的那個時候遇到了阿洛伊絲。<hex:02100103>我本以為命運的相遇只會存在於故事之中。<hex:02100103>沒想到現實中真的有這種不可思議的緣分呢。","0","0"
"597523","0","1","2","0","0","738","0","0","1","1","1","0","0","0","0","0","0","False","False","False","這裡正在舉辦愛情慶典——戀人節！<hex:02100103>你心中是否也隱藏著濃濃的愛情呢？<hex:02100103>藉著這個節日，將你的愛傳達給重要的人吧！","0","0"
"597524","0","1","2","0","0","950","0","0","1","1","1","0","0","0","0","0","0","False","False","False","你的心中是否也燃燒著熾熱的愛情之火呢？<hex:02100103>來一起將炒熱這個熱烈的季節吧！","0","0"
"597525","0","1","2","0","0","5696","0","0","1","1","1","0","0","0","0","0","0","False","False","False","這裡正在舉辦愛情慶典——戀人節！<hex:02100103>希望你也與美妙的愛情相遇……","0","0"
"597526","0","1","1","0","0","755","755","0","1","1","1","0","0","0","8","8","8","False","False","False","<hex:024804F2022303>能有客人來真好。<hex:02100103>不過這裡只有完成了使命的我而已……<hex:02100103>像你們這樣要向未來邁進的人不應該停留在這裡。<hex:0248020103>","<hex:024804F2022303>好了，出發吧……<hex:02100103>海德林並沒有要求我對人類怎樣。<hex:02100103>沒錯……沒有這樣要求我……<hex:0248020103>","0"
"597527","0","1","2","0","0","764","0","0","1","1","1","0","0","0","0","0","0","False","False","False","總之這樣下去也是束手無策。<hex:02100103>我只能選擇相信你們和你們的熟人了……","0","0"
"597528","0","1","1","0","0","755","0","0","1","1","1","0","0","0","8","8","8","False","False","False","<hex:024804F2022303>我已經確認到月球與海德林之間那細微的聯繫<hex:02100103>如今也已經徹底切斷了。<hex:02100103>她……終於可以休息了……<hex:0248020103>","0","0"
"597529","0","1","2","0","0","4219","0","0","1","1","1","0","0","0","0","0","0","False","False","False","為了協助茶．拉恰的研究，<hex:02100103>我一直在屯集堂忙來忙去，<hex:02100103>感覺在完成論文之前都閒不下來了！","0","0"
"597530","0","1","2","0","0","763","0","0","1","1","1","0","0","0","0","0","0","False","False","False","茶．拉恰還換了一身行頭，<hex:02100103>是不是感覺更像個教授了？<hex:02100103>如今整個研究室團結一心，下次研究也要好好支援他才行！","0","0"
"597531","0","1","1","0","0","757","0","0","1","1","1","0","0","0","0","0","0","False","False","False","好在是順利把鯨魚送了出去。<hex:02100103>那麼接下來得抓緊思考<hex:02100103>下一個研究主題才行了！","0","0"
"597532","0","1","2","0","0","763","0","0","1","1","1","0","0","0","0","0","0","False","False","False","來幫忙的學生也增多了，一下子變得很熱鬧對吧？<hex:02100103>接下來的研究也受到了乙太系教授們的矚目，<hex:02100103>目前正在改進樣本測量的體制！","0","0"
"597533","0","1","1","0","0","764","0","0","1","1","1","0","0","0","0","7","7","False","False","False","非常抱歉。<hex:02100103>這裡只對註冊了拾穗人總會魔物狩獵制度的人開放。","要接受舊薩雷安的支線任務「初階總會魔物狩獵」需滿足以下條件。","1.完成支線任務「伊修加爾德的惡名菁英」。<hex:02100103>2.完成「曉月的終焉主線任務」中的「舊薩雷安」。"
"597534","0","1","2","0","0","764","0","0","1","1","1","0","0","0","0","0","0","False","False","False","哎呀，你要交換魔晶石嗎？<hex:02100103>歡迎歡迎！","0","0"
"597535","0","1","2","0","0","4219","0","0","1","1","1","0","0","0","0","0","0","False","False","False","啊，英雄閣下。<hex:02100103>皇都伊修加爾德也出現了偽神獸。<hex:02100103>而且和龍長得很像……","0","0"
"597536","0","1","2","0","0","764","0","0","1","1","1","0","0","0","0","0","0","False","False","False","我國針對偽神獸的策略<hex:02100103>正在以艾默里克閣下和阿圖瓦雷爾閣下為中心進行推進。<hex:02100103>非常感謝英雄閣下的幫助！","0","0"
"597537","0","1","2","0","0","764","0","0","1","1","1","0","0","0","0","0","0","False","False","False","感謝英雄閣下遠道而來！<hex:02100103>這邊目前正在收集來自各國的關於偽神獸的情報，<hex:02100103>並隨時傳遞給皇都。","0","0"
"597538","0","1","2","0","0","764","0","0","1","1","1","0","0","0","0","0","0","False","False","False","英雄閣下！<hex:02100103>非常感謝你幫忙討伐偽神獸！<hex:02100103>希望下次有機會可以聽聽你的冒險故事！","0","0"
"597539","0","1","2","0","0","4218","0","0","1","1","1","0","0","0","0","0","0","False","False","False","出現在我國的偽神獸<hex:02100103>飛行能力出眾，逃跑速度很快。<hex:02100103>所以我們現在需要能夠遠程攻擊它的高手……","0","0"
"597540","0","1","2","0","0","764","0","0","1","1","1","0","0","0","0","0","0","False","False","False","如果閣下願意協助多瑪對付偽神獸，<hex:02100103>就請前往多瑪飛地，與夕霧大人打聲招呼。<hex:02100103>拜託了。","0","0"
"597541","0","1","2","0","0","764","0","0","1","1","1","0","0","0","0","0","0","False","False","False","<hex:022903EB0203>閣下，<hex:02100103>請繼續協助多瑪對付偽神獸。","0","0"
"597542","0","1","2","0","0","1062","0","0","1","1","1","0","0","0","0","0","0","False","False","False","<hex:022903EB0203>閣下，感謝你拯救了我的故鄉。<hex:02100103>待我回到故鄉之際，也要去岩燕廟拜一拜。","0","0"
"597543","0","0","0","0","0","0","0","0","0","0","0","0","0","0","0","0","0","False","False","False","","",""
"597544","0","1","2","0","0","764","0","0","1","1","1","0","0","0","0","0","0","False","False","False","你身為代理團長應該還有要做的事吧？","0","0"
"597545","0","1","2","0","0","5665","0","0","1","1","1","0","0","0","0","0","0","False","False","False","是你啊……<hex:02100103>該不會是又惹了什麼麻煩吧……","開玩笑的啦。<hex:02100103>下次要是再發生了什麼，我會把那個喜歡捉迷藏的男人<hex:02100103>和霧鬚老爺子一起拉出來的。","0"
"597546","0","1","2","0","0","768","0","0","1","1","1","0","0","0","0","0","0","False","False","False","代理團長啊，什麼時候才能去戰鬥啊！","0","0"
"597547","0","1","2","0","0","4219","0","768","1","1","1","0","0","0","0","0","0","False","False","False","喲，代理團長……已經結束了啊。<hex:02100103>你也見識過團長的身手了吧。","旅團剛剛成立之時，我曾向團長提出了決鬥。<hex:02100103>團長那傢伙說要以平等的條件進行對決，<hex:02100103>沒有選擇他擅長的槍，而是以我擅長的長矛進行比試。","可結果依然是以我的慘敗告終。<hex:02100103>自那之後，我就一直在追隨團長的腳步。<hex:02100103>終有一天，我一定要打敗他！"
"597548","0","1","2","0","0","4218","0","0","1","1","1","0","0","0","0","0","0","False","False","False","雖說要重新作為海雄旅團的團員出任務了，<hex:02100103>但是族長的擔子也不能撂下。","0","0"
"597549","0","1","0","2","0","1041","764","0","1","1","1","0","0","0","0","0","0","False","False","False","話說團長那傢伙雖然消失了五年，<hex:02100103>但身手卻完全沒有退步啊……","哦，是你啊。<hex:02100103>既然你這麼有空，<hex:02100103>那就陪我一起修行吧！","0"
"597550","0","1","2","0","0","764","0","0","1","1","1","0","0","0","0","0","0","False","False","False","你問我在這裡做什麼？<hex:02100103>哈哈，怎麼能讓這麼好的酒浪費掉呢？","0","0"
"597551","0","1","2","0","0","763","0","0","1","1","1","0","0","0","0","0","0","False","False","False","哎呀，又見面了啊。","看來比起充滿血腥味的戰鬥，<hex:02100103>還是美酒更適合我啊。<hex:02100103>不像朗德內爾和烏．歐德……","0"
"597552","0","1","2","0","0","945","0","0","1","1","1","0","0","0","0","0","0","False","False","False","呼哧……呼哧……<hex:02100103>衝啊衝啊 海雄旅團！<hex:02100103>打倒那些 壞傢伙！","0","0"
"597553","0","1","2","0","0","763","0","0","1","1","1","0","0","0","0","0","0","False","False","False","呼哧……呼哧……<hex:02100103>難道是要再次組建海雄旅團了嗎？！<hex:02100103>哥布的新兵器終於要公開了嗎？！","什麼啊，不是嗎？真是可惜！<hex:02100103>但畢竟你是哥布的盟友，<hex:02100103>歡迎隨時過來！","0"
"597554","0","1","0","0","0","1041","0","0","1","1","1","0","0","0","0","0","0","False","False","False","喂喂，是不是有點太心急了？<hex:02100103>到我出場還早著呢……","當然這只是我的自言自語而已。<hex:02100103>沒錯……我就是無處不在的只與海為伍的男人……","0"
"597555","0","1","2","0","0","764","0","0","1","1","1","0","0","0","0","0","0","False","False","False","這裡是羅薇娜商會的交易窗口。<hex:02100103>很抱歉，我們這裡採用私人推薦制。","0","0"
"597556","0","1","2","0","0","764","0","0","1","1","1","0","0","0","0","0","0","False","False","False","請問您擁有羅薇娜商會發行的工票嗎？<hex:02100103>如果您想要使用工票進行交換的話，<hex:02100103>就請您看看可供交換的物品的目錄吧。","0","0"
"597557","0","1","0","0","0","0","0","0","1","1","1","0","0","0","0","0","0","False","False","False","要是能有不畏懼那傢伙的特殊能力，<hex:02100103>足以保護嘉恩．艾大人的勇者就好了……","0","0"
"597558","0","1","2","0","0","763","0","0","1","1","1","0","0","0","0","0","0","False","False","False","有關討伐格萊普尼爾的進展，可以隨時從本國瞭解。<hex:02100103>總之在作戰結束前要多麻煩你了！","0","0"
"597559","0","1","2","0","0","763","0","0","1","1","1","0","0","0","0","0","0","False","False","False","有關討伐格萊普尼爾的進展，可以隨時從本國瞭解。<hex:02100103>總之在作戰結束前要多麻煩你了！","0","0"
"597560","0","1","2","0","0","763","0","0","1","1","1","0","0","0","0","0","0","False","False","False","雖然籠罩著格里達尼亞的烏雲已經散去，但這並不意味著結束。<hex:02100103>讓和平儘早到來，才是對你最大的回報……<hex:02100103>再次向你表示感謝！","0","0"
"597561","0","1","2","0","0","764","0","0","1","1","1","0","0","0","0","0","0","False","False","False","阿拉米格似乎出現了偽神獸。<hex:02100103>希望你能支援我們……","0","0"
"597562","0","1","2","0","0","763","0","0","1","1","1","0","0","0","0","0","0","False","False","False","烏爾達哈隨時都有可能會出現偽神獸。<hex:02100103>但是下官相信，願意傾聽貧民和難民們聲音的娜娜莫陛下<hex:02100103>一定可以平息大家的不安情緒。","0","0"
"597563","0","1","2","0","0","694","0","0","1","1","1","0","0","0","0","0","0","False","False","False","非常感謝你拯救同盟國阿拉米格於危難之中！","0","0"
"597564","0","1","2","0","0","764","0","0","1","1","1","0","0","0","0","0","0","False","False","False","我們的目的是要填補阿拉米格人之間那根深蒂固的嫌隙。<hex:02100103>白羽會就是懷揣著這樣的願望而誕生，<hex:02100103>其名字就由來於作為團結的象徵的白色獅鷲。","0","0"
"597565","0","1","0","0","0","766","0","0","1","1","1","0","0","0","0","0","0","False","False","False","偽神獸在我們國家也出現了……<hex:02100103>目前我們治療人手不足，不知道能撐到什麼時候……","0","0"
"597566","0","1","2","0","0","4219","0","0","1","1","1","0","0","0","0","0","0","False","False","False","祖國處於危機之中，自己卻不能前往營救，著實慚愧，<hex:02100103>不過能有<hex:022903EB0203>閣下在我就放心了。<hex:02100103>阿拉米格就拜託你了！","0","0"
"597567","0","1","2","0","0","764","5533","0","1","1","1","0","0","0","0","0","0","False","False","False","<hex:022903EB0203>閣下，此次非常感謝你幫忙討伐偽神獸。","在瞭解了事情的大致經過之後，<hex:02100103>身為一名阿拉米格人，我思考了很多。<hex:02100103>我一定要建構一個人人平安順遂的國度。","0"
"597568","0","1","2","0","0","764","0","0","1","1","1","0","0","0","0","0","0","False","False","False","你來了啊，感謝你如此費心。<hex:02100103>那之後順利進行了追悼儀式。<hex:02100103>如此一來，就可以悼念所有死去的同胞了。","我一直覺得，如果自己動作可以再快一點，或許就能救出查萊特了。<hex:02100103>作為那場戰爭的親身經歷者，<hex:02100103>我發誓絕對不能讓他白白犧牲。","0"
"597569","0","1","2","0","0","767","0","0","1","1","1","0","0","0","0","7","0","False","False","False","不好意思，現在還在準備階段。<hex:02100103>我們打算將保管院用不著的物品都發放出去，<hex:02100103>目前正在整理庫存。","需要將「主線任務：曉月的終焉」推進到特定的階段<hex:02100103>才能開始與當前地區的廣域交易商進行交易。","0"
"597570","0","1","2","0","0","767","0","0","1","1","1","0","0","0","0","0","0","False","False","False","你對珍稀物品感興趣嗎？<hex:02100103>我們打算將保管院用不著的物品都發放出去，<hex:02100103>你可以使用雙色寶石進行交換。","0","0"
"597571","0","1","2","0","0","767","0","0","1","1","1","0","0","0","0","0","0","False","False","False","目前發放的物品是這些……<hex:02100103>如今迷津的物流行業發展迅速，如果拾穗人們表現活躍的話，<hex:02100103>商品也能有所增加，庫存也會更加豐富。","0","0"
"597572","0","1","2","0","0","767","0","0","1","1","1","0","0","0","0","0","0","False","False","False","目前發放的物品是這些……<hex:02100103>本領高強的拾穗人們為我們收集了很多物品，<hex:02100103>有一些庫存過多，所以我們打算發放一批。","0","0"
"597573","0","1","2","0","0","767","0","0","1","1","1","0","0","0","0","0","0","False","False","False","目前發放的物品是這些……<hex:02100103>感覺拾穗人們的幹勁有點十足過頭了，<hex:02100103>如今不僅庫存充足，還多出了很多稀有物品。","0","0"
"597574","0","1","2","0","0","767","0","0","1","1","1","0","0","0","0","7","0","False","False","False","很抱歉，現在無法進行交易。<hex:02100103>由於目前行業不景氣，物流也受到了影響……<hex:02100103>搞得我心情也不好。","需要將「主線任務：曉月的終焉」推進到特定的階段<hex:02100103>才能開始與當前地區的廣域交易商進行交易。","0"
"597575","0","1","2","0","0","767","0","0","1","1","1","0","0","0","0","0","0","False","False","False","歡迎光臨。<hex:02100103>我也不能因為不景氣就一直不開張，<hex:02100103>所以現在重新開啟雙色寶石的交易！","0","0"
"597576","0","1","2","0","0","767","0","0","1","1","1","0","0","0","0","0","0","False","False","False","雖然商品有點少，不過還是看一下吧！<hex:02100103>等到薩維奈島的治安穩定一些，物流恢復了之後，<hex:02100103>相信商品肯定就會有所增加了。","0","0"
"597577","0","1","2","0","0","767","0","0","1","1","1","0","0","0","0","0","0","False","False","False","來看看商品吧！<hex:02100103>目前薩維奈島的物流多少恢復了一些……<hex:02100103>所以商品的數量也有所增加。","0","0"
"597578","0","1","2","0","0","767","0","0","1","1","1","0","0","0","0","0","0","False","False","False","快來看看這琳琅滿目的商品！<hex:02100103>雖然之前不太景氣，不過如今物流恢復，<hex:02100103>商品數量也豐富了很多！","0","0"
"597579","0","1","2","0","0","767","0","0","1","1","1","0","0","0","0","7","0","False","False","False","我是一名隨軍商人。<hex:02100103>一直都是跟隨軍隊四處做買賣……<hex:02100103>目前還在準備當中，請稍後再來！","需要將「主線任務：曉月的終焉」推進到特定的階段<hex:02100103>才能開始與當前地區的廣域交易商進行交易。","0"
"597580","0","1","2","0","0","767","0","0","1","1","1","0","0","0","0","0","0","False","False","False","雖然這地方氣候嚴寒，但我這裡卻很溫暖！<hex:02100103>這裡是我收集到的稀有物品！<hex:02100103>可以用雙色寶石進行交換！","0","0"
"597581","0","1","2","0","0","767","0","0","1","1","1","0","0","0","0","0","0","False","False","False","看看有沒有想要的？<hex:02100103>要是沒有的話還請見諒。<hex:02100103>等到加雷馬安全之後，我就可以去籌備商品了……","0","0"
"597582","0","1","2","0","0","767","0","0","1","1","1","0","0","0","0","0","0","False","False","False","有沒有看到想要的東西？<hex:02100103>這裡還有最近從加雷馬的廢墟挖掘出來的東西……<hex:02100103>其中不乏有趣的商品哦。","0","0"
"597583","0","1","2","0","0","767","0","0","1","1","1","0","0","0","0","0","0","False","False","False","是不是想要的東西太多無從下手了？<hex:02100103>由於危險的魔導兵器和野生生物都被清理掉了，<hex:02100103>所以廢墟探索方面也進展得很順利，找到了不少有趣的東西。","0","0"
"597584","0","1","2","0","0","767","0","0","1","1","1","0","0","0","0","7","0","False","False","False","我是經營威！<hex:02100103>我想模仿亞伊太利斯的人們經營生意，<hex:02100103>可是卻完全不得要領！","需要將「主線任務：曉月的終焉」推進到特定的階段<hex:02100103>才能開始與當前地區的廣域交易商進行交易。","0"
"597585","0","1","2","0","0","767","0","0","1","1","1","0","0","0","0","0","0","False","False","False","我是經營威！<hex:02100103>我在模仿亞伊太利斯的人們經營生意！<hex:02100103>請拿閃閃發光的雙色寶石來進行交換吧！","0","0"
"597586","0","1","2","0","0","767","0","0","1","1","1","0","0","0","0","0","0","False","False","False","雖然商品數量有限，不過還請看一下吧！<hex:02100103>其實我是想在月球上多開發一些特產的，<hex:02100103>只可惜嘆息海太過危險，事情沒有想像中的那樣順利……","0","0"
"597587","0","1","2","0","0","767","0","0","1","1","1","0","0","0","0","0","0","False","False","False","商品數量稍微增加了一些，快來看看吧！<hex:02100103>雖然嘆息海依然很危險，不過多虧了協助機的幫助，<hex:02100103>材料收集工作順利展開，目前正在進行商品開發！","0","0"
"597588","0","1","2","0","0","767","0","0","1","1","1","0","0","0","0","0","0","False","False","False","商品數量大幅增加，快點來看看啊！<hex:02100103>最近嘆息海的危險少了很多，協助機也在全力工作，<hex:02100103>商品開發和生產都進行得很順利！","0","0"
"597589","0","1","2","0","0","767","0","0","1","1","1","0","0","0","0","7","0","False","False","False","我創造的創造生物不知為何<hex:02100103>只吃雙色寶石……<hex:02100103>所以我得想辦法多賺一些才行。","需要將「主線任務：曉月的終焉」推進到特定的階段<hex:02100103>才能開始與當前地區的廣域交易商進行交易。","0"
"597590","0","1","2","0","0","767","0","0","1","1","1","0","0","0","0","0","0","False","False","False","我創造的創造生物不知為何<hex:02100103>只吃雙色寶石……<hex:02100103>所以我才開始了交易！","0","0"
"597591","0","1","2","0","0","767","0","0","1","1","1","0","0","0","0","0","0","False","False","False","目前可以交換的商品是這些。<hex:02100103>等到厄爾庇斯變得更加安靜一些，能有助於沉思之時，<hex:02100103>或許我就可以想到一些新商品了……","0","0"
"597592","0","1","2","0","0","767","0","0","1","1","1","0","0","0","0","0","0","False","False","False","可以交換的商品是這些。<hex:02100103>最近我走在村落外面沉思的時候，<hex:02100103>突然靈光一閃想到了新的商品！","0","0"
"597593","0","1","2","0","0","767","0","0","1","1","1","0","0","0","0","0","0","False","False","False","可以交換的商品增加了不少呢。<hex:02100103>在厄爾庇斯散步時，新商品的點子不斷湧現，<hex:02100103>所以我每天都在不停地使用創造魔法！","0","0"
"597594","0","1","2","0","0","767","0","0","1","1","1","0","0","0","11","7","0","False","False","False","交易協議錯誤。<hex:02100103>正在檢查錯誤，請稍候。","需要將「主線任務：曉月的終焉」推進到特定的階段<hex:02100103>才能開始與當前地區的廣域交易商進行交易。","0"
"597595","0","1","2","0","0","767","0","0","1","1","1","0","0","0","11","0","0","False","False","False","啟動交易協議。<hex:02100103>雖然沒有意義，但請按照程式，<hex:02100103>開始進行雙色寶石交易。","0","0"
"597596","0","1","2","0","0","767","0","0","1","1","1","0","0","0","11","0","0","False","False","False","顯示交易品列表……<hex:02100103>商品不足的主要原因有89.6%的機率<hex:02100103>是由於資源籌備機器人的回歸率太低所致。","0","0"
"597597","0","1","2","0","0","767","0","0","1","1","1","0","0","0","11","0","0","False","False","False","顯示交易品列表……<hex:02100103>商品增加的主要原因有93.5%的機率<hex:02100103>是由於伴隨著危險度的下降，資源籌備機器人的回歸率提升所致。","0","0"
"597598","0","1","2","0","0","767","0","0","1","1","1","0","0","0","11","0","0","False","False","False","整體顯示交易品列表……<hex:02100103>商品充實的主要原因有99.8%的機率<hex:02100103>是由於你的活躍表現，提高了周圍環境的安全性所致。","0","0"
"597599","0","1","0","0","0","0","0","0","1","1","1","0","0","0","7","7","0","False","False","False","可以和當前區域的廣域交易商進行交易了！<hex:02100103>在廣域交易商處可使用雙色寶石交換多種道具。","另外，提升危命任務的完成次數<hex:02100103>可以相應增加該區域廣域交易商提供的道具種類。<hex:02100103>建議積極參加危命任務。","0"
"597600","0","1","2","0","0","767","0","0","1","1","1","0","0","0","0","0","0","False","False","False","非常抱歉。<hex:02100103>目前無法進行交易。","0","0"
"597601","0","1","2","0","0","767","0","0","1","1","1","0","0","0","0","7","0","False","False","False","非常抱歉。<hex:02100103>由於各地的物流停滯，導致商品進貨推遲。<hex:02100103>目前暫時無法進行交易，請諒解。","需要將「主線任務：曉月的終焉」推進到特定的階段<hex:02100103>才能開始與當前地區的廣域交易商進行交易。","0"
"597602","0","1","2","0","0","767","0","0","1","1","1","0","0","0","0","7","0","False","False","False","非常抱歉。<hex:02100103>由於各地的物流停滯，導致商品進貨推遲。<hex:02100103>目前暫時無法進行交易，請諒解。","需要使迷津、薩維奈島、加雷馬、嘆息海、<hex:02100103>厄爾庇斯、天外天垓的危命任務完成度達到3級<hex:02100103>才能開始進行交易。","0"
