"597324","0","1","2","0","0","766","0","0","1","1","1","0","0","0","0","0","0","False","False","False","亞拉戈帝國就連如此細緻的工作都交給那個球來做嗎？<hex:02100103>所以工匠們只要負責操作就可以了嗎？<hex:02100103>有些無聊，又有些不錯……","0","0"
"597325","0","1","2","0","0","764","0","0","1","1","1","0","0","0","0","0","0","False","False","False","並不是所有擁有出眾才能之人的人格都很高尚。<hex:02100103>我也是最近才明白了這個可悲的現實。<hex:02100103>啊……當然了，我並不是在說解放者閣下！","0","0"
"597326","0","1","2","0","0","766","0","0","1","1","1","0","0","0","0","0","0","False","False","False","這樣下去的話，羅薇娜商會的影響力就有些過於強大了。<hex:02100103>我一定要好好守護反抗軍的財富才行……","0","0"
"597327","0","1","2","0","0","764","0","0","1","1","1","0","0","0","0","0","0","False","False","False","嗶嗶……正在確認輸入資料……<hex:02100103>反抗軍武器、博茲雅、探覺石……<hex:02100103>羅薇娜商會、優惠商品……嗶——","0","0"
"597328","0","1","2","0","0","763","0","0","1","1","1","0","0","0","0","0","0","False","False","False","來魯什芒德紀念醫院有事嗎？<hex:02100103>如果是來探望長期住院的患者的話，<hex:02100103>請從樓下進入。","0","0"
"597329","0","1","2","0","0","4219","0","0","1","1","1","0","0","0","0","0","0","False","False","False","歡迎來到魯什芒德紀念醫院。<hex:02100103>處於長期療養的患者如今心情都好了很多，<hex:02100103>如果要見面的話隨時歡迎！","0","0"
"597330","0","1","2","0","0","764","0","0","1","1","1","0","0","0","0","0","0","False","False","False","這個房間是為需要長期療養的重傷者準備的。<hex:02100103>在有患者休息的房間請保持安靜。","0","0"
"597331","0","1","2","0","0","764","0","0","1","1","1","0","0","0","0","0","0","False","False","False","里奧爾已經前往各國的同盟軍那裡了。<hex:02100103>他說為了加強合作，光靠通訊是不行的，<hex:02100103>一定要當面交流才行。","0","0"
"597332","0","1","2","0","0","764","0","0","1","1","1","0","0","0","0","0","0","False","False","False","你喜不喜歡珍貴的東西？<hex:02100103>我這裡有不少別的地方見不到的珍稀物品哦。<hex:02100103>價格的話……物以稀為貴嘛。","0","0"
"597333","0","1","2","0","0","764","0","0","1","1","1","0","0","0","0","0","0","False","False","False","我這裡有不少珍稀物品哦。<hex:02100103>有興趣的話請務必來看看。<hex:02100103>雖然價格高昂，但我敢保證，每一樣都是好東西。","0","0"
"597334","0","1","2","0","0","1071","0","0","1","1","1","0","0","0","0","0","0","False","False","False","接下來可有得忙了。","0","0"
"597335","0","1","2","0","0","1041","0","0","1","1","1","0","0","0","0","0","0","False","False","False","村子要是恢復了以前的樣子，<hex:02100103>科諾古自然也就回來了吧……","0","0"
"597336","0","1","2","0","0","766","0","0","1","1","1","0","0","0","0","0","0","False","False","False","總覺得格拉古的樣子有些奇怪，他沒事吧……","0","0"
"597337","0","1","2","0","0","4218","0","0","1","1","1","0","0","0","0","0","0","False","False","False","科諾古現在正在哪裡做什麼呢……","0","0"
"597338","0","1","2","0","0","766","0","0","1","1","1","0","0","0","0","0","0","False","False","False","雖然很擔心科諾古，<hex:02100103>但格拉古也很讓人在意……","0","0"
"597339","0","1","2","0","0","1024","0","0","1","1","1","0","0","0","0","0","0","False","False","False","格拉古……","0","0"
"597340","0","1","2","0","0","764","0","0","1","1","1","0","0","0","0","0","0","False","False","False","這個村子，還有村民們能有今天，都是多虧了你。<hex:02100103>你已經算是這個村子的一員了，所以有空一定要常來啊。","0","0"
"597341","0","1","2","2","0","4218","0","0","1","1","1","0","0","0","0","0","0","False","False","False","已經沒有什麼需要再麻煩你的事情了……","這種時候到底該說什麼才好呢……<hex:02100103>謝謝……<hex:02100103>感謝你這麼長時間的幫助。","0"
"597342","0","1","2","0","0","763","0","0","1","1","1","0","0","0","0","0","0","False","False","False","要是能把那些未知的技術和矮人的技術結合起來，<hex:02100103>創造出新的技術就好了。<hex:02100103>那在這裡的生活就會一下子變得方便許多。","0","0"
"597343","0","1","2","0","0","4219","0","0","1","1","1","0","0","0","0","0","0","False","False","False","有了口齒伶俐的傢伙來幫忙，<hex:02100103>今後就可以展開更多的活動了。","0","0"
"597344","0","1","2","0","0","763","0","0","1","1","1","0","0","0","0","0","0","False","False","False","你覺得村子是恢復成以前的樣子了嗎？<hex:02100103>在我看來，村子比以前變得好多了。","0","0"
"597345","0","1","2","0","0","766","0","0","1","1","1","0","0","0","0","0","0","False","False","False","啊——啊——嗯哼。<hex:02100103>為了賣出更高的價格，我得練習一下叫賣的技術才行。","0","0"
"597346","0","1","0","0","0","0","0","0","0","0","1","0","0","0","0","7","0","False","False","False","……","雙唇緊閉。<hex:02100103>看起來什麼都不打算說。","0"
"597347","0","1","2","0","0","1041","0","0","1","1","1","0","0","0","0","0","0","False","False","False","雖然村子已經恢復了原樣，但我們還得繼續努力。<hex:02100103>畢竟還要繼續生活嘛。","0","0"
"597348","0","1","2","0","0","4219","0","0","1","1","1","0","0","0","0","0","0","False","False","False","我要努力成為像你一樣的人。","0","0"
"597349","0","1","2","0","0","4218","0","0","1","1","1","0","0","0","0","0","0","False","False","False","能請你告訴我要怎麼做才能變得和你一樣勇敢嗎？","0","0"
"597350","0","1","2","0","0","5533","0","0","1","1","1","0","0","0","0","0","0","False","False","False","這個村子已經變了，<hex:02100103>我也不能再繼續原地踏步了啊。","0","0"
"597351","0","1","2","0","0","950","0","0","1","1","1","0","0","0","0","0","0","False","False","False","難道說你迷上小可愛們了？！真是太好了！<hex:02100103>要進入彩蛋預言雞舍嗎？","0","0"
"597352","0","1","2","0","0","950","0","0","1","1","1","0","0","0","0","0","0","False","False","False","你已經和小可愛們交流完了？<hex:02100103>要離開彩蛋預言雞舍嗎？","0","0"
"597353","0","1","2","0","0","708","0","0","1","1","1","0","0","0","0","0","0","False","False","False","彩蛋～彩蛋～大彩蛋～<hex:02100103>我是彩蛋狩獵活動的主辦人吉莉．阿里亞珀！<hex:02100103>你也來好好享受一下這個活動吧！","0","0"
"597354","0","1","2","0","0","4219","708","0","1","1","1","0","0","0","0","0","0","False","False","False","餅乾剛一烤好就沒了……<hex:02100103>沒想到莫古利族看起來小小的卻這麼能吃！","不過看大家一臉享受的樣子，我也覺得很開心！<hex:02100103>我乾脆去當個糕點師算了，<hex:02100103>這樣的話大家就能吃餅乾吃到飽了！","0"
"597355","0","1","2","0","0","4218","0","0","1","1","1","0","0","0","0","0","0","False","False","False","非常抱歉，現在還在準備中。<hex:02100103>請你過些時間再來。","0","0"
"597356","0","1","2","0","0","4218","0","0","1","1","1","0","0","0","0","0","0","False","False","False","我正在和老爹商量重建計劃，<hex:02100103>可能到時候還要拜託你幫一些忙。","0","0"
"597357","0","1","2","0","0","764","0","0","1","1","1","0","0","0","0","0","0","False","False","False","怎麼樣，有沒有覺得很熱？一定覺得很熱吧！<hex:02100103>那是因為舉辦紅蓮祭的季節到來了！<hex:02100103>這次的紅蓮祭是在太陽海岸的永夏島舉辦！","0","0"
"597358","0","1","0","0","0","766","0","0","1","1","1","0","0","0","0","0","0","False","False","False","唉，究竟是怎麼回事……","0","0"
"597359","0","1","2","0","0","764","0","0","1","1","1","0","0","0","0","0","0","False","False","False","沒想到竟然會有和大炎獸轟擊怪相似的冰屬性魔物，<hex:02100103>真是世界之大，無奇不有啊。","0","0"
"597360","0","1","2","0","0","740","0","0","1","1","1","0","0","0","0","0","0","False","False","False","<hex:022903EB0203><hex:020813E905FF07>小姐<hex:FF07>小哥<hex:03>，<hex:02100103>有沒有在享受紅蓮祭呀？<hex:02100103>冰品還有的是，你就敞開了肚皮吃吧！","0","0"
"597361","0","1","2","0","0","708","0","0","1","1","1","0","0","0","0","0","0","False","False","False","冰海岸好像很受歡迎呢，<hex:02100103>小內可似乎也很高興的樣子，真是太好了！","0","0"
"597362","0","1","2","0","0","764","0","0","1","1","1","0","0","0","0","0","0","False","False","False","如果要返回燕鷗崖的話，就由我來帶路吧！","0","0"
"597363","0","1","2","0","0","764","0","0","1","1","1","0","0","0","0","0","0","False","False","False","似乎還有一些寒冰轟擊怪沒有被打倒。<hex:02100103>如果可以的話，請你繼續為紅蓮祭出一份力！","0","0"
"597364","0","1","2","0","0","5695","0","0","1","1","1","0","0","0","0","0","0","False","False","False","謝謝你幫助他們兩個，<hex:022903EB0203>。","多虧了你，他們才能安心工作。","0"
"597365","0","1","2","0","0","763","0","0","1","1","1","0","0","0","0","0","0","False","False","False","瑪埃莉很擔心自己會因為年齡太小而不被患者接受，<hex:02100103>夏爾芒則是對自己的貴族身份有所顧慮。","不過他們兩人的努力大家都是有目共睹的。<hex:02100103>醫院的氛圍也比以前活躍多了，真是太好了。","0"
"597366","0","1","2","0","0","950","0","0","1","1","1","0","0","0","0","0","0","False","False","False","給魯什芒德紀念醫院幫忙很開心，所以瑪埃莉很努力哦！<hex:02100103>看！瑪埃莉還得到了醫院的制服！","0","0"
"597367","0","1","2","0","0","763","0","0","1","1","1","0","0","0","0","0","0","False","False","False","瑪埃莉一般都是從大叔那裡學知識，<hex:02100103>不過也有很多患者大哥哥、大姐姐會教瑪埃莉。<hex:02100103>總之，瑪埃莉可是很努力地在學習呢！","0","0"
"597368","0","1","2","0","0","4218","0","0","1","1","1","0","0","0","0","0","0","False","False","False","我想成為能幫助大家的人。<hex:02100103>所以我要效仿伯父大人，在這裡好好學習一番。","0","0"
"597369","0","1","2","0","0","4218","0","0","1","1","1","0","0","0","0","0","0","False","False","False","艾奧傑亞同盟軍本部決定，<hex:02100103>將以破壞入侵的紅寶石神兵為首的這一連串戰鬥稱之為……","「維爾利特戰役」。","0"
"597370","0","1","2","0","0","764","0","0","1","1","1","0","0","0","0","0","0","False","False","False","我一定會好好守護他們救出的那些孩子們……<hex:02100103>以及他們奪回的這個國家。","0","0"
"597371","0","1","2","0","0","4218","0","0","1","1","1","0","0","0","0","0","0","False","False","False","我並沒有忘記自己的妻兒。<hex:02100103>如果他們還活著的話，肯定會給予我莫大的支持。<hex:02100103>所以……我也要大步向前邁進。","0","0"
"597372","0","1","2","0","0","764","0","0","1","1","1","0","0","0","0","0","0","False","False","False","臨時政府已經和阿拉米格解放軍聯手，<hex:02100103>正在努力救出遺留在第七軍團基地設施的人們。<hex:02100103>希望這個國家可以越來越好。","0","0"
"597373","0","1","0","0","0","5533","756","0","1","1","1","0","0","0","0","0","0","False","False","False","米莉珊迪雅、利孔、萊克斯，還有哥哥……","我會連同你們那份一起活下去。","0"
"597374","0","1","2","0","0","4219","0","0","1","1","1","0","0","0","0","0","0","False","False","False","我本想加入臨時政府，以抵抗軍的身份參加戰鬥，<hex:02100103>但最後還是放棄了。<hex:02100103>我捨不得剛剛得以團聚的家人……","0","0"
"597375","0","1","2","0","0","763","0","0","1","1","1","0","0","0","0","0","0","False","False","False","「希爾迪布蘭德大人被綁架案」的情報，<hex:02100103>就交給調查員的助手娜修去收集吧。<hex:02100103>在找到線索之前，還請冒險者耐心等待！","0","0"
"597376","0","1","1","0","0","5471","0","0","1","1","1","0","0","0","0","0","0","False","False","False","沒想到啊，竟然能在有生之年過上和平的日子……","0","0"
"597377","0","1","2","0","0","4219","0","0","1","1","1","0","0","0","0","0","0","False","False","False","紀念碑好像已經完成了，你去看了嗎？","0","0"
"597378","0","1","2","0","0","4219","0","0","1","1","1","0","0","0","0","0","0","False","False","False","紀念碑上雕刻著維爾利特的戰死者的姓名。<hex:02100103>衷心希望上面不會再刻上新的名字了。","0","0"
"597379","0","1","2","0","0","764","0","0","1","1","1","0","0","0","0","0","0","False","False","False","我想建議席德會長，讓阿維莉娜正式成為我廠員工。<hex:02100103>她的技術和想像力一定能為我們提供不少幫助。","0","0"
"597380","0","1","2","0","0","4219","0","0","1","1","1","0","0","0","0","0","0","False","False","False","我們今後也會繼續為這個國家提供支援。<hex:02100103>作為經歷過同種悲劇的鄰居，一定要相互扶持才行。","0","0"
"597381","0","1","0","0","0","0","0","0","1","1","1","0","0","0","0","0","0","False","False","False","現在想想，那天晚上見到的景象<hex:02100103>不過是人造聖石系統創造的幻影而已……<hex:02100103>但我還是很高興能再次看到你的笑臉……","晚安，米莉珊迪雅。<hex:02100103>我的第一個朋友……","0"
"597382","0","1","1","0","0","0","0","0","1","1","1","0","0","0","0","0","0","False","False","False","臨時政府會負責照顧那些孩子。<hex:02100103>畢竟孩子們才是國家未來的希望啊。","0","0"
"597383","0","1","2","0","0","764","0","0","1","1","1","0","0","0","0","0","0","False","False","False","帝國丘陵堡究竟發生了什麼事？！","0","0"
"597384","0","1","2","0","0","764","0","0","1","1","1","0","0","0","0","0","0","False","False","False","悲觀的傢伙和口齒伶俐的傢伙好像很早之前就在幫忙了，<hex:02100103>我會試著鼓起勇氣去問問有沒有我也能做的事。","0","0"
"597385","0","1","2","0","0","757","0","0","1","1","1","0","0","0","0","0","0","False","False","False","這些物資由我們第一軍團負責嚴加保管。<hex:02100103>怎麼可能會給你們這些異國人！","0","0"
"597386","0","1","2","0","0","764","0","0","1","1","1","0","0","0","0","0","0","False","False","False","說起來最近看不到阿諾古和科諾古了呢。<hex:02100103>對於我曾經說過的話，我想向他們表示歉意……<hex:02100103>如果你見到他們了就跟我說一聲。","0","0"
"597387","0","1","2","0","0","933","0","0","1","1","1","0","0","0","0","0","0","False","False","False","你認識坑道入口前的看守嗎？<hex:02100103>其實我現在正跟他一起做生意呢。<hex:02100103>那傢伙對於金錢的熱情實在是令人佩服啊……","0","0"
"597388","0","1","2","0","0","933","0","0","1","1","1","0","0","0","0","0","0","False","False","False","我身為古姆拉村的長老，<hex:02100103>今後也會繼續守護這個村子的。","0","0"
"597389","0","1","2","0","0","5533","0","0","1","1","1","0","0","0","0","0","0","False","False","False","旅行者，你好啊。<hex:02100103>其實我最近有了喜歡的人……<hex:02100103>我正在戰勝自己悲觀的一面，努力接近她。","0","0"
"597390","0","1","2","0","0","763","0","0","1","1","1","0","0","0","0","0","0","False","False","False","非常抱歉，現在還在準備中。<hex:02100103>請你過些時間再來。","0","0"
"597391","0","1","2","0","0","763","0","0","1","1","1","0","0","0","0","0","0","False","False","False","你知道嗎？<hex:02100103>金碟遊樂場現正舉行<hex:02100103>1.5倍金碟幣限時活動！","0","0"
"597392","0","1","2","0","0","763","0","0","1","1","1","0","0","0","0","0","0","False","False","False","你知道嗎？<hex:02100103>金碟遊樂場現正舉行<hex:02100103>1.5倍金碟幣限時活動！","0","0"
"597393","0","1","2","0","0","763","0","0","1","1","1","0","0","0","0","0","0","False","False","False","你知道嗎？<hex:02100103>金碟遊樂場現正舉行<hex:02100103>1.5倍金碟幣限時活動！","0","0"
"597394","0","1","2","0","0","764","0","0","1","1","1","0","0","0","0","0","0","False","False","False","阿爾希烏說這個遊戲可以當做消遣放鬆一下，<hex:02100103>我就試了試，結果完全被它迷住了！<hex:02100103>沒想到還能與解放者閣下比試，這是何等幸運！","0","0"
"597395","0","1","2","0","0","764","0","0","1","1","1","0","0","0","0","0","0","False","False","False","這種令人感到愉快的興奮感，<hex:02100103>這個遊戲確實能舒緩心情呢。<hex:02100103>多虧了閣下，感覺我這邊的記錄工作也更有效率了。","0","0"
"597396","0","1","2","0","0","933","0","0","1","1","1","0","0","0","0","0","0","False","False","False","這不是實戰，在遊戲中輸掉又沒什麼……<hex:02100103>算了，還是不要騙自己了，不論是遊戲還是實戰，<hex:02100103>輸掉總是令人不甘心的，我們也是在勝利的盡頭才達成了夙願啊。","0","0"
"597397","0","1","2","0","0","766","0","0","1","1","1","0","0","0","0","0","0","False","False","False","這也真是令人心急的結果……！<hex:02100103>心裡總想著恨不得立刻就再戰一局……<hex:02100103>一不小心就太過入迷，很容易把任務都拋之腦後呢。","0","0"
"597398","0","1","2","0","0","763","0","0","1","1","1","0","0","0","0","0","0","False","False","False","維爾利特城市近郊的第七軍團據點——帝國丘陵堡<hex:02100103>由於受到鑽石神兵的攻擊，崩塌了一大半。","神奇的是，在那種情況下竟然沒有一個行省人傷亡。","0"
"597399","0","1","0","0","0","1041","0","0","1","1","1","0","0","0","0","0","0","False","False","False","我明明就是不想被捲入這種情況，<hex:02100103>所以才一直都是小心謹慎地活到現在的……","0","0"
"597400","0","1","2","0","0","5533","0","0","1","1","1","0","0","0","0","0","0","False","False","False","就算是我，應該也有能做到的事。","0","0"
"597401","0","1","2","0","0","5695","0","0","1","1","1","0","0","0","0","0","0","False","False","False","我本來在找新工作，不過被那個口齒伶俐的傢伙說服了，<hex:02100103>現在正和他一起經營。<hex:02100103>感覺和他合作的話，很有可能賺大錢啊……","0","0"
"597402","0","1","2","0","0","933","0","0","1","1","1","0","0","0","0","0","0","False","False","False","旅行者啊，我決定成為矮人族中最厲害的商人。<hex:02100103>這樣的話，我就又能向那位姑娘展開求愛了……","0","0"
"597403","0","1","2","0","0","933","0","0","1","1","1","0","0","0","0","0","0","False","False","False","有備無患你懂吧！<hex:02100103>我正在製作特製的自走人偶，<hex:02100103>這樣在村子再度遇襲時就能派上用場了啦哩！","0","0"
"597404","0","1","2","0","0","1071","0","0","1","1","1","0","0","0","0","0","0","False","False","False","村子可算恢復原樣了，這次一定要給圖爾家族點顏色看看！","0","0"
"597405","0","1","2","0","0","766","0","0","1","1","1","0","0","0","0","0","0","False","False","False","村子面臨的威脅真的消失了嗎？<hex:02100103>大家都在喜氣洋洋地重建村子，<hex:02100103>可是……真的能徹底放下心來嗎？","0","0"
"597406","0","1","2","0","0","950","0","0","1","1","1","0","0","0","0","0","0","False","False","False","他們再敢襲擊村子的話，<hex:02100103>我一定要喂他們吃敲石蟲的觸手啦哩！","0","0"
"597407","0","1","1","0","0","757","0","0","1","1","1","0","0","0","0","0","0","False","False","False","呼……不知廉恥的傢伙終於沒了。<hex:02100103>這才是這個村子應有的樣子。","0","0"
"597408","0","1","2","0","0","763","0","0","1","1","1","0","0","0","0","0","0","False","False","False","村子裡的人好像都充滿了活力呢。<hex:02100103>我也想儘快找到另一半，過上幸福的日子。","0","0"
"597409","0","1","2","0","0","5695","0","0","1","1","1","0","0","0","0","0","0","False","False","False","哎呀，旅行者你能聽我說說嗎？<hex:02100103>最近有一位村民向我展開了求愛攻勢呢……","雖然性格上有點悲觀，<hex:02100103>不過看上去倒是個蠻實在的人，我正發愁要不要跟他交往……<hex:02100103>哎，到底該怎麼辦呢。","0"
"597410","0","1","2","0","0","764","0","0","1","1","1","0","0","0","0","0","0","False","False","False","第四軍團裡淨是些可怕的敵人啊……<hex:02100103>聽說還有透過聖石碎片發生變異的傢伙，真是有趣。<hex:02100103>我想著以後沒準還會有研究的機會，就把他們的資料都整理成了資料。","0","0"
"597411","0","1","2","0","0","933","0","0","1","1","1","0","0","0","0","0","0","False","False","False","能找到行蹤詭秘的龍騎士可是我的獨門絕學！<hex:02100103>我還想過利用這個搜索技術在情報商那裡賺取營運資金呢，<hex:02100103>不過石之家不能長時間沒人看家，真是糾結啊……","0","0"
"597412","0","1","2","0","0","4229","0","0","1","1","1","0","0","0","0","0","0","False","False","False","為了找埃斯蒂尼安先生，我到處跑好久，腿都快不會動了……<hex:02100103>不過我可不能休息，接下來還要和雅．修特拉一起去調查呢。","0","0"
"597413","0","1","0","0","0","0","0","0","1","1","1","0","0","0","0","0","0","False","False","False","我在回來的路上看到的那些塔，<hex:02100103>都是位於和艾奧傑亞各國敵對的種族的領地內。<hex:02100103>這一點讓我十分在意……","0","0"
"597414","0","1","2","0","0","764","0","0","1","1","1","0","0","0","0","0","0","False","False","False","傳授給各種族請神的秘法的正是無影，<hex:02100103>所以法丹尼爾身為無影，自然也很擅長這一套。<hex:02100103>想必終焉使徒今後也會利用蠻神來對付我們。","0","0"
"597415","0","1","2","0","0","5695","0","0","1","1","1","0","0","0","0","0","0","False","False","False","等和可露兒一起進行的調查結束之後，<hex:02100103>我一定會告訴你結果的，所以先給我一些時間吧。","0","0"
"597416","0","1","2","0","0","763","0","0","1","1","1","0","0","0","0","0","0","False","False","False","阿雷恩瓦爾德好像和芙朵拉一起進行任務去了。<hex:02100103>聽說囚徒部隊的工作都完成得相當出色，<hex:02100103>所以我相信他們肯定能圓滿完成任務。","0","0"
"597417","0","1","2","0","0","5695","0","0","1","1","1","0","0","0","0","0","0","False","False","False","我們會連同阿雷恩瓦爾德的份，<hex:02100103>在這裡協助阿拉米格解放軍治療伽黎亞派的信徒。","0","0"
"597418","0","1","2","0","0","764","0","0","1","1","1","0","0","0","0","0","0","False","False","False","我發誓，絕不會停下前進的腳步。<hex:02100103>無論理想有多麼遙遠……","0","0"
"597419","0","1","2","0","0","5695","0","0","1","1","1","0","0","0","0","0","0","False","False","False","治好了強大的提亞馬特讓我信心倍增。<hex:02100103>我要保持這個勁頭治好更多的信徒。","0","0"
"597420","0","1","2","0","0","766","0","0","1","1","1","0","0","0","0","0","0","False","False","False","薩雷安應該早就開始觀測末日塔了吧。<hex:02100103>希望可露兒能為我們帶回一些更加明確的情報。","0","0"
"597421","0","1","2","0","0","764","0","0","1","1","1","0","0","0","0","0","0","False","False","False","異形蠻神似乎在反覆進行一些零散的襲擊，<hex:02100103>而沒有進攻各國的主要據點的打算。<hex:02100103>恐怕這些攻擊並不是他們的主要目的。","0","0"
"597422","0","1","2","0","0","933","0","0","1","1","1","0","0","0","0","0","0","False","False","False","與異種族講和，建立更加緊密的聯繫，<hex:02100103>不僅能有效防止終焉使徒對他們進行綁架，<hex:02100103>也有助於共同商討針對異形蠻神的對策。","0","0"
"597423","0","1","2","0","0","763","0","0","1","1","1","0","0","0","0","0","0","False","False","False","在迄今為止的戰鬥中，<hex:02100103>海德林的加護都起到了莫大的作用，這是毋庸置疑的。","但我們都知道，即使是無影也無法斷言海德林究竟是善是惡。<hex:02100103>所以我想要弄清楚海德林真正的想法。","0"
"597424","0","1","2","0","0","764","766","0","1","1","1","0","0","0","0","0","0","False","False","False","有需要就來找我，<hex:02100103>在此之前，我要按自己的意願行事。","話說回來……我聽說……<hex:02100103>拂曉和黃金港的烏爾達哈商館往來頗深，這是真的嗎？<hex:02100103>若真是如此，能不能幫我訂購一些那個啊……","0"
"597425","0","1","2","0","0","950","0","0","1","1","1","0","0","0","0","0","0","False","False","False","<hex:022903EB0203>，你現在的工作就是好好休息！<hex:02100103>不過適當的冒險的話，我倒是不會阻止你啦……","0","0"
