"597426","0","1","2","0","0","715","0","0","1","1","1","0","0","0","0","0","0","False","False","False","如果有什麼和異形蠻神有關的問題的話，<hex:02100103>正在各國的庫爾特內他們會發來聯繫的。<hex:02100103>我們還留有後備力量，所以異形蠻神的事就交給我們吧。","0","0"
"597427","0","1","2","0","0","764","0","0","1","1","1","0","0","0","0","0","0","False","False","False","我們一直都在招募頗有能力的冒險者，<hex:02100103>現在，他們構築起來的情報網<hex:02100103>正在監視各地的末日塔方面大顯神通呢。","0","0"
"597428","0","1","2","0","0","5695","0","0","1","1","1","0","0","0","0","0","0","False","False","False","在處理蠻神問題的過程中，有時會遇到一些信徒。<hex:02100103>所以我正在從阿莉塞那裡學習用使魔解除精煉的方法。","0","0"
"597429","0","1","2","0","0","5695","0","0","1","1","1","0","0","0","0","0","0","False","False","False","在延夏也出現了那種末日塔，<hex:02100103>不過我一聽說異形蠻神的事就立刻趕回來了！<hex:02100103>現在只能祈禱爺爺和多瑪的各位都能平安無事了。","0","0"
"597430","0","1","0","0","0","0","0","0","1","1","1","0","0","0","0","0","0","False","False","False","赫利大哥在出發時幹勁十足的樣子真是太帥了！<hex:02100103>相信暫時的分別一定能加深他們二人的兄弟情！","0","0"
"597431","0","1","2","0","0","5533","0","0","1","1","1","0","0","0","0","0","0","False","False","False","雖然同為拂曉的一員，但我和阿雷恩瓦爾德的私下交流很少。<hex:02100103>可即便如此，我也感到非常心痛。","0","0"
"597432","0","1","1","0","0","765","0","0","1","1","1","0","0","0","0","0","0","False","False","False","我本想和阿麗亞娜一起回去的，<hex:02100103>但現在各國都需要戰鬥力，所以我決定暫時留在多瑪。","0","0"
"597433","0","1","1","0","0","755","0","0","1","1","1","0","0","0","0","0","0","False","False","False","多瑪的忍者似乎也都亂了陣腳。<hex:02100103>不過我相信飛燕大人和東方聯盟的精銳<hex:02100103>肯定能重整旗鼓，全力應對危機。","0","0"
"597434","0","1","2","0","0","5533","0","0","1","1","1","0","0","0","0","0","0","False","False","False","我相信阿雷恩瓦爾德一定會跨越苦難，繼續向前。<hex:02100103>但我還是……感到非常的後悔……","0","0"
"597435","0","1","2","0","0","715","0","0","1","1","1","0","0","0","0","0","0","False","False","False","既然知道了阿雷恩瓦爾德的決心，我們就不該再去看望他了。<hex:02100103>我們要全力完成與伽黎亞派講和的任務，讓他感到自豪。","0","0"
"597436","0","1","2","0","0","763","0","0","1","1","1","0","0","0","0","0","0","False","False","False","將會議的結果傳達給大夥以後，所有人都表現得熱血沸騰。<hex:02100103>畢竟為了阻止請神，大夥可沒少經歷戰鬥。<hex:02100103>今後像是這樣的戰鬥應該會越來越少吧……","0","0"
"597437","0","1","2","0","0","764","0","0","1","1","1","0","0","0","0","0","0","False","False","False","哎呀，阿爾菲諾那邊已經忙完了嗎？","要是以前的話，他肯定會因為過強的責任感，<hex:02100103>一個人承擔起所有的事情……<hex:02100103>不過如今的他一定能找到屬於自己的答案。","0"
"597438","0","1","2","0","0","763","0","0","1","1","1","0","0","0","0","0","0","False","False","False","埃斯蒂尼安剛剛加入拂曉，現在正是與他拉近距離的好機會。<hex:02100103>我們同為精靈族，年齡又相仿，肯定有不少共同語言。","比如……埃斯蒂尼安曾被尼德霍格附身，<hex:02100103>而龍詩的傳誦者詩龍拉塔托斯克正是尼德霍格的胞妹。<hex:02100103>幸而，我對詩歌創作略有涉獵，就用我的拙作來打開話題吧。","0"
"597439","0","1","1","0","0","755","0","0","1","1","1","0","0","0","0","0","0","False","False","False","不用擔心，我不會趁你們不在逃跑的。<hex:02100103>反正逃出去也要被抓回來……","0","0"
"597440","0","1","2","0","0","711","0","0","1","1","1","0","0","0","0","0","0","False","False","False","原來是這樣，妖精族來負責聯繫嗎。<hex:02100103>要想瞭解各種族的動向，去問他們就好了是吧！<hex:02100103>呵呵呵……拂曉的情報網又能再次拓展了呢。","0","0"
"597441","0","1","1","0","0","4218","0","0","1","1","1","0","0","0","0","0","0","False","False","False","啊，這裡又變冷清了對吧？<hex:02100103>聽說要跟異種族聯手共鬥，<hex:02100103>可能需要更多的人手才能順利推進，所以大家都出去忙了。","0","0"
"597442","0","1","2","0","0","764","5533","0","1","1","1","0","611","0","0","0","0","False","True","False","在那之後，阿雷恩瓦爾德好像回到了福隆戴爾藥學院。<hex:02100103>雖然我還是在意他的傷勢，<hex:02100103>不過我還沒有找到答案，哪好意思去見他。","即便現在我去見他，<hex:02100103>也肯定會在他堅強的笑容下什麼也說不出來。<hex:02100103>等我煩惱、掙扎、邁出一步以後……再去見他吧。","0"
"597443","0","1","1","0","0","765","0","0","1","1","1","0","0","0","0","0","0","False","False","False","薩雷安和父親的態度實在讓人費解。<hex:02100103>不管他們打算隱瞞什麼，我們都會揭露出來！<hex:02100103>我一定要讓他們知道，逃避不能解除威脅。","0","0"
"597444","0","1","1","0","0","757","756","0","1","1","1","0","0","0","0","0","0","False","False","False","聽了富爾什諾先生所說的話，想必你已經有所體會，<hex:02100103>薩雷安一直奉行不干涉國外爭端的政策。<hex:02100103>我覺得這背後一定有什麼隱情…","如果沒有人從內部打點的話，<hex:02100103>反對薩雷安國策的拂曉想要入境一定是相當困難的。<hex:02100103>希望可露兒能儘早傳回好消息。","0"
"597445","0","1","0","1","0","0","0","0","1","1","1","0","0","0","0","0","0","False","False","False","雖然很想救出被塔困住的獸人們，<hex:02100103>但強行從牆上往外拉只會導致他們直接死亡嗎……","為了阻止異形蠻神的降臨，我們必須想辦法救出他們。<hex:02100103>不過現在能做的，只有先阻止終焉使徒綁架人口，<hex:02100103>不讓受害者繼續增加了。","0"
"597446","0","1","1","0","0","4218","0","0","1","1","1","0","0","0","0","0","0","False","False","False","我和桑克瑞德在帝國看到人們在魔導城內拚命幹活……<hex:02100103>他們的精神想必也被汙染了。","0","0"
"597447","0","1","1","0","0","758","0","0","1","1","1","0","0","0","0","0","0","False","False","False","透過精神汙染把靠近的人變成傀儡、<hex:02100103>利用抓來的獸人們強行召喚蠻神，<hex:02100103>還從地脈中抽取乙太……","終焉使徒的想法真是讓人捉摸不透啊。<hex:02100103>他們究竟打算用塔來做什麼？","0"
"597448","0","1","1","0","0","755","0","0","1","1","1","0","0","0","0","0","0","False","False","False","黃金港、拉札罕和帝都……<hex:02100103>龍詩戰爭結束後，我雲遊四方，<hex:02100103>不過還沒去過薩雷安呢。","一想到那裡住的全都是阿爾菲諾那樣的書呆子，<hex:02100103>我就脊背發涼。","0"
"597449","0","1","2","0","0","950","0","0","1","1","1","0","0","0","0","0","0","False","False","False","要想讓事態真正迎來轉變，<hex:02100103>得等各位進入薩雷安之後了。<hex:02100103>請大家養精蓄銳，做好準備。","0","0"
"597450","0","1","1","0","0","4218","0","0","1","1","1","0","0","0","0","0","0","False","False","False","我把艾默里克大人的請求也傳達給了庫爾特內他們。<hex:02100103>大夥都很努力地在各地收集情報傳遞資訊，<hex:02100103>並說這是自己如今能做出的最大貢獻。","0","0"
"597451","0","1","2","0","0","764","0","0","1","1","1","0","0","0","0","0","0","False","False","False","嗯……是你啊。<hex:02100103>不管你有什麼事，沒有許可都無法前往芙蓉圓桌。<hex:02100103>抱歉，請回吧。","0","0"
"597452","0","1","2","0","0","768","0","0","1","1","1","0","0","0","0","0","0","False","False","False","沒想到芝諾斯竟然會和無影聯手，<hex:02100103>而且還驅使蠻神發起襲擊！<hex:02100103>我絕不會讓他們接近烏爾達哈一步！","0","0"
"597453","0","1","2","0","0","763","0","0","1","1","1","0","0","0","0","0","0","False","False","False","基姆利特的戰鬥才剛結束，<hex:02100103>這個晦氣的塔又冒出來了！真是沒完沒了！<hex:02100103>一定要和海盜們齊心協力，保持警戒狀態才行。","0","0"
"597454","0","1","2","0","0","764","0","0","1","1","1","0","0","0","0","0","0","False","False","False","哎……真是一波未平一波又起啊。<hex:02100103>我緊急召回了在基姆利特防守的士兵們，<hex:02100103>然後為了提防終焉使徒的進攻重新編制了隊伍，真是忙死我了！","0","0"
"597455","0","1","2","0","0","764","0","0","1","1","1","0","0","0","0","0","0","False","False","False","隨著重建的進行，皇都也逐漸恢復了曾經的活力。<hex:02100103>我絕不會讓終焉使徒那些傢伙奪走這來之不易的和平！","0","0"
"597456","0","1","1","0","0","0","0","0","1","1","1","0","0","0","0","0","0","False","False","False","從戰場上生還的士兵們都很疲憊。<hex:02100103>可見戰鬥真的是十分激烈……<hex:02100103>如果有我可以幫上忙的事情就好了……","0","0"
"597457","0","1","2","0","0","764","0","0","1","1","1","0","0","0","0","0","0","False","False","False","只要能幫到冒險者和博茲雅的各位，我們定會傾囊相助。<hex:02100103>不過在這個過程中，也請允許我們追求一些利益。","0","0"
"597458","0","1","2","0","0","4219","0","0","1","1","1","0","0","0","0","0","0","False","False","False","我怎麼了？<hex:02100103>我很好啊，還是像往常一樣做著自己的工作。<hex:02100103>請不要太在意我的事情。","0","0"
"597459","0","1","2","0","0","764","0","0","1","1","1","0","0","0","0","0","0","False","False","False","不用你這麼盯著我，我也會正經地做生意的。<hex:02100103>畢竟你們都這麼信任我……","0","0"
"597460","0","1","2","0","0","766","0","0","1","1","1","0","0","0","0","0","0","False","False","False","雷佳娜的監視突然變鬆了。<hex:02100103>本以為能偷偷喝兩口酒呢，<hex:02100103>沒想到還要考慮武器的改良方案啊。","0","0"
"597461","0","1","2","0","0","5665","0","0","1","1","1","0","0","0","0","0","0","False","False","False","要是英雄大人替我求情的話，<hex:02100103>白沙恩他們會不會幫我還錢啊……應該不會有這種好事。<hex:02100103>話說回來，我到底欠了羅薇娜多少錢啊……","0","0"
"597462","0","1","2","0","0","764","0","0","1","1","1","0","0","0","0","0","0","False","False","False","雖然多少有點疑慮，<hex:02100103>不過為了完成真正的反抗軍武器，<hex:02100103>加把勁吧！","0","0"
"597463","0","1","2","0","0","763","0","0","1","1","1","0","0","0","0","0","0","False","False","False","蓋羅爾特閣下沒再叫過我的名字了，我猜他是因為害羞吧。<hex:02100103>沒想到他還有內向的一面。","多虧了解放者閣下，我們才能順利完成第一把武器！<hex:02100103>而且有雷佳娜小姐負責交易，我放心了不少。<hex:02100103>剩下的工作就交給蓋羅爾特閣下了……","0"
"597464","0","1","2","0","0","764","0","0","1","1","1","0","0","0","0","0","0","False","False","False","我會在新戰場上繼續努力收集情報。<hex:02100103>除了戰況以及對新據點的介紹以外，<hex:02100103>如果有其他可以幫到解放者閣下的事情，還請儘管吩咐！","0","0"
"597465","0","1","2","0","0","764","0","0","1","1","1","0","0","0","0","0","0","False","False","False","我在試著看看能不能再現出古代之民曾經使用過的裝備。<hex:02100103>不過畢竟是已經失傳的技術，就連我也陷入了苦戰呢。","0","0"
"597466","0","1","2","0","0","5533","0","0","1","1","1","0","0","0","0","0","0","False","False","False","有了越來越多可以互相幫助的同伴，這可是件好事。<hex:02100103>我們又能像以前一樣過上安穩的生活了吧。","0","0"
"597467","0","1","0","0","0","0","0","0","1","1","1","0","0","0","0","0","0","False","False","False","擺弄未知的機械真是太有意思了。<hex:02100103>一旦沉迷其中，煩惱和迷茫都會被拋到腦後。","0","0"
"597468","0","1","2","0","0","764","0","0","1","1","1","0","0","0","0","0","0","False","False","False","要確認札杜諾爾高原的詳情嗎？","0","0"
"597469","0","1","2","0","0","764","0","0","1","1","1","0","0","0","0","0","0","False","False","False","哦，你想去放鬆一下嗎？<hex:02100103>別讓嘉恩．艾大人等太久了……","0","0"
"597470","0","1","1","0","0","755","0","0","1","1","1","0","0","0","0","0","0","False","False","False","嗯……難道就沒有<hex:02100103>能讓人眼前一亮的超一流工匠嗎……","0","0"
"597471","0","1","1","0","0","755","0","0","1","1","1","0","0","0","0","0","0","False","False","False","歡迎光臨！<hex:02100103>既然都已經來了，<hex:02100103>那就隨便交易點什麼再走吧！","0","0"
"597472","0","1","2","0","0","764","0","0","1","1","1","0","0","0","0","0","0","False","False","False","這裡是羅薇娜商會的交易窗口。<hex:02100103>很抱歉，我們這裡採用私人推薦制。","0","0"
"597473","0","1","2","0","0","764","0","0","1","1","1","0","0","0","0","0","0","False","False","False","請問您擁有羅薇娜商會發行的工票嗎？<hex:02100103>如果您想要使用工票進行交換的話，<hex:02100103>就請您看看可供交換的物品的目錄吧。","0","0"
"597474","0","1","1","0","0","755","0","0","1","1","1","0","0","0","0","0","0","False","False","False","這裡是羅薇娜商會的交易窗口。<hex:02100103>很抱歉，我們這裡採用私人推薦制。","0","0"
"597475","0","1","1","0","0","755","0","0","1","1","1","0","0","0","0","0","0","False","False","False","<hex:022903EB0203>大人，歡迎光臨。<hex:02100103>我們為老練的冒險者以及技藝高超的工匠<hex:02100103>準備了不少珍品。","0","0"
"597476","0","1","2","0","0","764","0","0","1","1","1","0","0","0","0","0","7","False","False","False","歡迎來到天上的住宅區——蒼天淨界！<hex:02100103>這裡目前作為冒險者住宅區對外開放，<hex:02100103>正在由工匠們進行最後的調整。","距離土地開始出售還有一段時間，<hex:02100103>請在開放區域隨意散心吧。<hex:02100103>希望您可以喜歡這裡！","蒼天淨界現還處於售前展示狀態。<hex:02100103>在土地正式對外銷售前，請您耐心等待。"
"597477","0","1","2","0","0","764","0","0","1","1","1","0","0","0","0","0","0","False","False","False","0","0","0"
"597478","0","1","2","0","0","763","0","0","1","1","1","0","0","0","0","0","0","False","False","False","這裡是拾穗人們的工作窗口。<hex:02100103>主要負責為具備工匠技術的人們介紹工作。","0","0"
"597479","0","1","2","0","0","763","0","0","1","1","1","0","0","0","0","0","0","False","False","False","如果對製作和採集方面的技術有自信的話，<hex:02100103>就去跟旁邊的格里格打聲招呼吧！<hex:02100103>他會給你介紹很好的工作的！","0","0"
"597480","0","1","0","0","0","0","0","0","1","1","1","0","0","0","0","7","0","False","False","False","……","他好像在聚精會神地讀書，<hex:02100103>完全沒注意到你……","0"
"597481","0","1","1","0","0","755","0","0","1","1","1","0","0","0","0","0","0","False","False","False","我還沒找到有用的情報。<hex:02100103>或許真的像雅．修特拉說的那樣，<hex:02100103>結果就是「一無所獲」吧。","0","0"
"597482","0","1","2","0","0","766","0","0","1","1","1","0","0","0","0","0","0","False","False","False","嗯……<hex:02100103>倒是有介紹關於第一靈災之前的世界的書，<hex:02100103>不過與其說書中的內容是推測，更應該說是幻想……","0","0"
"597483","0","1","2","0","0","5696","0","0","1","1","1","0","0","0","0","0","0","False","False","False","多虧你的幫助，我這邊進展蠻順利的。<hex:02100103>現在我忙得開了，你去稍微休息一下吧。","0","0"
"597484","0","1","0","0","0","764","0","0","1","1","1","0","0","0","0","0","0","False","False","False","冒昧打擾一下，你是拾穗人吧？<hex:02100103>我有些問題想請教你……","0","0"
"597485","0","1","0","0","0","4219","0","0","1","1","1","0","0","0","0","0","0","False","False","False","呃，這點已經足夠了……<hex:02100103>能不能把剛才提到的部分再詳細講講？","0","0"
"597486","0","1","2","0","0","5696","0","0","1","1","1","0","0","0","0","0","0","False","False","False","哎呀，我可沒有在偷懶哦？<hex:02100103>只不過好久沒來這裡了，<hex:02100103>在觀察情況的同時順便回憶一些以前的事情而已。","目之所及也並沒有什麼特別可疑的地方。<hex:02100103>果然只能挨個地去找人打聽了。","0"
"597487","0","1","0","0","0","0","0","0","1","1","1","0","0","0","7","7","0","False","False","False","所謂刺魚，是指使用漁叉來捕魚。<hex:02100103>對出現在畫面中的魚使用「刺魚」刺出漁叉，<hex:02100103>只要擊中，便可將魚捕獲。","刺魚過程中，魚會變得很警戒，<hex:02100103>當達到一定的警戒值時，捕魚便會結束。<hex:02100103>在結束前，盡可能地多捕魚吧！","0"
"597488","0","1","2","0","0","764","0","0","1","1","1","0","0","0","0","0","0","False","False","False","無論何時我都是這個星球上眾多熱羅梅爾當中<hex:02100103>最帥氣的那一個。","0","0"
"597489","0","1","2","0","0","763","0","0","1","1","1","0","0","0","0","0","0","False","False","False","和熱羅梅爾一起眺望星空的時候，<hex:02100103>感覺就像是回到了十年前一樣。<hex:02100103>幸好當初沒有放棄……","0","0"
"597490","0","1","2","0","0","763","0","0","1","1","1","0","0","0","0","0","0","False","False","False","那麼關於第一個研究對象拉札罕……<hex:02100103>眾所周知，那是位於伊爾薩巴德大陸的南邊，<hex:02100103>漂浮在豐饒海東南方的薩維奈島上的島國。","那裡乾季氣候比較宜人，<hex:02100103>一旦進入暑季氣溫和溼度便會相繼升高，隨之進入雨季。<hex:02100103>也就是說，那裡是高溫潮溼的環境。","這與北洋截然相反，不知那裡孕育著怎樣的文化呢？<hex:02100103>光是想想都覺得激動！"
"597491","0","1","2","0","0","763","0","0","1","1","1","0","0","0","0","0","0","False","False","False","記得拉札罕那裡辛辣食物很多，我很喜歡。<hex:02100103>一旦代謝提高，就更容易燃燒脂肪，<hex:02100103>在容易造成運動不足的環境當中，這的確很有利於健康。","0","0"
"597492","0","1","2","0","0","950","0","0","1","1","1","0","0","0","0","0","0","False","False","False","挖掘出翻譯機的墳墓的墓主人，<hex:02100103>生前或許就是從事翻譯行業的。<hex:02100103>這樣的話，或許我們也能有機會讀懂其他未知語言……","0","0"
"597493","0","1","2","0","0","763","0","0","1","1","1","0","0","0","0","0","0","False","False","False","只要使用魔法就能輕鬆辦到的事情，對於加雷馬族來說卻很困難。<hex:02100103>如果能模仿他們的文化，體驗一下不依賴魔法的生活的話，<hex:02100103>相信一定會有一些有用的發現。","0","0"
"597494","0","1","0","0","0","766","0","0","1","1","1","0","0","0","0","0","0","False","False","False","教授有難，當然不能坐視不管……<hex:02100103>可是找不到能夠幫忙的工匠啊。","0","0"
"597495","0","1","2","0","0","763","0","0","1","1","1","0","0","0","0","0","0","False","False","False","你環遊世界是出於個人的意志，<hex:02100103>還是因為有什麼不得以的苦衷……<hex:02100103>不管怎麼說，這份行動力真是讓人驚嘆。","0","0"
"597496","0","1","2","0","0","763","0","0","1","1","1","0","0","0","0","0","0","False","False","False","感覺此次的研究旅行收穫頗豐。<hex:02100103>那份在異國他鄉感受到的安心感……如果能弄明白那個，<hex:02100103>相信此次研究就能獲得巨大的進展。","0","0"
"597497","0","1","2","0","0","763","0","0","1","1","1","0","0","0","0","0","0","False","False","False","哎呀呀，你能來我真是太開心了！<hex:02100103>不過由於連續的新發現，現在忙得不可開交，<hex:02100103>下次到背水咖啡廳一起喝茶吧。","0","0"
"597498","0","1","2","0","0","764","0","0","1","1","1","0","0","0","0","0","0","False","False","False","每天都過著和平安穩的生活啊……","0","0"
"597499","0","1","2","0","0","763","0","0","1","1","1","0","0","0","0","0","0","False","False","False","和平安穩的生活啊……<hex:02100103>不過仔細一想，這絕非易事啊。","不過每天試錯的日子才更適合我們。<hex:02100103>今後也要繼續努力啊！","0"
"597500","0","1","2","0","0","768","0","0","1","1","1","0","0","0","0","0","0","False","False","False","順勢就弄了個永結同心，<hex:02100103>可沒想到還會得到其他學系的祝福！","看來大家一直都很支持我們呢。<hex:02100103>啊，光是想想都覺得好難為情……","0"
"597501","0","1","2","0","0","763","0","0","1","1","1","0","0","0","0","0","0","False","False","False","使用賢具的戰鬥方法我會銘記在心。<hex:02100103>月長石和黑曜石蓄積的魔力，<hex:02100103>這次將注入到賢具當中。","雖然形成一個使魔的個體不是易事，<hex:02100103>但我相信形成寶石獸的這股力量<hex:02100103>會以新的形式與我並肩戰鬥。","0"
"597502","0","1","2","0","0","763","0","0","1","1","1","0","0","0","0","0","0","False","False","False","我才沒有因為自己沒拿到武器<hex:02100103>就在那裡鬧彆扭。<hex:02100103>從戰鬥方式考慮，這武器也應該由阿爾菲諾來拿。","我們被送到艾奧傑亞時還是統一的服裝，<hex:02100103>如今卻穿著不同的衣服，拿著不同的武器。<hex:02100103>有一種……心潮澎湃的感覺。","0"
"597503","0","1","2","0","0","5696","0","0","1","1","1","0","0","0","0","0","0","False","False","False","我們自以為要對他們兩個被逐出萊維耶勒爾家一事負責，<hex:02100103>但說不定只是我們一廂情願的想法。<hex:02100103>說到底，這終究是他們的家事……","但話雖如此，我也沒辦法對他們毫不關心……<hex:02100103>如果你們在那裡度過了一段美好的時光，<hex:02100103>那我也會感到很高興。","0"
"597504","0","1","2","0","0","5731","0","0","1","1","1","0","0","0","0","0","0","False","False","False","包括使命在內，哲學家議會還有很多事情瞞著我們。<hex:02100103>恐怕是與星海和末日相關的重大事情。","但我還是願意選擇相信<hex:02100103>富爾什諾先生所謂的「流血」，<hex:02100103>只不過是因為對他們二人失望罷了。","0"
"597505","0","1","2","0","0","763","0","0","1","1","1","0","0","0","0","0","0","False","False","False","送給重要之人的滿懷心意的衣服，<hex:02100103>不僅能夠保護身體，還可以強大內心。","而加拉夫爺爺送給我的長袍也教會了我，<hex:02100103>不必懼怕「打破語言壁壘的超越之力」。<hex:02100103>真的……好懷念啊……","0"
"597506","0","1","2","0","0","764","0","0","1","1","1","0","0","0","0","0","0","False","False","False","目前前方禁止通行。<hex:02100103>很抱歉！","0","0"
"597507","0","1","2","0","0","764","0","0","1","1","1","0","0","0","0","0","0","False","False","False","英雄閣下！<hex:02100103>你是要前往蒼天淨界嗎？<hex:02100103>那就由我來帶路吧！","0","0"
"597508","0","1","2","0","0","764","0","0","1","1","1","0","0","0","0","0","0","False","False","False","英雄閣下！<hex:02100103>你是要前往蒼天街或蒼天淨界嗎？<hex:02100103>那就由我來帶路吧！","0","0"
"597509","0","1","2","0","0","764","0","0","1","1","1","0","0","0","0","0","0","False","False","False","從這裡可以前往蒼天淨界哦！<hex:02100103>要我為你帶路嗎？","0","0"
"597510","0","1","2","0","0","764","0","0","1","1","1","0","0","0","0","0","0","False","False","False","要前往伊修加爾德基礎層或蒼天淨界的其他社區嗎？","0","0"
"597511","0","1","2","0","0","764","0","0","1","1","1","0","0","0","0","7","7","False","False","False","此處禁止出入。<hex:02100103>很抱歉。","想要別人帶路需完成「蒼天的伊修加爾德主線任務」中的「前往伊修加爾德」。","0"
"597512","0","1","2","0","0","764","0","0","1","1","1","0","0","0","0","0","0","False","False","False","從這裡可以前往蒼天街或蒼天淨界的其他社區哦！<hex:02100103>要我為你帶路嗎？","0","0"
"597513","0","1","2","0","0","764","0","0","1","1","1","0","0","0","0","7","7","False","False","False","前方是伊修加爾德居民的住宅區。<hex:02100103>如果不瞭解蒼天街的話，<hex:02100103>請先前往皇都瞭解詳情。","想要別人帶路需完成「支線任務」中的「仰望蒼天之街」。","0"
