"0","TEXT_VOICEMAN_02300_000010_ALPHINAUD","心配ないさ、たいした傷じゃない。<hex:02100103>……フフ、まったくタタルは大げさだな。"
"1","TEXT_VOICEMAN_02300_000020_ALPHINAUD","先ほど、ちょっとした暴動があってね。<hex:02100103>それに巻き込まれたのさ。"
"2","TEXT_VOICEMAN_02300_000030_ALPHINAUD","……このところ、ウルダハでは不穏な空気が流れている。"
"3","TEXT_VOICEMAN_02300_000040_ALPHINAUD","元々ウルダハは、交易都市だけあって、<hex:02100103>豪商が幅を利かせる、貧富の差が激しい国だ。"
"4","TEXT_VOICEMAN_02300_000050_ALPHINAUD","エオルゼアいち豊かな都市と言われる裏で、<hex:02100103>金が飛び交う権力争いが絶えない。<hex:02100103>……そう、金さえあれば政治すら動かせる国なのさ。"
"5","TEXT_VOICEMAN_02300_000060_ALPHINAUD","そこに、アラミゴからの「戦災難民」や、<hex:02100103>第七霊災以降は「霊災難民」が押し寄せてきた。"
"6","TEXT_VOICEMAN_02300_000070_ALPHINAUD","権力者……特に豪商たち「砂蠍衆」にしてみれば、<hex:02100103>金を持たない厄介者を抱え込んだ状態だったろう。"
"7","TEXT_VOICEMAN_02300_000080_ALPHINAUD","そして、王党派のラウバーン局長が率いる不滅隊は、<hex:02100103>治安維持と戦力強化を謳い、難民救済策を打ち出した。"
"8","TEXT_VOICEMAN_02300_000090_ALPHINAUD","昨今、ウルダハが難民に支払っている援助金は、<hex:02100103>国の財政を圧迫するほどに上がり続けている。"
"9","TEXT_VOICEMAN_02300_000100_ALPHINAUD","そういった経緯もあって、ウルダハの民は難民に対し、<hex:02100103>常に厳しい姿勢をとってきた。"
"10","TEXT_VOICEMAN_02300_000110_ALPHINAUD","難民からしてみれば、頼らざるをえないものの、<hex:02100103>迫害を受け続けてきたに等しい状況だったのさ。"
"11","TEXT_VOICEMAN_02300_000120_ALPHINAUD","そこにきて、先のドマ難民の受け入れ拒否だ。<hex:02100103>共和派のロロリトを筆頭とする富裕層に、<hex:02100103>弱者救済の意思がないことが明確となる結果となった。"
"12","TEXT_VOICEMAN_02300_000130_ALPHINAUD","難民たちのウルダハに対する不信感は頂点に達し、<hex:02100103>各地で起きていた難民の抗議活動は、暴動に発展している。<hex:02100103>……今やウルダハは火薬庫同然さ。"
"13","TEXT_VOICEMAN_02300_000140_ALPHINAUD","……それに、各国のグランドカンパニーも、<hex:02100103>きな臭い動きを見せている……。<hex:02100103>どうにも、ひと波乱起きそうな気配がするのだ……。"
"14","TEXT_VOICEMAN_02300_100010_RAUBAHN","スウィフト大闘佐から連絡は受けている。<hex:02100103>暴動の鎮圧、ご苦労だったな。"
"15","TEXT_VOICEMAN_02300_100020_ALPHINAUD","ウルダハの難民の動きは把握していたつもりだが、<hex:02100103>ここ最近になって、さらに活発化しているように思える。<hex:02100103>……ラウバーン局長、何か掴んでいるのではないか？"
"16","TEXT_VOICEMAN_02300_100030_RAUBAHN","貴様らだから話すのだ。<hex:02100103>……他言無用で頼むぞ。"
"17","TEXT_VOICEMAN_02300_100040_RAUBAHN","先のドマ難民の受け入れ拒否が決定したことに対し、<hex:02100103>かねてから不信感を抱いていた難民のうち、<hex:02100103>「霊災難民」の一部が反発。"
"18","TEXT_VOICEMAN_02300_100050_RAUBAHN","アラミゴ系難民の急進派と一党を組み、<hex:02100103>王家への抗議活動が行われた。"
"19","TEXT_VOICEMAN_02300_100060_RAUBAHN","抗議活動は一時、示威行進まで発展したものの、<hex:02100103>それでも、時間の経過とともに、<hex:02100103>収まりをみせはじめていたのだ。"
"20","TEXT_VOICEMAN_02300_100070_RAUBAHN","……ところが、ある事件をきっかけに、<hex:02100103>暴動へと急転する。"
"21","TEXT_VOICEMAN_02300_100080_NANAMOULNAMO","難民の対応にあたっていた銅刃団の衛兵が、<hex:02100103>抗議に集まっていた非武装の難民に、矢を射たのじゃ……。"
"22","TEXT_VOICEMAN_02300_100090_NANAMOULNAMO","これに激昂した難民たちは暴徒と化した。<hex:02100103>……この事件が、暴動の発端となったのじゃ。"
"23","TEXT_VOICEMAN_02300_100100_RAUBAHN","初動調査では、あくまで事故だった。<hex:02100103>しかし、事の発端となった衛兵が不審な動きを見せたため、<hex:02100103>我ら不滅隊が、奴を捕縛して尋問したところ……"
"24","TEXT_VOICEMAN_02300_100110_RAUBAHN","砂蠍衆のテレジ・アデレジの息が掛かった商人から、<hex:02100103>金を掴まされていたことが判明したのだ。"
"25","TEXT_VOICEMAN_02300_100120_ALPHINAUD","テレジ・アデレジだと……？"
"26","TEXT_VOICEMAN_02300_100130_ALPHINAUD","彼は、ドマ難民の問題の際には、<hex:02100103>受け入れに賛成するそぶりを見せていたはず……。<hex:02100103>……なぜ、そのようなことを。"
"27","TEXT_VOICEMAN_02300_100140_RAUBAHN","「フロンティア計画」という名に、聞き覚えはあるか？"
"28","TEXT_VOICEMAN_02300_100150_RAUBAHN","現在、いずれの都市にも領有されておらず、<hex:02100103>北ザナラーンに隣接する地……「カルテノー平原」。<hex:02100103>あの地を開拓し、植民都市を築くという計画だ。"
"29","TEXT_VOICEMAN_02300_100160_ALPHINAUD","しかし、あの地は現在……。"
"30","TEXT_VOICEMAN_02300_100170_RAUBAHN","……そうだ。<hex:02100103>「アウトロー戦区」として「戦場」になっている。"
"31","TEXT_VOICEMAN_02300_200010_RAUBAHN","「カルテノー平原」……。<hex:02100103>忘れもしない、第七霊災の中心地だ。"
"32","TEXT_VOICEMAN_02300_200020_RAUBAHN","同地は、霊災後に大規模な調査が行われていたのだが、<hex:02100103>そこには、元より地中に眠っていたと思われる、<hex:02100103>古代アラグ文明の「遺跡」が露になっていたのだ。"
"33","TEXT_VOICEMAN_02300_200030_RAUBAHN","そして、現在のカルテノー平原は、遺跡の保有権を巡り、<hex:02100103>三都市が対峙している場所となっている。"
"34","TEXT_VOICEMAN_02300_200040_RAUBAHN","エオルゼア都市軍事同盟は、この争いを亀裂とせぬために、<hex:02100103>かの地で起こった対立の一切を、<hex:02100103>外に持ち出さないという協定を結んだ。"
"35","TEXT_VOICEMAN_02300_200050_RAUBAHN","……これが、「<hex:024A1AFF07E6B395E5A496FF10E382A2E382A6E38388E383ADE383BC03>戦区」と<hex:02100103>呼ばれる所以だ。"
"36","TEXT_VOICEMAN_02300_200060_RAUBAHN","戦場となっているカルテノー平原への植民……。<hex:02100103>この無謀な「フロンティア計画」の出資者こそ、<hex:02100103>件のテレジ・アデレジ……。"
"37","TEXT_VOICEMAN_02300_200070_RAUBAHN","奴は、同地の状況を知る立場でありながら、<hex:02100103>この計画を発表した。"
"38","TEXT_VOICEMAN_02300_200080_RAUBAHN","おそらく、計画で集めた多くの難民を引き連れ、<hex:02100103>彼らを人の盾として、各国の軍勢の間に入り込むつもりだ。<hex:02100103>……「遺跡」を独占するために。"
"39","TEXT_VOICEMAN_02300_200090_NANAMOULNAMO","テレジ・アデレジめ……。<hex:02100103>「フロンティア計画」は、いわば、<hex:02100103>ウルダハが領土拡大を宣言したことと同じぞ！"
"40","TEXT_VOICEMAN_02300_200100_RAUBAHN","我々王党派との調整どころか、<hex:02100103>共和派……砂蠍衆の中でも、統率はとれていないでしょう。<hex:02100103>完全に奴の単独での行いです。"
"41","TEXT_VOICEMAN_02300_200110_NANAMOULNAMO","先の暴動騒ぎも、難民たちに、<hex:02100103>ウルダハでの暮らしを諦めさせるための仕掛け……。"
"42","TEXT_VOICEMAN_02300_200120_NANAMOULNAMO","ドマの民に理解の立場を示していたのも、<hex:02100103>難民からの支持を得るための、見せかけだったに違いない。"
"43","TEXT_VOICEMAN_02300_300010_ALPHINAUD","しかし、なぜテレジ・アデレジは、<hex:02100103>そこまでカルテノーの遺跡にこだわる？<hex:02100103>下手をすれば、王家への反逆の罪ともなりえるぞ。"
"44","TEXT_VOICEMAN_02300_300020_NANAMOULNAMO","オメガ……。"
"45","TEXT_VOICEMAN_02300_300030_ALPHINAUD","……オメガ？"
"46","TEXT_VOICEMAN_02300_300040_RAUBAHN","遺跡の調査中に発見された、異形の怪物……。<hex:02100103>我々は、これを「オメガ」と呼称している。<hex:02100103>あまりに巨大なため、現在も地中に埋もれたままだがな。"
"47","TEXT_VOICEMAN_02300_300050_RAUBAHN","遺跡に記された古代アラグ文字を解読したところ、<hex:02100103>オメガは、「バハムートを捕らえし者」と示されていた。"
"48","TEXT_VOICEMAN_02300_300060_RAUBAHN","……先の「カルテノーの戦い」のおり、<hex:02100103>ガレマール帝国の将軍ネール・ヴァン・ダーナスは、<hex:02100103>衛星「ダラガブ」の落下地点をカルテノーの地とした。"
"49","TEXT_VOICEMAN_02300_300070_RAUBAHN","我々は、奴が「対バハムート兵器」とも呼ぶべきオメガを、<hex:02100103>完全破壊するためだったのではないかと睨んでいる。"
"50","TEXT_VOICEMAN_02300_300080_ALPHINAUD","対バハムート兵器……まさか、対蛮神兵器というのか！？<hex:02100103>あのアルテマウェポンのような……。"
"51","TEXT_VOICEMAN_02300_300090_RAUBAHN","我々も、完全に信じていたわけではなかった。<hex:02100103>しかし、ガイウスのアルテマウェポンを見た時、<hex:02100103>思い直したのだ……オメガは本物だと。"
"52","TEXT_VOICEMAN_02300_300100_NANAMOULNAMO","幸いなことに、現在オメガは、<hex:02100103>まさに化石のごとく沈黙しておる。<hex:02100103>……だが、先のアルテマウェポンの件もあろう。"
"53","TEXT_VOICEMAN_02300_300110_NANAMOULNAMO","古の蛮神「バハムート」を討つという力。<hex:02100103>そのような強大な力を秘めた古代兵器を、<hex:02100103>もしも、手に入れることができたなら……。"
"54","TEXT_VOICEMAN_02300_300120_RAUBAHN","テレジ・アデレジの狙いは、オメガの確保。<hex:02100103>そして、それを武器に、ウルダハ……いや、<hex:02100103>エオルゼア全土における発言権を確保するつもりだろう。"
"55","TEXT_VOICEMAN_02300_300130_NANAMOULNAMO","くだらぬ話じゃ……ロロリトと対峙して、<hex:02100103>砂蠍衆をまとめることもできぬような男に、<hex:02100103>エオルゼアを牛耳れるものか。"
"56","TEXT_VOICEMAN_02300_300140_RAUBAHN","だからこそ、危険なのです。<hex:02100103>自分の限界を知るからこそ、外に力を求める。<hex:02100103>……決して油断はできませんぞ。"
"57","TEXT_VOICEMAN_02300_300150_NANAMOULNAMO","鼠じゃ、放っておけ。<hex:02100103>……どうせ、今のウルダハに機密は無きに等しい。"
"58","TEXT_VOICEMAN_02300_300160_ALPHINAUD","いずれにせよ、難民問題には注意しておくべきだろう。<hex:02100103>これは、ウルダハだけの問題ではないのだから。"
"59","TEXT_VOICEMAN_02300_400010_HAURCHEFANT","……なるほど、開拓団の件で訪ねてきたのだな。<hex:02100103>皆まで言うな、それだけわかれば十分だ。"
"60","TEXT_VOICEMAN_02300_400020_HAURCHEFANT","ふふ……開拓団……！<hex:02100103>実に肉躍るたくましい響きではないか。<hex:02100103>しかもお前が参加しているとあらば、なおのこと……イイ！"
"61","TEXT_VOICEMAN_02300_400030_HAURCHEFANT","モードゥナに一大拠点が築かれれば、<hex:02100103>かの地の帝国軍も、クルザスへ介入しづらくなるだろう。<hex:02100103>加えて、お前には個人的な恩もある……。"
"62","TEXT_VOICEMAN_02300_400040_HAURCHEFANT","これに協力しない道理はないと、本家に掛け合って、<hex:02100103>支援物資を手配したのだがな。<hex:02100103>よりにもよって、異端者に奪取されるとは……。"
"63","TEXT_VOICEMAN_02300_400050_HAURCHEFANT","……実は最近、クルザスを根城とする異端者が組織化され、<hex:02100103>いささか手を焼いているのだ。"
"64","TEXT_VOICEMAN_02300_400060_HAURCHEFANT","異端者の頭目は「氷の巫女」と呼ばれる女……。<hex:02100103>我々も調査を続けているが、本名すら暴けていない。"
"65","TEXT_VOICEMAN_02300_400070_HAURCHEFANT","異端者たちは、その「氷の巫女」を聖女のように敬い、<hex:02100103>死も厭わずに行動しているようでな……。<hex:02100103>奴らによる組織的な犯行が増えつつあるのだ。"
"66","TEXT_VOICEMAN_02300_400080_HAURCHEFANT","今のところ、このキャンプへの実害は少ないが、<hex:02100103>ここより西方では、度々奴らが目撃されているらしい。"
"67","TEXT_VOICEMAN_02300_400090_HAURCHEFANT","ホワイトブリム前哨地ならば、情報が掴めるかもしれんぞ。<hex:02100103>……行ってみるか？"
"68","TEXT_VOICEMAN_02300_400100_HAURCHEFANT","そうかそうか！<hex:02100103>支援物資の件は遺憾だが……期せずして、お前の汗が……<hex:02100103>再びこの雪原にきらめく日がきたようだな！"
"69","TEXT_VOICEMAN_02300_400110_HAURCHEFANT","お前は以前よりも強靭になった。<hex:02100103>そして、頷きひとつからあふれる、その揺るぎなき自信……<hex:02100103>イイぞ……ますます活躍から目が離せん！"
"70","TEXT_VOICEMAN_02300_400120_HAURCHEFANT","何かわかったら、是非私にも報せてくれ。<hex:02100103>ふふ……この辺りは一段と冷えるからな、<hex:02100103>温かい床を用意して待っているぞ！"
"71","TEXT_VOICEMAN_02300_500010_YSAYLE","(-？？？？-)……フフッ。"
"72","TEXT_VOICEMAN_02300_600010_HAURCHEFANT","ああ、いいところに戻ってくれた。<hex:02100103>ちょうどお前の戦いぶりに、想いを馳せていたのだ。<hex:02100103>一撃を繰る際の肉体のしなりなど……とてもイイ……。"
"73","TEXT_VOICEMAN_02300_600020_HAURCHEFANT","時が許せばサシで向き合い、稽古をつけてもらいたいが……<hex:02100103>まずは、報告を聞かねばな。<hex:02100103>「氷の巫女」について、何か情報を得ることはできたか？"
"74","TEXT_VOICEMAN_02300_600030_HAURCHEFANT","……ふむ。<hex:02100103>スノークローク大氷壁で、そのようなことが。"
"75","TEXT_VOICEMAN_02300_600040_HAURCHEFANT","あの辺りは、クルザス中央高地の中でも、<hex:02100103>気候変化の影響が色濃く現れた場所だ。"
"76","TEXT_VOICEMAN_02300_600050_HAURCHEFANT","そのため、未だ一帯の全容は明らかになっていない。<hex:02100103>異端者にとっては、良い隠れ家かもしれんな。<hex:02100103>一度、早急に調査するよう進言すべきか……。"
"77","TEXT_VOICEMAN_02300_600060_HAURCHEFANT","それにしても、「氷の巫女」とは、いったい何者だ……？<hex:02100103>異端者をまとめあげるなど、相当な実力者に思える。"
"78","TEXT_VOICEMAN_02300_600070_HAURCHEFANT","お前とともに追ってみるのも一興だが、<hex:02100103>現状では危険が過ぎるか……。<hex:02100103>教皇庁の神殿騎士にも連絡し、対策を願おう。"
"79","TEXT_VOICEMAN_02300_600080_HAURCHEFANT","新任の神殿騎士団長は、なかなかに話のわかる人物だという。<hex:02100103>きっと、適切な判断をされることだろう。"
"80","TEXT_VOICEMAN_02300_600090_HAURCHEFANT","イイ情報を持ち帰ってくれた、感謝するぞ。<hex:02100103>お前は本当に真摯に働く……<hex:02100103>それが真実を呼ぶのだと、友として誇りに思う。"
"81","TEXT_VOICEMAN_02300_600100_HAURCHEFANT","支援物資については、本家に再度掛け合っているところだ。<hex:02100103>準備ができ次第、そちらに贈るとしよう。<hex:02100103>熱気にあふれる……イイ街になることを願ってな！"
"82","TEXT_VOICEMAN_02300_700010_KANESENNA","ようこそ、いらっしゃいました。<hex:02100103>お話というのは、シルフ族の件なのです。"
"83","TEXT_VOICEMAN_02300_700020_KANESENNA","少し前の出来事でした。<hex:02100103>私は、森の大精霊の声を聞いたのです。<hex:02100103>……それは、蛮神「ラムウ」の顕現を告げていました。"
"84","TEXT_VOICEMAN_02300_700030_KANESENNA","そして、つい先刻のこと……<hex:02100103>仮宿より、シルフ族の使いがやってきました。"
"85","TEXT_VOICEMAN_02300_700050_KANESENNA","この者によれば、仮宿のシルフたちもまた、<hex:02100103>ラムウちゃま……ラムウの顕現を感じたとのこと。"
"86","TEXT_VOICEMAN_02300_700055_KANESENNA","この者によれば、仮宿のシルフたちもまた、<hex:02100103>ラムウの顕現を感じたとのこと。"
"87","TEXT_VOICEMAN_02300_700060_KANESENNA","詳細は不明ですが、おそらく「シルフ領」の奥地にて、<hex:02100103>すでに蛮神「ラムウ」は、神降ろしされているでしょう。"
"88","TEXT_VOICEMAN_02300_700070_KANESENNA","ですが、蛮神「ラムウ」は、守護と調停を司る賢き神……。<hex:02100103>こちらが彼の意志に背くことをしなければ、<hex:02100103>シルフ族と同様に対話が成立するはずなのです。"
"89","TEXT_VOICEMAN_02300_700080_KANESENNA","「超える力」を持つあなたならば、<hex:02100103>きっと心を通わせることができるでしょう。<hex:02100103>どうか、ラムウとの対話をお願いできないでしょうか。"
"90","TEXT_VOICEMAN_02300_700090_KANESENNA","人にとっても、シルフ族にとっても、<hex:02100103>おそらくは「ラムウ」にとっても……。<hex:02100103>これ以上、この森を乱したくない想いは同じはず。"
"91","TEXT_VOICEMAN_02300_700100_KANESENNA","そしてなにより、私たちグリダニアの民は、<hex:02100103>シルフ族と森との調和、共存を望んでいるのです。"
"92","TEXT_VOICEMAN_02300_700110_KANESENNA","……感謝いたします。"
"93","TEXT_VOICEMAN_02300_700120_KANESENNA","「シルフの仮宿」に、双蛇党の者を派遣しています。<hex:02100103>詳しい話は、その者からお聞きください。"
"94","TEXT_VOICEMAN_02300_700130_KANESENNA","森に嫌な風が流れてきています。"
"95","TEXT_VOICEMAN_02300_700140_KANESENNA","この風は、黒衣森だけではない……<hex:02100103>エオルゼア全土に流れる風に感じるのです。<hex:02100103>……どうか、お気をつけて。"
"96","TEXT_VOICEMAN_02300_800010_RAMUH","……その力。<hex:02100103>お主、ハイデリンの使徒か。"
"97","TEXT_VOICEMAN_02300_800020_RAMUH","ふむ……イフリート、タイタン、ガルーダ。<hex:02100103>それにリヴァイアサン……。<hex:02100103>奴等を払い退けし光の者というのは、お主のことじゃな。"
"98","TEXT_VOICEMAN_02300_800030_RAMUH","ワシの名はラムウ。<hex:02100103>黒衣森の民、シルフ族の守護者……。"
"99","TEXT_VOICEMAN_02300_800040_RAMUH","光の者よ、ここはシルフ族の聖地。<hex:02100103>何用で「ヒト」が足を踏み入れたのじゃ。"
"100","TEXT_VOICEMAN_02300_800050_RAMUH","グリダニアの民は、調和を望んでおるというのか。<hex:02100103>……ヒトとは、かくも身勝手なものか……<hex:02100103>まっこと愚かじゃ。"
"101","TEXT_VOICEMAN_02300_800060_RAMUH","お主に、この者たちの願いが解るか。<hex:02100103>ただ、この森で静かに暮らしたいだけなのじゃ。<hex:02100103>しかし、ヒトはその小さな願いすら阻害する。"
"102","TEXT_VOICEMAN_02300_800070_RAMUH","シルフ族がワシを招いたのは、その願いを叶えるため……。<hex:02100103>そこまで追い込んだのは、貴様らヒトの仕業なのじゃぞ。"
"103","TEXT_VOICEMAN_02300_800080_RAMUH","シルフ族にとって、ヒトはヒト。<hex:02100103>たとえ、グリダニアの民が自然との調和を重んじようと、<hex:02100103>一方で、帝国の民は森を侵し続ける……。"
"104","TEXT_VOICEMAN_02300_800090_RAMUH","結果的にヒトは、森に穢れと争いを持ち込むだけじゃ。<hex:02100103>すべてはヒトが、闇を抱える存在だからにほかならん。"
"105","TEXT_VOICEMAN_02300_800100_RAMUH","……そもそも、ヒトはいつから闇を抱えるようになった。<hex:02100103>始原の時……そこには光も闇も無かった……。<hex:02100103>まさか、ヒトがヒトたるために生まれたというのか。"
"106","TEXT_VOICEMAN_02300_800110_RAMUH","ならば、ヒトがいる限り、<hex:02100103>この世から、穢れと争いが無くならぬ道理よな。<hex:02100103>なぜなら、ヒトが生きるために必要なことだからじゃ。"
"107","TEXT_VOICEMAN_02300_800120_RAMUH","光の者よ。<hex:02100103>……それでも貴様はヒトとして、<hex:02100103>調和の道を歩むというのか。"
"108","TEXT_VOICEMAN_02300_800130_RAMUH","ほう、それは聖域を去った子らに渡したクリスタル……。<hex:02100103>……なるほど、お主はワシの知ったヒトとは、<hex:02100103>ずいぶん異なる存在のようだ。"
"109","TEXT_VOICEMAN_02300_800140_RAMUH","これは光の使徒だからではない……。<hex:02100103>何か特異な……そうか、もしやあやつになら……。"
"110","TEXT_VOICEMAN_02300_800150_RAMUH","よかろう……ならば、ワシに示せ。<hex:02100103>貴様の力を。"
"111","TEXT_VOICEMAN_02300_800160_RAMUH","ヒトがシルフ族や森との調和を望むというのなら、<hex:02100103>この森から帝国を排除するほどの力を、<hex:02100103>世から闇を取り払うほどの力を、ワシに示してみせよ。"
"112","TEXT_VOICEMAN_02300_800170_RAMUH","それができぬというのなら、この雷神ラムウが、<hex:02100103>地表のすべてのヒトに、「裁きの雷」を落とすまでじゃ！"
"113","TEXT_VOICEMAN_02300_800180_RAMUH","来るがいい、光の者よ。<hex:02100103>裁きの地にて、貴様を待っておるぞ！"
"114","TEXT_VOICEMAN_02300_800190_YSHTOLA","……珍しいわね。<hex:02100103>あなたがこんなところまで出てくるなんて。"
"115","TEXT_VOICEMAN_02300_800200_URIANGER","蛮神「ラムウ」……私も、この目で見るのは初めてです……。<hex:02100103>これは眼福の光景……結尾の記憶としましょう。<hex:02100103>……これは失礼を……。"
"116","TEXT_VOICEMAN_02300_800210_URIANGER","どうしても、調べたいことがあるのです。<hex:02100103>この機械仕掛けの<hex:024A11FF04E79CBCFF0AE381BEE381AAE3819303>を通し、<hex:02100103>雷神狩りを、拝見させていただきましょう……。"
"117","TEXT_VOICEMAN_02300_900010_RAMUH","お主の力、しかと見届けた……。"
"118","TEXT_VOICEMAN_02300_900020_RAMUH","……光の者よ、気付いておろう。<hex:02100103>ヒトが抱えし闇は、すべてはヒトが撒いたもの。"
"119","TEXT_VOICEMAN_02300_900030_RAMUH","ならば、その力をこの森のため、<hex:02100103>エオルゼアのために履行してみせよ。<hex:02100103>世との調和を求めるのなら、己で勝ち取ってみせよ。"
"120","TEXT_VOICEMAN_02300_900040_RAMUH","特異な存在であるお主ならば、それも叶おう。<hex:02100103>光によって闇を払い、ヒトを正しき方向へ導くことが……。"
"121","TEXT_VOICEMAN_02300_900050_URIANGER","さすがは光の戦士……。<hex:02100103>蛮神「ラムウ」の討伐、見事です。"
"122","TEXT_VOICEMAN_02300_900060_URIANGER","私も、あなたの戦いを拝見して、たどり着きましたよ。<hex:02100103>アシエンを完全消滅させる手掛かりに……。"
"123","TEXT_VOICEMAN_02300_900070_URIANGER","まずは戻りましょう……。<hex:02100103>後ほど、石の家にて報告いたします。"
"124","TEXT_VOICEMAN_02300_A00010_KANESENNA","冒険者殿、ご苦労さまでした。<hex:02100103>先ほど、双蛇党の者より報告を受けたところです。"
"125","TEXT_VOICEMAN_02300_A00020_KANESENNA","結果的に、蛮神「ラムウ」と刃を交えることになったとか。<hex:02100103>……本当に無事でなによりでした。"
"126","TEXT_VOICEMAN_02300_A00030_KANESENNA","ラムウがそんなことを……。"
"127","TEXT_VOICEMAN_02300_A00040_KANESENNA","人が持つ闇が、新たな問題を生む……。<hex:02100103>確かにそうなのかもしれません。"
