"595017","0","1","1","0","0","755","0","0","1","1","1","0","0","0","0","0","0","False","False","False","在多瑪飛地玩捉迷藏，<hex:02100103>一定很有趣……<hex:02100103>下課後叫大家一起去玩吧。","0","0"
"595018","0","1","1","0","0","755","0","0","1","1","1","0","0","0","0","0","0","False","False","False","如果我刻苦學習，是不是很快就能長大成人了？<hex:02100103>好想快點去見見世面啊！<hex:02100103>畢竟時間就是金錢嘛！","0","0"
"595019","0","1","1","0","0","755","0","0","1","1","1","0","0","0","0","0","0","False","False","False","我要努力學習，成為多瑪最聰明的冒險者。<hex:02100103>陽山和小春總是學到一半就跑了，<hex:02100103>我得去把他們拉回來。","0","0"
"595020","0","1","2","0","0","4218","0","0","1","1","1","0","0","0","0","0","0","False","False","False","喲， <hex:022903EB0203> ！<hex:02100103>我還是一如既往，在師父身邊學習呢。<hex:02100103>要從師父那裡學習的東西還多得很呢！","0","0"
"595021","0","1","2","0","0","4219","0","0","1","1","1","0","0","0","0","0","0","False","False","False","我在做水無月老師的助教。<hex:02100103>能看孩子的大人越多越好。","0","0"
"595022","0","1","2","0","0","764","0","0","1","1","1","0","0","0","0","0","0","False","False","False","看著孩子們健康地嬉戲學習，<hex:02100103>感覺心靈受到了淨化。<hex:02100103>連我們的心情也變好了。","0","0"
"595023","0","1","2","0","0","755","0","0","1","1","1","0","0","0","0","0","0","False","False","False","想聽西方故事的人越來越多了，<hex:02100103>我現在分身乏術啊！<hex:02100103>只能到處跑去講故事了！","0","0"
"595024","0","1","1","0","0","755","0","0","1","1","1","0","0","0","0","0","0","False","False","False","你經常在各地奔走吧。<hex:02100103>不知遠方的伊西多爾閣下是否安泰？<hex:02100103>真想與他在此飲著茶，談天說地啊……","0","0"
"595025","0","1","2","0","0","764","0","0","1","1","1","0","0","0","0","0","0","False","False","False","讓孩子們吃了太多苦，<hex:02100103>現在總算能讓他們過上無憂無慮的日子。<hex:02100103>只是孩子們還是很想念在摩杜納的朋友。","0","0"
"595026","0","1","1","0","0","755","0","0","1","1","1","0","0","0","0","0","0","False","False","False","多虧了你啊。<hex:02100103>我會抱著再次回到多瑪的喜悅與謝意，<hex:02100103>努力生活每一天的。","0","0"
"595027","0","1","2","0","0","4219","0","0","1","1","1","0","0","0","0","0","0","False","False","False","最近我在糾結如何才能為多瑪飛地做出貢獻……<hex:02100103>我又不像貫師傅他們那樣有一門手藝，<hex:02100103>又沒有緋桐那樣的烹飪技巧……","0","0"
"595028","0","1","2","0","0","764","0","0","1","1","1","0","0","0","0","0","0","False","False","False","這是一個能充分發揮我本領的地方。<hex:02100103>我要遵循自己的忍道，維護飛地的治安！","0","0"
"595029","0","1","2","0","0","4218","0","0","1","1","1","0","0","0","0","0","0","False","False","False","最近我和三葉一起，<hex:02100103>嘗試製作了符合多瑪人口味的艾奧傑亞風味美食！<hex:02100103>獲得了多瑪飛地眾人的一致好評！","0","0"
"595030","0","1","2","0","0","4219","0","0","1","1","1","0","0","0","0","0","0","False","False","False","託你的福我才能回到多瑪，和父親一起生活。<hex:02100103>能回到多瑪和家人團聚，簡直像做夢一樣！","我現在也還覺得愧對收留了我的海賊眾。<hex:02100103>我現在能在飛地幫忙修船，也是多虧了首領當初的栽培。","0"
"595031","0","1","2","0","0","764","0","0","1","1","1","0","0","0","0","0","0","False","False","False","城內的瓦礫基本都清理完了，這下清爽多了！<hex:02100103>照這樣子一點點建起新的建築，<hex:02100103>總有一天多瑪飛地能恢復繁榮！","0","0"
"595032","0","1","2","0","0","4218","0","0","1","1","1","0","0","0","0","0","0","False","False","False","小櫻她們……車前會……<hex:02100103>一直在幫我們……籌集物資……<hex:02100103>實在是……感激不盡……","0","0"
"595033","0","1","2","0","0","763","0","0","1","1","1","0","0","0","0","0","0","False","False","False","四季輪轉交替，新的一年又來臨了！<hex:02100103>祝你新年快樂、萬事如意！<hex:02100103>我是子奉行，來自那遙遠的東方。","為了和艾奧傑亞的朋友們共度降神祭、增進友誼，<hex:02100103>我們特意準備了東方風情的慶祝活動，請務必前來捧場！","0"
"595034","0","1","2","0","0","763","0","0","1","1","1","0","0","0","0","0","0","False","False","False","冒險者，真是承蒙你的幫助了！<hex:02100103>降神祭還將持續一段時間，<hex:02100103>要是再遇到降神糕發狂的話，還請你繼續出手相助！","0","0"
"595035","0","1","2","0","0","4219","0","0","1","1","1","0","0","0","0","0","0","False","False","False","星芒祭的協助者們可以持證書來這裡交換禮品，<hex:02100103>不過暫時還在進行準備工作，請稍後再來！","0","0"
"595036","0","1","2","0","0","764","0","0","1","1","1","0","0","0","0","0","0","False","False","False","呵呵，本店還在做準備呢。<hex:02100103>請等一下再來吧。","0","0"
"595037","0","1","2","0","0","764","0","0","1","1","1","0","0","0","0","0","0","False","False","False","本店尚在準備中，請過後再來。","0","0"
"595038","0","1","1","0","0","0","0","0","1","1","1","0","0","0","0","0","0","False","False","False","汪助那傢伙自己把自己綁了？<hex:02100103>這消息簡直太難以置信了，是真的嗎？<hex:02100103>真令人吃驚……","0","0"
"595039","0","1","1","0","0","0","0","0","1","1","1","0","0","0","0","0","0","False","False","False","喲，是你啊。<hex:02100103>那個袋子裡的果然不是什麼好東西啊，<hex:02100103>看來我的直覺還蠻準。","0","0"
"595040","0","1","2","0","0","4219","0","0","1","1","1","0","0","0","0","0","0","False","False","False","太好了時雨，得救了呢！","0","0"
"595041","0","1","2","0","0","4219","0","0","1","1","1","0","0","0","0","0","0","False","False","False","我們的生活一直過得很緊張，<hex:02100103>但現在靠著一點一點存下來的錢也總算是有些剩餘了，<hex:02100103>這樣一來把賣掉的房子和市民權買回來已經不再是做夢了！","0","0"
"595042","0","1","2","0","0","4218","763","0","1","1","1","0","0","0","0","0","0","False","False","False","白玉小巷的傢伙們早已經忘記夢想這個單詞了，<hex:02100103>然而現在卻為此而行動起來，<hex:02100103>更令人驚訝的是連我都有了自己的夢想。","那就是讓同伴們脫貧致富，離開這裡，<hex:02100103>終有一天讓這條白玉小巷人去巷空……","0"
"595043","0","1","2","0","0","763","0","0","1","1","1","0","0","0","0","0","0","False","False","False","謝謝你去跟白玉小巷同伴們聊天。<hex:02100103>你要是有時間的話請去看看這裡的大家，<hex:02100103>看看他們身上從心底湧現出來的對未來的希望……","0","0"
"595044","0","1","2","0","0","763","0","0","1","1","1","0","0","0","0","0","0","False","False","False","真是一段神奇的體驗。<hex:02100103>會說人話的動物們一起生活在一個神社裡這種事……<hex:02100103>就算說出去恐怕也不會有人信吧。","0","0"
"595045","0","1","1","0","0","0","0","0","1","1","1","0","0","0","0","0","0","False","False","False","沒想到算盤居然成了新一任玄武——<hex:02100103>他可真是我們碧甲族的驕傲——","0","0"
"595046","0","1","2","0","0","768","0","0","1","1","1","0","0","0","0","0","0","False","False","False","真是瘋了，居然故意引發靈災！<hex:02100103>必須阻止瓦厲斯的野心！","0","0"
"595047","0","1","2","0","0","764","0","0","1","1","1","0","0","0","0","0","0","False","False","False","現在我們得知了瓦厲斯真正的意圖，<hex:02100103>停戰已經是痴人說夢了。<hex:02100103>到了這種時候就對自己無法戰鬥而感到懊惱……","0","0"
"595048","0","1","2","0","0","764","0","0","1","1","1","0","0","0","0","0","0","False","False","False","無影為了達到目的甚至建立了國家，實在是太可怕了……<hex:02100103>看來帝國的歷史和我國一樣，都被扭曲了。","0","0"
"595049","0","1","2","0","0","764","0","0","1","1","1","0","0","0","0","0","0","False","False","False","帝國本就是該戰鬥的對象，現在也確實要開戰了。<hex:02100103>只不過對手過於強大，想必將會是一場十分嚴峻的戰爭……","0","0"
"595050","0","1","2","0","0","763","0","0","1","1","1","0","0","0","0","0","0","False","False","False","沒想到帝國居然是無影建立的……<hex:02100103>我仍然無法相信，不過這樣一來要打倒的敵人就合為一體了，<hex:02100103>現在正是展現艾奧傑亞同盟軍的力量的時候！","0","0"
"595051","0","1","2","0","0","1071","0","0","1","1","1","0","0","0","0","0","0","False","False","False","之前懷疑帝國背地裡有無影在活動，<hex:02100103>欸，遠沒有想到居然是這種程度陰謀。<hex:02100103>不過既然知道了敵人的真身，那麼之後剩下的就只有戰鬥了！","0","0"
"595052","0","1","2","0","0","764","0","0","1","1","1","0","0","0","0","0","0","False","False","False","我無論如何都無法同意皇帝所說的，<hex:02100103>犧牲他人來達成理想，能有什麼大義可言？","0","0"
"595053","0","1","2","0","0","764","0","0","1","1","1","0","0","0","0","0","0","False","False","False","我也是帝國出身，<hex:02100103>但我現在效忠的對象已經不再是帝國，<hex:02100103>我只效忠於嘉恩．艾大人一人。","0","0"
"595054","0","1","2","0","0","4218","0","0","1","1","1","0","0","0","0","0","0","False","False","False","還好趕上了開戰，<hex:02100103>就在剛才，東方聯盟的先遣部隊已經抵達了，<hex:02100103>人數雖然不多，但是都是精挑細選的精銳部隊。","0","0"
"595055","0","1","2","0","0","4219","0","0","1","1","1","0","0","0","0","0","0","False","False","False","這次我也要上前線，<hex:02100103>就讓帝國兵們好好嘗嘗黑渦團的大炮和我的鐵斧吧！","0","0"
"595056","0","1","2","0","0","4218","0","0","1","1","1","0","0","0","0","0","0","False","False","False","神殿騎士團也派出了全部兵力前來參戰，<hex:02100103>艾奧傑亞的未來就是伊修加爾德的未來！<hex:02100103>這是一場絕對不能輸的戰爭！","0","0"
"595057","0","1","2","0","0","4219","0","0","1","1","1","0","0","0","0","0","0","False","False","False","第一次作為恆輝隊總帥上陣就是和帝國的全面戰爭啊，<hex:02100103>雖說略微有些緊張，不過我會全身心投入戰鬥，<hex:02100103>絕不會給父親蒙羞！","0","0"
"595058","0","1","2","0","0","764","0","0","1","1","1","0","0","0","0","0","0","False","False","False","海賊眾的船不適合遠航，<hex:02100103>沒辦法遠征艾奧傑亞，<hex:02100103>所以我們就老實待在這裡好好守衛東方了。","0","0"
"595059","0","1","2","0","0","763","0","0","1","1","1","0","0","0","0","0","0","False","False","False","為了保障在太陽神草原的平穩生活，<hex:02100103>很多部族都表示願意加入東方聯盟。<hex:02100103>我覺得若是能以此為契機加強草原人民的團結就好了。","0","0"
"595060","0","1","2","2","0","933","764","0","1","1","1","0","0","0","0","0","0","False","False","False","尋找水晶塔的裝置一事正由聖寇伊納克財團在<hex:02100103>加隆德煉鐵廠的協助下進行。<hex:02100103>在有所進展之前冒險者你先養精蓄銳好好休息吧！","對了新的旅行衣裝你還喜歡嗎？<hex:02100103>那套衣服用了大量黃金港最高級的黑漆做染料，<hex:02100103>以黑色為基調做了時尚的設計。","0"
"595061","0","1","2","0","0","1071","0","0","1","1","1","0","0","0","0","0","0","False","False","False","在賢人們接連倒下的現在，<hex:02100103>拂曉得靠我們支撐起來才行。<hex:02100103>我會帶上各位賢人的份一起努力、做好工作的！","0","0"
"595062","0","1","2","0","0","736","0","0","1","1","1","0","0","0","0","0","0","False","False","False","至今還沒有找到能讓暈倒的賢人們恢復的方法。<hex:02100103>希望那個水晶塔的裝置上會有一些線索……","0","0"
"595063","0","1","2","0","0","4218","0","0","1","1","1","0","0","0","0","0","0","False","False","False","這是拂曉的緊急事態，所以去出任務的里奧爾也回來了，<hex:02100103>越是這種時候大家就越要團結。","0","0"
"595064","0","1","2","0","0","763","0","0","1","1","1","0","0","0","0","0","0","False","False","False","不要忘了拂曉不但有阿爾菲諾和阿莉塞這對萊維耶勒爾兄妹，<hex:02100103>還有我們博爾達兄弟。<hex:02100103>我們雖然力量微薄，但也會拼盡全力將拂曉支撐起來的！","0","0"
"595065","0","1","2","0","0","763","0","0","1","1","1","0","0","0","0","0","0","False","False","False","事到如今，我更是感受到了帶領拂曉的賢人們是多麼重要。<hex:02100103>我們也要努力精進，跟上他們的腳步。","0","0"
"595066","0","1","2","0","0","4218","0","0","1","1","1","0","0","0","0","0","0","False","False","False","賢人們依舊沒有什麼變化，<hex:02100103>現在由我在和姐姐、歐卡先生等人交替進行看護。<hex:02100103>請不要擔心，一切交給我們就好。","0","0"
"595067","0","1","1","0","0","0","0","0","1","1","1","0","0","0","0","0","0","False","False","False","我這把老骨頭就算上了戰場也抵不上年輕人，<hex:02100103>我該為、又能為拂曉做些什麼呢？","0","0"
"595068","0","1","1","0","0","765","0","0","1","1","1","0","0","0","0","0","0","False","False","False","爺爺在為自己沒辦法為拂曉做些什麼而煩惱，<hex:02100103>以前這種時候總是有多瑪的寶明爺爺在身邊開導他……","0","0"
"595069","0","1","1","0","0","0","0","0","1","1","1","0","0","0","0","0","0","False","False","False","我所潛入的帝國行省也開始瀰漫起火藥味，戰爭一開始，<hex:02100103>我聽說拂曉出事就趕緊趕了回來，沒想到賢人們都陷入了昏睡……<hex:02100103>總之現在比起諜報工作，尋找那個裝置更加優先。","0","0"
"595070","0","1","1","1","0","765","666","0","1","1","1","0","0","0","0","0","0","False","False","False","啊……好久不見了呀……<hex:02100103>說起來，拂曉有來找我商量乙太的事……","構成靈魂的乙太失去了蹤影這種情況，<hex:02100103>就算是我也沒有辦法解決啊……呼。","0"
"595071","0","1","2","0","0","764","0","0","1","1","1","0","0","0","0","0","0","False","False","False","神殿騎士團向艾奧傑亞同盟軍注入了大量的戰力，<hex:02100103>現在正在阿拉米格國境地帶戰鬥。<hex:02100103>留下來的我們唯一的任務就是守衛皇都的秩序和百姓的安全。","0","0"
"595072","0","1","1","0","0","0","0","0","1","1","1","0","0","0","0","0","0","False","False","False","加入東方聯盟一事海賊眾可是非常爽快地就答應了，<hex:02100103>要和帝國這一共同的敵人戰鬥，我們也沒有拒絕的理由，<hex:02100103>就算是為了保護我們的紅玉海，團結肯定也是上策。","0","0"
"595073","0","1","2","0","0","763","0","0","1","1","1","0","0","0","0","0","0","False","False","False","聽說前往艾奧傑亞的東方聯盟在戰場上和你一起戰鬥，<hex:02100103>我身為留守組也是很羨慕了，但我會全力完成自己的任務。<hex:02100103>接下來也請多關照飛燕大人。","0","0"
"595074","0","1","2","0","0","4218","0","0","1","1","1","0","0","0","0","0","0","False","False","False","和帝國開戰之後解放軍都快忙死了。<hex:02100103>我也很想上前線，但莉瑟把邊區的事情都交給我了，<hex:02100103>我可沒辦法再說些任性的話。","0","0"
"595075","0","1","2","0","0","4218","0","0","1","1","1","0","0","0","0","0","0","False","False","False","喲，搭檔，你好像在國境地帶很活躍嘛。<hex:02100103>我本來也想參加遠征軍，結果被大哥搶先了。<hex:02100103>他說領地就交給我了，這我可沒辦法拒絕！","0","0"
"595076","0","1","2","0","0","4218","0","0","1","1","1","0","0","0","0","0","0","False","False","False","埃馬內蘭少爺聽說不用去國境地帶的時候，<hex:02100103>偷偷地做出了勝利姿勢，這一點可沒有逃過我的眼睛，嗯。","0","0"
"595077","0","1","2","0","0","763","0","0","1","1","1","0","0","0","0","0","0","False","False","False","修特拉可是耐住了地脈的奔流，<hex:02100103>她的靈魂十分強韌……路易索瓦的學生們也一樣，<hex:02100103>所以你要相信他們，做好自己眼前的事。","0","0"
"595078","0","1","2","0","0","763","0","0","1","1","1","0","0","0","0","0","0","False","False","False"," <hex:022C0DFF07022903EB0203FF02200203> ！<hex:02100103>聽說拂曉的大家都倒下了是真的嗎？！<hex:02100103>冒險者你可千萬不能再有事啊！","0","0"
"595079","0","1","2","0","0","764","0","0","1","1","1","0","0","0","0","0","0","False","False","False","要是食罪靈來了我會立刻通知要塞裡的人，<hex:02100103>對於情報來說速度就是生命，這是非常重要的工作。","0","0"
"595080","0","1","2","0","0","763","0","0","1","1","1","0","0","0","0","0","0","False","False","False","阿爾菲諾的事我聽說了，<hex:02100103>但令人懊惱的是我沒什麼學問也幫不上什麼忙。","所以我要做好自己能做的事來為守護艾奧傑亞出一份力，<hex:02100103>這樣的話等他醒來的時候，作為拂曉的成員我也能挺起胸膛。","0"
"595081","0","1","2","0","0","763","0","0","1","1","1","0","0","0","0","0","0","False","False","False","歡迎， <hex:022903EB0203> 閣下。<hex:02100103>雖說現下硝煙四起，但休息也不可或缺。<hex:02100103>來，烤著暖爐好好放鬆吧。","0","0"
"595082","0","1","2","2","0","950","763","0","1","1","1","0","0","0","0","0","0","False","False","False"," <hex:022C0DFF07022903EB0203FF02200203> ！<hex:02100103>聽說你倒在了戰場上我可擔心死了！<hex:02100103>總之沒事就好……","我們正在處理應對已知的蠻神。<hex:02100103>各國將軍隊派往這裡，<hex:02100103>會使得拂曉所肩負的責任變得更加重大。","0"
"595083","0","1","2","0","0","4218","0","0","1","1","1","0","0","0","0","0","0","False","False","False","關於和已知的蠻神的戰鬥，那個骷髏處刑人……<hex:02100103>芙朵拉也加入了進來，你知道這件事嗎？<hex:02100103>她選擇作為囚徒部隊的一員加入戰鬥。","0","0"
"595084","0","1","2","0","0","763","0","0","1","1","1","0","0","0","0","0","0","False","False","False","解放軍只參與了國境地帶的防衛戰，<hex:02100103>但越是這種時候越不能忘記蠻神相關的監視。<hex:02100103>結果導致我錯過了回石之家的時機……","0","0"
"595085","0","1","1","0","0","0","0","0","1","1","1","0","0","0","0","0","0","False","False","False","碧甲族加入東方聯盟的原因有兩個。<hex:02100103>一個當然是和帝國戰鬥——<hex:02100103>另一個是爭取到更多的客戶——","0","0"
"595086","0","1","2","0","0","763","0","0","1","1","1","0","0","0","0","0","0","False","False","False"," <hex:022C0DFF07022903EB0203FF02200203> ，<hex:02100103>東方聯盟那邊跟我說你倒下了，<hex:02100103>請不要勉強自己，一定要保重……","0","0"
"595087","0","1","1","0","0","765","0","0","1","1","1","0","0","0","0","0","0","False","False","False","以前我說過你身上發出的光芒中有陰影，<hex:02100103>我也不知道那和你在戰場上倒下是否有關係。<hex:02100103>不過現在你沒事我就放心了。","0","0"
"595088","0","1","2","0","0","4194","0","0","1","1","1","0","0","0","0","0","0","False","False","False","喂，聽說你倒在戰場上了？<hex:02100103>也不知道對手是誰，看這樣子是個相當厲害的傢伙啊。<hex:02100103>但是別輸第二次啊……給我顧忌一下這個輸給你的人的面子！","0","0"
"595089","0","1","1","0","0","0","0","0","1","1","1","0","0","0","0","0","0","False","False","False","根據東方聯盟的說法，那個帝國族還是啥了的，<hex:02100103>想要統一世界在那邊作威作福呢，<hex:02100103>奧羅尼部作為這草原的霸主可不能當做沒聽到這話。","0","0"
"595090","0","1","2","0","0","763","0","0","1","1","1","0","0","0","0","0","0","False","False","False","塔塔露小姐不在真是寂寞呀。<hex:02100103>你好像很忙的樣子，不過偶爾也過來玩一下嘛，<hex:02100103>哎呀，不小心學起塔塔露小姐說話了……","0","0"
"595091","0","1","2","0","0","763","0","0","1","1","1","0","0","0","0","0","0","False","False","False","聽說在戰場上，飛燕大人危險的時候，<hex:02100103>是你第一個衝過去救了他。<hex:02100103>我代表多瑪深表感謝！","0","0"
"595092","0","1","2","0","0","736","0","0","1","1","1","0","0","0","0","0","0","False","False","False","沒想到帝國會這麼快就再次進行侵略……<hex:02100103>我能做到的就只有每天勤懇勞動，<hex:02100103>給前線的士兵們送去好吃的醃肉了。","0","0"
"595093","0","1","2","0","0","1071","0","0","1","1","1","0","0","0","0","0","0","False","False","False","又一次回到了戰爭期間啊，<hex:02100103>我會一如既往地認真做好警備工作的。<hex:02100103>這裡就是我現在的戰場！","0","0"
"595094","0","1","2","0","0","957","0","0","1","1","1","0","0","0","0","0","0","False","False","False"," <hex:022903EB0203> 大人，<hex:02100103>老爺隨時歡迎您的光臨。<hex:02100103>請在這裡好好放鬆吧。","0","0"
"595095","0","1","2","0","0","763","0","0","1","1","1","0","0","0","0","0","0","False","False","False","哇， <hex:022C0DFF07022903EB0203FF02200203> 大人！<hex:02100103>你醒來的時候沒能說上話，<hex:02100103>不過你能醒過來我就很高興了！","0","0"
"595096","0","1","2","0","0","766","0","0","1","1","1","0","0","0","0","0","0","False","False","False","在國境防線基姆利特暗區戰鬥的同志們沒事吧……<hex:02100103>不，還是不要亂擔心了，<hex:02100103>我們都不相信同伴們能夠成功的話怎麼能行呢……","0","0"
"595097","0","1","2","0","0","950","0","0","1","1","1","0","0","0","0","0","0","False","False","False","呀，太好了，你沒事。<hex:02100103>我也參與了基姆利特暗區的戰鬥，那可真是一場激戰。<hex:02100103>真期待下次被派往前線啊！","0","0"
"595098","0","1","2","0","0","763","0","0","1","1","1","0","0","0","0","0","0","False","False","False","雖然比不上你的活躍，<hex:02100103>不過我也參與了基姆利特暗區的戰鬥，<hex:02100103>總算是贏得了激戰擊退了敵人的第一波攻擊。","0","0"
"595099","0","1","2","0","0","764","0","0","1","1","1","0","0","0","0","0","0","False","False","False","哦，這不是利奧法德中意的<hex:020813E905FF07>小姐<hex:FF07>小哥<hex:03>嗎？<hex:02100103>我是來為基地採購物資的。<hex:02100103>話說，這個有意思的裝置……能拆走嗎？","0","0"
"595100","0","1","2","0","0","764","0","0","1","1","1","0","0","0","0","0","0","False","False","False","呱呱……出去採藥時偶然撿到了漂亮的卡片呱。","0","0"
"595101","0","1","2","0","0","764","0","0","1","1","1","0","0","0","0","0","0","False","False","False","時空狹縫的調查結束了，<hex:02100103>員工們開始忙著處理調查期間積下的工作。<hex:02100103>唉——還是看守呵欠洞比較輕鬆……","0","0"
"595102","0","1","2","0","0","764","0","0","1","1","1","0","0","0","0","0","0","False","False","False","我的一位女性朋友喜歡上了西方的紙牌遊戲，<hex:02100103>弄得我也有了興趣呢。","我拜託調查隊的那些西方人，<hex:02100103>給我弄來了遊戲用的紙牌，不過玩法可真難。<hex:02100103>看來得先想想策略才行呢。","0"
"595103","0","1","2","0","0","763","0","0","1","1","1","0","0","0","0","0","0","False","False","False","彩蛋～彩蛋～大彩蛋～<hex:02100103>彩蛋狩獵的時節又來臨了！<hex:02100103>這次的彩蛋狩獵會開辦怎樣的活動呢？請好好期待一下吧！","0","0"
"595104","0","1","2","0","0","763","0","0","1","1","1","0","0","0","0","0","0","False","False","False","在格里達尼亞轉轉，<hex:02100103>看看都有什麼樣的人在參加彩蛋狩獵應該也蠻有意思的！","0","0"
"595105","0","1","2","0","0","763","0","0","1","1","1","0","0","0","0","0","0","False","False","False","看到大家玩得這麼開心，諾諾塔欣慰極了！","0","0"
"595106","0","1","2","0","0","763","0","0","1","1","1","0","0","0","0","0","0","False","False","False","咿嘰嘰！<hex:02100103>里吉、藥工作！<hex:02100103>給老碟、棒忙！","0","0"
"595107","0","1","2","0","0","764","0","0","1","1","1","0","0","0","0","0","0","False","False","False","呵呵呵……你好。<hex:02100103>我是將故鄉的傳統遊戲從東方引進到這裡的人。<hex:02100103>要是能有緣和你一起對戰一局就好了。","0","0"
"595108","0","1","2","0","0","763","0","0","1","1","1","0","0","0","0","0","0","False","False","False","勝負的運勢如何呀？<hex:02100103>多瑪方城戰是靠計略與運氣決定輸贏的遊戲。<hex:02100103>呵呵呵，我的運勢還算是很不錯的呢。","0","0"
