"590606","0","1","2","0","0","764","0","0","1","1","1","0","0","0","0","0","0","False","False","False","どうぞ、お静かに。<hex:02100103>ここ豊穣神祭壇は、道士様に加え、<hex:02100103>角尊の方々も多く訪れる場なのです。","0","0"
"590593","0","1","1","0","0","0","0","0","1","1","1","0","0","0","0","0","0","False","False","False","おや、新顔の冒険者かい？<hex:02100103>だったら、悪いこといわないから、なにはさておき<hex:02100103>うちのマスター「バデロン」に声かけときなよ。","0","0"
"590592","0","1","2","0","0","764","0","0","1","1","1","0","0","0","0","7","0","False","False","False","おや、もう降りたいのか？<hex:02100103>必要な人に話しかけたか、辺りを確認してみるんだ。<hex:02100103>用件がすべてすんだらリフトに乗せてやろう。","溺れた海豚亭を出発するには、<hex:02100103>クエスト「海都で名をなす秘訣」を受注する必要があります。<hex:02100103>「ニニヤ」からクエストを受注しましょう！","0"
"590595","0","1","2","1","0","764","756","0","1","1","1","0","0","0","0","0","0","False","False","False","すぐそこに、無骨な奴らがたむろする施設があるだろ？<hex:02100103>あそこがウルダハのグランドカンパニー、<hex:02100103>「不滅隊」の作戦本部だ。","実力ある冒険者なら、ウルダハ人じゃなくても、<hex:02100103>その一員になれるらしいな。","0"
"590594","0","1","2","0","0","764","0","0","1","1","1","0","0","0","0","0","0","False","False","False","どうした？<hex:02100103>「溺れた海豚亭」に着いたら、<hex:02100103>マスターの「バデロン」に話をするんだぞ。","0","0"
"590597","0","1","2","0","0","764","0","0","1","1","1","0","0","0","0","0","0","False","False","False","今日は、愛しの剣闘士フランツ様の試合があるんです！<hex:02100103>フランツ様～敵を華麗にぶっとばしてえ～！<hex:02100103>コロセウムに死体の山を築くのよ～！","0","0"
"590596","0","1","1","1","0","757","0","0","1","1","1","0","0","0","0","0","0","False","False","False","なによ～、せっかく来たっていうのに、<hex:02100103>会員じゃないと、カジノに入れないってどういうこと！？","……でも、無駄なお金使わないでよかったかも。<hex:02100103>私の友達なんて、ギャンブルで身を持ち崩して、<hex:02100103>今じゃ立派な盗賊よ。","0"
"590599","0","1","1","0","0","766","0","0","1","1","1","0","0","0","0","0","0","False","False","False","ウルダハは大きな街、冒険者の仕事は山ほどあるぞ。<hex:02100103>私はそろそろ潮時かな。<hex:02100103>今日のところは、クイックサンドで休むとするか。","0","0"
"590598","0","1","2","0","0","764","0","0","1","1","1","0","0","0","0","0","0","False","False","False","この扉の向こうは「フロンデール歩廊」。<hex:02100103>その奥にあるのが「錬金術師ギルド」だ。<hex:02100103>フロンデール歩廊には、我ら銀冑団の総長室もあるぞ。","0","0"
"590617","0","1","2","0","0","764","0","0","1","1","1","0","0","0","0","0","0","False","False","False","寒冷化の影響で、農作物の収穫量は減る一方。<hex:02100103>クルザスでは、食料不足が心配されているんだ。<hex:02100103>魚介類は、貴重な食料源だよ。","0","0"
"590616","0","1","2","0","0","764","0","0","1","1","1","0","0","0","0","0","0","False","False","False","私はゲゲルジュ氏の使用人、<hex:02100103>ですが、いつかは私だって……。<hex:02100103>そう祈ることくらい、構わないでしょう？","0","0"
"590619","0","1","2","0","0","764","0","0","1","1","1","0","0","0","0","0","0","False","False","False","僕は古代アラグ人の食生活について、<hex:02100103>研究を進めているんだが……<hex:02100103>なぜか、食料調達係に任命されてしまったんだ。","0","0"
"590618","0","1","2","0","0","764","0","0","1","1","1","0","0","0","0","0","0","False","False","False","私の名はルヴィオヌ。<hex:02100103>雲海に棲む魚を中心に、魚介類を商っている。<hex:02100103>君も一度、雲海を見てくるといい。絶景だぞ？","0","0"
"590621","0","1","2","0","0","764","0","0","1","1","1","0","0","0","0","7","0","False","False","False","この船は「シルバーバザー」行きだよ。<hex:02100103>今は船の点検中で、運航を中止してんだ、すまん。","レベル12以上になると、使用できるようになります。","0"
"590620","0","1","2","0","0","764","0","0","1","1","1","0","0","0","0","7","0","False","False","False","この船は「クレセントコーヴ」行きだけど……<hex:02100103>今は船の点検中で、運航を中止してんだ、すまん。","レベル12以上になると、使用できるようになります。","0"
"590623","0","1","2","0","0","764","0","0","1","1","1","0","0","0","0","0","0","False","False","False","乗船するには40ギル必要なんだ。<hex:02100103>悪いが、金を貯めて出直してくれ。","0","0"
"590622","0","1","2","0","0","764","0","0","1","1","1","0","0","0","0","0","0","False","False","False","乗船するには40ギル必要なんだ。<hex:02100103>悪いが、金を貯めて出直してくれ。","0","0"
"590609","0","1","2","0","0","764","0","0","1","1","1","0","0","0","0","0","0","False","False","False","リムサ・ロミンサ・ランディングのラウンジへ<hex:02100103>お戻りになられますか？","0","0"
"590608","0","1","2","0","0","764","0","0","1","1","1","0","0","0","0","0","0","False","False","False","グリダニア・ランディングのラウンジへ<hex:02100103>お戻りになられますか？","0","0"
"590611","0","1","0","0","0","0","0","0","1","1","1","0","0","0","7","0","0","False","False","False","クエスト「猛る焔神イフリート」で行われる、<hex:02100103>イフリート討伐戦に参加するための部屋にワープします。<hex:02100103>※β３版のみの一時的な機能となります。","0","0"
"590610","0","1","0","0","0","755","0","0","1","1","1","0","0","0","0","0","0","False","False","False","おい……黙って聞いてくれ。<hex:02100103>実はこの水辺、ドライボーンの沼地につながってるんだ。<hex:02100103>だが、皆で一斉に逃げ出したら気付かれちまう。","お前ひとりでここを抜けだして、<hex:02100103>仲間や武装を整え、俺たちを助けに来てくれないか？","無事外に出られたら、<hex:02100103>ドライボーンにいる俺の相棒を訪ねてくれ。<hex:02100103>またここまで案内してくれるはずだ。"
"590613","0","1","2","0","0","764","0","0","1","1","1","0","0","0","0","0","0","False","False","False","以前は西にあった入植地にいたのですが、<hex:02100103>サハギン族のせいで、故郷を失ってしまいました。<hex:02100103>今では、この辺りで魚介類の卸売をしていますのよ？","0","0"
"590612","0","1","2","0","0","764","0","0","1","1","1","0","0","0","0","0","0","False","False","False","俺は創作料理を追い求める「味の探求者」だ。<hex:02100103>ここリムサ・ロミンサで、豊富な魚介類を活かした<hex:02100103>新しい料理を考えてるところさ。","0","0"
"590615","0","1","2","0","0","764","0","0","1","1","1","0","0","0","0","0","0","False","False","False","その昔、新しい出会いを求めて、<hex:02100103>リムサ・ロミンサに漁師の修行に行ったことがあります。<hex:02100103>なぜ故郷に戻ってきたかって？　察してくださいよ～。","0","0"
"590614","0","1","2","0","0","764","0","0","1","1","1","0","0","0","0","0","0","False","False","False","魚介類を集めて、お店屋さんに卸しているの。<hex:02100103>貝殻を拾い集めて、お小遣いを稼いでいるうちに、<hex:02100103>これが本業になっちゃったのよね。","0","0"
"590633","0","1","2","0","0","764","0","0","1","1","1","0","0","0","0","0","0","False","False","False","この船は「モラビー造船廠」行きだよ。<hex:02100103>乗っていくかい？","0","0"
"590632","0","1","2","0","0","764","0","0","1","1","1","0","0","0","0","0","0","False","False","False","この船は「ウルヴズジェイル」行きだよ。<hex:02100103>乗っていくかい？","0","0"
"590635","0","1","2","0","0","764","0","0","1","1","1","0","0","0","0","0","0","False","False","False","この船は「幻影諸島」行きだよ。<hex:02100103>乗っていくかい？","0","0"
"590634","0","1","2","0","0","764","0","0","1","1","1","0","0","0","0","0","0","False","False","False","この船は「エールポート」行きだよ。<hex:02100103>乗っていくかい？","0","0"
"590637","0","1","2","0","0","764","0","0","1","1","1","0","0","0","0","0","0","False","False","False","乗船するには40ギル必要なんだ。<hex:02100103>悪いが、金を貯めて出直してくれ。","0","0"
"590636","0","1","2","0","0","764","0","0","1","1","1","0","0","0","0","0","0","False","False","False","この船は「幻影諸島」行きだが……<hex:02100103>今は渡航禁止なんだ、悪いがあきらめてくれ。","0","0"
"590639","0","1","2","0","0","764","0","0","1","1","1","0","0","0","0","0","0","False","False","False","この船は「海蛇の巣穴」行きだが……<hex:02100103>あそこは危険だから、今は運航を中止してんだ。","0","0"
"590638","0","1","2","0","0","764","0","0","1","1","1","0","0","0","0","0","0","False","False","False","この船は「海蛇の巣穴」行きだよ。<hex:02100103>乗っていくかい？","0","0"
"590625","0","1","2","0","0","764","0","0","1","1","1","0","0","0","0","0","0","False","False","False","乗船するには40ギル必要なんだ。<hex:02100103>悪いが、金を貯めて出直してくれ。","0","0"
"590624","0","1","2","0","0","764","0","0","1","1","1","0","0","0","0","0","0","False","False","False","乗船するには40ギル必要なんだ。<hex:02100103>悪いが、金を貯めて出直してくれ。","0","0"
"590627","0","1","2","0","0","764","0","0","1","1","1","0","0","0","0","7","0","False","False","False","この船は「キャンドルキープ埠頭」行きだよ。<hex:02100103>今は船の点検中で、運航を中止してんだ、すまん。","レベル15以上になると、使用できるようになります。","0"
"590626","0","1","2","0","0","764","0","0","1","1","1","0","0","0","0","7","0","False","False","False","この船は「エールポート」行きですが……<hex:02100103>今は船の点検中で、運航を中止してます。","レベル15以上になると、使用できるようになります。","0"
"590629","0","1","2","0","0","764","0","0","1","1","1","0","0","0","0","0","0","False","False","False","乗船するには40ギル必要なんだ。<hex:02100103>悪いが、金を貯めて出直してくれ。","0","0"
"590628","0","1","2","0","0","764","0","0","1","1","1","0","0","0","0","0","0","False","False","False","乗船するには40ギル必要なんだ。<hex:02100103>悪いが、金を貯めて出直してくれ。","0","0"
"590631","0","1","2","0","0","764","0","0","1","1","1","0","0","0","0","0","0","False","False","False","乗船するには40ギル必要なんだ。<hex:02100103>悪いが、金を貯めて出直してくれ。","0","0"
"590630","0","1","2","0","0","764","0","0","1","1","1","0","0","0","0","0","0","False","False","False","乗船するには40ギル必要なんだ。<hex:02100103>悪いが、金を貯めて出直してくれ。","0","0"
"590649","0","1","2","0","0","764","0","0","1","1","1","0","0","0","0","0","0","False","False","False","冒険者殿！<hex:02100103>こちらは現在、ご利用いただけないのであります！<hex:02100103>いわゆる「準備中」というやつであります！","0","0"
"590648","0","1","2","0","0","757","0","0","1","1","1","0","0","0","0","0","0","False","False","False","準備に思ったよりも手間取っててね。<hex:02100103>実際にここが機能し始めるのは、まだ先になりそうだ。","0","0"
"590651","0","1","2","0","0","764","0","0","1","1","1","0","0","0","0","0","0","False","False","False","カラカラのお魚、どんな味っちゃ？<hex:02100103>一口だけでも、食べてみたいっちゃ～！","0","0"
"590650","0","1","2","0","0","764","0","0","1","1","1","0","0","0","0","0","0","False","False","False","「ウルヴズジェイル」の準備が整えば、<hex:02100103>ここで防具の支給が受けられるようになるでしょう。","0","0"
"590653","0","1","2","0","0","764","0","0","1","1","1","0","0","0","0","0","0","False","False","False","ううっ、今日も寒いな……。<hex:02100103>だけどいつか立派な騎士になるって決めたんだ、<hex:02100103>このくらいの雪には負けないぞ！","0","0"
"590652","0","1","1","0","0","755","0","0","1","1","1","0","0","0","0","0","0","False","False","False","こんな砂漠で釣り支度なんて、おかしいかい？<hex:02100103>なかなかどうして、こういう土地では面白い獲物がね、<hex:02100103>釣れちゃったりするものなのさ。","0","0"
"590655","0","1","2","0","0","764","0","0","1","1","1","0","0","0","0","0","0","False","False","False","あの霊災が終わってから、<hex:02100103>ラヤ・オも、ちょっとオトナになったクポ。<hex:02100103>いつまでも子どもではいられない、なんて言ってたクポ～。","0","0"
"590654","0","1","2","0","0","764","0","0","1","1","1","0","0","0","0","0","0","False","False","False","あたしはここから一望する黒衣森が一番好き。<hex:02100103>見るたびに、いつまでも守っていかなきゃって……<hex:02100103>そんな気分にさせてくれるのよね。","0","0"
"590641","0","1","2","0","0","764","0","0","1","1","1","0","0","0","0","0","0","False","False","False","私はしがない「<hex:024A29FF0DE98592E4BF9DE59586E4BABAFF19E38197E38285E381BBE38197E38287E38186E381ABE3829303>」。<hex:02100103>騎兵団みたいな連中に、くっついて回って、<hex:02100103>必要な物資をそろえてやるのが仕事なんだ。","0","0"
"590640","0","1","2","0","0","764","0","0","1","1","1","0","0","0","0","0","0","False","False","False","乗船するには40ギル必要なんだ。<hex:02100103>悪いが、金を貯めて出直してくれ。","0","0"
"590643","0","1","2","0","0","764","0","0","1","1","1","0","0","0","0","0","0","False","False","False","調査に必要となる品々を、<hex:02100103>取りそろえるのが、私の役目です。<hex:02100103>裏方ではありますが、必要な仕事ですからね。","0","0"
"590642","0","1","2","0","0","764","0","0","1","1","1","0","0","0","0","0","0","False","False","False","私はランケール。<hex:02100103>主にデュランデル家の騎兵団を相手とする<hex:02100103>取引を行っている、いわゆる酒保商人というやつだ。 ","0","0"
"590645","0","1","2","0","0","755","0","0","1","1","1","0","0","0","0","0","0","False","False","False","よく来たな、ウジ虫ども！<hex:02100103>だが、ここ「ウルヴズジェイル」は現在準備中だ！<hex:02100103>足りない脳みそで理解したら、さっさと立ち去るがいい！！","0","0"
"590644","0","1","0","0","0","0","0","0","1","1","1","0","0","0","0","0","0","False","False","False","わわわ、攻撃をしないでくだサイ……。<hex:02100103>ワタシは悪いゾンビーではありまセン。<hex:02100103>たダ、静かに暮らしたいダケなんデス……。","襲いくる冒険者から必死で逃げて、<hex:02100103>ようやく、見つけた安住の地なんデス。<hex:02100103>そっとしておいてくだサイ……。","0"
"590647","0","1","2","0","0","764","0","0","1","1","1","0","0","0","0","0","0","False","False","False","武器の支給を受けたいのでしょうか？<hex:02100103>申し訳ありませんが、まだ準備中なのです。","0","0"
"590646","0","1","2","0","0","764","0","0","1","1","1","0","0","0","0","0","0","False","False","False","訓練兵受け入れのため、現在準備中です。<hex:02100103>今しばらくお待ちください。","0","0"
"590665","0","1","2","0","0","764","0","0","1","1","1","0","0","0","0","0","0","False","False","False","ここの美しい彫金細工の補修に関われることは、<hex:02100103>彫金師として、とても誇りなことよ。<hex:02100103>作者の意図を汲んで、一つ一つ修理していくの。","0","0"
"590664","0","1","1","0","0","755","0","0","1","1","1","0","0","0","0","0","0","False","False","False","どうだい、綺麗な庭だろう？<hex:02100103>なんせここは、十二神をすべて祀っているんだ。<hex:02100103>毎日キレイな花を咲かせないとな。","0","0"
"590667","0","1","2","0","0","764","0","0","1","1","1","0","0","0","0","0","0","False","False","False","別に、お給料が良い訳じゃないんですけどね。<hex:02100103>バスカロンさんの人柄に惚れ込んじゃいまして……。<hex:02100103>盗賊稼業からは、足を洗ったんですよ、フフ♪","0","0"
"590666","0","1","1","0","0","755","0","0","1","1","1","0","0","0","0","0","0","False","False","False","ねえ知ってる～？<hex:02100103>ここで結婚式を挙げたお嫁さんは、<hex:02100103>ず～っと幸せになれるんですって～！！","あと、近ごろはね～！<hex:02100103>「エターナルセレモニー」っていう、<hex:02100103>新しい絆の儀式をする冒険者さんも増えてるんだって～！","0"
"590669","0","1","2","0","0","764","0","0","1","1","1","0","0","0","0","0","0","False","False","False","キャンプ・トランキル付近の安全は、我々に任せろ。<hex:02100103>我ら鬼哭隊六番槍を束ねる豪腕のランドゥネル隊長が、<hex:02100103>周囲の危険に、目を光らせているのだからな。","0","0"
"590668","0","1","2","0","0","764","0","0","1","1","1","0","0","0","0","0","0","False","False","False","てめェ、どこガンつけてやが……<hex:02100103>……ゴホン、付近に危険はありませんでしたか？<hex:02100103>何かあったら、すぐに我々鬼哭隊にお報せください。","0","0"
"590671","0","1","2","0","0","764","0","0","1","1","1","0","0","0","0","0","0","False","False","False","この辺りで狩れるのは、アンテロープやドーマウスだよ。<hex:02100103>もちろん、必要な時に必要な分だけではあるが、<hex:02100103>狩りができるってのは、ありがたいことだね。","0","0"
"590670","0","1","2","0","0","764","0","0","1","1","1","0","0","0","0","0","0","False","False","False","「レッドベリー砦」と「朽葉の吹き溜まり」の動向、<hex:02100103>そして「ウルズの泉」にまつわる噂話……。<hex:02100103>ああ、報告書にまとめることがたくさんあるわ！","0","0"
"590657","0","1","2","0","0","764","0","0","1","1","1","0","0","0","0","0","0","False","False","False","ミルバネス礼拝堂は、現在立ち入り禁止です。<hex:02100103>目につかない部分で老朽化が進んでいるとのことで……<hex:02100103>修繕するのか建て直すのか……どうしたものでしょうね。","0","0"
"590656","0","1","2","0","0","764","0","0","1","1","1","0","0","0","0","0","0","False","False","False","昔はラヤ・オに、ずいぶんヒヤヒヤさせられたんだクポ。<hex:02100103>あの頃の苦労はもう、思い出したくもないクポ……。","0","0"
"590659","0","1","2","0","0","764","0","0","1","1","1","0","0","0","0","0","0","False","False","False","この滝のことは、従姉から何度も聞いていたの。<hex:02100103>機会があれば、一度は見てみたいと思っていたのよね。<hex:02100103>想像していたとおりの、美しい場所だわ……。","0","0"
"590658","0","1","2","0","0","764","0","0","1","1","1","0","0","0","0","0","0","False","False","False","臥薪嘗胆、隠忍自重。<hex:02100103>土地の者どもより狙われる此の身なれば、<hex:02100103>斯様な地に姿を隠すこと致し方なし。","されど雌伏雄飛。<hex:02100103>一族郎党に受け継がれし宿命果たすまで、<hex:02100103>吾輩、流れに漱ぎ石に枕するもの也。","0"
"590661","0","1","2","0","0","764","0","0","1","1","1","0","0","0","0","0","0","False","False","False","ここジョスラン監視哨には、<hex:02100103>偉大な鬼哭隊の元隊長の名が付けられているのだ。<hex:02100103>英雄の霊と共に任務にあたっているような、心強さがあるな。","0","0"
"590660","0","1","2","0","0","764","0","0","1","1","1","0","0","0","0","0","0","False","False","False","力自慢なだけの斧術士は、もう古いね。<hex:02100103>これからは頭脳の時代だよ、ず・の・う！","斧術士だって頭を使わなきゃ、<hex:02100103>新しい時代の戦いには、ついていけないよ。","0"
"590663","0","1","2","0","0","764","0","0","1","1","1","0","0","0","0","0","0","False","False","False","僕、シルフ族とうまく会話できないや……。<hex:02100103>話の途中で、急にいたずらしはじめたりするし……。","0","0"
"590662","0","1","2","0","0","764","0","0","1","1","1","0","0","0","0","0","0","False","False","False","ここのお家が小さいからって、<hex:02100103>バカにしないでほぴいのでふっち！<hex:02100103>本当は、もっともっと大きいお家があるのでふっち！","0","0"
"590681","0","1","2","0","0","764","0","0","1","1","1","0","0","0","0","0","0","False","False","False","この飛空艇に触れると、不思議な気分になる。<hex:02100103>冷えた心の内に、火が灯るような……<hex:02100103>こいつを早く修理してやりたくて仕方ないんだ。","0","0"
"590680","0","1","2","0","0","764","0","0","1","1","1","0","0","0","0","0","0","False","False","False","グリダニアの盟主カヌ・エ・センナ様は、<hex:02100103>冒険者の働きに、大きな期待をしておられます。<hex:02100103>どうぞ市民の声に耳を傾け、手を差し伸べてください。","0","0"
"590683","0","1","2","0","0","764","0","0","1","1","1","0","0","0","0","0","0","False","False","False","ランベルタン先生が提唱する「ナイフ変換の定理」を元に、<hex:02100103>観測されたエーテルの属性値を代入すると、<hex:02100103>理論上は属性の限界値が255、いや無限に……あ。","……あっハイ、すすす、スミマセン……ハイ。<hex:02100103>僕はエーテル学の権威、ランベルタン先生の弟子で……<hex:02100103>あ、す、スミマセン、僕の話なんて興味ないですよね……。","0"
"590682","0","1","2","0","0","764","0","0","1","1","1","0","0","0","0","0","0","False","False","False","白狼門の先には、「スカンポの安息所」が広がっている。<hex:02100103>獰猛な魔物が多く生息しているからな、<hex:02100103>力を持つ実力者でなければ、ここを通すことはできない。","0","0"
"590685","0","1","2","0","0","764","0","0","1","1","1","0","0","0","0","0","0","False","False","False","ここは「オーラムヴェイル」。<hex:02100103>金の谷の呼び名に釣られて来たのなら帰りな。<hex:02100103>中にあるのは金銀財宝じゃない、金色の毒沼さ……。","0","0"
"590684","0","1","2","0","0","764","0","0","1","1","1","0","0","0","0","0","0","False","False","False","森都「グリダニア」の緑は、良く手入れされているでしょう？<hex:02100103>あの「フフチャ」率いる園芸師ギルドの仕事ですもの、<hex:02100103>植物の世話に、手は抜けないわ。","0","0"
"590687","0","1","2","0","0","764","0","0","1","1","1","0","0","0","0","0","0","False","False","False","ゲゲルン、メメルンとお仕事っちゃ。<hex:02100103>だから、ゲゲルン、仕事がいっぱいっちゃ。<hex:02100103>ちゃりちゃりたっぷりお小遣い、ゲゲルン稼ぐっちゃ。","0","0"
"590686","0","1","1","0","0","755","0","0","1","1","1","0","0","0","0","0","0","False","False","False","ワシは無限の富と悠久の時の中で、<hex:02100103>人生の哲学について思い耽っておるのじゃよ～。<hex:02100103>才あるワシの思考のまどろみを、邪魔しないでちょ～。","0","0"
"590673","0","1","2","0","0","764","0","0","1","1","1","0","0","0","0","0","0","False","False","False","ここは「古城アムダプール」。<hex:02100103>第五星暦時代に栄えた「アムダプール」文明の遺跡です。<hex:02100103>そんな場所に、カルト教団が逃げ込もうとは……。","0","0"
"590672","0","1","2","0","0","764","0","0","1","1","1","0","0","0","0","0","0","False","False","False","お父さんは狩りに行っちゃったし、暇だなあ。<hex:02100103>ねーねー、なんか面白いことなーい？","0","0"
"590675","0","1","2","0","0","764","0","0","1","1","1","0","0","0","0","0","0","False","False","False","この辺りって、ハンノキが多いでしょう？<hex:02100103>だから、アルダースプリングスなんて呼ばれているのよ。","0","0"
