"590450","0","1","2","0","0","764","0","0","1","1","1","0","0","0","7","0","0","False","False","False","扉は閉ざされている……。","0","0"
"590453","0","1","2","0","0","764","0","0","1","1","1","0","0","0","0","0","0","False","False","False","……すみませんが、所持金が足りないようです。<hex:02100103>またの機会にご利用、お待ちしています。","0","0"
"590452","0","1","2","0","0","764","0","0","1","1","1","0","0","0","0","0","0","False","False","False","ここより先は銀冑団総長室。<hex:02100103>無用の者は入ることまかりならん。","0","0"
"590455","0","1","2","0","0","764","0","0","1","1","1","0","0","0","0","0","0","False","False","False","……すみませんが、所持金が足りないようです。<hex:02100103>またの機会にご利用、お待ちしています。","0","0"
"590454","0","1","2","0","0","764","0","0","1","1","1","0","0","0","0","0","0","False","False","False","……すみませんが、所持金が足りないようです。<hex:02100103>またの機会にご利用、お待ちしています。","0","0"
"590473","0","1","2","0","0","764","0","0","1","1","1","0","0","0","0","0","0","False","False","False","怪我はないかなぁ……僕のチョコボちゃん……。<hex:02100103>ここは気味悪いし、早く移動したいよぉ……。","0","0"
"590472","0","1","1","0","0","764","0","0","1","1","1","0","0","0","0","0","0","False","False","False","さぁさぁ、埋葬の準備は整ったかしら？<hex:02100103>何か必要なら、キャンプ・ドライボーンで調達していって！","0","0"
"590475","0","1","1","1","0","755","755","0","1","1","1","0","0","0","0","0","0","False","False","False","あんた知ってるかい？<hex:02100103>アマルジャ族が信仰してる神様は、<hex:02100103>地獄の火炎を巻き起こす「蛮神イフリート」だ。","その姿を見た者は、イフリートの信徒となるか、<hex:02100103>焼け焦げて炭になるかの二択……。<hex:02100103>ま、どちらにせよ生きて帰ってくることはねぇな。","0"
"590474","0","1","1","0","0","755","0","0","1","1","1","0","0","0","0","0","0","False","False","False","このあたりは、日差しが強烈でしてね。<hex:02100103>行き倒れたら、あっという間に「干からびた骨」に<hex:02100103>なってしまうから、「ドライボーン」って呼ばれています。","そうならないためにも、<hex:02100103>しっかりと装備を整えていってくださいね。","0"
"590477","0","1","2","0","0","764","0","0","1","1","1","0","0","0","0","0","0","False","False","False","……お静かに、ご家族がいらっしゃいます。","0","0"
"590476","0","1","2","0","0","764","0","0","1","1","1","0","0","0","0","0","0","False","False","False","我々不滅隊は、付近のアマルジャ族の警戒にあたっている。<hex:02100103>アマルジャ族を見つけたら、迂闊に近寄らないようにしろ、<hex:02100103>お前も墓地に埋められることになるぞ。","0","0"
"590479","0","1","1","1","0","755","757","0","1","1","1","0","0","0","0","0","0","False","False","False","あんた冒険者なら、ギルドリーヴとかやるんだろう？<hex:02100103>聖アダマ・ランダマっつーのは、ギルドリーヴプレートの<hex:02100103>モチーフにもなってる金持ちの聖人だぜ。","ケッ、金持ちの聖人の名がついた教会に、<hex:02100103>金のない人々が故人を弔いにくるっつーのも、<hex:02100103>妙な話だぜ、まったく。","0"
"590478","0","1","2","0","0","764","0","0","1","1","1","0","0","0","0","0","0","False","False","False","ここはザル神を祀る、聖アダマ・ランダマ教会。<hex:02100103>以前は大富豪でもあった守護聖人、聖ランダマに<hex:02100103>あやかろうと多くの商人が訪れたものです。","ですが、第七霊災ですべてが変わりました。<hex:02100103>犠牲者の亡骸を受け入れるうちに、園墓だけが広がり、<hex:02100103>今では死者の埋葬に訪れる人がほとんどです。","0"
"590465","0","1","2","0","0","764","0","0","1","1","1","0","0","0","0","0","0","False","False","False","ここはザル神の御下で呪術の学びに耽る場所……。<hex:02100103>静粛にするべし……司祭のママネに怒られる前に。","0","0"
"590464","0","1","2","0","0","764","0","0","1","1","1","0","0","0","0","0","0","False","False","False","格闘士たるもの、スタミナは大事よ！<hex:02100103>ご飯いっぱい食べて、よく寝て、日々精進しなきゃね！","0","0"
"590467","0","1","2","0","0","764","0","0","1","1","1","0","0","0","0","0","0","False","False","False","じ、呪術ってね、強くって危ないんだ……。<hex:02100103>あ、危ないから強いのかもしれないけど……。","0","0"
"590466","0","1","1","0","0","755","0","0","1","1","1","0","0","0","0","0","0","False","False","False","みんな呪術がじょうずにな～れ！<hex:02100103>破壊の力で焼き尽くせ～！　アハハ！","0","0"
"590469","0","1","2","0","0","764","0","0","1","1","1","0","0","0","0","0","0","False","False","False","第七霊災は太陽と審理を司るアーゼマ様の裁きであった！<hex:02100103>今こそ罪を告白し、導きの光を請うのだ！","0","0"
"590468","0","1","2","0","0","764","0","0","1","1","1","0","0","0","0","0","0","False","False","False","あぁ！？　なめんじゃねぇぞぉ！？<hex:02100103>お前にスリプルかまして、寝顔に落書きするぞ！","0","0"
"590471","0","1","2","0","0","764","0","0","1","1","1","0","0","0","0","0","0","False","False","False","ここは、黒衣森方面とウルダハを繋ぐ街道にある集落だ。<hex:02100103>アマルジャ族が巣食う「アマルジャ軍陣屋」や、<hex:02100103>ザル神を祀る「聖アダマ・ランダマ教会」も近い。","街道を行く商人から、アマルジャ族を見張る不滅隊。<hex:02100103>そして教会に運ばれる、無言の遺体……。<hex:02100103>様々な人が集まる場所でもある。","0"
"590470","0","1","2","0","0","764","0","0","1","1","1","0","0","0","0","0","0","False","False","False","ここは墓地が近いでしょう？<hex:02100103>だから、大切な人を亡くした遺族がたくさんいるわ。<hex:02100103>……あなたも、大事な人はきちんと守ることね。","0","0"
"590489","0","1","2","0","0","764","0","0","1","1","1","0","0","0","0","0","0","False","False","False","……あんた、本当にまっさらな冒険者？<hex:02100103>アマルジャのスパイ、とかじゃないわよね？","0","0"
"590488","0","1","2","0","0","764","0","0","1","1","1","0","0","0","0","0","0","False","False","False","ここはベスパーベイからの大量の物資が届くからね、<hex:02100103>あちこち散らばる物資の確認で大変よ。<hex:02100103>変なものが入ってないか、ちゃんとチェックしなきゃ！","0","0"
"590491","0","1","2","0","0","764","0","0","1","1","1","0","0","0","0","0","0","False","False","False","ウチの家系は代々、探検家をしていてね。<hex:02100103>俺も、爺様の作った地図「エオルゼア全図」に<hex:02100103>霊災後の地形を加筆、修正するために各地を見てまわってる。","もし、<hex:02081CE905FF0DE5ACA2E381A1E38283E38293FF0AE38380E383B3E3838A03>が俺の眼鏡にかなう働きができたなら、<hex:02100103>大冒険にピッタリの秘境を教えてやろう。<hex:02100103>危険な場所も多いが……<hex:02081CE905FF0DE5ACA2E381A1E38283E38293FF0AE38380E383B3E3838A03>なら望むところだよな？","0"
"590490","0","1","2","0","0","764","0","0","1","1","1","0","0","0","0","0","0","False","False","False","ここは「ハラタリ修練所」。<hex:02100103>ウルダハのコロセウムで戦う剣闘士の訓練施設……<hex:02100103>だったのですが、今や興行用に飼育していた魔物の巣窟ですよ。","0","0"
"590493","0","1","2","0","0","764","0","0","1","1","1","0","0","0","0","0","0","False","False","False","グリダニアは、調和と協調を重んじております。<hex:02100103>それがこの国の、ひいてはエオルゼア全体を<hex:02100103>平和に導くと信じて。","森と人が手を取りあうこの都市のごとく、<hex:02100103>エオルゼア諸国が手を取りあえるよう……<hex:02100103>冒険者殿、この先も、どうかお力をお貸しください。 ","0"
"590492","0","1","2","0","0","764","0","0","1","1","1","0","0","0","0","0","0","False","False","False","ここから先は、王宮へと続くロイヤル・プロムナード。<hex:02100103>許可なき者はお引き取り願おう。","0","0"
"590495","0","1","1","0","0","0","0","0","1","1","1","0","0","0","0","0","0","False","False","False","リムサ・ロミンサ領の港を使用する船は、<hex:02100103>積み荷検査と、関税支払が義務付けられています。<hex:02100103>まずは、このメルヴァン税関公社で受付をお願いします。","0","0"
"590494","0","1","2","0","0","764","0","0","1","1","1","0","0","0","0","0","0","False","False","False","わしの名はリュウィン。<hex:02100103>森に仇なす者の討滅を使命とする神勇隊、<hex:02100103>その隊長を務めている。","森を侵さんとする者は、<hex:02100103>イクサル族やガレマール帝国軍に限らず。<hex:02100103>お前のような冒険者の助力は、いつでも歓迎だ。","0"
"590481","0","1","2","0","0","764","0","0","1","1","1","0","0","0","0","0","0","False","False","False","西ザナラーンの「シルバーバザー」みたいに、<hex:02100103>時流を見失って落ちぶれるわけにはいかねぇ。<hex:02100103>「ゴールドバザー」は俺が、金ピカに磨いていくんだ！","0","0"
"590480","0","1","1","0","0","755","0","0","1","1","1","0","0","0","0","0","0","False","False","False","この美しい花々が生えた、不思議なグゥーブーは、<hex:02100103>第七霊災の時にクルザスから逃れてきて、<hex:02100103>ここで息絶えたそうだ。","死に物狂いで逃げてくる道中、<hex:02100103>数々の花の種を体に付けてきたのだろう……<hex:02100103>クルザス、黒衣森、ザナラーンの花が混生しているよ。","死した身体を苗床として育つ、多様な花々の芸術……。<hex:02100103>なんという美しい生命の姿、生命の神秘！"
"590483","0","1","2","0","0","763","0","0","1","1","1","0","0","0","0","0","0","False","False","False","シュコォ……シュコォ……<hex:02100103>モノにやどりし　ヒトがココロ<hex:02100103>マテリア　ひろいて　かがやきはなつ～","0","0"
"590482","0","1","2","0","0","764","0","0","1","1","1","0","0","0","0","0","0","False","False","False","今は採掘師相手の商売が熱いの！<hex:02100103>この商機、逃してなるものですかぁっ！","0","0"
"590485","0","1","2","0","0","764","0","0","1","1","1","0","0","0","0","0","0","False","False","False","科学者集団「青の手」って、かなり謎が多いんだよ。<hex:02100103>でも、ミュタミクス師は技術の発展のために、<hex:02100103>わざわざ人里に降りて、知識を広めてくれてるの！","0","0"
"590484","0","1","2","0","0","764","0","0","1","1","1","0","0","0","0","0","0","False","False","False","ミュタミクス師は、知る人ぞ知る<hex:02100103>ゴブリン族の科学者集団「青の手」の出身であられるぞ。<hex:02100103>彼らの知識は、シャーレアンに勝るとも劣らんという。","0","0"
"590487","0","1","2","0","0","764","0","0","1","1","1","0","0","0","0","0","0","False","False","False","どうもどうも、僕はここで備蓄品の管理をしています。<hex:02100103>見ての通り、荷物管理でてんてこ舞いの場所です、<hex:02100103>仕事が無くて困るということはありませんね。","0","0"
"590486","0","1","2","0","0","764","0","0","1","1","1","0","0","0","0","0","0","False","False","False","私はアシュガナ貿易のロリッヒ。<hex:02100103>優良な品質であれば、鉱石、綿布、なんでも買い取ろう。<hex:02100103>ただし私は忙しい、用がないなら話しかけないでくれよ。","0","0"
"590505","0","1","2","0","0","764","0","0","1","1","1","0","0","0","0","0","0","False","False","False","チョコボちゃんは、とても繊細なのよ。<hex:02100103>ほかの家畜よりも丁寧に接してあげないと、<hex:02100103>すぐにしょんぼりしちゃうの……。","0","0"
"590504","0","1","2","0","0","764","0","0","1","1","1","0","0","0","0","0","0","False","False","False","ソルトストランドの巨大な塩の柱は、<hex:02100103>霊災時に降ってきた炎によって、一夜にしてできたという。<hex:02100103>周囲にどんな影響が出ているのかは、目下調査中だ。","0","0"
"590507","0","1","2","0","0","764","0","0","1","1","1","0","0","0","0","0","0","False","False","False","海に生きる民は荒っぽいもんだが、<hex:02100103>それでもリムサ・ロミンサの連中は別格だな。<hex:02100103>さすがは「海賊の都市」といったところか。","0","0"
"590506","0","1","2","0","0","763","0","0","1","1","1","0","0","0","0","0","0","False","False","False","農場ができたばかりの頃の話だぁ。<hex:02100103>赤い鶏が生まれてね。そいつが普通の鶏よりも、<hex:02100103>強いかどうか、賭けをしたんだぁ。","だが、賭けの結果で大喧嘩に発展しちまってなぁ<hex:02100103>鶏も人も、みんな血で真っ赤に染まっちまった。<hex:02100103>これが「レッドルースター」って農場名の由来さ。","0"
"590509","0","1","2","0","0","764","0","0","1","1","1","0","0","0","0","0","0","False","False","False","おヌシも一杯どうだ、わっはっはっ！<hex:02100103>ここは、安く酒が飲めるから最高じゃ！！<hex:02100103>傭兵時代の蓄えは、全部酒にかわっちまったがな。","0","0"
"590508","0","1","2","0","0","764","0","0","1","1","1","0","0","0","0","0","0","False","False","False","ここはエール取引の中心地エールポート。<hex:02100103>エールは、長期航海の必需品、船乗りの飲み水だ。<hex:02100103>水は腐っちまうが、酒なら長期保存できるからなっ！","この港なら酒税が安くすむんで、<hex:02100103>商船が競ってエールを買い込みにくるのさ。","0"
"590511","0","1","2","0","0","764","0","0","1","1","1","0","0","0","0","0","0","False","False","False","ちゃりちゃり、ないない？<hex:02100103>ちゃりちゃり、40ギルくれくれっちゃ！","0","0"
"590510","0","1","2","0","0","764","0","0","1","1","1","0","0","0","0","0","0","False","False","False","ジジルンの店、いくいく？<hex:02100103>ちゃりちゃり、40ギルっちゃ！","0","0"
"590497","0","1","1","0","0","0","0","0","1","1","1","0","0","0","0","0","0","False","False","False","私たち紅血聖女団は、ローズウェン様が率いる海賊団。<hex:02100103>リムサ・ロミンサの三大海賊団のひとつよ。<hex:02100103>仲間になりたいのなら、もっと腕を磨くことね。","0","0"
"590496","0","1","2","0","0","764","0","0","1","1","1","0","0","0","0","0","0","False","False","False","現在、巴術による積み荷検査の訓練中だ。<hex:02100103>集中が必要なので、悪いが話しかけないでいただきたい。","0","0"
"590499","0","1","2","0","0","763","0","0","1","1","1","0","0","0","0","0","0","False","False","False","漁師ギルドは、エオルゼアで最大級の<hex:02100103>大きな生け簀を持っていましてね。<hex:02100103>いっつも、採れたお魚いっぱいなんです。","釣果がまったくないときは、そこでこっそり……<hex:02100103>いえ、なんでもありませんよ。","0"
"590498","0","1","1","0","0","765","0","0","1","1","1","0","0","0","0","0","0","False","False","False","この酒場には、各地から来た冒険者が集う。<hex:02100103>情報収集はもちろん、旅の仲間を見つけるためにも、<hex:02100103>積極的に交流を持つといいだろう。","0","0"
"590501","0","1","2","0","0","1018","0","0","1","1","1","0","0","0","0","0","0","False","False","False","息子が、今どこで何をしているかわかりませんが<hex:02100103>いつ帰ってきても、すぐに食事が出せるように<hex:02100103>いつも魚を余分に買っているのです。","0","0"
"590500","0","1","1","0","0","756","0","0","1","1","1","0","0","0","0","0","0","False","False","False","おや、あんたもお頭の海賊団に入りたいのかい？<hex:02100103>だったら、この列の最後に並びな。<hex:02100103>お頭に気に入られれば、海賊団に入れるよ。","お頭の船は、リムサ・ロミンサの<hex:02100103>守護神にして、航海の女神……<hex:02100103>リムレーン様に愛された最強の船さ。","0"
"590503","0","1","0","0","0","757","0","0","1","1","1","0","0","0","0","0","0","False","False","False","霊災以降、メルウィブ提督の政策が奏功して、<hex:02100103>違法な海賊はかなり減っているのだが……<hex:02100103>それでも、しぶとく残っている奴らはいてな。頭が痛いぜ。","0","0"
"590502","0","1","1","0","0","764","756","0","1","1","1","0","0","0","0","0","0","False","False","False","我ら「断罪党」は、リムサ・ロミンサの三大海賊でも、<hex:02100103>もっとも大きな勢力を誇っている。","我らは、はるか遠く東方海域まで航海し、<hex:02100103>帝国属領の船を襲撃しているのだ。<hex:02100103>そうした働きができるのも、我らの実力ゆえと覚えておけ。","0"
"590521","0","1","2","0","0","764","0","0","1","1","1","0","0","0","0","7","0","False","False","False","この船は、「リムサ・ロミンサ」行きだが……<hex:02100103>今、船の点検中で運行を中止してんだ。すまねぇな。","レベル30以上になると、使用できるようになります。","0"
"590520","0","1","2","0","0","764","0","0","1","1","1","0","0","0","0","0","0","False","False","False","この船は、「リムサ・ロミンサ」行きだよ。<hex:02100103>乗ってくかい？","0","0"
"590523","0","1","2","0","0","764","0","0","1","1","1","0","0","0","0","0","0","False","False","False","この船は、「キャンドルキープ埠頭」行きだよ。<hex:02100103>乗ってくかい？","0","0"
"590522","0","1","2","0","0","764","0","0","1","1","1","0","0","0","0","0","0","False","False","False","この船は、「エールポート」行きです。<hex:02100103>お乗りになられますか？","0","0"
"590525","0","1","2","0","0","764","0","0","1","1","1","0","0","0","0","0","0","False","False","False","ここは「<hex:024A20FF0AE799BDE78BBCE99680FF13E381AFE3818FE3828DE38186E38282E3829303>」だ。<hex:02100103>門の先は危険な魔物が多いゆえ、お前のような<hex:02100103>未熟な冒険者を通すことはできん。","0","0"
"590524","0","1","2","0","0","764","0","0","1","1","1","0","0","0","0","0","0","False","False","False","ここは「<hex:024A20FF0AE799BDE78BBCE99680FF13E381AFE3818FE3828DE38186E38282E3829303>」だ。<hex:02100103>門を通り、中央森林へ出るのか？","0","0"
"590527","0","1","2","0","0","764","0","0","1","1","1","0","0","0","0","0","0","False","False","False","この船は、「レインキャッチャー」行きだよ。<hex:02100103>乗ってくかい？","0","0"
"590526","0","1","2","0","0","764","0","0","1","1","1","0","0","0","0","0","0","False","False","False","この門は、現在封鎖中だ。<hex:02100103>森都グリダニアへ入りたいのなら、南東の地神の忘却を降り、<hex:02100103>「<hex:024A20FF0AE99D92E78BA2E99680FF13E3819BE38184E3818BE3818FE38282E3829303>」から入ることだ。","0","0"
"590513","0","1","2","0","0","764","0","0","1","1","1","0","0","0","0","0","0","False","False","False","ちゃりちゃり、ないない？<hex:02100103>ちゃりちゃり、40ギルくれくれっちゃ！","0","0"
"590512","0","1","2","0","0","764","0","0","1","1","1","0","0","0","0","0","0","False","False","False","メメルンの店、いくいく？<hex:02100103>ちゃりちゃり、40ギルっちゃ！","0","0"
"590515","0","1","2","0","0","764","0","0","1","1","1","0","0","0","0","0","7","False","False","False","この船は、「エールポート」行きだが……<hex:02100103>どうやらあんた、リムサ・ロミンサに着いたばかりの冒険者だな？","だったら、まずは、リムサ・ロミンサ都市内をまわり、<hex:02100103>都市の地理や冒険者の仕事を覚えちまったほうが身のためだぞ。<hex:02100103>外へ出るのは、それからでも遅くねぇさ。","レベル15以上になると、使用できるようになります。"
"590514","0","1","2","0","0","764","0","0","1","1","1","0","0","0","0","0","0","False","False","False","この船は、「エールポート」行きだよ。<hex:02100103>乗ってくかい？","0","0"
"590517","0","1","2","0","0","764","0","0","1","1","1","0","0","0","0","7","0","False","False","False","この船は、「リムサ・ロミンサ」行きだが……<hex:02100103>今、船の点検中で運行を中止してんだ。すまねぇな。","レベル15以上になると、使用できるようになります。","0"
"590516","0","1","2","0","0","764","0","0","1","1","1","0","0","0","0","0","0","False","False","False","この船は、「リムサ・ロミンサ」行きだよ。<hex:02100103>乗ってくかい？","0","0"
"590519","0","1","2","0","0","764","0","0","1","1","1","0","0","0","0","0","7","False","False","False","この船は、「コスタ・デル・ソル」行きだが……<hex:02100103>どうやらあんた、リムサ・ロミンサに着いたばかりの冒険者だな？","だったら、まずは、リムサ・ロミンサ都市内をまわり、<hex:02100103>都市の地理や冒険者の仕事を覚えちまったほうが身のためだぞ。<hex:02100103>外へ出るのは、それからでも遅くねぇさ。","レベル30以上になると、使用できるようになります。"
"590518","0","1","2","0","0","764","0","0","1","1","1","0","0","0","0","0","0","False","False","False","この船は、「コスタ・デル・ソル」行きだよ。<hex:02100103>乗ってくかい？","0","0"
"590537","0","1","2","0","0","764","0","0","1","1","1","0","0","0","0","0","0","False","False","False","0","0","0"
"590536","0","1","2","0","0","764","0","0","1","1","1","0","0","0","0","0","0","False","False","False","幻術皇カヌ・エ・センナ様はご多忙の身。<hex:02100103>今は「不語仙の座卓」へお通しすることはできません。","0","0"
"590539","0","1","2","0","0","764","0","0","1","1","1","0","0","0","0","0","0","False","False","False","申し訳ないでっすが、ここは一般の方の立ち入りは、<hex:02100103>お控えいただいておりまっす。<hex:02100103>すみやかに、お引き取りねがいまっす。","0","0"
"590538","0","1","2","0","0","764","0","0","1","1","1","0","0","0","0","0","0","False","False","False","あ、<hex:022C0DFF07022903EB0203FF02200203>さん！<hex:02100103>おつかれさまでっす。受付、異常なしでっす。","0","0"
"590541","0","1","2","0","0","764","0","0","1","1","1","0","0","0","0","0","0","False","False","False","タタルさんのおしゃべりは困ったものだけど、<hex:02100103>いい機会かもしれないわ。","グランドカンパニーに所属してしまえば、<hex:02100103>「暁の血盟」との繋がりは、見えにくくなる……。<hex:02100103>思う存分、活躍できるってこと！","0"
"590540","0","1","2","0","0","764","0","0","1","1","1","0","0","0","0","0","0","False","False","False","いきなりの任務でごめんなさい。<hex:02100103>でも、蛮神問題がどれだけ切迫しているか、<hex:02100103>あなたに知って欲しいの。","第七霊災から、世界は復興に向かっている……<hex:02100103>本当にそうなのかしら？","今のエオルゼアを知り、真実を見つけて。<hex:02100103>あなたの活躍に期待しているわ。"
"590543","0","1","2","0","0","764","0","0","1","1","1","0","0","0","0","0","0","False","False","False","キミのこと、あちこちで話題になってるよ～？<hex:02100103>もちろん、ここ「砂の家」でもね！","あ、「砂の家」っていうのは元々別の建物だったんだけど、<hex:02100103>いろいろあって今の……まあいっか。<hex:02100103>つまり、あたしたちのアジトってこと！","0"
"590542","0","1","2","0","0","764","0","0","1","1","1","0","0","0","0","0","0","False","False","False","キミのこと、あちこちで話題になってるよ～？<hex:02100103>もちろん、ここ「砂の家」でもね！","あ、「砂の家」っていうのは元々別の建物だったんだけど、<hex:02100103>いろいろあって今の……まあいっか。<hex:02100103>つまり、あたしたちのアジトってこと！","0"
