"592509","0","1","2","0","0","950","0","0","1","1","1","0","0","0","0","0","0","False","False","False","翼はカピカピしてないくぽ？<hex:02100103>頭のポンポンはムズムズしてないくぽ？<hex:02100103>いいお薬があるくぽよ……元気なら、なによりくぽ。","0","0"
"592508","0","1","1","0","0","755","0","0","1","1","1","0","0","0","0","0","0","False","False","False","ダサい名前の<hex:022C0DFF07022903EB0203FF02200203>よ。<hex:02100103>モグは、名前だけで決めつけたりしないくぽ。<hex:02100103>モグの試練を受けてもらい、じっくりしっかり吟味するくぽ。","0","0"
"592511","0","1","2","0","0","4226","0","0","1","1","1","0","0","0","0","0","0","False","False","False","モグに見とれて、くーぽくぽ！<hex:02100103>別に、恥ずかしがらなくてもいいくぽ。<hex:02100103>地上にもこんな美人は、いないハズくぽ！","0","0"
"592510","0","1","2","0","0","763","0","0","1","1","1","0","0","0","0","0","0","False","False","False","この坂をトットコ登っていけば、<hex:02100103>ソーム・アルの山頂に出られるくぽ！<hex:02100103>見晴らしもよくて、モグたちのお気に入りの場所くぽ～！","0","0"
"592497","0","1","2","0","0","950","0","0","1","1","1","0","0","0","0","0","0","False","False","False","おお、自分に何かご用であるか！？<hex:02100103>申し訳ないが、ただいま歩哨任務中である！<hex:02100103>用件は、また後ほど、うかがうのであ～る！","0","0"
"592496","0","1","2","0","0","763","0","0","1","1","1","0","0","0","0","0","0","False","False","False","オイラはこれでも、羊飼育のセキニンシャダイリなんだぜ！<hex:02100103>つまり、雲海での羊飼育の未来は、オイラのソウケンに、<hex:02100103>かかってるってことなんだ、すごいだろ！","0","0"
"592499","0","1","1","0","0","755","0","0","1","1","1","0","0","0","0","0","0","False","False","False","……ここは、ここは、<hex:02100103>ヒトの訪れるような場所ではないのです。","0","0"
"592498","0","1","2","0","0","763","0","0","1","1","1","0","0","0","0","0","0","False","False","False","士気の低い者が多いからこそ、<hex:02100103>上官が模範を示さねばなりません。<hex:02100103>ラニエット隊長を支える者として……。","0","0"
"592501","0","1","1","0","0","755","0","0","1","1","1","0","0","0","0","0","0","False","False","False","待たれよ、待たれよ。<hex:02100103>長老であるソヌバヌさまの前で、無礼な真似をするでないぞ。","0","0"
"592500","0","1","2","0","0","4219","0","0","1","1","1","0","0","0","0","0","0","False","False","False","ようこそ、ようこそ、旅のおヒト様！<hex:02100103>干天にやってくる雨雲のように、歓迎するよ！<hex:02100103>何かあれば、遠慮無く言ってほしいね！","0","0"
"592503","0","1","2","0","0","763","0","0","1","1","1","0","0","0","0","0","0","False","False","False","いやはや、いやはや……。<hex:02100103>いや、出来の悪い弟のことを考えていたら、<hex:02100103>ついつい不安になってしまってな……はあ……。","0","0"
"592502","0","1","2","0","0","4219","0","0","1","1","1","0","0","0","0","0","0","False","False","False","ようこそ、ようこそ、オク・ズンドへ。<hex:02100103>エーテライトの傍で踊っているやつらを見たか？<hex:02100103>それは、それは、見事な踊りであろう、そうであろう！？","0","0"
"592521","0","1","2","0","0","763","0","0","1","1","1","0","0","0","0","0","0","False","False","False","シュコォ……シュコォ……<hex:02100103>ここは　我らが　イディルシャイア！<hex:02100103>みんなで作る　自由の都市ゴブ！","0","0"
"592520","0","1","2","0","0","763","0","0","1","1","1","0","0","0","0","0","0","False","False","False","モグは、お花が大好きくぽ。<hex:02100103>いつか、この雲海をお花でいっぱいにして、<hex:02100103>地上からも、お客さんを招きたいくぽ。","0","0"
"592523","0","1","2","0","0","763","0","0","1","1","1","0","0","0","0","0","0","False","False","False","シュコォ……シュコォ……<hex:02100103> 「青の手」　来なけりゃ　ノンビリと<hex:02100103>ご飯が食べれて　幸せよ～","0","0"
"592522","0","1","2","0","0","763","0","0","1","1","1","0","0","0","0","0","0","False","False","False","シュコォ……シュコォ……<hex:02100103>この街は　ただ今ゼッサン　つくり途中～！<hex:02100103>やる気があれば　ヒトでも誰でも　大歓迎～！","0","0"
"592525","0","1","2","0","0","763","0","0","1","1","1","0","0","0","0","0","0","False","False","False","シュコォ……シュコォ……<hex:02100103>シャーレアン　みんな　去って　街だけ残った<hex:02100103>だからゴブたち　決めたのだ！　ここに住むこと　決めたのだ！","トンテンカンテン　直した　造った<hex:02100103>イディルシャイア　ゴブらの誇り～<hex:02100103>素敵な我が家　守ってみせる～","0"
"592524","0","1","2","0","0","763","0","0","1","1","1","0","0","0","0","0","0","False","False","False","シュコォ……シュコォ……<hex:02100103>イディルシャイアは　ゴブらの楽園<hex:02100103>悪い奴らは　通さない～　門番だから　通さない～","0","0"
"592527","0","1","2","0","0","763","0","0","1","1","1","0","0","0","0","0","0","False","False","False","シュコォ……シュコォ……<hex:02100103>シャーレアン　不思議なものが沢山ね～<hex:02100103>いっぱい拾って　いじくるの～","0","0"
"592526","0","1","2","0","0","763","0","0","1","1","1","0","0","0","0","0","0","False","False","False","シュコォ……シュコォ……<hex:02100103>「青の手」　ゴブらの邪魔をする～<hex:02100103>憎き　奴らを倒すため～　作戦　立案　検討中～","0","0"
"592513","0","1","2","0","0","763","0","0","1","1","1","0","0","0","0","0","0","False","False","False","物騒な格好をしてるくぽ？<hex:02100103>それはそうくぽ、モグリンさまや、みんなを守るためくぽ！<hex:02100103>モグリンさまの前では、失礼のないようにするくぽ～。","0","0"
"592512","0","1","2","0","0","950","0","0","1","1","1","0","0","0","0","0","0","False","False","False","このお花を見るくぽ、とってもきれいくぽ～！<hex:02100103>モグモモが、心をこめて、大事に大事に育ててるくぽ♪","0","0"
"592515","0","1","2","0","0","950","0","0","1","1","1","0","0","0","0","0","0","False","False","False","ここは日当たりが良くて、植物たちを育てるのに絶好くぽ。<hex:02100103>クポの木や、フワフワ浮草を栽培したり、<hex:02100103>ドラゴン族から護りたい植物も、育ててるくぽ。","0","0"
"592514","0","1","2","0","0","967","0","0","1","1","1","0","0","0","0","0","0","False","False","False","どーもどーも、ゲージュツカのモグは、<hex:02100103>「クポの実」を題材にしたいのですくぽ。<hex:02100103>でも……どうしても、描く前に食べちゃうんですくぽ。","0","0"
"592517","0","1","2","0","0","950","0","0","1","1","1","0","0","0","0","0","0","False","False","False","モグたちはここで、ドラゴン族の動きを監視しているくぽ。<hex:02100103>邪竜様が咆哮を発してから、一時も目が離せないくぽ。","0","0"
"592516","0","1","2","0","0","763","0","0","1","1","1","0","0","0","0","0","0","False","False","False","くぽぽ……モグミルは、ヒトが作った金属をたくさん集めて、<hex:02100103>それから、それから……えーっと……<hex:02100103>みんなに自慢するくぽ！","0","0"
"592519","0","1","2","0","0","950","0","0","1","1","1","0","0","0","0","0","0","False","False","False","おっきな建物を建てたり、ピカピカの金属を作ったり、<hex:02100103>ヒトって、とっても興味深いくぽ！","0","0"
"592518","0","1","2","0","0","763","0","0","1","1","1","0","0","0","0","0","0","False","False","False","ここから見ると、下にいるドラゴン族なんか、<hex:02100103>クポの実くらい小さくて、モグにも倒せそうくぽ！<hex:02100103>……でも、今日は調子が悪いから、今度にするくぽ。","0","0"
"592537","0","1","2","0","0","763","0","0","1","1","1","0","0","0","0","0","0","False","False","False","……ザザ……視察中のお客様にお知らせします。<hex:02100103>ポート・ヘリックスで、保安用端末の指令機が……ザ……。<hex:02100103>事態の収束まで近づかないようお願い……ザザ……。","0","0"
"592536","0","1","2","0","0","764","0","0","1","1","1","0","0","0","0","0","0","False","False","False","ザ……ただいま、清掃中……ザザ……。<hex:02100103>お足元が滑りやすくなって……ザ……。","0","0"
"592539","0","1","2","0","0","763","0","0","1","1","1","0","0","0","0","0","0","False","False","False","ふむ、冒険者か……。<hex:02100103>あまり余計な騒ぎはおこさないでくれよ。<hex:02100103>いつ何時、ドラゴン族が襲ってくるかわからないんだ。","0","0"
"592538","0","1","2","0","0","764","0","0","1","1","1","0","0","0","0","0","0","False","False","False","ザ……鎮圧システムより、緊急連絡。<hex:02100103>忠実なるアラグ帝国軍将兵……ザザ……発令。<hex:02100103>対人鎮圧用端末が……ザ……これは、訓練では……ザザ……。","0","0"
"592541","0","1","2","0","0","763","0","0","1","1","1","0","0","0","0","0","0","False","False","False","……見ればわかるだろう、忙しくてね。<hex:02100103>史上初めてのドラゴン族の皇都侵入……<hex:02100103>あの悪夢を振り払うためにも、修繕を急ぎたいんだ。","0","0"
"592540","0","1","1","0","0","755","0","0","1","1","1","0","0","0","0","0","0","False","False","False","階段を登った先は、聖バルロアイアン広場……。<hex:02100103>数百年前に邪竜「ニーズヘッグ」を退けたこともある、<hex:02100103>「蒼の竜騎士」バルロアイアンを記念した広場です。","0","0"
"592543","0","1","2","0","0","764","0","0","1","1","1","0","0","0","0","0","0","False","False","False","仕事が欲しければ、そこの神殿騎士に声をかけてみな。<hex:02100103>今のイシュガルドには、それこそ腐るほど仕事がある。<hex:02100103>特にアンタみたいな、デキる奴にとっては、ね。","0","0"
"592542","0","1","2","0","0","764","0","0","1","1","1","0","0","0","0","0","0","False","False","False","……かわいそうに。<hex:02100103>このお客さん、小さなお子さんを亡くしたそうです。","0","0"
"592529","0","1","2","0","0","763","0","0","1","1","1","0","0","0","0","0","0","False","False","False","ここは、ウルダハとぜんぜん違うな。<hex:02100103>あっちの方が発展はしてるけどよ、<hex:02100103>イディルシャイアの方が断然、暮らしやすいぜ。","0","0"
"592528","0","1","2","0","0","933","0","0","1","1","1","0","0","0","0","0","0","False","False","False","ここは、堅気の連中が来る場所じゃないよ！<hex:02100103>かくいうアタシも、トレジャーハンター。<hex:02100103>後ろ暗い稼業じゃないけど、世間の目は厳しいからね。","0","0"
"592531","0","1","2","0","0","763","0","0","1","1","1","0","0","0","0","0","0","False","False","False","たとえ両の眼が開いていようと、<hex:02100103>心の眼を閉じた大馬鹿者どもに、知恵を貸す気はないね！<hex:02100103>フン、偏屈者と呼びたければ、勝手に呼ぶがいいさ！","0","0"
"592530","0","1","2","0","0","950","0","0","1","1","1","0","0","0","0","0","0","False","False","False","第七霊災で死にかけた時、僕は兄貴に救ってもらったっす！<hex:02100103>だから僕は、どこまでも兄貴についていくっす！","0","0"
"592533","0","1","2","0","0","966","0","0","1","1","1","0","0","0","0","0","0","False","False","False","キレイニ、シマショウ、サッサカサ！<hex:02100103>床はピカピカ、柄はツヤツヤ。<hex:02100103>真ん中ホウキは、二枚目サ！","0","0"
"592532","0","1","2","0","0","966","0","0","1","1","1","0","0","0","0","0","0","False","False","False","オソウジ、シマショウ、サッサカサ！<hex:02100103>頑固な汚れも、根気ヨク。<hex:02100103>兄さんホウキは、一本気！","0","0"
"592535","0","1","2","0","0","763","0","0","1","1","1","0","0","0","0","0","0","False","False","False","ザ……ザザ……<hex:02100103>忠実なるアラグ帝国軍将兵の皆さま、こんにちは。<hex:02100103>本日のトレーニングプログラムを開始……ザ……。","0","0"
"592534","0","1","2","0","0","763","0","0","1","1","1","0","0","0","0","0","0","False","False","False","ゲコゲコォ……。<hex:02100103>戦うのはさっぱりダメで、おつかいひとつ全うできず、<hex:02100103>掃除をすればホウキに劣る、ダメにダメな、このわたくし……。","それでも、ただのトードには戻されたくないケロ！<hex:02100103>どうにかして、マトーヤ様のお役に立つケローッ！","0"
"592553","0","0","0","0","0","0","0","0","0","0","0","0","0","0","0","0","0","False","False","False","","",""
"592552","0","1","2","0","0","763","0","0","1","1","1","0","0","0","0","0","0","False","False","False","イシュガルドが寒いのは、気候のせいだけではない。<hex:02100103>人々の悲しみが深く、気持ちが沈んでいるせいさ……。","0","0"
"592555","0","1","2","0","0","764","0","0","1","1","1","0","0","0","0","0","0","False","False","False","ああ、故郷に帰りたい……。<hex:02100103>ファルコンネスト、わしの美しい故郷……。","0","0"
"592554","0","1","2","0","0","763","0","0","1","1","1","0","0","0","0","0","0","False","False","False","飢えを凌ぐ食料も、寒さを凌ぐ布も、すべて足りない。<hex:02100103>俺たちはいい、だが子どもたちはどうする……！","0","0"
"592557","0","1","1","0","0","755","0","0","1","1","1","0","0","0","0","0","0","False","False","False","ここはもともと、神殿騎士団向けのチョコボを飼育するため、<hex:02100103>教皇庁が設立した施設なんだ。<hex:02100103>だから、施設の名前に「聖」が付くってわけさ。","0","0"
"592556","0","1","2","0","0","763","0","0","1","1","1","0","0","0","0","0","0","False","False","False","ここは、聖大厩舎。<hex:02100103>騎兵向けの軍用チョコボを飼育、訓練している施設です。<hex:02100103>黒チョコボの訓練なら、我々にお任せください。","0","0"
"592559","0","1","2","0","0","763","0","0","1","1","1","0","0","0","0","0","0","False","False","False","あら、いらっしゃい。<hex:02100103>ここ宝杖通りには、さまざまな店がひしめいています。<hex:02100103>お探しの物がございましたら、ぜひお立ち寄りくださいな。","0","0"
"592558","0","1","2","0","0","763","0","0","1","1","1","0","0","0","0","0","0","False","False","False","嘆いたって、愚痴ったって、戦いは終わらない。<hex:02100103>だったら、明るく前向きに生きたほうが得ってもんだ！<hex:02100103>あんたも、そう思わないかい？","0","0"
"592545","0","1","2","0","0","763","0","0","1","1","1","0","0","0","0","0","0","False","False","False","神殿騎士団コマンドとして、総長の補佐を務めている。<hex:02100103>君のことは、総長からよく聞いているぞ。","0","0"
"592544","0","1","2","0","0","4219","0","0","1","1","1","0","0","0","0","0","0","False","False","False","やれやれ……次から次へとドラゴン族の襲撃報告が舞い込む。<hex:02100103>被害報告をまとめるのも、一苦労だ。","0","0"
"592547","0","1","1","0","0","755","0","0","1","1","1","0","0","0","0","0","0","False","False","False","この先は、イシュガルドの「上層」です。<hex:02100103>四大名家のお屋敷や、神聖裁判所、聖レマノー大聖堂……。<hex:02100103>聖ガンリオル占星院などがございます。","0","0"
"592546","0","1","1","0","0","755","0","0","1","1","1","0","0","0","0","0","0","False","False","False","イシュガルドの平和のため、すべてを捨ててここに来た。<hex:02100103>だが、一向に減らぬドラゴン族の襲撃を前にすると、<hex:02100103>たまに、どうしようもなく無力な気持ちになる。","0","0"
"592549","0","1","1","0","0","755","0","0","1","1","1","0","0","0","0","0","0","False","False","False","雲霧街に踏み入るなんて……あんたも趣味が悪い。<hex:02100103>ハッ、寒さに凍える貧乏人を、笑いにでも来たのかい？","0","0"
"592548","0","1","1","0","0","755","0","0","1","1","1","0","0","0","0","0","0","False","False","False","ここは、イシュガルド正教の総本山を護る要。<hex:02100103>誇り高き、神殿騎士団本部です。","0","0"
"592551","0","1","2","0","0","763","0","0","1","1","1","0","0","0","0","0","0","False","False","False","私は雲霧街で寒さに震える人々に、<hex:02100103>炊き出しや奉仕活動をしながら、神の教えを説いています。","そう、神の教えとは、政治の方便でもなければ、<hex:02100103>戦いの道具でも、商いの口上でもありません。<hex:02100103>人を救うためにあるのですから……。","0"
"592550","0","1","1","0","0","755","0","0","1","1","1","0","0","0","0","0","0","False","False","False","冷たい……左腕の感覚がないの……。<hex:02100103>ねぇ、これ、どうなっちゃうの……？<hex:02100103>怖い、怖い、怖いよ……。","0","0"
"592569","0","1","2","0","0","4221","0","0","1","1","1","0","0","0","0","0","0","False","False","False","フォルタン家のご長男は、秀麗眉目の貴公子として、<hex:02100103>皇都のご婦人方に、大変人気なのですよ。<hex:02100103>ああ、アルトアレール様、顔を見せてくださらないかしら。","0","0"
"592568","0","1","2","0","0","4218","0","0","1","1","1","0","0","0","0","0","0","False","False","False","……あら、この服装が気になるのかしら？<hex:02100103>これは聖レマノー大聖堂に併設されている、<hex:02100103>聖アンダリム神学院の制服よ。","0","0"
"592571","0","1","2","0","0","763","0","0","1","1","1","0","0","0","0","0","0","False","False","False","飛空艇による輸送は、陸路よりも費用がかさむんですよね。<hex:02100103>だから、こうした輸送品目の確認にも、気は抜けません。<hex:02100103>洩れがないようにしなければ！","0","0"
"592570","0","1","2","0","0","763","0","0","1","1","1","0","0","0","0","0","0","False","False","False","ドラゴン族どもが襲ってくるやもしれぬと考えると、<hex:02100103>空を眺めていても、なかなか心が休まらないものです……。","0","0"
"592573","0","1","2","0","0","4219","0","0","1","1","1","0","0","0","0","0","0","False","False","False","ふう、飛行計画を管理している身としては、<hex:02100103>天候不順で欠航が出ると、怒鳴り散らしたくなるね。<hex:02100103>埋め合わせの便は、どうするか……やれやれだよ。","0","0"
"592572","0","1","2","0","0","4218","0","0","1","1","1","0","0","0","0","0","0","False","False","False","貴方も、この制服が気になりますか？<hex:02100103>以前は人々の憧れだったのに、今や怒りの標的……。<hex:02100103>まったく気が滅入りますよ。","0","0"
"592575","0","1","2","0","0","4218","0","0","1","1","1","0","0","0","0","0","0","False","False","False","星図に興味があるのかい？<hex:02100103>船乗りが重視するのは、北の空に鎮座する北極星だけど、<hex:02100103>イシュガルドでは、「竜星」が一番重要だ。","0","0"
"592574","0","1","2","0","0","763","756","0","1","1","1","0","0","0","0","0","0","False","False","False","ここ「聖ガンリオル占星院」は、<hex:02100103>皇都における占星術研究の中心地……。<hex:02100103>竜の動向予測の精度を上げるべく研究が行われています。","0","0"
"592561","0","1","1","0","0","755","0","0","1","1","1","0","0","0","0","0","0","False","False","False","この階段は、聖レマノー大聖堂……<hex:02100103>そして、イシュガルド教皇庁へと続いています。<hex:02100103>どちらも皇都の中心、不審な言動はお慎みください。","0","0"
"592560","0","1","2","0","0","763","0","0","1","1","1","0","0","0","0","0","0","False","False","False","私はこの宝杖通りで、手広く商いをしている者です。<hex:02100103>神学院の蔵書からチョコボの飼料まで、何でも扱いますよ。<hex:02100103>商売を選ぶなんて、そんな贅沢できませんからね。","0","0"
"592563","0","1","2","0","0","764","0","0","1","1","1","0","0","0","0","0","0","False","False","False","僕らは、まだ生きているんだ……。<hex:02100103>戦いの中で散っていった仲間たちのためにも、<hex:02100103>立ち止まらず、戦いつづけていかないとね。","0","0"
"592562","0","1","2","0","0","4221","0","0","1","1","1","0","0","0","0","0","0","False","False","False","これからお友だちと、宝杖通りへお買い物に行きますの。<hex:02100103>ああ、階段の下から、わたくしに買ってほしいとねだる、<hex:02100103>商品たちの声が聞こえてくるようですわ！","0","0"
"592565","0","1","1","0","0","755","0","0","1","1","1","0","0","0","0","0","0","False","False","False","この先は、イシュガルド教皇庁。<hex:02100103>申し訳ありませんが、<hex:02100103>許可のない方をお通しすることはできません。","0","0"
"592564","0","1","1","0","0","755","0","0","1","1","1","0","0","0","0","0","0","False","False","False","フォルタン伯は、いったい何を考えておられるのか。<hex:02100103>素性の知れぬ者どもを、外より招き入れるなど……。<hex:02100103>不思慮な行いだと、貴公も思わんか？","0","0"
"592567","0","1","2","0","0","764","0","0","1","1","1","0","0","0","0","0","0","False","False","False","フォルタン様の騎兵になった孫が、<hex:02100103>任務で皇都の外へ行くと言うのでねえ、<hex:02100103>ハルオーネ様に無事をお祈りしにきたのですよ。","0","0"
"592566","0","1","1","0","0","755","0","0","1","1","1","0","0","0","0","0","0","False","False","False","聖レマノー大聖堂は、万人に開かれております。<hex:02100103>さあ、あなたも戦神ハルオーネに祈りを捧げましょう……。","0","0"
"592585","0","1","1","0","0","755","0","0","1","1","1","0","0","0","0","0","0","False","False","False","この神学院は、確かに万人に開かれているとされている。<hex:02100103>だが、それは単なる方便であることを察すべきだな……。","我々、貴族に生まれた高貴なる学生は、<hex:02100103>迷える民を導く高位聖職者となるべき使命を負っている。<hex:02100103>ハッ、その貴重なる勉学の時を、こうして邪魔するとは……！","0"
"592584","0","1","1","0","0","765","0","0","1","1","1","0","0","0","0","0","0","False","False","False","私に、なにか御用ですの？<hex:02100103>急用でなければ、ここでの私語は慎んだ方が身のためですわ。<hex:02100103>そういうのを気にする学生がいるものですから……。","聖職者を目指す身である以上、民に奉仕する心持をもたずに、<hex:02100103>なにが高位の聖職者だと、私は思いますけれども……。<hex:02100103>あら失言ですわ、今のはお忘れになって。","0"
"592587","0","1","2","0","0","764","0","0","1","1","1","0","0","0","0","0","0","False","False","False","こうやって、外にキャンプを張って食う飯は、<hex:02100103>テイルフェザーで食うのとはまた違って、旨いもんなんだ。<hex:02100103>あんたも一口どうだ？","0","0"
"592586","0","1","2","0","0","764","0","0","1","1","1","0","0","0","0","0","0","False","False","False","……ふん、こんなオンボロ波止場を訪ねる奴がいるとはな。<hex:02100103>生憎だが、お前の興味をひくようなものは何もないぞ。","0","0"
"592589","0","1","2","0","0","763","0","0","1","1","1","0","0","0","0","0","0","False","False","False","へぇ、この露営地のことでしたら、<hex:02100103>ジャントゥロー様にお尋ねになったほうがいいかと……。<hex:02100103>なんせ、ここの連隊長様でいらっしゃいますから……。","0","0"
"592588","0","1","2","0","0","763","0","0","1","1","1","0","0","0","0","0","0","False","False","False","シシシシシ……「繋がりし者たち」は、<hex:02100103>毎日、毎日、飽きもせず同じ練り物ばかり食べているわ。<hex:02100103>世界はこんなにもウマソウな物で満ちているというのに……。","0","0"
