"0","TEXT_LUCKBZ001_03629_SEQ_00","彷徨う階段亭のグリナードは、冒険者の凱旋を待ちわびていたようだ。"
"1","TEXT_LUCKBZ001_03629_SEQ_01","サイエラから、悪しき存在の討伐を依頼された。クリスタリウムの天蓋の座で「サイエラ」と話そう。"
"2","TEXT_LUCKBZ001_03629_SEQ_02","悪しき存在というのは、四使徒が生まれる要因となった「すべての元凶」だという。コルシア島の偏屈者の小屋で「サイエラ」と話そう。"
"3","TEXT_LUCKBZ001_03629_SEQ_03","すべての元凶とは、かつてアルバートたちと旅をともにしていたシルヴァだという。アム・アレーンのアンバーフィールドで「サイエラ」と話そう。"
"4","TEXT_LUCKBZ001_03629_SEQ_04","シルヴァは、ナイルベルトが捨てた「追慕の心」を盗み、自らの力に変えたという。ラケティカ大森林のシチュア湿地で「サイエラ」と話そう。"
"5","TEXT_LUCKBZ001_03629_SEQ_05","シルヴァは、レンダ・レイからも、彼女が捨てた「自由なる心」を盗んだらしい。イル・メグのリェー・ギア城で「サイエラ」と話そう。"
"6","TEXT_LUCKBZ001_03629_SEQ_06","シルヴァは、ブランデンが捨て去った「温情の心」も盗み、己の力にしていたらしい。コルシア島のトメラの村で「サイエラ」と話そう。"
"7","TEXT_LUCKBZ001_03629_SEQ_07","シルヴァは、ラミットが捨てた「伝統の心」を盗み、仲間にも知られることなく、人知を超えた力を手にしたらしい。サイエラは、アルバートたちが倒した「影の王」の正体に、冒険者が気づいているのではないかと問いかけた。決戦の地、レイクランドのラクサン城にある「<hex:02280CFF05454F626AF61EACF90103>」で待機して、周囲を見張ろう。"
"8","TEXT_LUCKBZ001_03629_SEQ_08","冒険者の前に剣を手に現れたサイエラ。彼女は、「影の王」となりアルバートたちに立ちはだかった「シルヴァ」だった。彼女の正体は、第十三世界で生まれた、英雄のなり損ないだった。シルヴァは、四使徒を討った冒険者に討たれたいと、ここまで冒険者を導いたのだった。冒険者と話すことで、シルヴァは死すことなく、酒場に戻って真実を伝える語り部となることを決めた。彷徨う階段亭に戻り「サイエラ」と話そう。"
"9","TEXT_LUCKBZ001_03629_SEQ_09","サイエラは、彼女自身ができなかったぶん、冒険者には真の英雄として歩み続けてほしいようだ。"
"10","TEXT_LUCKBZ001_03629_SEQ_10",""
"11","TEXT_LUCKBZ001_03629_SEQ_11",""
"12","TEXT_LUCKBZ001_03629_SEQ_12",""
"13","TEXT_LUCKBZ001_03629_SEQ_13",""
"14","TEXT_LUCKBZ001_03629_SEQ_14",""
"15","TEXT_LUCKBZ001_03629_SEQ_15",""
"16","TEXT_LUCKBZ001_03629_SEQ_16",""
"17","TEXT_LUCKBZ001_03629_SEQ_17",""
"18","TEXT_LUCKBZ001_03629_SEQ_18",""
"19","TEXT_LUCKBZ001_03629_SEQ_19",""
"20","TEXT_LUCKBZ001_03629_SEQ_20",""
"21","TEXT_LUCKBZ001_03629_SEQ_21",""
"22","TEXT_LUCKBZ001_03629_SEQ_22",""
"23","TEXT_LUCKBZ001_03629_SEQ_23",""
"24","TEXT_LUCKBZ001_03629_TODO_00","天蓋の座のサイエラと話す"
"25","TEXT_LUCKBZ001_03629_TODO_01","偏屈者の小屋のサイエラと話す"
"26","TEXT_LUCKBZ001_03629_TODO_02","アンバーフィールドのサイエラと話す"
"27","TEXT_LUCKBZ001_03629_TODO_03","シチュア湿地のサイエラと話す"
"28","TEXT_LUCKBZ001_03629_TODO_04","リェー・ギア城のサイエラと話す"
"29","TEXT_LUCKBZ001_03629_TODO_05","トメラの村のサイエラと話す"
"30","TEXT_LUCKBZ001_03629_TODO_06","ラクサン城の<hex:02280CFF05454F626AF61EACF90103>で待機"
"31","TEXT_LUCKBZ001_03629_TODO_07","彷徨う階段亭のサイエラと話す"
"32","TEXT_LUCKBZ001_03629_TODO_08",""
"33","TEXT_LUCKBZ001_03629_TODO_09",""
"34","TEXT_LUCKBZ001_03629_TODO_10",""
"35","TEXT_LUCKBZ001_03629_TODO_11",""
"36","TEXT_LUCKBZ001_03629_TODO_12",""
"37","TEXT_LUCKBZ001_03629_TODO_13",""
"38","TEXT_LUCKBZ001_03629_TODO_14",""
"39","TEXT_LUCKBZ001_03629_TODO_15",""
"40","TEXT_LUCKBZ001_03629_TODO_16",""
"41","TEXT_LUCKBZ001_03629_TODO_17",""
"42","TEXT_LUCKBZ001_03629_TODO_18",""
"43","TEXT_LUCKBZ001_03629_TODO_19",""
"44","TEXT_LUCKBZ001_03629_TODO_20",""
"45","TEXT_LUCKBZ001_03629_TODO_21",""
"46","TEXT_LUCKBZ001_03629_TODO_22",""
"47","TEXT_LUCKBZ001_03629_TODO_23",""
"48","TEXT_LUCKBZ001_03629_GLYNARD_000_000","おお、我らが英雄の凱旋だな！"
"49","TEXT_LUCKBZ001_03629_GLYNARD_000_001","なんだ、忘れちまったのか？<hex:02100103>この酒場から「四使徒」を倒す英雄が現れたら、<hex:02100103>俺としても誇らしいって話をしたことをよ！"
"50","TEXT_LUCKBZ001_03629_GLYNARD_000_002","あの時は「夜」の訪れで舞い上がってたから、<hex:02100103>冗談半分で言ったんだが、まさかすべての使徒を倒すとはな！<hex:02100103>まさしく英雄……いや、大英雄だぜ！"
"51","TEXT_LUCKBZ001_03629_CYELLA_000_003","私はマスターと違って、<hex:02100103>最初にお目にかかったときから信じていましたよ？<hex:02100103>貴方が、四使徒を倒してくれるって……。"
"52","TEXT_LUCKBZ001_03629_GLYNARD_000_004","ハッ……調子のいいヤツめ！"
"53","TEXT_LUCKBZ001_03629_GLYNARD_000_005","が、そんな話はともかく、せっかく来店してくれたんだ。<hex:02100103>一杯奢るから、罪喰いとの戦いの旅について聞かせてくれ！"
"54","TEXT_LUCKBZ001_03629_GLYNARD_000_006","なんて……なんて、ヤツらなんだ……。<hex:02100103>どうやら、俺は四使徒たち……<hex:02100103>いや、「光の戦士たち」のことを誤解していたようだぜ……。"
"55","TEXT_LUCKBZ001_03629_GLYNARD_000_007","命がけで、悪しき存在を倒したはずなのに、<hex:02100103>それが世界の崩壊に……「光の氾濫」に繋がっちまうだなんて！"
"56","TEXT_LUCKBZ001_03629_GLYNARD_000_008","彼らの魂に安らぎあれ！<hex:02100103>今日、この一杯は、彼らに捧げよう……！"
"57","TEXT_LUCKBZ001_03629_CYELLA_000_009","まったく、相変わらずマスターは情にもろいんだから……。<hex:02100103>さあ、マスター、愉しいお話はここまでにして、<hex:02100103>お客さんの相手をしてきてくださいな。"
"58","TEXT_LUCKBZ001_03629_GLYNARD_000_010","やれやれ、この店にサイエラがいるかぎり、<hex:02100103>俺の方には安息が訪れることはなさそうだぜ。<hex:02100103>じゃあな、英雄！　いつでも、立ち寄ってくれよ！"
"59","TEXT_LUCKBZ001_03629_CYELLA_000_011","<hex:022C0DFF07022903EB0203FF02200203>さん、<hex:02100103>本日は貴重な話をありがとうございました。<hex:02100103>その上で、厚かましいのですが……聞いてほしい話があるのです。"
"60","TEXT_LUCKBZ001_03629_CYELLA_000_012","まだ、残っているのですよ。<hex:02100103>倒すべき……存在してはならない悪しき存在が……。<hex:02100103>四使徒を倒した貴方に、ぜひその討伐を依頼したいのです。"
"61","TEXT_LUCKBZ001_03629_CYELLA_000_013","もしも興味を持ってくださるのでしたら、<hex:02100103>「天蓋の座」にいらしてください。<hex:02100103>どうか、よろしくお願いします。"
"62","TEXT_LUCKBZ001_03629_GLYNARD_000_020","サイエラのヤツ、俺を仕事に追いやっておきながら、<hex:02100103>急用があるとかで帰っちまいやがった……。<hex:02100103>どうしたってんだ？"
"63","TEXT_LUCKBZ001_03629_CYELLA_000_030","来てくださったのですね。<hex:02100103>貴方は、やはり私が思ったとおりの人です。"
"64","TEXT_LUCKBZ001_03629_CYELLA_000_031","倒すべき悪しき存在がいると知れば無視はできず、<hex:02100103>助けを求められれば、つい手を差し伸べてしまう。<hex:02100103>やはり、貴方は「良い人」です……。"
"65","TEXT_LUCKBZ001_03629_CYELLA_000_032","フフ、そう身構えないでくださいな。<hex:02100103>討伐すべき悪しき存在がいるという話は、嘘などではありません。<hex:02100103>しかも、あの四使徒が生まれる要因となった者なのです。"
"66","TEXT_LUCKBZ001_03629_CYELLA_000_033","酒場のウェイトレスに過ぎない私が、<hex:02100103>そのような依頼を持ちかけるのが不思議ですか？"
"67","TEXT_LUCKBZ001_03629_CYELLA_000_034","ですが、話の順序が逆なのです……。<hex:02100103>私は、一連の事件に終止符を打つために酒場で働き、<hex:02100103>四使徒を倒せる人材を探し、賞金稼ぎたちに紹介したのですから。"
"68","TEXT_LUCKBZ001_03629_CYELLA_000_035","すでに倒すべき「すべての元凶」の正体は、目星がついています。<hex:02100103>ですが、その者を追うには、根気がいることでしょう。"
"69","TEXT_LUCKBZ001_03629_CYELLA_000_036","どうか長旅となる覚悟をした上で、来てください。<hex:02100103>最初の手がかりがあるのはコルシア島……<hex:02100103>「偏屈者の小屋」にて、お待ちしております。"
"70","TEXT_LUCKBZ001_03629_CYELLA_000_040","はるばる、ご足労いただき、ありがとうございます。<hex:02100103>どうやら私と同様、しっかりと長旅の準備を、<hex:02100103>整えてきてくださったようですね。"
"71","TEXT_LUCKBZ001_03629_CYELLA_000_041","ここは、ある意味において、すべてが始まった場所です。<hex:02100103>若き冒険者「アルバート」と癒やし手「ラミット」の出会いの場、<hex:02100103>貴方も、その様子を視たのでしょう？"
"72","TEXT_LUCKBZ001_03629_CYELLA_000_042","彼らは若く、未熟でしたが、ある才を秘めていました。<hex:02100103>貴方と同じく「英雄」となるべき異能を有していたのです。"
"73","TEXT_LUCKBZ001_03629_CYELLA_000_043","が、その才が開花するのは、後のこと……。<hex:02100103>当初は、一介の冒険者として旅し、放浪の騎士「ブランデン」や、<hex:02100103>森の狩人「レンダ・レイ」を、仲間に加えていきました。"
"74","TEXT_LUCKBZ001_03629_CYELLA_000_044","そんなときです。<hex:02100103>一行にエルフ族の女剣士が加わったのは……。"
"75","TEXT_LUCKBZ001_03629_CYELLA_000_045","何かが引っかかりませんか？<hex:02100103>大罪人「光の戦士たち」は、ぜんぶで5人のはず。"
"76","TEXT_LUCKBZ001_03629_CYELLA_000_046","ですが、魔道士「ナイルベルト」と出会う以前に、<hex:02100103>今や人々の記憶から忘れ去られた仲間が加わっていたのです。<hex:02100103>彼女の名は「シルヴァ」……。"
"77","TEXT_LUCKBZ001_03629_CYELLA_000_047","貴方が視た過去の情景にも、その姿があったはずです。<hex:02100103>思い出せましたか？"
"78","TEXT_LUCKBZ001_03629_CYELLA_000_048","彼女こそが「すべての元凶」……<hex:02100103>獅子身中の虫だったのです。"
"79","TEXT_LUCKBZ001_03629_CYELLA_000_049","さあ、次の場所へ向かいましょう。<hex:02100103>ここで確認したいことは、できましたので……。<hex:02100103>次はアム・アレーンの「アンバーフィールド」です。"
"80","TEXT_LUCKBZ001_03629_CYELLA_000_060","お待ちしておりました、<hex:022C0DFF07022903EB0203FF02200203>さん。<hex:02100103>さあ、さっそく物語を再開しましょう。<hex:02100103>それが「すべての元凶」に至る近道なのですから……。"
"81","TEXT_LUCKBZ001_03629_CYELLA_000_061","女剣士シルヴァを加え、5名になったアルバート一行は、<hex:02100103>当時ナバスアレンの領地だった、アム・アレーンにやってきました。<hex:02100103>そして、坑道に住み着いた魔物の討伐依頼を受けます。"
"82","TEXT_LUCKBZ001_03629_CYELLA_000_062","ここで、同じ討伐目標を奪い合う競争相手として出会ったのが、<hex:02100103>エルフ族の魔道士「ナイルベルト」でした。"
"83","TEXT_LUCKBZ001_03629_CYELLA_000_063","地震による坑道の崩落という想定外の出来事から、<hex:02100103>共闘を余儀なくされたことで、彼らは手を取り合います。<hex:02100103>そして、見事に魔物「ボヴァイン」を倒したのでした。"
"84","TEXT_LUCKBZ001_03629_CYELLA_000_064","この時、ナイルベルトは、件の魔物が持つ、<hex:02100103>莫大な魔力を秘めた鉱石「魔光石」を求めていたそうです。<hex:02100103>次元の狭間へと落ちた、親友を救うために……。"
"85","TEXT_LUCKBZ001_03629_CYELLA_000_065","ですが、魔光石の魔力を大地に還元せねば、<hex:02100103>地盤は崩壊し、山に呑まれて多くの人々が生き埋めになる。<hex:02100103>結局、ナイルベルトは目の前の人々を救う道を選びました……。"
"86","TEXT_LUCKBZ001_03629_CYELLA_000_066","私心を捨て他者を救う、まさに英雄的な決断を下したとき、<hex:02100103>ナイルベルトは不思議な光を放つクリスタルを手にしたそうです。<hex:02100103>つまり、これこそが「光の戦士」誕生の瞬間だったのですよ……。"
"87","TEXT_LUCKBZ001_03629_CYELLA_000_067","以降、正式に旅の仲間となったナイルベルトは、<hex:02100103>一行の頭脳として活躍し「智慧の魔人」と呼ばれるようになります。<hex:02100103>そう、智慧……「プロネーシス」です。"
"88","TEXT_LUCKBZ001_03629_CYELLA_000_068","一方、英雄としての第一歩を踏み出したナイルベルトを見て、<hex:02100103>女剣士シルヴァは、内心ほくそ笑んでいたことでしょう……。"
"89","TEXT_LUCKBZ001_03629_CYELLA_000_069","彼女は、彼が捨てた「追慕の心」を盗み、<hex:02100103>密やかに自らの力へと変えていたのですから……。"
"90","TEXT_LUCKBZ001_03629_CYELLA_000_070","何のことかわからないですか？<hex:02100103>いずれ、理解できますよ。"
"91","TEXT_LUCKBZ001_03629_CYELLA_000_071","さあ、次の手がかりを追いましょう。<hex:02100103>少し退屈でしょうが、これは倒すべき元凶を追うには必要なこと。<hex:02100103>ラケティカ大森林の「シチュア湿地」まで来てくださいね。"
"92","TEXT_LUCKBZ001_03629_CYELLA_000_080","よくぞ、おいでくださいました。<hex:02100103>またも長話になりますが、辛抱してくださいね。"
"93","TEXT_LUCKBZ001_03629_CYELLA_000_081","アム・アレーンでの一件で、冒険者としての名声を高めたことで、<hex:02100103>アルバートの一行には、次々と依頼が舞い込むようになります。<hex:02100103>彼らがラケティカ大森林を訪れたのは、そんな時分でした。"
"94","TEXT_LUCKBZ001_03629_CYELLA_000_082","その過程で、狩人レンダ・レイは、<hex:02100103>付近で狂暴な魔獣「バラム・キツェー」が出没していると知り、<hex:02100103>密かに一行を離れ、単独での追跡を決行します。"
"95","TEXT_LUCKBZ001_03629_CYELLA_000_083","なぜなら、その獣こそ、<hex:02100103>彼女のかつての仲間を殺した仇だったのです。"
"96","TEXT_LUCKBZ001_03629_CYELLA_000_084","それは、今の仲間を危険にさらさぬための独走でもありましたが、<hex:02100103>ノルヴラント随一の魔獣を前に、レンダ・レイは窮地に陥ります。<hex:02100103>ですが、アルバートたちは決して彼女を見捨てなかった。"
"97","TEXT_LUCKBZ001_03629_CYELLA_000_085","仲間たちの協力を得て、因縁の大物を仕留めたレンダ・レイは、<hex:02100103>ナイルベルトと同様に、光のクリスタルを手にしたといいます。"
"98","TEXT_LUCKBZ001_03629_CYELLA_000_086","そして、これ以降、彼女は仲間のためならば、<hex:02100103>どんな危険も顧みない凄腕の射手として、知られるようになります。<hex:02100103>が、一方で自由な生き方を捨てもしました……。"
"99","TEXT_LUCKBZ001_03629_CYELLA_000_087","知っていますか？<hex:02100103>全盛期の彼女が「勇気の狩人」と呼ばれていたことを……<hex:02100103>そう、勇気……つまり「アンドレイア」です。"
"100","TEXT_LUCKBZ001_03629_CYELLA_000_088","そして、シルヴァは、またしても盗みました。<hex:02100103>レンダ・レイが捨て去った「自由なる心」を……。"
"101","TEXT_LUCKBZ001_03629_CYELLA_000_089","……ふふ、どうか、ご安心くださいな。<hex:02100103>倒すべき「すべての元凶」の痕跡は、しっかりと見つけています。<hex:02100103>どうやら、その者もここに来ていたようですね。"
"102","TEXT_LUCKBZ001_03629_CYELLA_000_090","さあ、次の場所へ向かいましょう。<hex:02100103>続いて訪れるべきは妖精郷「イル・メグ」の中心、<hex:02100103>「リェー・ギア城」です。"
"103","TEXT_LUCKBZ001_03629_CYELLA_000_100","長旅、ご苦労さま……。<hex:02100103>私が妖精郷を無事に旅してきたことが不思議ですか？<hex:02100103>ふふ……そんな些末なことは置いておいて、物語を続けましょう。"
"104","TEXT_LUCKBZ001_03629_CYELLA_000_101","バラム・キツェーの討伐という偉業を成し遂げ、<hex:02100103>一行の名声は、いよいよ「英雄」へと近づいていきます。<hex:02100103>その最後のひと押しとなったのが、フッブート王国での事件です。"
"105","TEXT_LUCKBZ001_03629_CYELLA_000_102","当時、この王国では、<hex:02100103>次々と領民が魔物に変異するという怪事件が起きていました。"
"106","TEXT_LUCKBZ001_03629_CYELLA_000_103","かつて、王国騎士だったブランデンを、<hex:02100103>故郷から切り離すことになったほどの難事件です。<hex:02100103>ですが、彼らは旅を通じて経験を積み、大きく成長していました。"
"107","TEXT_LUCKBZ001_03629_CYELLA_000_104","やがて、アルバートたちは、<hex:02100103>事件の黒幕が宮廷魔道士であることを突き止め、討ち倒しました。<hex:02100103>が、そこに喜びはなく、大きな悲しみを背負うことになります。"
"108","TEXT_LUCKBZ001_03629_CYELLA_000_105","なぜなら、その黒幕タドリクが、<hex:02100103>かつてブランデンが忠誠を誓った王女ソールディアを、<hex:02100103>魔物へと変えてしまったのですから……。"
"109","TEXT_LUCKBZ001_03629_CYELLA_000_106","守ると誓った王女に乞われ、剣を振り下ろしたブランデン。<hex:02100103>その想いたるや……。"
"110","TEXT_LUCKBZ001_03629_CYELLA_000_107","しかし、この悲劇を境に、騎士ブランデンは変わりました。<hex:02100103>優しさゆえに迷いを秘めていた剣からは、鈍さが消え去り、<hex:02100103>その鋭さは剣聖の域に達したのです。"
"111","TEXT_LUCKBZ001_03629_CYELLA_000_108","あまりの荒々しさゆえに、人々はブランデンをこう呼びました。<hex:02100103>鬼の形相で魔を討ち続ける「正義の魔剣士」と……。<hex:02100103>そう、正義……「ディカイオシュネー」です。"
"112","TEXT_LUCKBZ001_03629_CYELLA_000_109","もう、おわかりでしょうが、またもシルヴァは盗みました。<hex:02100103>ブランデンが捨て去った「温情の心」を……。<hex:02100103>彼女は心を盗むたびに、その力を強めていきました。"
"113","TEXT_LUCKBZ001_03629_CYELLA_000_110","急激に剣士として強くなるシルヴァを、アルバートたちは、<hex:02100103>修行の成果だと思ったでしょうが……違ったのですよ。"
"114","TEXT_LUCKBZ001_03629_CYELLA_000_111","さて、ここにも「すべての元凶」が現れていたようです。<hex:02100103>追い詰めるのも、あと少し……次は、ふたたびのコルシア島。<hex:02100103>その山岳部、「トメラの村」に向かいましょう。"
"115","TEXT_LUCKBZ001_03629_CYELLA_000_120","長旅に付き合っていただき、感謝します。<hex:02100103>さて、貴方も物語の結末など察しているとは思いますが、<hex:02100103>今しばらく、ご辛抱くださいましね。"
"116","TEXT_LUCKBZ001_03629_CYELLA_000_121","フッブート王国の一件は、彼らの名声を確固たるものとしました。<hex:02100103>しかし、もうひとつの英雄的行為については、<hex:02100103>あまり知られていません。"
"117","TEXT_LUCKBZ001_03629_CYELLA_000_122","発端は、ラケティカ大森林のロンカ遺跡にて、<hex:02100103>一行の癒やし手、ラミットが大再生魔法を会得したことによります。"
"118","TEXT_LUCKBZ001_03629_CYELLA_000_123","そもそも、領地から離れないことで知られるドワーフ族の彼女が、<hex:02100103>旅に出た目的こそ、件の魔法を修得するためだったのです。<hex:02100103>病に侵された妹を救うために……。"
"119","TEXT_LUCKBZ001_03629_CYELLA_000_124","ですが、妹を含む数多くの病人たちを救いながらも、<hex:02100103>掟を破ったとして、彼女は永久追放を宣告されてしまいます。"
"120","TEXT_LUCKBZ001_03629_CYELLA_000_125","一族との結びつきを重んじるドワーフ族にとって、<hex:02100103>これがいかに酷い仕打ちか……貴方には想像できますか？"
"121","TEXT_LUCKBZ001_03629_CYELLA_000_126","それでもラミットは、失意の底に沈むことなく、<hex:02100103>一族の証たる兜を脱ぎ、英雄として生きることを誓いました。"
"122","TEXT_LUCKBZ001_03629_CYELLA_000_127","以後、多くの人々を癒やした彼女は、こう呼ばれました。<hex:02100103>思慮深き「節制の導師」と……。<hex:02100103>そう、節制……「ソープロシュネー」です。"
"123","TEXT_LUCKBZ001_03629_CYELLA_000_128","そして、シルヴァはラミットが捨て去った「伝統の心」を盗み、<hex:02100103>いよいよ、人知を超えた力を手にしていました。<hex:02100103>仲間に知られることもなく……。"
"124","TEXT_LUCKBZ001_03629_CYELLA_000_129","一方、アルバートたちは、トメラの村の出来事に前後して、<hex:02100103>自分たちが倒すべき相手の影を、おぼろげに掴んでいました。"
"125","TEXT_LUCKBZ001_03629_CYELLA_000_130","その名は「影の王」……<hex:02100103>ノルヴラント社会を裏から操り、<hex:02100103>不安と混沌を広める謎めいた存在です。"
"126","TEXT_LUCKBZ001_03629_CYELLA_000_131","世界を救うため、英雄として歩む覚悟を決めた彼らは、<hex:02100103>多くを犠牲にしながらも、「影の王」との対決を決意します。"
"127","TEXT_LUCKBZ001_03629_CYELLA_000_132","貴方はもう「影の王」の正体に、<hex:02100103>気づいているのではありませんか？"
"128","TEXT_LUCKBZ001_03629_CYELLA_000_133","では、私たちも倒すべき「すべての元凶」を追い詰めましょう。<hex:02100103>旅の終着点……決戦の地は、レイクランドです。"
"129","TEXT_LUCKBZ001_03629_CYELLA_000_134","私は罠の準備をしてから向かいますので、<hex:02100103>貴方は「ラクサン城」のテラスにて、庭を見張っていてください。<hex:02100103>よろしくお願いしますね……。"
"130","TEXT_LUCKBZ001_03629_WARRIOROFDARKNESS_000_300","なぜだ、シルヴァ！<hex:02100103>なぜ、俺たちを裏切ったッ！<hex:02100103>俺とお前は……俺たちは仲間だったんじゃないのか！？"
"131","TEXT_LUCKBZ001_03629_CYLVA_000_301","もちろん、仲間だとも……。<hex:02100103>世界を救うため、英雄になると誓いあった大切な仲間だよ。"
"132","TEXT_LUCKBZ001_03629_WARRIOROFDARKNESS_000_302","だったら……！<hex:02100103>なんだって、お前が「影の王」なんだよッ！"
"133","TEXT_LUCKBZ001_03629_CYLVA_000_303","それは、お前たちが「光のクリスタル」を得る過程で、<hex:02100103>代償として捨て去った心の欠片を集めてきたからさ……！<hex:02100103>真の英雄となるためにッ……！"
"134","TEXT_LUCKBZ001_03629_CYLVA_000_304","ナイルベルトが捨てた「追慕の心」は、<hex:02100103>闇を友とすることを可能とし、その力を我が物となさしめた！"
"135","TEXT_LUCKBZ001_03629_CYLVA_000_305","レンダ・レイが捨てた「自由なる心」は、<hex:02100103>私を人という枷から解き放った！"
"136","TEXT_LUCKBZ001_03629_CYLVA_000_306","ブランデンが捨てた「温情の心」は、<hex:02100103>分かたれた命への慈愛となり、私を理想へ突き動かした！"
"137","TEXT_LUCKBZ001_03629_CYLVA_000_307","ラミットが捨てた「伝統の心」は、<hex:02100103>私とこの世界との結びつきを強め、古の力を得る鍵となった！"
