"138","TEXT_LUCKBZ001_03629_CYLVA_000_308","そして、アルバート……<hex:02100103>お前はこれから「友愛の心」を捨てる！<hex:02100103>旅の中で友情を育んだ私に、その斧を振り下ろすことによって！"
"139","TEXT_LUCKBZ001_03629_CYLVA_000_309","私は、その心を糧として戦おう！<hex:02100103>君を愛するがゆえに……！"
"140","TEXT_LUCKBZ001_03629_CYLVA_000_310","我は「影の王」！<hex:02100103>闇に沈みし世界より来たりて、<hex:02100103>この世界を砕き、その魂を救う者なり！"
"141","TEXT_LUCKBZ001_03629_WARRIOROFDARKNESS_000_311","うおおおおおおッ！"
"142","TEXT_LUCKBZ001_03629_CYELLA_000_330","どうやら「超える力」によって、私の過去を視たようだね……。"
"143","TEXT_LUCKBZ001_03629_CYELLA_000_331","そう、私こそが6人目の仲間「シルヴァ」だ。<hex:02100103>いや違うな……その名すら本名ではない。"
"144","TEXT_LUCKBZ001_03629_CYELLA_000_332","なぜなら私は、君と同じく、<hex:02100103>この世界の住人ではないのだから……。"
"145","TEXT_LUCKBZ001_03629_CYELLA_000_333","私は「闇の氾濫」によって滅びた「第十三世界」で生まれ、<hex:02100103>故郷を救うことに失敗した、英雄のなり損ないのひとりなのさ。"
"146","TEXT_LUCKBZ001_03629_CYELLA_000_335","「ウヌクアルハイ」と呼ばれる少年の仲間だった者……<hex:02100103>と、言えば、「第一世界」に渡ってきた理由も察しが付くだろう？<hex:02100103>アシエンの誘いに乗り、次元圧壊を起こそうとしたのさ。"
"147","TEXT_LUCKBZ001_03629_CYELLA_000_340","世界が闇に沈み、命なきヴォイドと化したことを悔やみ、<hex:02100103>アシエンの誘いに乗り、ここ「第一世界」へと渡ってきた。<hex:02100103>次元圧壊を起こす手助けをするためにね。"
"148","TEXT_LUCKBZ001_03629_CYELLA_000_350","第十三世界で「闇の氾濫」が起きたことで、<hex:02100103>対極に位置する第一世界で「光の氾濫」が起きようとしている。<hex:02100103>それゆえに、世界の統合を急ぐべきだと説得されたのさ。"
"149","TEXT_LUCKBZ001_03629_CYELLA_000_351","このままでは、やがて「光の氾濫」が起き、<hex:02100103>統合する価値すらない、虚無の世界になってしまう。<hex:02100103>世界統合を望むアシエンにとっては、避けたい状況だ。"
"150","TEXT_LUCKBZ001_03629_CYELLA_001_351","ならば、あえて光を高め得る才ある者たち、<hex:02100103>つまりアルバートたち英雄の資質を持つ者たちを集め、<hex:02100103>光の増大を制御下に置こうと考えたのだろうさ。"
"151","TEXT_LUCKBZ001_03629_CYELLA_002_351","私に与えられたのは、英雄一行に仲間として潜り込み、<hex:02100103>その成長を支えつつ、密かに力の一部を奪い取ること……。<hex:02100103>そして、己が闇の英雄となり、彼らの歩みを止めることだ。"
"152","TEXT_LUCKBZ001_03629_CYELLA_003_351","こうして第一世界を、ギリギリのバランスで保ちつつ、<hex:02100103>一方、アシエンたちが原初世界側で霊災のトリガーを引く……。"
"153","TEXT_LUCKBZ001_03629_CYELLA_004_351","これが、当時、ミトロンとアログリフの座にあった、<hex:02100103>アシエンどもの計画だったわけだが……"
"154","TEXT_LUCKBZ001_03629_CYELLA_005_351","結局のところ失敗に終わった。<hex:02100103>英雄のなり損ないである私は、英雄が捨てた心を盗むことで、<hex:02100103>「影の王」として力を高めたが、それでもなお敗北したのだよ。"
"155","TEXT_LUCKBZ001_03629_CYELLA_006_351","敗因は、アルバートが決戦の中でさえ、<hex:02100103>「友愛の心」を捨てなかったこと。"
"156","TEXT_LUCKBZ001_03629_CYELLA_007_351","あの大馬鹿野郎は、<hex:02100103>裏切り者である私すら、本気で救おうとしたのさ。<hex:02100103>そして、最後の力を奪えなかった私は、戦いに敗れた……。"
"157","TEXT_LUCKBZ001_03629_CYELLA_000_352","後の展開は、知ってのとおり。<hex:02100103>「光の戦士たち」は、そのままミトロンとアログリフを討ち、<hex:02100103>懸念されていた「光の氾濫」が発生した……。"
"158","TEXT_LUCKBZ001_03629_CYELLA_000_353","以後、私は滅びゆく世界に取り残され、終わりの時を待ち続けた。<hex:02100103>これでも「不滅なる者」の端くれだから、簡単には死ねないし、<hex:02100103>すべてを見届けるのが、関与した者の責務にも思えたのでね。"
"159","TEXT_LUCKBZ001_03629_CYELLA_000_354","だが、数年前に「四使徒」が現れた。"
"160","TEXT_LUCKBZ001_03629_CYELLA_000_355","タイミング的には、<hex:02100103>君の仲間が第一世界に渡ってきた時期と一致する。<hex:02100103>光の使徒の介入を感じ、アシエンが対抗として用意したのだろう。"
"161","TEXT_LUCKBZ001_03629_CYELLA_000_356","ドン・ヴァウスリーあたりに入れ知恵をして、<hex:02100103>「光の戦士たち」の遺体で罪喰いを作らせたといったところか……。<hex:02100103>彼らの墓は、ユールモア領にあったからな。"
"162","TEXT_LUCKBZ001_03629_CYELLA_000_357","ところがどういうわけか、<hex:02100103>かつて自分が裏切った仲間たちの姿をした四使徒を見たとき、<hex:02100103>私は、怒りに呑まれ……許してはおけないと感じたんだ。"
"163","TEXT_LUCKBZ001_03629_CYELLA_000_358","罪悪感や後悔がそうさせるのか……<hex:02100103>この感情は、自分でも上手く説明はできない。<hex:02100103>いずれにせよ、いまさら善人を気取るつもりはないがね。"
"164","TEXT_LUCKBZ001_03629_CYELLA_000_359","ともかく、アシエンを警戒させる存在が現れたのなら、<hex:02100103>賭けてみようと思ったのさ。"
"165","TEXT_LUCKBZ001_03629_CYELLA_000_360","だから、サイエラと名乗ってクリスタリウムに移住し、<hex:02100103>酒場で働きながら、罪喰い狩りの賞金稼ぎを集め始めた。<hex:02100103>いつか来る、アシエンの敵と引き合わせるために……。"
"166","TEXT_LUCKBZ001_03629_CYELLA_000_361","そして、君が現れ……四使徒は討たれた。<hex:02100103>彼らの魂にも、ようやく安らぎが訪れたことだろう。"
"167","TEXT_LUCKBZ001_03629_CYELLA_000_362","もはや思い残すことはない……。<hex:02100103>「すべての元凶」として、世界を砕こうとした「影の王」として、<hex:02100103>真の英雄たる君に討ってもらいたいんだ。"
"168","TEXT_LUCKBZ001_03629_CYELLA_000_363","この世界のために戦い続けた英雄、<hex:02100103>「光の戦士たち」の真実を語り終えた今、私の役割は終わった。<hex:02100103>身勝手な願いとは重々承知の上だが……どうか私を殺してくれ……。"
"169","TEXT_LUCKBZ001_03629_Q1_000_500","サイエラに何と言う？"
"170","TEXT_LUCKBZ001_03629_A1_000_500","生きて責任を果たせ！"
"171","TEXT_LUCKBZ001_03629_A2_000_500","…………"
"172","TEXT_LUCKBZ001_03629_A3_000_500","（★未使用／削除予定★）"
"173","TEXT_LUCKBZ001_03629_CYELLA_000_370","何を馬鹿なことを！<hex:02100103>君も、アルバートと同じように情けをかけようというのか！"
"174","TEXT_LUCKBZ001_03629_CYELLA_000_371","（★未使用／削除予定★）"
"175","TEXT_LUCKBZ001_03629_CYELLA_000_375","ハッ……なんて、目で見つめやがるんだ……。<hex:02100103>安易に「死」に逃げようとする私を、軽蔑するかい？<hex:02100103>それとも、自殺の手伝いなど御免だとでも？"
"176","TEXT_LUCKBZ001_03629_CYELLA_000_380","（★未使用／削除予定★）"
"177","TEXT_LUCKBZ001_03629_CYELLA_001_380","いいか、私は「影の王」として、多くの人々の命を翻弄してきた！<hex:02100103>真に大罪人と呼ぶべき者がいるとすれば、それは私だ……！<hex:02100103>君は、倒すべき「すべての元凶」を見逃すというのか！？"
"178","TEXT_LUCKBZ001_03629_Q2_000_600","サイエラに何と言う？"
"179","TEXT_LUCKBZ001_03629_A1_000_600","それでも生きて責任を果たすべきだ！"
"180","TEXT_LUCKBZ001_03629_A2_000_600","ならば責任を果たしてから死を選べ！"
"181","TEXT_LUCKBZ001_03629_CYELLA_010_380","…………。<hex:02100103>英雄ってやつは、これだから……。"
"182","TEXT_LUCKBZ001_03629_CYELLA_011_380","こうと決めたら、その道を進み続ける。<hex:02100103>ちょっとやそっとで、方向を曲げさせることはできない。<hex:02100103>奴の隣を歩んだことで知っていたはずなんだがな……。"
"183","TEXT_LUCKBZ001_03629_CYELLA_020_380","……死ぬなら、勝手に死ねということか。"
"184","TEXT_LUCKBZ001_03629_CYELLA_021_380","確かに、君の手を、薄汚い私の血で穢すわけにもいかないな。<hex:02100103>君は、私が最後までなることのできなかった、<hex:02100103>真の英雄なのだから……。"
"185","TEXT_LUCKBZ001_03629_CYELLA_000_390","わかった、ならば今少しだけ、生き恥をさらすとしよう……。<hex:02100103>せめて、アルバートたちの……<hex:02100103>大罪人「光の戦士たち」の名誉が回復するまで……。"
"186","TEXT_LUCKBZ001_03629_CYELLA_000_391","あの酒場の片隅で、マスターと酔っぱらいたちを相手にしながら、<hex:02100103>真実を伝える語り部となることでな……。"
"187","TEXT_LUCKBZ001_03629_CYELLA_000_392","<hex:022C0DFF07022903EB0203FF02200203>……<hex:02100103>君を見ていると、アルバートを思い出して嫌になるよ。"
"188","TEXT_LUCKBZ001_03629_CYELLA_000_393","さあ、帰ろう、あの酒場に……な。"
"189","TEXT_LUCKBZ001_03629_GLYNARD_000_400","サイエラのヤツ、戻ってきたのはいいが、<hex:02100103>なんだか雰囲気がガラリと変わっちまった……。<hex:02100103>どうしたってんだ？"
"190","TEXT_LUCKBZ001_03629_CYELLA_000_410","やれやれ、久しぶりに鎧を着たら肩が凝ってしかたがない。<hex:02100103>時を経て消耗した私には、そこらの雑兵にも劣る力しか、<hex:02100103>残されていないものでね……。"
"191","TEXT_LUCKBZ001_03629_CYELLA_000_411","せいぜい、これからはアルバートたちの名誉のため、<hex:02100103>酒場の語り部として過ごしてみるさ。"
"192","TEXT_LUCKBZ001_03629_CYELLA_000_412","私の独りよがりな旅に付き合ってくれて、ありがとう。<hex:02100103>君は真の英雄として、このまま歩み続けてちょうだい。<hex:02100103>私には、それができなかったから……。"
