"157","TEXT_AKTKBA111_04103_REFUGEEMAN1_000_172","お前、それ……逃げるときに樹の根っこに足をひっかけて、<hex:02100103>転んでできた傷だって言ってたじゃねぇか！<hex:02100103>まさか、あの獣にやられたのか！？"
"158","TEXT_AKTKBA111_04103_KANESENNA_000_173","天駆ける風、力の根源へと我を導き、そを与えたまえ……！"
"159","TEXT_AKTKBA111_04103_REFUGEEMAN2_100_173","全然、効かねぇ……。<hex:02100103>もっとだ……もっと頼む……！"
"160","TEXT_AKTKBA111_04103_REFUGEEMAN2_000_174","痛ぇ……いてぇよぉ……。"
"161","TEXT_AKTKBA111_04103_KANESENNA_000_175","解毒の魔法が効かない……！<hex:02100103>これは、やはり偽神獣の毒気……。"
"162","TEXT_AKTKBA111_04103_KANESENNA_000_176","だめです、絶望してはいけません！"
"163","TEXT_AKTKBA111_04103_REFUGEEMAN2_000_177","い、いやだ、死にたくない……。<hex:02100103>誰か、助けて……。"
"164","TEXT_AKTKBA111_04103_REFUGEEMAN2_000_178","うがあぁぁぁぁ！！"
"165","TEXT_AKTKBA111_04103_KEEPEROFTHEENTWINEDSERPENTS_000_179","危険です、下がって！"
"166","TEXT_AKTKBA111_04103_REFUGEEMAN1_000_180","う、嘘だろ……？<hex:02100103>まさか、俺の身体も……？"
"167","TEXT_AKTKBA111_04103_REFUGEEMAN1_000_181","もう誰も信じねぇ……何も信じられねぇ！<hex:02100103>俺は死にたくねぇぞおおぉぉ……！"
"168","TEXT_AKTKBA111_04103_KANESENNA_000_182","……！<hex:02100103>これが、獣への転化……。<hex:02100103>こうなっては、もう元に戻す術は……？"
"169","TEXT_AKTKBA111_04103_KANESENNA_100_182","……止むを得ません。"
"170","TEXT_AKTKBA111_04103_KANESENNA_000_185","残念ながら、止むを得ません……。"
"171","TEXT_AKTKBA111_04103_KEEPEROFTHEENTWINEDSERPENTS_000_186","これが、終末の獣……！"
"172","TEXT_AKTKBA111_04103_WOODWAILER1_000_187","民のことは我々に任せてくれ！"
"173","TEXT_AKTKBA111_04103_REFUGEEMAN3_000_188","あ、ああ、アイツが化け物に……！？"
"174","TEXT_AKTKBA111_04103_REFUGEEWOMAN_000_189","そ、そんな、ウソでしょ！<hex:02100103>なにが起きてるの……！？"
"175","TEXT_AKTKBA111_04103_KEEPEROFTHEENTWINEDSERPENTS_000_190","絶望によって、人が獣へと転じる……。<hex:02100103>初めて目の当たりにしましたが、これほど無惨なものだとは。"
"176","TEXT_AKTKBA111_04103_REFUGEEMAN3_000_191","こんな、こんなのって……。<hex:02100103>病で死ぬよりひどいじゃないか……！"
"177","TEXT_AKTKBA111_04103_REFUGEEWOMAN_000_192","い、イヤよ、私はイヤ……！<hex:02100103>死ぬのも、獣になるのも、何もかもイヤッ……！"
"178","TEXT_AKTKBA111_04103_WOODWAILER1_000_193","すでに襲われていたとは……。<hex:02100103>やりきれませんね。"
"179","TEXT_AKTKBA111_04103_KANESENNA_000_200","また、救うことができなかった……！<hex:02100103>なんと無力なのでしょう……。"
"180","TEXT_AKTKBA111_04103_KEEPEROFTHEENTWINEDSERPENTS_000_201","カヌ・エ様……。"
"181","TEXT_AKTKBA111_04103_REFUGEEMAN3_000_202","あの……私たちもあのようになってしまうんでしょうか？<hex:02100103>これからいったい、どうすれば……。"
"182","TEXT_AKTKBA111_04103_KANESENNA_000_203","……ご覧になったとおり、<hex:02100103>獣への転化は、襲われた傷が直接の原因ではなく、<hex:02100103>深い絶望に囚われたことによって起こります。"
"183","TEXT_AKTKBA111_04103_KANESENNA_000_204","グレイプニルと毒気の問題は、私が必ず解決します。<hex:02100103>ですからあなた方は、何があっても絶望しないで、<hex:02100103>希望を持ち続けてください。"
"184","TEXT_AKTKBA111_04103_REFUGEEMAN3_000_205","……わかりました。"
"185","TEXT_AKTKBA111_04103_KANESENNA_000_206","どうやら、グレイプニルは、<hex:02100103>もうこの周辺にはいないようです。<hex:02100103>どうか、このまま戻っていただけないでしょうか。"
"186","TEXT_AKTKBA111_04103_REFUGEEMAN3_000_207","はい……。"
"187","TEXT_AKTKBA111_04103_KANESENNA_000_208","……この場は収まりましたが、<hex:02100103>根本的な問題は、何も解決していません。"
"188","TEXT_AKTKBA111_04103_KANESENNA_000_209","死への恐怖は、これからも人々の心に広まり続け、<hex:02100103>グレイプニルに襲われずして、獣に堕ちる者が現れかねない。<hex:02100103>それほどまでに、事態はひっ迫していたのです。"
"189","TEXT_AKTKBA111_04103_KANESENNA_000_210","精霊の声は、私たちに獣を退治せよと告げていますが、<hex:02100103>このままでは、犠牲者が増えるばかり……。"
"190","TEXT_AKTKBA111_04103_KANESENNA_000_211","ここはラヤ・オの言うとおり、森の大精霊に語りかけ、<hex:02100103>その力を借りるしかありません。"
"191","TEXT_AKTKBA111_04103_KANESENNA_100_211","私は対話に備え、身を清めに不語仙の座卓に向かいます。<hex:02100103>あなた方は、「双蛇党：統合司令部」に戻り、<hex:02100103>私の準備が整うまで、待っていていただけますか？"
"192","TEXT_AKTKBA111_04103_RAYAOSENNA_000_221","国境でのことは聞いたわ。<hex:02100103>あたしだって、角尊が無力だなんて、思いたくないけど……<hex:02100103>今は、精霊の力を頼るしかなさそう。"
"193","TEXT_AKTKBA111_04103_KEEPEROFTHEENTWINEDSERPENTS_000_230","前回に続き、今回もまた、犠牲者を出してしまいました。<hex:02100103>命を救うとは、なんと難しいことか……。"
"194","TEXT_AKTKBA111_04103_KEEPEROFTHEENTWINEDSERPENTS_000_231","それでも我々は、前に進まなければなりません。<hex:02100103>一刻も早く、グレイプニルの脅威に終止符を打たねば……！"
"195","TEXT_AKTKBA111_04103_KEEPEROFTHEENTWINEDSERPENTS_000_232","英雄殿は、カヌ・エ様の御準備が整うまで、<hex:02100103>今しばらく待機をお願いいたします。"
